,parentId,authorDisplayName,replyComment,publishedAt,likeCount
0,Ugzoo_58ATK2o_8MKMt4AaABAg,stevearts89,"God your a predictable Troll- you Know the story- he denies abusing her, There is no proof, she bragged about abusing him. There is proof of that & her Make Up Artist has stated she never had the marks on her face she released in photos which were clearly a Make Up Job used to set him up & gain public Sympathy.
I only state this to Fact Check you, for people looking at the comments, I know you know the story & are just trolling for attention.",2020-11-11T03:25:06Z,1
1,UgyuTwDuRsYa0ssEhNR4AaABAg,stevearts89,Totally.,2020-11-10T22:31:25Z,1
2,Ugx0XmX6Otg44OD0Lml4AaABAg,stevearts89,I heard this after the video.,2020-11-11T03:26:35Z,1
3,UgxhMYQzYTQcDr1pvVt4AaABAg,stevearts89,Indeed- only little channels like mine are talking about it it seems.,2020-11-10T22:33:01Z,1
