,id,comment,author,likecount,publishedAt
0,UgzxsjNtjNqtpa2rTQ54AaABAg,"She never does any wrong and THAT exactly will be her down fall because of the simple fact that we are only HUMAN and the fact that humans can NEVER be ""perfect"" yells at her stupidity.
LOVED WATCHING THIS. TOTAL SMART AND JUST MOVE.
THANK YOU, JUDY AND STEVIE.
P.S. I signed 😉",Flor Delgado,0,2021-08-28T14:59:09Z
1,Ugwt0jxtZkDCTzFm0Uh4AaABAg,I don't want that ugly woman to be around jason momoa. She is crazy.,neha sanwal,0,2020-12-24T12:46:07Z
2,UgzW1Dm5PRslUnT4d1x4AaABAg,I never believed her either,Christine Lee,0,2020-11-24T22:10:32Z
3,UgyMprNADLal5eC66eZ4AaABAg,She is not a Bot Amber!!!,whiteheart68,0,2020-11-16T09:32:20Z
4,UgzzkHhpbQ095Pwr9eN4AaABAg,The media is under Elon Musk's thumb!!,whiteheart68,0,2020-11-16T09:30:31Z
5,UgzOKgdM_-Avlku0aWR4AaABAg,I proudly. Signed your  petition. Thank you for sTarting this incredible petition to help this legendary actor and domestic abuse survivor.we will get Mr. Depp the justice he deserves,Jeanne Cihla,1,2020-11-16T07:30:35Z
6,Ugyek33fhIGvppVBvO14AaABAg,im signing the Petition,nel-sun studio,0,2020-11-10T05:13:21Z
7,Ugz455vE9ijETirBo9J4AaABAg,Lol both have talent  Depp and Def leopard,Lisa Thomson,0,2020-11-06T10:20:51Z
8,Ugz120ZnikRKiADWVDB4AaABAg,Thanks for standing up for the TRUTH You All !!!!!!!,Revaline Isle,1,2020-11-03T22:03:02Z
9,UgxFhv1W_E9R_edlTkl4AaABAg,"I have to say, I myself am the same. I never really got on Twitter much only on my Professional Account for Business purposes. I ended up wanting to check in on  Incredible Brian on there and met some great people. There is actually a very large community on the forums since day one. I remember going on one in particular where all info is pinned to the top for members to access court info etc. Here thousands sit together and discuss. The petition was shared there and that's how I found it the first time. Many avoid twitter due to a few toxic people that have tried to overtake and made some uncomfortable with harassment on others so they go to Forums and Youtube channels mostly for their information over the last few years. Shout out to all the great you tubers who have really been getting the word out and to the petitions too. Many fans, on Twitter, forums, Youtube, Facebook etc spread the word and sign these. The most paramount outside of the Petitions is the YouTubers. I still scroll around and chat on Twitter myself We had a six-hour chat and listening party on a forum and on Facebook for those audios that came out with her admitting to hitting him. Great video as always I just wanted some to know there is so many out there helping spread the word Twitter is just a drop in the pool. I also hate cancel culture but I'm a survivor and I have worked with DV centers and victims doing charities and things. I hate she used them. I still remember the day I saw someone claim Spiritually empowered was a new person looking at the case when she has been doing it for a long time Twitter people just had no idea of all the great YouTubers. It's good to see the recognition from some of them who don't realize JD supporters are everywhere.",Tammie queen,1,2020-10-31T01:22:28Z
10,UgzBs6S8mwpCiz68Sx54AaABAg,I am behind on videos this week. Commenting before watching to say Look she's not a bot!!,Tammie queen,1,2020-10-31T01:02:28Z
11,UgxgT8slnpWVvCtd81V4AaABAg,Amanda D with the MeToo movement also came forward as soon as she learned the truth.,Joann Hess,1,2020-10-29T23:27:52Z
12,UgwnuUWVJ-L37U3ZqVt4AaABAg,I believe Amber was considering killing Johnny.  There is no other conclusion for the knives Josh Drew was giving Amber stating to Amber just show Johnny the knives don’t use them on him and she replies I’ll reconsider.  WHY WASN’T JOSH DREW GRILLED ON THIS???,Laura Azarowicz,0,2020-10-25T14:57:35Z
13,Ugy58ozEzET1DDgEGCF4AaABAg,"Crazy that there are still people who deny Amber’s guilt even in the recordings in her own voice, STIGMA WOMEN CAN’T ABUSE MEN which Amber says and counts on in the NO ONE WILL BELIEVE YOU JOHNNY!!",Laura Azarowicz,0,2020-10-25T14:43:38Z
14,UgxA1YKaf-u7AcwGArh4AaABAg,We need #mentoo needs to be an official movement and Johnny the spokesman after these trials!,Laura Azarowicz,0,2020-10-25T14:38:51Z
15,UgzJHkCzYOaBhMt4O8d4AaABAg,"There is still this stigma that men can’t be abused by women!  Totally bull, I know firsthand my Mom 5’2” use to punch her boyfriend all the time me too.  Remember in school the girl who always slapped and punched their boyfriends and they took it, HELLO ABUSERS!!!  No one can say they haven’t seen it!",Laura Azarowicz,0,2020-10-25T14:37:14Z
16,UgzxrscsMoi6hcppxyd4AaABAg,Good job Jeanne,Laura Azarowicz,0,2020-10-25T14:33:38Z
17,UgwlznoTlS7kbOB6aCh4AaABAg,Amber Turd.,DevilMaskMedia,0,2020-10-24T15:54:56Z
18,Ugwhg7_Nu6ZFI1ShPoN4AaABAg,"I read all her updates, so nice to know people out there feel as strongly about Amber Heard getting away with her fuckery and abuse as I do.",grhyservondub,0,2020-10-24T13:23:43Z
19,UgwALnUnpyJmMsVR1B94AaABAg,"I signed a long time ago and read all of Jeanne's updates.  I've been a fan of Johnny's since his 21 Jump Street days and almost feel like a grew up with him.  AH is scandalous, disgustingly fake and cringy, a bad actor and just plain insulting everywhere she goes.  JUSTICE FOR JOHNNY!!!",Lynn Kat,2,2020-10-24T06:37:32Z
20,UgxjNKklncdUQW1BwWt4AaABAg,Didn’t Amber-say Johnny started  petition or is that a false statement?,Julie F,0,2020-10-23T17:27:27Z
21,UgxugRIUEnMBFpo3NuV4AaABAg,Let's get Johnny back in his role as Captain Jack sparrow https://www.change.org/Justiceforjohnny,ReviewMonkeys Banana,1,2020-10-22T17:27:50Z
22,UgwjGVQrSgKOIcgNUyN4AaABAg,"Amber should basically just not be a celebrity anymore.. Like promoting anything. Her name and reputation was ruined bc of the way she treats ppl. And she has so many issues that she needs to be getting help instead. I also think if johnny loses, amber in the future will end up snapping on someone and she'll hurt someone else worse.",a Friend or Foe,1,2020-10-21T03:55:38Z
23,UgwSQ7wWi_IeVK0K7vZ4AaABAg,"Amber lier,i love Johnny Depp is may hero 🌻🌻🌻🌻🌻🌻🌻🌻🌻💞💞💞💞💞💞💞💞💞💞💞💞",Luciana novaes Novaes,1,2020-10-20T14:56:18Z
24,Ugxl6rj26OrZ3PRYmbF4AaABAg,Stevie please make a live stream on IO Toilet!,taahism,2,2020-10-20T12:03:12Z
25,Ugwn35pSM5Zp8YEM0cJ4AaABAg,Thank you,Nooney Love,1,2020-10-20T11:11:05Z
26,Ugy5tV2_L8IhFKd-M454AaABAg,"OMG! I'm crying! She did from what I gather, wanted to be a widow! My poor Johnny. I love him so much! ESPECIALLY after all this!
#AmberIsaLiar
#JusticeForJohnnyDepp",Cat Meissner,2,2020-10-20T07:37:48Z
27,UgwgMoirihGTb5lzRgp4AaABAg,"I found Tug by accident & suggestions led me to SJR. As I began to realize what was really going on, I joined & found this twitter community, & the petition. I signed & have been RTing furiously ever since. Thank you Stevie & Jeanne! ✨❤️❤️👍",Cat Meissner,2,2020-10-20T07:19:06Z
28,UgwFsVUzJK5lRshm3DF4AaABAg,"Thank you so much Jeanne! I think this does a LOT to let everyone know (incl scamber) that WE DON'T SUPPORT AN ABUSER'!!!
#AMBERISALIAR
#JUSTICEFORJOHNNYDEPP",Cat Meissner,2,2020-10-20T07:11:40Z
29,UgwURRJad7F344PF6fl4AaABAg,This is truly a small world but I met a guy at the casino in my hometown and his significant  other is really up high in Telsla.. She has met Amber Heard  and yes its true she's a difficult  woman to deal with!!   Lol.  I signed the petition  twice!!,Melissa Dietz,1,2020-10-20T02:57:41Z
30,Ugw8RyjTFQJaVX8qMAV4AaABAg,Rocky needs to step up to the plate and breaking the lies open.,Nitrosgal 2,0,2020-10-19T23:07:30Z
31,UgzmKium4z8jpawx4k14AaABAg,Jeannie did a great job.  Great video!  I hope Depp's team and especially Heard's team see this and know Jeannie is a real person with her own opinions and she started this all on her own.,TheRealLauraB,3,2020-10-19T22:59:30Z
32,UgwOHYt8C524ROzO9O14AaABAg,“Believe women”,Nicole Thoel,1,2020-10-19T16:51:55Z
33,Ugy_C3d_F23-reqNArh4AaABAg,"Hey y'all here is the link to have her replaced with Emilia Clarke
http://chng.it/Rx4GZg9x",chantall meyer,2,2020-10-19T13:47:06Z
34,UgxZtsUsgs5fay61PdV4AaABAg,I think there were 2 plans to enact depending on how Amber & Johnny ended. They could use their trumped up “evidence” to blackmail him & live on easy street for the rest of their lives. I’m glad they tried it because it hurt them & helped him. BUT they were documenting his addictions as well as his “abuse” of Amber as part of a self-defence plea in case she ACCIDENTALLY murdered him in a rage... I actually believe she had a plan for what to do if she ever beat a partner to death,Jayne Davis,1,2020-10-19T11:46:05Z
35,UgxqXunAU79OpXWWfDB4AaABAg,"In just 2 weeks of watching, you’re already a better interviewer than before. You don’t talk over the top of people anymore, I’m glad you’re building on your own marketable skills packet as well as just doing the right thing. Got sick & had to drop the stream: Almost every YouTuber I’ve seen credits Incredibly Average’s channel as the thing that turned them around on the case. Without the leaked audio & his dedication in providing facts that support them, I don’t think this would be (almost) an entire platform saying “The facts don’t match up & mainstream media is lying to you”. I saw a story from last year & every single newspaper in the country printed the same front page. It was “redacted” bars (no text but the name & date of the paper). The JOURNALISTS are fed up being forced to fit pieces into the narrative that the owner/board want them to sell. They don’t believe that they’re allowed to print the news anymore. What does “freedom of the press” mean when the people who run the press tell them what to print?",Jayne Davis,2,2020-10-19T10:55:53Z
36,Ugw7zEtk_9C3-6-n6Yd4AaABAg,I always miss the livestream due 😪 to time difference,Belicia Alphonso,1,2020-10-19T02:50:50Z
37,UgxAhbmXvawc08PfHpF4AaABAg,Hi mom :D (really... that's my mom being interviewed :D ) You did great!,JuneMagee,6,2020-10-18T23:07:23Z
38,UgzD-qzYJQpmrY2wDmt4AaABAg,"although i like Johnny Depp, im a bigger fan of justice. not a lot of men come forward when they are the ones being abused and maybe this case will make it possible for that to happen. I believe AH is a sociopath, she accuses people of the bad things she herself is doing.",yellowpillpeople,2,2020-10-18T22:44:09Z
39,Ugw9LFX9v2HPMs_7Vol4AaABAg,I  am big Johnny fan and never believed. Her she never seem like victim and I hope this petition works and Johnny get his justice,shanna martinez,1,2020-10-18T22:15:17Z
40,UgzYmCuUDzuyShWgQn14AaABAg,"You have the so called believer's who will disappear an have been a lot recently their like rats 🐀  trying to get of the Titanic. I  think JD will contact Jeanne to thank you either in letter form for he has mentioned the Creator an said a big thanks to you, but while your name was private JD would never compromise Jeanne's name. Also those adds come with a Contract as L'Oréal Paris has removed her from their team an she has been replaced with a dark girl to try an get new customer's. You can check this out yourself. Amber has been removed of Aquaman2 but she'll get money but won't appear. And the new cover for Aquaman it only shows only Jason Mamooa so Turd through a fit so WB through more money at her to stop her saying anything.",FrancesMarie McLaughlin,1,2020-10-18T18:46:07Z
41,UgzhhZw08lvIeZzCwrB4AaABAg,I never believed it either. Thank you for starting this petition.,PixlinsPlace,3,2020-10-18T17:15:52Z
42,UgyJnWxBwOvPzZlmg3x4AaABAg,Watched the first 15 minutes got sick of all the adds so fuck it not watching no more,Gumzilla Singh,1,2020-10-18T13:08:24Z
43,Ugxgr2LSwpgzoJOy_h94AaABAg,I signed when the petition first came out ... 🤘,julzstock,3,2020-10-18T12:26:57Z
44,UgzZ5Pd1dXbjHAkBvRN4AaABAg,"That video film 🎥 show how she SETS him up ,it back 🔥 on her.  Lol 😹🙄🙄😭😹🤣😂🥑",PrueWyatt Tran,2,2020-10-18T12:00:20Z
45,Ugz8OsSpUH7FQXFHp7x4AaABAg,"On the UK Gov petitions, 10k signatures are enough to take the issue to parliamentary debate. Almost .5million?! It’s spectacular work!! Well done for doing this n keeping us all updated, much love.",Al Jacob,2,2020-10-18T11:07:37Z
46,UgwJXzojmRuwKIQ2NdZ4AaABAg,"I'm against cancel culture for all of the obvious reasons, but I make an exception when it comes to Amber Heard. She herself used cancel culture in an attempt to destroy Johnny's life and livelihood. Turnabout if fair play in my book. I don't pity her at all. She's getting her just desertes.",Mimi B,2,2020-10-18T10:45:53Z
47,UgzYf6aEnLMxwhixbu94AaABAg,"RE Depp having to come home, great point. Now no one can get out of it! Now I'm all for it! 

RE : she should stop... Even now she could stop, and still be able play the ""I was deeply hurt by the breakup so I lied card."" And she might just recover.  But if she doesn't stop, the truth will come out

Thank you both for a really great interview! 💕 Genie, you are a very lovely lady 💕",Toshi yaar,2,2020-10-18T09:28:04Z
48,UgyF13yRBbB6YzUVH-14AaABAg,Great interview Jeannie! Good to see you and great job!!👏👏👏😊,Pamela 2am }!!{,2,2020-10-18T08:27:58Z
49,Ugys2uzN_MRueMV27YV4AaABAg,"Justice!!!
We appreciate the petition.  Its about doing the right thing.",laurels heart,9,2020-10-18T06:14:35Z
50,Ugx2azL9Cim7WWF26el4AaABAg,"I gotta change my life schedule so I can get here to  your Lives, hahaha..GREAT video,  Stevie..Jeannie was amazing,  she had some great opinions on the Judge making Johnny go to VA to give his depo. she is right, now  AH and her band of misfits will have to sit in person to do theirs, that goes for Elon, how has he managed to sidestep this depo for so long, and what about James Franco? how he has been so quiet in all this....keep up the great work, Stevie xx ...ooo there is 4 DISLIKES, is AH and i0 trolling again..",K H,2,2020-10-18T06:07:56Z
51,UgwIg0f9-daMFpXmrJR4AaABAg,IO = SIMP,Jennifer Mullins,5,2020-10-18T05:08:10Z
52,Ugy4B4BkaKom1xPwepl4AaABAg,"I am doing a #justiceforjohnnydepp soap line!!! I have never promoted my business on any of these channels before, but I want to be able to do something to help this cause!! The best way I can is making my art (which is entirely usable and wonderful natural body soap). I have already started with Edward Scissorhands, and am making Mad Hatter tonight. I will make all of the best characters he played and want to use half of the proceeds to give to the AH removal from Aquaman 2 petition. You can view these soaps on my instagram @lucynellsoaps and I will put the making of them on my utube Lucy Nell Soaps. #justiceforjohnnydepp",Melissa Owens,1,2020-10-18T04:18:55Z
53,UgwrpDU0-fhocVgAStR4AaABAg,I wouldn't be saprised if Jason seid he would not do it... if! An they picked rite! But who knows.,Jen Watson,2,2020-10-18T03:55:19Z
54,UgwVfI-A1wt7Xps3O_R4AaABAg,🤣 I really hope Adam sees this and uses it in court just to piss off amber 😂,Blue,2,2020-10-18T03:28:20Z
55,Ugz7yzzgU1mxhXVycy94AaABAg,"She. Was a great interview. ;spoke well,have signed a while ago !! Thank You Stevie💖",Animal tested Love approved,5,2020-10-18T03:23:23Z
56,UgyrlF0WMoXvejyVrwJ4AaABAg,"Thanks for starting it an speeking out for a lovely person, that why most of use watch him in ! He's not fake at all, he is always his self! An its sad that he had to go thru it! Like meany of us ,more than once in life!",Jen Watson,2,2020-10-18T03:06:55Z
57,UgxJvt8hpqczoDsgsh94AaABAg,"Mandy broke the James Franco elevator information over a, month before media touched it",Blue,1,2020-10-18T02:44:10Z
58,UgxpA9s2MDs29WMxRuF4AaABAg,I’m surprised there aren’t more signatures,Natalie Smith,4,2020-10-18T02:32:25Z
59,Ugz28m6Em_OTvXu1vM94AaABAg,It's confusing why AH is trying to force JD into court knowing all the evidence against her you would think she would be happy to delay it all as much as possible.,Kerrie Louise,12,2020-10-18T00:14:50Z
60,UgyR32bUAQB3FcNp0nR4AaABAg,Talking to petition creator wouldn't fit her victim narrative. She's trying to convince court and media JD is behind it with bots,Kerrie Louise,12,2020-10-18T00:02:26Z
61,UgymTfBk229Cjdvukgd4AaABAg,"The fun part about Johnny having to interrupt his filming is that the longer WB has to run filming on FB3, the further back  AQ2 gets pushed back.",RhomanysRealm,16,2020-10-17T23:38:38Z
62,UgwlxI_peGLw9F0ITw54AaABAg,Thanks for clarifying Johnny's Nov deposition in the VA. I hope you're correct that this is indeed the judge's tactic.,Sunny Exposure,4,2020-10-17T22:45:25Z
63,Ugylrv8OYyqGM0qtVKR4AaABAg,The media is finally doing some good for Johnny without even knowing it. Thats priceless!!,jelaine,6,2020-10-17T22:14:54Z
64,Ugz0JzkUdeSNBVx5lul4AaABAg,"I`ve signed the petition. :) The reason I didnt do it before, is because I didnt feel like this was as important, to cancel people like that, I would rather wait to see how the trial worked out first. But you were totally right. She dont deserve to have this job, at this point, or probably ever! JD lost he big role, for lies! What she has done, I have to remind me everyday, cause I have easy a heart for even people who makes big mistakes.. But this is not just a mistake at all..  And I will fight for JD and justice.  

Txh for a great video. Sorry I missed the live stream, again. ;)",Linda Ellingsen,10,2020-10-17T22:00:09Z
65,Ugwjf2NEqbnf_wBTg8N4AaABAg,"I want to know what happened in Toronto! I have watched so many of these video. Spiritually empowered, Incredibly Average, That Umbrella Guy, Come Geek Some, but I feel like I have missed info on Toronto. I know something happened. Something Amber doesnt want to talk about. But WHAT HAPPENED? Can anyone link me a video on that talks about? I dont know how I have watched hours of videos, but have no idea about Toronto. I also kind find the video of Whitney fake hitting Amber in the elevator that I keep hear getting mentioned, but I cant find that one",Jennifer Buhmann,10,2020-10-17T21:50:28Z
66,UgyCLN1QxnhG2eBLkQ94AaABAg,Another great live stream.  So grateful for you and Jeannie for bringing out the truth about this situation.  I was happy to sign the petition and hopefully it will get AH out of this and many other movie roles.😁,Patti_C,3,2020-10-17T21:49:07Z
67,Ugx44gV4vG-VcfRicxB4AaABAg,I ve watched the live and now I m watching the after video. 👏👍😂,Πασιφάη,4,2020-10-17T21:02:15Z
68,Ugy5idEfW27Lga7D5St4AaABAg,thank u shelby,l c,3,2020-10-17T20:55:15Z
69,UgyaGtJBwxvACjOOXXJ4AaABAg,"Hi Stevie, another good interview. Jeannie is friendly and I liked her initiative to make the petition. Today I was not notified by youtube about this live and during and even at the end there were no subtitles again.",Maria Nadir Santos,11,2020-10-17T20:49:48Z
70,Ugx6vFUzQ7Ey7hQ3-tR4AaABAg,"What Sia did when defending Johnny Depp, was pure bliss. What a woman, even keeping Elon accountable in that tweet. Awesome 😎.",Kaffekaffe Kaffe,50,2020-10-17T20:49:20Z
71,UgwRP8eR1_JxBn1wFmJ4AaABAg,Signed,Corinne Ritchie,6,2020-10-17T20:48:10Z
72,UgzLTRmWdJHjnXdB57d4AaABAg,"Thank you so much for having such an action oriented person as a guest 
This is inspiring knowing that our voices CAN count 
Those of us who are male victims of DV and treated from all directions (including courts that are tasked with bringing justice ) experience a unique form of betrayal and injustice 
Thank you Stevie 
And thank you Jeannie 
It takes a special person to take this important action for Johnny and the rest of us",gary R,15,2020-10-17T20:41:02Z
73,UgzNjChEjfnDvW0wAUF4AaABAg,I proudly Signed Your Petition❤️In support for Johnny 👍,MiSook McCauley,25,2020-10-17T20:27:06Z
74,UgxYbt_ln65XK3rFXXh4AaABAg,"nice chat stevie, thank you",bernardo marin marin,5,2020-10-17T20:18:30Z
75,Ugxw-56HSOjMSpEXOQ14AaABAg,Very good interview and brilliant woman. I want to thank you too.,Chickp Stranded,4,2020-10-17T20:15:02Z
76,Ugyde-wRn-NIFPV1XUN4AaABAg,"Thank you for this great video. Would love to see James Franco and Io being called for their deposition. They are accomplices to Amber Heard as well. What disgusts me also is the many celebs like Rose McGowan and Me Too goons who attacked Johnny Depp and called him an abuser. Now that facts are out, they refuse to admit they were wrong. Which doesn't surprise me as they are not the kind of people who admit any wrongdoing. To them, everything they do is perfect and irreproachable.

I have seen comic book writers and TV showrunners who still attack Johnny Depp calling him vile names. Two hack artists, one of them a tv showrunner whom I won't name though many fans know who it is, attacked him on Twitter and when they were confronted by Johnny Depp fans, they blocked them. One still insisting that JD was evil, the other saying that she was a fan of Johnny. Really disgusting hypocrite.

Another thing that disgusts me is the tv shows and celebs like Jessica Chastain who embarked on the hate trend against Johnny Depp. Everyone remembers her behaviour on a BBC interview where a reporter told her a gossip about Johnny learning his lines through an earpiece and instead of questioning the validity, she believed it and rolled her eyes in disgust about Johnny. Which I remember caused quite a hostile reaction from Johnny fans and many remember her for what she did and found her act snarky. Though it doesn't surprise me as she is notorious for doing that eye-rolling and putting her face into her hands whenever something annoys her. As for the earpiece in Johnny's ears, people who do their research know it was there to play music in his ear. To treat his tinnitus and to put him in the mood of certain scenes he was going to perform.

As of Daniel Radcliffe, who also said bad things about Johnny Depp in interviews, it would be nice to see him apologize for his remarks about Johnny Depp as what he said fuelled people's attacks against JD and toward J K Rowling who supported him because she knew all the facts about the case. I have seen Harry Potter fans/websites (Leaky Cauldron and Mugglenet) who have attacked both of them while exploiting from their work and image repeatedly. Which is really disgusting. Here are the links to the articles where he stated his remarks.

https://ew.com/movies/2018/01/12/daniel-radcliffe-johnny-depp-fantastic-beasts/

https://ca.movies.yahoo.com/daniel-radcliffe-reveals-hes-friends-with-racists-153311580.html

Thank you for this great interview.

For those who didn't get to sign the petition, here is the link to it.

https://www.change.org/p/dc-entertainment-remove-amber-heard-from-aquaman-2

And here is another link to another petition for Johnny. One asking Disney to bring him back for Pirates of the Caribbean.

https://www.change.org/p/walt-disney-we-want-johnny-depp-back-as-captain-jack-sparrow",Simon Barré-Brisebois,12,2020-10-17T20:14:57Z
77,UgxzU9A52SETnc-vVDp4AaABAg,How great would it be if Johnny got the role in Aquaman2.  He can play any part,Myra Brodie,23,2020-10-17T19:57:14Z
78,UgxhMhhdLocR4MH8MM54AaABAg,I hope that Amber gets dropped from Aquaman 2. She doesn't  deserve  to be in the  moive or any moive  for the matter. I hope that Johnny gets his Captain Jack Sparrow role back and apologize  form Disney.  Justice for Johnny!!,Galit Weissman,43,2020-10-17T19:36:52Z
79,UgzogbLLVboSEElm7U14AaABAg,"sometimes i go on Twitter & end up spending way too much time looking at all stuff people write, but it is fascinating",Marge lane T.,16,2020-10-17T19:30:18Z
80,UgxeHws6bDxPGgl0gmZ4AaABAg,just popped in to listen n but you can't hear Jeannie at all...only your voice comes thru...at 10:17 you can hear Jeannie from then on,Marge lane T.,5,2020-10-17T19:26:11Z
81,UgzvITdVqm4PDe87MbZ4AaABAg,He got to be in Virginia  for the 10 th to the 12th for new Deposition and pay too thats crazy 😳,Judith Hodgson,5,2020-10-17T19:25:36Z
82,UgyOgAD_pzNLchcxcGp4AaABAg,Great live stream  again stevie  as always you heard about johnny have to go Virginia  and he got to pay $650 dollars  ??,Judith Hodgson,8,2020-10-17T19:22:47Z
83,UgykrM2jQK2yVcoNUG54AaABAg,"This was an amazing live-stream once again Stevie. I’m happy I found your channel  😄. First Shelby and now the legendary creator of the petition, Jeanne ❤️👏",Kaffekaffe Kaffe,16,2020-10-17T19:22:41Z
84,UgyM_HLrYo7pFMQfDhl4AaABAg,Can't hear her!!!,Laura Wheatland,3,2020-10-17T19:22:24Z
85,UgxcuiCOfQkfwlyNt0h4AaABAg,Great livestream and thank you both from the bottem of my heart.🤗🤗🤗🤗Take care and stay safe😉,Wendy Postma,6,2020-10-17T19:21:35Z
86,UgzrlJNKFwHCTF-Crml4AaABAg,"Wauw  you had 4 dislikes so AH,IO,Whitney and..ahhh oh a bot was there💩💩🤖🤖🤣🤣😂",Wendy Postma,22,2020-10-17T19:20:17Z
87,UgwCU-yxwTH5vnHB-RV4AaABAg,"Just watched your video with Jeannie and did my first live chat!
Your streams and guests are great!. Keep the coming!",annie frost,6,2020-10-17T19:18:25Z
