,id,comment,author,likecount,publishedAt
0,UgzfI7eRHLjK6FV-7Nl4AaABAg,Hey look out very closely at 0:47...johnny is very  cute,magnesium,0,2021-10-23T15:22:28Z
1,UgxnOMCfukOxrbNNR3x4AaABAg,Pirates of the caribbean,Rohan Ade,0,2021-10-02T12:14:47Z
2,UgxKZHrCf-U4GqjK_Fl4AaABAg,"Shif sa e bukur eshte ,rri me te",Lela Kovaci,0,2021-06-16T13:41:12Z
3,UgxQ23eveeaMK0rkHwR4AaABAg,Johnny And Amber😍,pal pandi K,0,2021-06-07T17:00:37Z
4,UgzDaxBagFcpZqvsMfF4AaABAg,"She is stunning, gorgeous, beautiful OMG.. 😮😮😮😮😮😮",sangeetha a. s,1,2021-06-07T14:10:32Z
5,UgwjaUNwdc4RTu4zD9F4AaABAg,"I don't understand, why he married with AH? I mean she's truly false .",Magenta Hena,2,2021-05-10T04:42:11Z
6,UgyP2TtQHc7BPWAidgJ4AaABAg,JD 😍,smartanki updates,0,2021-05-07T05:17:21Z
7,UgwT8T-fqhx0oTzoiit4AaABAg,I wonder how many hours she spends staring at herself in the mirror🤑,ella scrupple,8,2021-05-06T15:42:49Z
8,UgybNNV07qRvqarhvbd4AaABAg,He was so not himself when he was with her. He seemed more quiet than usual,Etigress,7,2021-04-07T09:32:24Z
9,UgxA6oWVMd2Wwl6RoNl4AaABAg,Amber Heard ruins everything.,linzi94,5,2021-04-05T07:09:29Z
10,UgxZOG5C2873mIYrxvN4AaABAg,Amber the abuser needs to go.  #JusticeforJohnnyDepp,Rock Candy,0,2021-03-22T01:04:37Z
11,UgxjaCtBrPCRY93Oibp4AaABAg,Well that boy I know by newt name what is his actual name,Shailendra Madane,0,2021-03-13T13:27:18Z
12,UgyU4dgXKR2viil0IId4AaABAg,Amber is by far too good for Johnny Depp and he knows it! She will continue to be famous while he burns out and fades away!,gamr,1,2021-03-04T07:49:26Z
13,UgyPdrJbRLOkspXX5c14AaABAg,Johnny Depp was never sober and his miserably bad looks match his equally miserable acting!,gamr,2,2021-03-04T07:45:16Z
14,UgzpNSt79G5LEP2Urll4AaABAg,1:03 girl say namaste😘,Harsu's Scoff,0,2021-03-04T06:37:01Z
15,UgyPZGuJEyRSp6Zd_uB4AaABAg,"amber is an awful awful person, she has several charges  and allegations against her from previous relationships and she’s a terrible human being in general, the email for disrespect she has shown for many many things and many things she has mocked is disgusting, she has so much privilege and she’s absolutely a menace! 
Thank You For Listening To My TED Talk",Mali Roma,5,2021-03-02T15:50:30Z
16,UgwH7ITTVJCbOyohV454AaABAg,She can hit me whenever she wants,Norbert Ruiz,0,2021-03-01T20:38:26Z
17,UgxCvrC4HW214478gNd4AaABAg,i was just going to say - he doesn't look happy.  Does a pretty good job of faking it but now we know he was miserable. #JusticeforJohnnyDepp,Rock Candy,4,2021-02-14T16:52:04Z
18,UgzRkWZkc0HaIkoVS5d4AaABAg,Next time Johnny be careful who u choose.  There are many gorgeous and beautiful women more closer to Ur age to ❤️ I love you Johnny Depp,Nadia Muhammed,2,2021-01-10T13:22:27Z
19,UgyCgt2600YwoeXq7xt4AaABAg,"#AmberHeardistherealabuser ~ #boycottAH ~ people wake up  ~ type in audio tapes Amber Heard Johnny Depp 2hrs worth of her verbally berating Johnny, admitting hitting him , throwing pots and pans at him and starting physical fights and mad that he always splits or leaves when she gets physical with him ~ actually making fun of him for doing the right thing. She admits she can’t control her anger and just loses it! #AmberHeardistherealabuser ~ she says in these tapes ~ what everyone is repeating here ~ go say you a man is being abused, see if anyone believes you! Her whole farce was knowing the “me-too” movement was believing women first ~ but unfortunately the tapes have been revealed and the real truths have come out ~ she’s the abuser! Look up narcissistic behavior and compare to AH ~ all these truths are there once you open your eyes . #JusticeForJohnnyDepp",Ani Ore,1,2020-12-27T06:35:40Z
20,UgyegnHYpAq5MFhKwIJ4AaABAg,Love you Johnny 💖💗❣️💖,Jeane Alejo,2,2020-12-22T03:09:31Z
21,UgyR7aR8zkfzHLgSHa14AaABAg,"Love you Johnny, so handsome ❤️ OMG the eyes and smile LOL 😂",Jisika Icho,10,2020-11-27T23:08:06Z
22,Ugy8LhzugYsuKWteAhh4AaABAg,How he reacts when the drink came,Lalak Dhanak,2,2020-11-24T14:51:30Z
23,Ugx4VeGshoMc9_7BGwd4AaABAg,You are unfair to Amber. I don't believe they are hurting each other deliberately. They are simply trapped in a wrong union.,Paol Vrobel,6,2020-10-18T18:45:30Z
24,Ugyp5XsboclUj8iCtBp4AaABAg,"The tension with deep and Amber u can cut it like butter... he clearly didn’t wanna be there. She “reassured him” with that tap shoulder gesture like, “Behave darling. U don’t want ur fans know what ur really doing to me behind the cameras.😏” 

God I hate that bitch, and I’m glad she’s finally gone from Depps life!😒",Purpledreams_82,4,2020-10-16T17:13:49Z
25,Ugxf8GTykK1laIAu-dZ4AaABAg,Mean expression on her face,MelissaTaydac TV,18,2020-10-04T10:29:47Z
26,UgwLDr253yiICCaErK94AaABAg,You dumb dumb dumb biaatchhhhhh!!,Mohit Nagarkoti,1,2020-09-25T20:12:00Z
27,UgzmNQMKat9Vt6QU9al4AaABAg,0:55 is so awkward! She kisses him out of nowhere and then he tries to kiss her and then she doesn't accept it.,Kayla B,55,2020-09-10T17:15:57Z
28,Ugzfceft93pnkonLRwZ4AaABAg,Johnny never looked happy with her,PureSparkles22,89,2020-09-08T02:06:44Z
29,UgxrFYXT19CizcQUkJd4AaABAg,"No one had any idea she was beating him behind the scenes, he looked exhausted.",DudeAbides,86,2020-08-21T01:35:44Z
30,Ugzv1IIYnXFLXcw-vKd4AaABAg,While Johnny Depp was being abused,Marta,71,2020-07-21T16:05:27Z
31,UgzeHln8KsgAgLGDH9J4AaABAg,Johnny :( ❤,Ozlem Uzun,23,2020-05-30T00:40:23Z
32,Ugzb65KdtYOqs5pJh4Z4AaABAg,"man, amber  has such a  mean expression on her face all the time.",FaithVamp,95,2020-05-14T19:20:36Z
33,UgwruHW-4WqYstIguk14AaABAg,0:57 Ulul amber,Angeline Cabrera,7,2020-03-23T14:42:45Z
34,UggwYKef7f-EoHgCoAEC,johnn,katlenn alves,11,2016-02-14T18:19:53Z
35,UgjloQ1U1CCKongCoAEC,Lovely Eddie!!! I can't wait to see the movie.,MsPatataki,18,2015-09-12T19:40:59Z
36,UgiZxc_dN9naZXgCoAEC,whoa! amber you're inhumaly beautiful?,Rey V,9,2015-09-12T14:42:40Z
37,UggWpCOj4QqgHHgCoAEC,whoa! amber you're inhumaly beautiful?,Rey V,13,2015-09-12T14:42:32Z
38,UgjBrn8GuiXz-ngCoAEC,god amber so fucking hot,myfirstkissgoesalittlelikethis,2,2015-09-06T14:18:54Z
