,parentId,authorDisplayName,replyComment,publishedAt,likeCount
0,UgzisLnrrP2V4-0u0y14AaABAg,drmayeda1,"@Dr. Simple Beauty 300 
I don't think she should have giggled before starting the story.  It's loke she's going to be telling a funny story.  I don't consider thoughts of suicide funny.",2020-10-16T08:03:20Z,5
1,UgzisLnrrP2V4-0u0y14AaABAg,Sarah Chops,Her suit and hair sucked BTW! 😉,2020-10-15T10:08:13Z,1
2,UgzisLnrrP2V4-0u0y14AaABAg,Sarah Chops,"OMG!! That laughter revealed her authentic self...  A PSYCHOPATH! so insensitive. 
How did she ever seduce Jonny Depp... 😕",2020-10-15T10:06:29Z,4
3,UgzisLnrrP2V4-0u0y14AaABAg,Dr. Simple Beauty 300,"If she was telling the story about a suicide that happened in MY family, and she giggled and then laughed and pointed at her friend whom she somehow KNEW their phone rang....I’d be backstage ready to 👊🏼",2020-10-15T04:09:12Z,6
4,UgzisLnrrP2V4-0u0y14AaABAg,Kapow Bam Bam Splat,That was sickening and disturbing.  Why would she think that was funny?  Do you notice its a running theme with AH to be distracted by anything during speeches or interviews? But this.... this is appalling,2020-10-15T02:24:01Z,6
5,Ugx7QybXNUUF8v19M2p4AaABAg,Nigel The Ripper,@eHacker you're very welcome Mr Hacker,2021-03-27T05:25:32Z,0
6,Ugx7QybXNUUF8v19M2p4AaABAg,eHacker,"I won’t argue, Nigel! Thanks for stopping by",2021-03-27T05:22:56Z,1
7,UgxgMWvpmJvEo_--pIl4AaABAg,eHacker,Thanks violet nice to see you,2020-12-10T13:18:07Z,0
8,Ugy0zk6_PB475U8xNwp4AaABAg,MNREDHEAD78,@eHacker love your videos! Keep up the great work :),2020-11-01T01:06:52Z,0
9,Ugy0zk6_PB475U8xNwp4AaABAg,eHacker,Thanks Debbie! Appreciate ya stopping by,2020-11-01T00:40:10Z,1
10,Ugx_gMTsr2TUvkTs-gx4AaABAg,eHacker,Thanks for the input Kelly. Won’t disagree. Consider subscribing if you haven’t I’d love to hear more from ya,2020-10-23T03:40:41Z,0
11,UgwqnoFUsrd7l3gRNa94AaABAg,eHacker,Agreed,2020-10-23T02:58:34Z,0
12,Ugwh58HWc6ak3jAJX9R4AaABAg,eHacker,Maybe. It’s an opinion piece. Appreciate the input.,2020-10-22T22:28:47Z,0
13,UgwVjFiZy0ReYN9ncSR4AaABAg,eHacker,Thanks Viking the comments are appreciated,2020-10-21T10:21:46Z,0
14,UgwVjFiZy0ReYN9ncSR4AaABAg,Apocalyptic Viking,She won't be embarrassed because she is a true narcissist... Any publicity will make her feel popular even negative will make her feel cool bullies feel cool when everybody hates them but they still feel cool the entire time they're putting somebody's head in the trash can in high school,2020-10-21T09:39:45Z,0
15,UgwAC9vETtN4kPyfR254AaABAg,eHacker,Very true,2020-10-21T04:10:05Z,0
16,UgxBrPcWcK64YnK4EpN4AaABAg,eHacker,Thanks Julie I agree,2020-10-21T03:08:16Z,0
17,UgwaTNn8YFjnRh7GeuV4AaABAg,eHacker,Thanks Wookiee! Nice to see you my friend,2020-10-20T12:41:13Z,1
18,Ugwm4gu8OSPvPAfRscx4AaABAg,Tonia Thraw,"@eHacker I actually gave this some more thought. Maybe it is scripted from a-to-z and the phone ringing is not an accident but a way to demonstrate how well she'd handle awkward situations like this. She picks up her story a bit too suave to be unrehearsed. No ""where was I?"" No flustered pauses.

I usually describe her with the ""You know she's lying because her lips are moving."" I do try to see the good in people but I may give ppl a bit too much credit sometimes.",2020-10-21T00:16:00Z,0
19,Ugwm4gu8OSPvPAfRscx4AaABAg,eHacker,"Thanks again, Thraw. I appreciate ya stopping by",2020-10-20T07:57:12Z,1
20,UgzzQXJzRLnsrLqOzVt4AaABAg,eHacker,You are not alone,2020-10-20T06:49:07Z,1
21,Ugw3JyijlISrYfUsOqp4AaABAg,Laurie Hand,"@eHacker you’re welcome. For the record, I can’t stand her and can’t wait to see her lose, and think she’s a terrible person.",2020-10-20T02:59:45Z,0
22,Ugw3JyijlISrYfUsOqp4AaABAg,eHacker,Okay thanks for the feedback,2020-10-20T02:51:15Z,1
23,Ugw-ENi2I2b4j7I72Ql4AaABAg,eHacker,Thanks B Girl I appreciate it,2020-10-19T07:40:53Z,1
24,Ugz0CoqDfT6jbjJGzsF4AaABAg,eHacker,Thanks Hommy appreciate ya stopping by,2020-10-19T06:48:31Z,1
25,Ugy9XzUhQJRnDN4Ry2t4AaABAg,eHacker,Thanks so much,2020-10-19T02:55:05Z,0
26,UgyPqQrnihgcxtnn7-p4AaABAg,eHacker,Thanks again Russell,2020-10-18T23:32:44Z,0
27,UgxykYfqHbHjUvt9XsV4AaABAg,eHacker,"Agreed, saga! It’s pretty bad.",2020-10-18T09:17:26Z,0
28,UgycNz0q0omlgwHwCAR4AaABAg,eHacker,Won’t argue,2020-10-18T04:32:46Z,0
29,Ugx2ZqNdXDKCJfmPuMl4AaABAg,H. Borter,@eHacker Thank you. Been away from YT for a bit.,2020-10-17T23:28:33Z,0
30,Ugx2ZqNdXDKCJfmPuMl4AaABAg,eHacker,Thanks Borter! Very nice to see you,2020-10-17T23:22:35Z,0
31,Ugx4yftdVXMPVn3cDbB4AaABAg,eHacker,Thanks Sally,2020-10-17T23:23:29Z,1
32,UgyUiugwCDga02jSKrV4AaABAg,eHacker,Thanks Thomas won’t argue. Appreciate ya stopping by my friend consider subscribing if you haven’t I’d love to hear more from ya,2020-10-17T23:26:19Z,0
33,Ugyfyggk7U2QlvXJp0d4AaABAg,eHacker,Thanks Karen,2020-10-16T22:41:50Z,0
34,UgzWM5Q4ieNWX6rcCjV4AaABAg,eHacker,@K Dizzle no one reason I make videos. Can’t say.,2020-10-16T15:46:45Z,0
35,UgzWM5Q4ieNWX6rcCjV4AaABAg,K Dizzle,"@eHacker Which is why I enjoy it, and maybe part of the reason why you do it?? :)",2020-10-16T15:03:16Z,0
36,UgzWM5Q4ieNWX6rcCjV4AaABAg,eHacker,Thanks K! Appreciate that. Amber probably doesn’t,2020-10-16T14:58:08Z,0
37,UgxD0dmmU3fd6sg8Rq54AaABAg,eHacker,Ya some people are ahead of me lol. But old news still gets interest stirred up,2020-10-16T10:51:24Z,1
38,UgxD0dmmU3fd6sg8Rq54AaABAg,Crazy Rat Lady,"@eHacker Waaaaaaaaay ahead of you sugar 😍😊 I hadn't seen this, and I had to turn it off when she laughed the first time, or I would have smacked the screen. My brother comitted suicide. How DARE she?! Thank you for bringing awareness to this 💖",2020-10-16T08:55:15Z,0
39,UgxD0dmmU3fd6sg8Rq54AaABAg,eHacker,Thanks Lady! Consider subscribing if you haven’t I’d love to hear more from ya,2020-10-16T08:49:25Z,1
40,UgzFjp8wWVzbBmk6XmV4AaABAg,eHacker,Thanks for the comments LePetit,2020-10-16T04:18:46Z,0
41,UgwHYfz7wm5OaXi1ELh4AaABAg,eHacker,Oh. That’s a really long time. I’ll aim for 1:30 next time.,2020-10-15T21:31:14Z,0
42,UgyeLEpwGWzcjSYoeYx4AaABAg,eHacker,Thanks Night appreciate ya stopping by,2020-10-15T08:18:05Z,0
43,UgxlJoABke-b6R_6Ujd4AaABAg,eHacker,Thanks Sue appreciate it,2020-10-15T07:39:34Z,0
44,Ugz_M-CxFU-wW2wRWt94AaABAg,eHacker,Thanks Lizzy,2020-10-15T07:23:59Z,0
45,UgxkA5f9sm0G6W_YM0B4AaABAg,eHacker,Thanks Sandy it’s appreciated,2020-10-15T07:24:12Z,0
46,UgzGubFIs7Qh0iF5uxN4AaABAg,eHacker,Think so!,2020-10-15T05:33:20Z,0
47,UgzWkS6fQcI5ZAM2j0R4AaABAg,eHacker,Agreed of course,2020-10-15T04:36:37Z,0
48,UgyAI4Tm00BV68zLCvV4AaABAg,eHacker,Thanks Dr!,2020-10-15T07:24:31Z,0
49,UgzEotlmjafRUjVgwEl4AaABAg,eHacker,Thanks Smith,2020-10-15T02:31:05Z,0
50,UgxsB8RNDopHZ0lJu-t4AaABAg,eHacker,Thanks Liv. Always appreciate ya stopping by. Nice to see you,2020-10-15T02:30:57Z,1
51,UgwcZ5fD-HQHptRkFy54AaABAg,Maria,"@eHacker Cheers JP, always good to have different sides, and yes, at the end of the day, we absolutely agree about that disgusting woman lol.",2020-10-15T02:44:08Z,0
52,UgwcZ5fD-HQHptRkFy54AaABAg,eHacker,Edited name! Quite a few Donnas around here! Sorry,2020-10-15T02:30:42Z,0
53,UgwcZ5fD-HQHptRkFy54AaABAg,eHacker,"Looks like we agree on this one, Maria lol. Thanks for stopping by",2020-10-15T02:30:08Z,1
54,UgwBuxkGJlqQ86NGL8R4AaABAg,eHacker,Thanks User,2020-10-15T02:29:47Z,1
55,Ugz6atzzC-QrLdPpnbh4AaABAg,eHacker,Thanks Harber nice to see ya,2020-10-15T01:56:21Z,1
56,UgxtXbAtWXNn9PzLgt54AaABAg,Anony Mouse,@eHacker love ya!,2020-10-15T02:54:29Z,0
57,UgxtXbAtWXNn9PzLgt54AaABAg,eHacker,Thanks Mouse good to see you,2020-10-15T01:55:35Z,0
58,UgzL22W5ulXmT7U3gNV4AaABAg,eHacker,Thanks JT. Appreciate the input. Agree of course.,2020-10-15T01:54:56Z,0
59,Ugxpd6auS9vMYc8U8a54AaABAg,eHacker,Agreed,2020-10-15T01:54:20Z,0
60,UgxMc8iEigdt7RM4yxF4AaABAg,eHacker,Thanks again,2020-10-15T01:54:11Z,1
61,UgzmYETYcG2aTWl8ABJ4AaABAg,eHacker,Thanks Chica appreciate it,2020-10-15T01:54:01Z,1
62,Ugzo-TyyaO4bo8qR6C54AaABAg,Pauline,@eHacker 💞,2020-10-15T02:22:53Z,0
63,Ugzo-TyyaO4bo8qR6C54AaABAg,eHacker,Thanks for sharing Pauline,2020-10-15T01:53:51Z,0
64,UgxvOAjkU9SGuiMeujN4AaABAg,eHacker,Thanks Cooper,2020-10-14T23:29:05Z,0
65,Ugz941jih7-fsNiWMMt4AaABAg,eHacker,Thanks again,2020-10-14T23:29:10Z,0
66,Ugy8mkug-SsWYJ47PWB4AaABAg,crazy4orlando2,"@eHacker I don't like her. I think she is a dishonest, manipulative selfish b!th but that doesn't mean everything she does is nefarious. 
She has created a world for herself where she is the center. She has no perspective other than her own. That is her own failure and the failure of those around her. She has no desire or incentive to change her thoughts or behavior. So she can do and say things that come off distasteful or bad to the rest of us with no ill intent. 
This clip shows her sustance dependency and reflects her willfully self centered mindset. 
She is a member of the lgbtq community and maybe when she was younger (or even then) she had thoughts of suicide. You don't typically become abusive and a drug/alcohol abuser because you have a happy wonderful life. 
So maybe this speech was harder for her than you might expect. People are multifaceted. She can be both a terrible person and a person that has experienced terrible things.
Although we know alot about her actions during her marriage to Johnny Depp we don't know why she is the way she is. Though it doesn't change what she did and is doing.  
If you look for the bad in someone you can find it. Johnny Depp is not angel but the evidence shows he's not a wife beater. They both have many flaws as do we all.
I'm not so quick to find a fault in everything she does. There is enough of her abuses, lies and duplicitous behavior out there you don't have to go looking for it.",2020-10-15T00:05:05Z,0
67,Ugy8mkug-SsWYJ47PWB4AaABAg,eHacker,Thanks Crazy,2020-10-14T23:28:42Z,0
68,UgxHteze9Tixs6I73tt4AaABAg,eHacker,Next level here,2020-10-14T23:28:22Z,1
69,Ugw9sqiWDHNvS3pYJR54AaABAg,eHacker,Thanks Renee,2020-10-14T23:28:12Z,0
70,UgyQf3ETc5meRgxVgCN4AaABAg,eHacker,Thanks Redmist appreciate it,2020-10-14T21:53:52Z,0
71,UgxndCciflk26WbOkjZ4AaABAg,eHacker,Thanks Kim,2020-10-14T21:53:31Z,0
72,UgxMOCyhagPl7Luv2sR4AaABAg,eHacker,Yes. She has defenders still. I guess there are people like her out there,2020-10-14T21:53:17Z,0
73,Ugxr7Ij2FCgE2QRZjQx4AaABAg,eHacker,Thanks Abyo,2020-10-14T21:52:51Z,0
74,UgxIcqDZfa_R6H1b0a94AaABAg,eHacker,Haha. Maybe ya,2020-10-14T21:20:31Z,0
75,UgwEt5Z4eG1_sjBMc7F4AaABAg,Queen Babylonia,"Yes, she should have been serious, apologised for the interruption and continued the speech. But I think she was trying not to laugh beforehand, the phone gave her the excuse to ‘blast’ unfortunately.",2020-10-15T09:42:26Z,0
76,UgwbfPVfNzg-XEgN5F14AaABAg,eHacker,Thanks Susan I agree,2020-10-14T20:13:03Z,1
77,Ugx47yRQYLN7nxniDD54AaABAg,eHacker,Thanks Yese,2020-10-14T20:15:12Z,0
78,UgwAtjIK5LFAuJ81DWV4AaABAg,Nadine Smith-Jensen,@eHacker 😎,2020-10-15T12:43:39Z,0
79,UgwAtjIK5LFAuJ81DWV4AaABAg,eHacker,Thanks Smith appreciate ya,2020-10-14T20:13:27Z,0
80,Ugybp3xQJWFkFtngG3d4AaABAg,eHacker,Thanks John! Always appreciate ya stopping by. Ya of course it’s not a laughing matter! Anything is to her I guess,2020-10-14T20:14:26Z,0
81,Ugy62PRTIU_QoRB4eYF4AaABAg,ladydowney2000,like a 6 year-old...,2020-10-14T17:18:13Z,0
82,UgxEK3oUgCAPPrVj_wV4AaABAg,Mimi B,"Exactly! She opened herself up to criticism when she started criticizing others publicly and trying to spread her lies worldwide. She did it to herself and now she's paying the consequences. I feel no shame for putting her on blast any chance she give me to do so. She is actively trying to do harm to people, and not just Johnny Depp. I don't feel bad about it, and I don't think anyone else should either. People shouldn't forget that there are people who have the power to hold her accountable for her actions, but they aren't. The mainstream media, her legal team, and her ridiculous supporters are not only enabling  her, but also joining in on her abusive behavior. People have a right to be angry with her and call her out on her bs.",2020-10-14T21:32:32Z,1
83,UgyYAts8pHcvFMgoDOd4AaABAg,Erna Anspach,"She can't even act when she's trying to act. No talent, no feeling, cold....",2020-10-16T03:01:44Z,4
84,UgxYK6pa-7kud2p5pBh4AaABAg,Dawn Sherratt,"Yeah I was thinking that! My 13 year old is way more emotionally mature, she'd never laugh while talking about suicide!",2020-10-14T21:41:25Z,8
85,UgwvqvMRhL1o9FTl94V4AaABAg,"Rain ""Liam Payne Lover"" Andrews",He also looks hella uncomfortable...,2020-10-14T18:29:43Z,0
86,UgwvqvMRhL1o9FTl94V4AaABAg,"Rain ""Liam Payne Lover"" Andrews","Next to her? That's Zachary Quinto, a famous actor... he's Spock...",2020-10-14T18:29:26Z,0
87,UgwFnTJGVxU4vGVE2Wl4AaABAg,Queen Babylonia,"She just wants herself known, her face in front of many. It’s not she thought it hard, she just doesn’t really care",2020-10-15T09:43:39Z,0
88,Ugx_qCGfWGGZjcvNcP54AaABAg,gaysy1st,I think you're spot on with your impression. It sums her up completely.,2020-11-07T18:41:21Z,0
89,Ugx_qCGfWGGZjcvNcP54AaABAg,A Ace,@always sunny Thank you. Yes that's the feeling,2020-10-15T01:48:01Z,1
90,Ugx_qCGfWGGZjcvNcP54AaABAg,always sunny,"This is the best description of her behaviour I've come across so far and I've been following this story and watched alot of interviews of her. It explains so well her strange behaviour and how it leaves people who witness it, with an off/creeped out feeling.",2020-10-15T01:10:30Z,1
91,UgxrQyPuW28Vg1byp8d4AaABAg,Tina N,@eHacker *),2020-10-15T09:20:50Z,0
92,UgxrQyPuW28Vg1byp8d4AaABAg,eHacker,Thanks Tina appreciate the support,2020-10-14T20:12:33Z,1
93,Ugy4f3qdoj1vmUY6wtp4AaABAg,MNREDHEAD78,"Narcissists play the perfect person at first..then slowly let the ""ugly"" show and blames everyone else for it.",2020-11-01T01:37:55Z,0
94,Ugy4f3qdoj1vmUY6wtp4AaABAg,H. Borter,I wouldn't completely blame Johnny for getting involved with her. It's complicated.,2020-10-17T20:46:29Z,6
95,Ugy4f3qdoj1vmUY6wtp4AaABAg,JiMineY kRicKet,"He wanted to fix her, but some things just ain’t worth the trouble.",2020-10-16T21:23:45Z,7
96,UgwuzKI48JhCBws9PBF4AaABAg,gaysy1st,"@Boris Hudej I had a friend like that too. She laughed at funerals & said it was nerves. But then she laughed when I got punched in the face by a guy, because of something SHE did. Not nerves, women like this are angry individuals who like to see someone else's downfall.",2020-11-07T18:34:30Z,0
97,UgwuzKI48JhCBws9PBF4AaABAg,Boris Hudej,"@Ava Myers yes, it's weird! She learned her text and is not hiding that she doesn't really understand what it is about. It's about a life! Totally unacceptable behaviour. .",2020-10-16T09:13:57Z,1
98,UgwuzKI48JhCBws9PBF4AaABAg,Ava Myers,"@Boris Hudej Yeah, she does look sober. Still don't like her for that inappropriate reaction to her phone ringing in a middle of a serious speech about teen suicide.",2020-10-16T09:08:19Z,1
99,UgwuzKI48JhCBws9PBF4AaABAg,Boris Hudej,"I think she is sober here. I had a friend too similar to her. She did things like that all the time. Sober. And no one cared, because she represented herself as funny.",2020-10-15T10:13:44Z,0
100,UgxjZxDN4bqdFX99cMB4AaABAg,PICK&MIX GAMER,"@Queen Babylonia I know ,it's just no stop with her disappointing behaviour if Johnny loses any of the court trials will not be happy & if celebrities try to good mouth Amber after this with all the stuff that has been proven I will be angry",2020-10-15T10:03:19Z,2
101,UgxjZxDN4bqdFX99cMB4AaABAg,Queen Babylonia,"The thing is she wanted to be an actress, she has always been full of herself, she left home at 17, I don’t think it was nerves.",2020-10-15T09:39:50Z,1
102,Ugxd6CZn3hLKBarz8GR4AaABAg,H. Borter,I don't think there's hope for her.,2020-10-17T20:45:20Z,1
103,Ugxd6CZn3hLKBarz8GR4AaABAg,chicostephenson,"hopefully, she can get lots of therapy while she's in prison where she belongs.",2020-10-14T15:50:13Z,6
104,Ugzb9Ba6IKbwxzmvBdp4AaABAg,Joni Ahti,"@Katanya Jason Yes, her minions. Insane bots.",2020-10-14T23:05:15Z,1
105,Ugzb9Ba6IKbwxzmvBdp4AaABAg,Katanya Jason,Maybe they are bots? 😁,2020-10-14T22:55:39Z,2
106,Ugzb9Ba6IKbwxzmvBdp4AaABAg,eHacker,Thanks Joni,2020-10-14T20:10:52Z,1
107,UgxzzkCZkHi68sVTIN94AaABAg,gaysy1st,Well said,2020-11-07T18:31:32Z,1
108,UgxzzkCZkHi68sVTIN94AaABAg,itsme Emma,"Hey dont bring lucifer into this, even he would be offended I mean all he does is punish the bad people sent to hell, she is pure filth",2020-10-26T11:46:58Z,3
109,UgxzzkCZkHi68sVTIN94AaABAg,Thomas Mcsorley,Well said 👍👏👌,2020-10-17T19:49:45Z,2
110,UgxBVlSUzLuHjjM5AeN4AaABAg,Fantasmigorical,"@eHacker I've been subscribed for a while
You're one of the 1st channels I subbed to when this s**t show started (at least when I became aware of this subject being covered)🤣❤❤ Keep up the great work!!
Much ❤ from Alabama!!!",2020-10-14T15:00:18Z,0
111,UgxBVlSUzLuHjjM5AeN4AaABAg,eHacker,Thanks Aimee! Appreciate ya stopping by my friend consider subscribing if you haven’t I’d love to hear more from ya,2020-10-14T14:52:50Z,1
112,UgxfzfUN4uijd7ejaNB4AaABAg,Susan Gail Hutchison,Until the phone rings,2020-10-24T02:32:52Z,0
113,UgxfzfUN4uijd7ejaNB4AaABAg,eHacker,Thanks Hound very nice to see you,2020-10-14T14:52:27Z,2
114,UgyfCOT2veE3vGfH1LN4AaABAg,gaysy1st,Perfect summing up,2021-03-01T09:17:16Z,0
115,UgyfCOT2veE3vGfH1LN4AaABAg,Jas Mac,Yup - she’s a PR-motivated person.,2020-10-15T02:50:34Z,2
116,UgysAWPE4AMpWq_YNR14AaABAg,gaysy1st,"That's what I think. The first thing you would say to the audience is ""I'm so sorry about that interruption"". But she not only laughs, but makes the comment ""I so needed that"", clearly implying that she didn't want to be there. And then carries on joking that her friend did it on purpose. If my friend did that on purpose, she would no longer be my friend.",2020-11-07T18:38:11Z,1
117,UgysAWPE4AMpWq_YNR14AaABAg,wascawy wabbit098,Any other person would have turned the phone off before they got on stage.,2020-10-24T23:59:51Z,1
118,UgxIxcTPtoJ5awGAWM14AaABAg,Queen Babylonia,"@Ariel Cheyenne hi, I doubt it, she’s got so much else going on, she’s on the worse end of narcissism, she has delusions of grandeur, she uses people to get what she wants , she appears to have sadistic tendencies too, oh and I would also say a misandrist because I think she just uses men, Musk included.",2020-10-15T19:09:42Z,3
119,UgxIxcTPtoJ5awGAWM14AaABAg,Ariel Cheyenne,"@Queen Babylonia hello again 🙋‍♀️Yeah, smh...I wonder if she has BPD and is just genuinely socially awkward which I would usually have some empathy for but I am so personally offended by her now that she ain't gettin' none of that !",2020-10-15T14:16:29Z,2
120,UgxIxcTPtoJ5awGAWM14AaABAg,Queen Babylonia,@Ariel Cheyenne she seemed to find the whole thing funny.,2020-10-15T09:35:11Z,1
121,UgxIxcTPtoJ5awGAWM14AaABAg,Ariel Cheyenne,"@Tammy Lockley quick question; do you think that saying her behavior is shameful has the same relevance as her wearing a skimpy dress ? I warned  against further using comments that could be called ""slut shaming "" and was told ; 
Behavior and clothing are the same thing 
My thought was "" I don't care what someone who robs me is wearing,  I care that they've stolen from me""...",2020-10-15T02:43:33Z,1
122,UgxIxcTPtoJ5awGAWM14AaABAg,Tammy Lockley,@Ariel Cheyenne that is what I was thinking! She acted like everyone was going to laugh with her.  It just shows how clueless she is to how you should behave in a moment like that.  She didn't care about what/who she was talking about she just wanted to look like she did. She is just trash and doesn't deserve to be applauded for anything unless she is being led in handcuffs for the abuse she has committed,2020-10-14T16:01:01Z,5
123,UgxF5QNpbShef_WNsZp4AaABAg,Robin Sage,Narcissism is ruling...ah. And djt,2020-10-21T01:25:07Z,0
124,UgxF5QNpbShef_WNsZp4AaABAg,angelicaca,"That’s so true, hence the bizarre behaviour on stage, she has no sympathy towards other people",2020-10-14T22:37:41Z,4
125,UgxF5QNpbShef_WNsZp4AaABAg,Infinite Soul,@Shame nolan she is also never sober... so that really complicates things.  she is one messed up chick. once she sobers up I am sure there are layers of problems.,2020-10-14T22:19:21Z,5
126,UgxF5QNpbShef_WNsZp4AaABAg,Redmist 2004,She only cares about herself and she’s so selfish,2020-10-14T21:53:34Z,5
127,UgxF5QNpbShef_WNsZp4AaABAg,Mimi B,"@Shame nolan Yea, I subscribed to her channel. Thanks 😊",2020-10-14T21:35:18Z,0
128,UgyRAaayxxuRFk4jgQ94AaABAg,highpeacetess,😅👍,2020-10-14T15:40:57Z,0
129,Ugzd4Sle-Ns502RwGLd4AaABAg,Margaret Adam,"@DMO_Enterprises I don’t think it’s about feminist cultural engineering. Too much has always been expected from men eg the breadwinner, the strong one, crying is not manly. Probably explains the high suicide rate among young men. Too many ‘isms’ these days. Let’s just treat everybody the way we want to be treated. Amber is an embarrassment to all women, and not typical of her sex.",2020-10-14T16:34:40Z,0
130,UgyfTt-V4pq4r9FAcnd4AaABAg,Dread Cthulhu,Wolves love their family and are very loyal.  She has been shown to be willing to throw anyone under the bus to protect herself.,2020-10-21T02:33:39Z,0
131,UgyfTt-V4pq4r9FAcnd4AaABAg,Brookie Brooke,"I agree...& her looks are lacking as of recently, dont ys ya think? No matter who is on what side, so many court appearances takes it toll...on anyone. But shes looking worse than him, bcuz she has to constantly try to keep her lies straight.  & all of her ducks in a row with her sister, making sure she doesnt implicate Amber!  & all of this is her obsession with Johnny. & loss of little control she had, or whatever power she thought she had... bringing dogs into other countries, proved she believes laws dont apply to her, bcuz of Johnny. & without Johnny, this chick, nobody knows who she is, or looks twice.  & that's the motivation ù drive to keep this charade going. Shell be dead broke when this is over too! 🤣🤣🤣 And Aquaman fired her, I'm sure!",2020-10-16T22:58:40Z,0
132,UgyfTt-V4pq4r9FAcnd4AaABAg,Rose Carey,"@Karen Arnold-McGregor She doesn't have JD money  to burn,take a look at her then,and now, shes looking  hagar,besides shes supporting  her gf,and her circle,shes doesn't  have friends,just LEECHES...Just wait ,years from now ,LEECHES  will be writing  books about her for their  financial gain,.That's Hollywood  for you!",2020-10-15T04:26:38Z,3
133,UgyfTt-V4pq4r9FAcnd4AaABAg,Melani de Villliers,Her looks is 50% plastic surgery,2020-10-14T17:31:14Z,4
134,UgyfTt-V4pq4r9FAcnd4AaABAg,chicostephenson,at least a wolf is cunning.  she's just a narcotic bitch.,2020-10-14T15:50:57Z,3
135,UgxmcMp9tiQPXQTjq594AaABAg,Mimi B,She can't help but crack up when she's trying to act sincere. There's not a sincere bone in her body.,2020-10-14T21:17:53Z,8
136,UgxmcMp9tiQPXQTjq594AaABAg,eHacker,Absolutely,2020-10-14T14:52:04Z,9
137,UgxYo26TY4C1mHcxN3x4AaABAg,Yvonne Burns,They invite her for the entertainment she provides talk about setting yourself up lol,2020-10-20T14:55:21Z,0
138,UgxYo26TY4C1mHcxN3x4AaABAg,eHacker,Thanks Fisk,2020-10-14T14:51:58Z,0
139,UgxTW6bZKBmfQGrNB2l4AaABAg,eHacker,Thanks AOJDC! Some people think like that. They don’t think past the surface.,2020-10-14T20:11:49Z,3
140,Ugyqy0NbLQlnluTcycd4AaABAg,Queen Babylonia,@wascawy wabbit098 one of those plants that are full of hidden spikes and poison.,2020-10-25T01:42:12Z,0
141,Ugyqy0NbLQlnluTcycd4AaABAg,wascawy wabbit098,"She is extremely happy because:
1. She is getting a LOT of attention.
2. She is virtue signalling, which makes her look like a really good person by ""representing"" and advocating help for teenage suicide.
3. She is a child who can't control her emotions, positive or negative.
4 She is a plant, and will die without sunlight.",2020-10-24T23:55:49Z,1
142,Ugyqy0NbLQlnluTcycd4AaABAg,Vixie Starfire,"She couldn’t even drop her cheeriness. She was  exhuming giddiness to the point of blatant disrespect for everyone in the room, and especially the victims of suicide",2020-10-17T21:23:13Z,2
143,Ugyqy0NbLQlnluTcycd4AaABAg,Queen Babylonia,"Yes she obviously was trying not to laugh before the phone rang, she just used the phone ringing as an excuse to be able to laugh....",2020-10-15T09:32:05Z,6
144,Ugyqy0NbLQlnluTcycd4AaABAg,chicostephenson,"you would think as an actress she'd at least be better at faking it.  then again, i've seen her work.  there ain't that much acting there.",2020-10-14T15:49:11Z,11
145,Ugw6noASViIq_Eq-_Kt4AaABAg,wascawy wabbit098,@H. Borter Yep. Full o' sh!t.,2020-10-25T00:02:34Z,0
146,Ugw6noASViIq_Eq-_Kt4AaABAg,H. Borter,It's full of you know what.,2020-10-17T20:47:12Z,1
147,Ugw6noASViIq_Eq-_Kt4AaABAg,Mike deGruchy,DudeAbides and heart,2020-10-14T14:38:28Z,2
148,UgyOhiZ9UiAaYxuEoLp4AaABAg,〈77 Seconds,She might be trying to be Scarlett Johansson.,2020-10-14T15:05:40Z,8
149,UgyOhiZ9UiAaYxuEoLp4AaABAg,Eternal Sunshine,yes it's weird she's not even a singer maybe the cocaine drip is attacking her vocal chords tissues everyday for ten years now,2020-10-14T14:51:18Z,5
150,UgxZnDiJbCAW6cNwoYx4AaABAg,eHacker,Ya this is next level.,2020-10-14T14:22:59Z,0
