,parentId,authorDisplayName,replyComment,publishedAt,likeCount
0,UgyTprO_Q7jNsD5Vwdh4AaABAg,JusticeFor Chauvin,"@LaraCroftEyes1 Yeh yeh,  meanwhile in portland...and Chicago..and New York..and LA...And FRisco...",2021-06-01T14:48:14Z,0
1,UgyTprO_Q7jNsD5Vwdh4AaABAg,LaraCroftEyes1,"No he isn't, and that Johnnyhas done more than murder prick named Derek Chauvin.",2021-05-28T20:44:43Z,0
2,Ugy93yUPVcvdBGUHtIZ4AaABAg,Askmolnet,I heard that.,2021-05-16T14:59:22Z,1
3,UgyuNYqO5cX5gho951Z4AaABAg,LaraCroftEyes1,"No, Amber was the only one physically abusive, and that she was has a history of abusing her former girlfriends that Amber was arrested in 2009 for abusing her wife in front of witnesses in an airport and that Amber abused her little sister.",2021-02-10T22:08:34Z,1
4,UgzRLxkWS2_zHDN29yJ4AaABAg,LaraCroftEyes1,What has OJ Simpson done now?,2021-02-10T22:12:15Z,0
5,UgzvNEBiSOzF9TGKUPN4AaABAg,LaraCroftEyes1,"No, he only trashes two hotels rooms and paid for the damages he caused and he was never violent to the crew member and never violent on the sets, and Amber has a history of abusing her former girlfriends, and that she was arrested in 2009 for abusing her wife in front of witnesses and that Amber abuse her little sister.",2021-02-10T22:11:35Z,0
6,UgwbmjjHGEV73WJpV994AaABAg,LaraCroftEyes1,How so? cause the abuser turns out to be Amber.,2021-01-31T19:41:15Z,1
7,Ugw6M0ba9b0EaXsVNIh4AaABAg,Johnny's Girl,@LaraCroftEyes1 Exactly. People need to do their research and stop believing the media and Amber's word.,2021-02-11T07:44:58Z,2
8,Ugw6M0ba9b0EaXsVNIh4AaABAg,LaraCroftEyes1,"Yes, I can there is no shred of evidence of Johnny being abusive to Amber and that his first wife, and his former girlfriends/the mother of his two children to whom he was in a relationship with for nearly 15 years all came to his defense saying that he was never abusive to them, and that he was loving and protective of them, and that Amber's parents were against her and that it turns out Amber's own mother was afraid of Amber that LAPD saw no signs of abuse on Amber the night she called them and neither did neighbors the penthouse to where Jonny and Amber saw no signs of abuse on Amber and that Amber change her story to many times and that she avoid court deposition 3 times, and that Amber defecated on Johnny side of the bed and burn his cheek with a cigarette.",2021-01-31T19:50:27Z,3
9,Ugw6M0ba9b0EaXsVNIh4AaABAg,doombuggy123,@LaraCroftEyes1 You can’t just say “wrong” to someone’s perspective and list a bunch of erroneous information. It makes one sense.,2021-01-27T12:35:55Z,1
10,Ugw6M0ba9b0EaXsVNIh4AaABAg,LaraCroftEyes1,Wrong Amber was abusing and gaslighting Johnny and that Amber has a history of abusing her former girlfriends that Amber was arrested in 2009 for abusing her wife in front of witnesses and that turns out Amber's own mother was afraid of Amber and that in early 2020 it turns out Amber defecated on Johnny side of the bed and she gave him two black eyes and burn his cheeks with a cigarette and that Amber abused her little sister.,2021-01-22T03:36:41Z,3
11,Ugw0O0dQnL3okJg-G414AaABAg,Johnny's Girl,@LaraCroftEyes1 And chopped off the tip of his finger by throwing a vodka bottle at him and it completely shattered the bones in the fingertip.,2021-02-11T07:47:16Z,1
12,Ugw0O0dQnL3okJg-G414AaABAg,LaraCroftEyes1,"Johnny is a victim and Amber is the one who leaks the video to TMZ, and that  Amber set Johnny up to advance her career and she cheated on him and she was abusing Johnny and that Amber has a history of abusing her former girlfriends that Amber was arrested in 2009 for abusing her wife in front of witnesses in an airport and that turns out that Amber's own mother was afraid of Amber and that in early 2020 it turns out that Amber defecated on Johnny side of the bed and she gave him two black eyes and burn his cheeks with a cigarette and that Amber abused her little sister.",2021-01-22T03:39:19Z,1
13,UgzS-nh5y2RdHmdh_Cl4AaABAg,Machiel van Rheenen,"@Johnny's Girl Hi, I agree 100%.
I just think that celebrity spectacles pushed by the media are the true abuse and dr. Grande should not play along.
Regards, Mac",2021-02-11T09:09:13Z,0
14,UgzS-nh5y2RdHmdh_Cl4AaABAg,Johnny's Girl,They are still human. Having money and fame is irrrelevant. All humans have the right to not be abused no matter who they are. She abused him. He tried to get her to stop abusing him. She continued.,2021-02-11T07:50:46Z,0
15,Ugw-Kf1rhyNXT5GubMp4AaABAg,Johnny's Girl,She admits to it. She is really crazy sounding too. Look at Incredibly Average. You'll hear it!,2021-02-11T07:54:45Z,0
16,UgwOn9Ucw-qq4Gbval94AaABAg,LaraCroftEyes1,Wrong Johnny isn't a wife beater the UK  trial  Judge was pay off by Elon Musk and that the UK judge knows Amber's lawyer and that Judge has a family member who works for  Telsa enterprises to which Elon own and that Rudolph Murdoch owns the British media and that Amber's lawyer is a good friend with the UK judge's wife and that Amber had Dinner with the UK judge a few months before the verdict.,2020-12-26T21:00:00Z,1
17,UgxPP8n9xPmuRLpwGdF4AaABAg,Johnny's Girl,👍,2021-02-11T07:56:56Z,0
18,UgzBhPcwz22uP7QFiiR4AaABAg,Johnny's Girl,No he doesn't. And his name is Johnny Depp not Jhonny Deep. You're so disrespectful!,2021-02-11T07:58:55Z,1
19,UgzBhPcwz22uP7QFiiR4AaABAg,LaraCroftEyes1,"No,he doesn't.",2020-12-26T21:00:57Z,2
20,UgxnBMdffAf6HdutYH14AaABAg,LaraCroftEyes1,Wrong there and that Amber is the abusive narcissit.,2020-12-26T21:02:10Z,2
21,UgzUthAlx4eYC26Pxhp4AaABAg,ReyTheJediLady ViaJakku,"@LaraCroftEyes1 that’s something you don’t hear very often, though. Yes, people will abuse the people in their lives but you don’t hear of wives being physically abusive very often so it’s hard to imagine. Kinda gotta wonder what Amber’s got going in her head cuz she needs help if she’s been abusing the people in her lives for so long. A serial abuser....definitely needs some more examination",2020-12-27T16:55:17Z,1
22,UgzUthAlx4eYC26Pxhp4AaABAg,LaraCroftEyes1,Amber was the only one physically abusive in their relationship and that she has a history of abusing her former girlfriends for which she was arrested twice for and that she abused her own sister.,2020-12-26T21:04:20Z,2
23,Ugx9uywZN5zd7nasvd14AaABAg,Emily Cook,"@Johnny's Girl ive never made a utube video, though I am quite opinionated lol",2021-02-11T10:57:32Z,0
24,Ugx9uywZN5zd7nasvd14AaABAg,Johnny's Girl,You should do a video about it. This so-called professional doesn't know didly squat about abusive relationship but you make more sense than him.,2021-02-11T08:03:51Z,0
25,Ugx9uywZN5zd7nasvd14AaABAg,Michelle Doherty,100% agree with you on this.,2021-02-10T22:56:42Z,0
26,UgxPmv2axxIq3KOLr9d4AaABAg,Johnny's Girl,SHE'S ALSO A DRUNK AND DRUG ADDICT AND SHE WAS BEFORE THEY MET!,2021-02-11T08:07:45Z,0
27,UgwJpymSEyl9Oad3Pj14AaABAg,LaraCroftEyes1,"Johnny is innocent he never physically abused Amber treated her queen she took it for granted it by cheating on him numerous times and physically, and emotionally, mentally abused him.",2020-08-23T19:01:48Z,2
28,UgxTGjBYJ8F1E-ZgPpR4AaABAg,Johnny's Girl,She lied. He didn't. Simple as that!,2021-02-11T08:09:59Z,0
29,UgwPIEJaMxn5T7b-FD14AaABAg,Johnny's Girl,He's an actor/musician by profession. But definitely not a narcissist!,2021-02-11T08:11:37Z,0
30,UgwPIEJaMxn5T7b-FD14AaABAg,LaraCroftEyes1,Johnny isn't a narcissist.,2020-08-23T19:02:34Z,1
31,UgzBVwHcnr4r1QMMP6h4AaABAg,Rabbi Spidermann,"@Johnny's Girl Doesn't she have video of him throwing a wine glass at her? Granted, it could have been an isolated moment of temper. He doesn't have a history of domestic abuse but he does have a history of substance abuse, being both loaded and provoked may change the situation. But hearing them interact with each other, neither one is expressing healthy emotions.",2021-02-11T12:57:46Z,0
32,UgzBVwHcnr4r1QMMP6h4AaABAg,Johnny's Girl,"Because there is no evidence Johnny abused her or any other woman, ever! His exes say he wasn't abusive. AH has a history of abusing her partners. Johnny doesn't. And Johnny said he leaves when she gets violent and AH gets angry that he doesn't stay and physically fight. He said he can't stand anymore physicality and fighting.",2021-02-11T08:18:02Z,0
33,UgyYqMbEH71KvAMePyt4AaABAg,Johnny's Girl,HE SPLITS EVERY FIGHT. THAT IS HER WORDS. SHE ADMITS TO ABUSE HE NEVER DOES IN THE TAPES EVER.,2021-02-11T08:20:51Z,0
34,UgyYqMbEH71KvAMePyt4AaABAg,LaraCroftEyes1,"There no evidence of Johnny physically abusing Amber,",2020-08-23T19:14:45Z,2
35,UgwfEhQp9bEY-GrEu6B4AaABAg,Johnny's Girl,He'd be in a jail cell.,2021-02-11T08:26:21Z,0
36,UgwFEaObEye6A-M3KxF4AaABAg,Johnny's Girl,Give me evidence he was violent towards AH! Haha there is none!,2021-02-11T08:33:33Z,0
37,Ugx9nGncaxOSrf4U8a14AaABAg,Johnny's Girl,He is out of the relationship.,2021-02-11T08:35:15Z,0
38,Ugz9g6_8SYw3xJxLY6p4AaABAg,LaraCroftEyes1,Amber is not an abuse victim.,2020-07-20T23:23:15Z,3
39,Ugx2fHhoJhQLUeOZ_hR4AaABAg,LaraCroftEyes1,"No, she shit on Johnny's side of the bed because he came home late from a meeting.",2020-07-20T23:25:41Z,0
40,UgxWQfhRBtPM2bZnWid4AaABAg,LaraCroftEyes1,Amber is the only abusive.,2020-07-20T23:26:11Z,1
41,UgwA8olxQ8YjzYIyt354AaABAg,LaraCroftEyes1,"No, she isn't emotionally damaged she is the abuser.",2020-07-20T23:26:45Z,1
42,UgxOK19QoYZSZN4jAld4AaABAg,LaraCroftEyes1,Amber was the only one abusive.,2020-07-20T23:27:29Z,1
43,Ugzuv5jtr0a6Pg-wnJd4AaABAg,Kirsty Fairly,"Bl MacDonald-If there was really mutual abuse between them as you claim, then how do you explain the fact that Amber can be heard on previous recordings outright mocking Johnny for leaving the room every single time she gets abusive rather then hit her back like she clearly wanted him to. Johnny even says on that recording that he does not want to fight, that there can be no more physical violence from her or else the relationship is over, and that he just wanted peace between them, which hardly sounds like something an abuser would say. 
Also abusers always have a history, and as others have already stated, Amber is the one with a history of abusing her partners while all of Johnny's ex's have said he's never once been violent towards them. Men don't just get to their 50s, after over 30 years of non violent relationships, and suddenly start abusing their partner. Also look back at photos, & video footage, of the two of them together, you'll notice Johnny very often had very visible bruising on his face, whereas Amber always looked completely uninjured & flawless. Plus there are multiple credible witnesses who saw Amber, without makeup, including Amber's own stylist, after she claims to have been brutally beaten, and they saw no injuries whatsoever, nor did these witnesses ever see Johnny attack Amber, but many of them did testify that they witnessed Amber attacking Johnny while he was always trying to get away from her, and often saw Johnny with injuries. Why is it that when a woman claims she was abused she's instantly believed and shown all the sympathy in the world, but the moment that a man admits to being a victim of abuse suddenly it's always oh well they were both at fault, or worse they mock the guy for ""letting it happen"", we really need to start taking male victims of abuse as seriously as we do female victims.",2021-02-09T18:35:04Z,0
44,UgwelYViDRoFQZzDnhd4AaABAg,Can we get 1000 Subscribers with no Videos???,"Regarding how Johnny approaches these discussions. I think he's fully aware of how she can try to destroy him if he doesn't cover his butt. She clearly has a nasty streak.  I think the he is resigned to the fact that his need to defend himself in this manner is just unfortunate.
I've experienced people like this before and for me, the clear clear message from this whole malarkey between Heard and Depp is that she is a despicable human being who is manipulating people left right and center to get what she wants.
Depp has suffered greatly due to the allegations she has made. I think he displays a remarkable amount of composition for someone in his position.",2020-04-30T16:49:40Z,1
45,UgxIAEJUCdbyr7BTd6B4AaABAg,Rachet87,white knight thats you are that cant see,2020-02-26T14:18:31Z,0
46,UgxIAEJUCdbyr7BTd6B4AaABAg,Ji Mo,In our case here amber might be also not clean and she's between BPD aggression and codependency attachment patterns as she also kept projecting non stop.  Give them time after final divorce and you'll clearly spot the real abuser who triggered it all from the beginning irregardless of what both are narrating now.,2020-02-26T13:11:45Z,0
47,Ugw3o9uAnWBxb_tygH14AaABAg,havest2,@LaraCroftEyes1 oKaY,2020-02-22T19:44:26Z,0
48,Ugw3o9uAnWBxb_tygH14AaABAg,LaraCroftEyes1,"No, he isn't a covert N.",2020-02-21T05:05:49Z,2
49,UgycvxXF6a-YaHfgUrp4AaABAg,CLARA WONKYIMAA ANDORFUL,@sean herron He lost the libel case... not the defamation case which is in 2021.,2020-12-08T11:23:12Z,5
50,UgycvxXF6a-YaHfgUrp4AaABAg,sean herron,"Well, this didn't age well.",2020-11-19T08:26:08Z,5
51,UgwhoZz7hzfN3pX4TDB4AaABAg,Rock Candy,agreed.  it's good to have an open mind but Amber is a narcisist who is a liar and everything you said.  So there is no sugar coating it.  Dr. Grande should have enough experience to understand the manipulation that Amber is using here.  Not sure why a professional can't identify a sociopath.   i've had to dislike the vid because the truth is missed.,2021-03-23T02:04:46Z,2
52,UgwhoZz7hzfN3pX4TDB4AaABAg,ThePaintedLady,"Fully agree. I've heard other recordings of her, there is no mistaking she is the real abuser in the dynamic.  In most cases I'd be inclined to believe the woman, but not this one.  From the beginning I had a feeling that she is the manipulative one, goes to extremes to provoke him through her own aggression and violence, and then as soon as he responds to defend themselves from her attacks or reacts badly to her abuse, he is suddenly 'victimizing' her.  Many of the recordings confirm this suspicion.",2020-08-02T02:04:14Z,3
53,UgyxPLEDd5niFAvW9Hx4AaABAg,Monica Wylie,"Indeed. However he was working with her on a film. Off camera she cried that her girlfriend of three years dumped her. He became the hero whilst comforting her. Then he buys her a pony. Things progressed from there. If he didn’t fall for her garbage, he would have stayed happy in his former relationship",2021-11-17T18:24:41Z,0
54,UgyxPLEDd5niFAvW9Hx4AaABAg,G W,"​@Paula Duncan Adams I completely agree with you. While I can't prove that Musk or Depp are narcs. As I don't know them personally. They can be prone to abuse if their ego is left unchecked, and are uneducated on narcissism and abusive relationships. Narcissism gravitates to fame and money like a moth to a flame. You are also right ... they both have a tendency to go after arm bling and drama. Nothing wrong with that and no shade directed to either of them. They just value different things. 

 I'll close off by saying everyone that has a pulse needs a personal couch in a psychotherapy office.  Not just them. I envy them more cause they can go every week if they wanted lol.",2021-09-22T22:06:38Z,0
55,UgyxPLEDd5niFAvW9Hx4AaABAg,Happy Baak,"True.. so sad, of all the women he fall and choose to marry this nasty woman who ruined his life in just a short period of time. WOW.",2021-08-21T09:46:59Z,0
56,UgyxPLEDd5niFAvW9Hx4AaABAg,Ramiro Díaz García,she chose him,2021-07-28T22:03:35Z,0
57,UgyxPLEDd5niFAvW9Hx4AaABAg,Justin Watson,"Dates, not cares.",2021-06-12T18:42:18Z,0
58,UgyDV51VUJBdLYj9lPB4AaABAg,Islayman,"Yeah, my ex-wife.  I think Buckcherry wrote that song about her.",2020-08-03T02:33:46Z,1
59,UgwXkh63-fcCLJYvnhd4AaABAg,Islayman,"I don't know about bouncing back, that suggest something like a rubber ball, I think its more similar to baby steps.  He's moving, but he's been through the ringer.",2020-08-03T02:36:55Z,1
60,Ugzy2nK56m81978i41B4AaABAg,Lenita A,"I agree with much of what you have said, except for the 'stereotype' comment! 'Largely false'?  Men are more likely to physically abuse than vice versa! Men are generally stronger, bigger and more aggressive! Testosterone plays a big part in this.. And if the man feels entitled, has no self control, controlling, etc, a bully, then he seems to feel justified to hit a woman..",2021-02-18T19:53:29Z,0
61,UgxUd4-mppKzHjNslQx4AaABAg,Oscillate Wildly,"What are his narc traits? Give examples. Not your made up one's, the real ones",2020-10-28T00:34:18Z,1
62,Ugxe50QgyECJjpfHGAh4AaABAg,P T,"""I'm not good enough"", is what lies in the subconscious mind of Narcissists. Most aren't self-aware to understand that it's the basis of the defense mechanism that has become their personality. If they are aware, they'll likely not admit it, unless they're manipulating someone. A borderline is more likely to admit to those feelings.",2020-02-20T00:23:45Z,0
63,UgyStGPOPg2QJJvUcX14AaABAg,Katanya Jason,I agree with you. And like your lion tamer analogy. Great way to put it!,2021-11-11T10:51:12Z,0
64,UgyxETt_bZcQQsZydMp4AaABAg,nadia c,"@Tammie queen from your first sentence to me, it is evident you are not balanced and fair. What a load of rubbish.",2020-02-12T17:54:26Z,0
65,UgyxETt_bZcQQsZydMp4AaABAg,Tammie queen,"@nadia c I am guessing you have never been in an actual abusive relationship. I have and I also have worked with victims and recieved Counceling from real Reputable world known Victims of Domestic Violence Center and Mutual abuse does not exist. In fact if you look up that term on reputable Centers and or programs you will see it does not exist. You will also see that she shows every classic sign not to mention it has been established by her own admittance he avoided confrontation and fights with her. He admits to defending himself twice. Once on a plane as he could not leave and once when she threw a bottle or can slicing his finger off. That is not mutual abuse that is self defense. Oh and the moment she released the video of her filming him slamming cabinets when he found out he lost all that money due to his management and a day after his mother passed I knew then she lied. A woman who claimed to live in fear as she claimed would not be nonchalantly filming their abuser like that. In fact the moment he began slamming cabinets a real victim fearful of their life as she claimed would be scared as they would fear they would get beat. I know this all to well and if you took the time to go to your local Victims of Domestic Violence Center and heard the stories of victims you would know too. The point here is she started this all by claiming to fear for her life and in the end she is an abuser. That is a fact by her own admission she hit, threw vases pots pans and sliced off his finger all while he tried to ""split"" and ""run away"" as she said because according to her he Is ""not brave"" a ""coward""- for leaving when she got violent. Not to mention she gave him xanax and I imagine how we all looked on wondering why he changed so much while with her. If this was Johnny talking that way to her people would condemn him but because he is a man suddenly it's both their faults or mutual. That is not how this works.",2020-02-12T16:53:44Z,1
66,UgyxETt_bZcQQsZydMp4AaABAg,nadia c,@Tammie queen they are both as bad as each other.,2020-02-12T15:51:07Z,0
67,UgyxETt_bZcQQsZydMp4AaABAg,Tammie queen,"Amber recorded the first one, where she admitted to abusing him. Not sure of the second one.",2020-02-12T15:45:45Z,1
68,UgwAcx9QV4Z4809ja8V4AaABAg,Sofabuddha,"@Palma Wow, way to over-react. I never said he was a bad person. If that's what you took from my comment I'd suggest you need to take a step back and calm down.",2020-02-12T14:16:49Z,0
69,UgwAcx9QV4Z4809ja8V4AaABAg,Palma,"So he has a different OPINION that your HOLY AND ONLY TRUTH, he's gotta be a BAD person. 
That's Cognitive dissonance.",2020-02-12T13:36:33Z,0
70,UgwkMH03Jwr7_VSqlWp4AaABAg,mophead (ᮟᮥ),"@Islayman oh yah, i get that. i was referring to the way the general public react to these issues and allegations, in which they more often apply guilty until proven innocent to the accused but even after the accused's been proven innocent they dont take back their initial prejudice. sorry for not being clear on that first time around.",2020-08-03T14:26:05Z,2
71,UgwkMH03Jwr7_VSqlWp4AaABAg,Islayman,"@mophead (ᮟᮥ) You do not understand the meaning of ""innocent until proven guilty"".  This is simply the burden of proof for the prosecution at trial.  Criminal defendants are arrested, charged, and have their liberty restricted and their reputations destroyed based on suspicion or probable cause which is a much lower burden of proof than the standard at trial.  As to civil litigation, the plaintiff still has the burden of proof, but a lower standard ""preponderance of the evidence"" approximately 51% or more likely than not.  Actual innocence not what ""innocence"" refers to. It refers to the prosecutor having to prove your guilt instead of you having to prove your innocence.",2020-08-02T23:18:14Z,2
72,UgwkMH03Jwr7_VSqlWp4AaABAg,Islayman,"@S Milo You are misinformed when you say that ""very few people lie about domestic abuse or sexual assault"".  Many people lie about this, frequently for strategic advantage.  It may not be the majority, but it is not ""very few"" as you say.  I have represented many, the vast majority successfully, regarding false accusations of domestic violence and sexual assault.",2020-08-02T23:11:54Z,3
73,UgwkMH03Jwr7_VSqlWp4AaABAg,Cuppy Cakey,"As soon as I heard it, I knew she was lying. It’s sad that people doubted him, but I’m glad he hit his day in court.",2020-07-28T22:09:00Z,1
74,UgwkMH03Jwr7_VSqlWp4AaABAg,mophead (ᮟᮥ),"@S Milo i agree. am not much of a fan of the whole thought of innocent/guilty until proven otherwise, i think ""suspect until proven otherwise"", for all parties involved, is a better option.

however, ever since i followed the case and get caught up with all proofs to date (audio, interview transcription, etc) i feel they point more and more into AH being the sole suspect.

but outside this specific case, aye, people do lie about DV, rape, and other horrendous acts. drives me mad every time people want to pretend as if those instances dont happen at all.",2020-07-21T10:38:48Z,1
75,UgyOZxaDxZjFDrcqKv14AaABAg,Anony Mouse,Palma yes!,2020-02-12T11:45:28Z,0
76,UgwMcz9lHSSBUpzSUZ54AaABAg,Anony Mouse,Palma yes I see both as manipulative. Neither is an angel.,2020-02-12T11:28:22Z,1
77,UgwYdCEe0eEjx7Q6Jq54AaABAg,The Fair Haired Boy With The Red Balloon,Ichigo Senpai - Why don’t you feel comfortable?  Would you feel comfortable going into a domestic violence shelter for women and say to them ”I don’t feel comfortable in saying that you are innocent”?,2020-02-27T10:11:29Z,2
78,UgzvH24wYer_LTF9gC94AaABAg,z,"@M R exactly! Sounds like a bpd- don't leave me, fight for me, fight with me, don't run away (dont abandon me), i am sorry, why do i always have to apologise, and patchup.

Has zero control over her emotions, can't control spitting out truth about hitting him even in controlled environment, with full awareness about their conversation being recorded. 
She's more on the bpd side of cluster b scale.",2020-02-12T15:25:22Z,1
79,UgzGPmGfqs6w4yZmY2V4AaABAg,Islayman,"@Marie Priss I saw that Depp testified to that, but I did not see a practioner provide this opinion.  Nevertheless, for me, after being married to a BPD with narcissitic and sociopathic traits and having similar experiences, I suspect that Depp's testimony was accurate.",2020-08-25T13:10:18Z,0
80,UgzGPmGfqs6w4yZmY2V4AaABAg,Ingvild XO,Marie Priss That makes sense😅,2020-08-25T05:32:49Z,1
81,UgzGPmGfqs6w4yZmY2V4AaABAg,Marie Priss,Fun Fact : She’s A Diagnosed Narcissistic Sociopath :),2020-08-25T03:03:10Z,1
82,UgzGPmGfqs6w4yZmY2V4AaABAg,Islayman,"Agreed.  Dr. Grande implies something, not sure exactly what but negative towards Depp, because he waited a while before he responded.  This is a guy who is exhausted hearing his partner's repetitive bs.",2020-08-02T23:25:14Z,2
83,UgwF3voYe1RoX70k3bF4AaABAg,Irina L,@KC fully agree with you. I wouldn't be able to express it better.,2020-02-22T19:40:28Z,0
84,UgwF3voYe1RoX70k3bF4AaABAg,Irina L,@M R I hear emotions in her monologue. In his monologue I hear acting. Both don't listen to each other and only pick up the words they want or they are triggered by. This is how she's more real to me than John.,2020-02-12T16:14:16Z,0
85,UgxEj8jwv3W_GqIg3tJ4AaABAg,H T,It's also telling that the only time in the phonecall where he was able to express himself properly and say more than 1-2 sentences was when she'd hung up on him.,2020-02-12T18:37:02Z,19
86,UgwO6cm5fST4ozJ-pZd4AaABAg,Pamela Carr,Agreed,2020-07-23T19:55:13Z,1
87,UgwO6cm5fST4ozJ-pZd4AaABAg,Pamela Carr,Totally agree,2020-07-23T19:54:58Z,1
88,UgwO6cm5fST4ozJ-pZd4AaABAg,Tamara Sunshine,Thats why im not even going to watch this video now. Was just scrolling trough the comments. Everyone who doesnt call her for what she is is not worth watching,2020-07-20T13:10:14Z,2
89,UgwO6cm5fST4ozJ-pZd4AaABAg,Can we get 1000 Subscribers with no Videos???,200 subs no videos. Hmm.,2020-04-30T16:39:01Z,0
90,UgwO6cm5fST4ozJ-pZd4AaABAg,ᗩᒪIYᗩᕼ,"Did anyone read the title of the video ⁉️
Dr. Grande is just analyzing a phone conversation. That’s it. But so many people are in their feelings because he didn’t reach all the conclusions that they wanted him to conclude, based on just this 25 minute phone call. 
My overall opinion of everything that I’ve seen about this case so far, is also that Amber Heard is guilty. However, that’s not the topic of this video. We need to learn how to view things objectively.",2020-04-01T14:56:33Z,14
