,parentId,authorDisplayName,replyComment,publishedAt,likeCount
91,UgxB0XVhpLuj40hlDQV4AaABAg,Rock Candy,True. His lack of understanding is actually making me a little upset and seems quite ignorant of the available facts.  Maybe the video needs an update.  It hasn't aged well.,2021-03-23T02:22:05Z,0
92,UgxBMvDONDUnAtYM52p4AaABAg,Victoria Wilder,"It is very important that Dr. Grande responds to these questions. If he's a professional, he will do so.",2020-02-12T14:16:06Z,1
93,UgynJA7y37dHq6NT7754AaABAg,Daniel Drake,He is suing her for I believe 50 million.,2020-02-13T08:02:46Z,0
94,UgxmLIinTUUwagf6aPl4AaABAg,👑TheMetamorphosisOfGipsy,"I'm by no means taking Amber's side, but reactive abuse is real.
You can be so traumatized and abused that your outbursts of anger are sometimes worse than the abusers. Especially after years and years of abuse.
After decades of manipulation, blame, shame, emotional, financial, physical and sexual abuse, there is a point reached when the abused turns into the abuser. I think, for the sake of argument, that reactive abuse should be taken into consideration.",2020-02-18T15:59:12Z,3
95,UgxmLIinTUUwagf6aPl4AaABAg,Edie Minturn,Nóra Zsuzsa Gácsi Thank you 🤗,2020-02-13T13:02:02Z,1
96,UgxmLIinTUUwagf6aPl4AaABAg,Edie Minturn,"Sandra H. Oh dear....that is a very different situation indeed... you had to protect your kids, of course you could not fight back!
You did what was safest for them, you did well. ❤️
I hope I would have done the same you did had there been kids involved- no child should have to defend their Mom or watch their Father physically hurt her or them. I was alone, desperate...looking back I have no idea how I survived in that situation for so long.
I was completely brainwashed by the end of it...and as much as I ache to have kids, I am grateful none were involved in that situation...",2020-02-13T12:59:43Z,1
97,UgxmLIinTUUwagf6aPl4AaABAg,Sandra H.,"In my case it was 14 years. And I was scared to raise my voice against him for obvious reasons. In my case were kids involved, this was one of the reasons I stayed silent.",2020-02-13T12:34:41Z,3
98,UgxmLIinTUUwagf6aPl4AaABAg,N G,"@Edie Minturn I am sorry you had to go through that :( you're right, the term survivor is better. I hope you are in a better place now",2020-02-12T21:27:27Z,2
99,UgwEZa6xm9Fnk0XbWDx4AaABAg,Jared Ferguson,"@John Rew Well, that's certainly true. I think our culture has a gigantic problem with normalizing abusive behavior and I certainly don't want to seem like part of the problem",2021-02-05T14:19:53Z,2
100,UgwEZa6xm9Fnk0XbWDx4AaABAg,John Rew,@Jared Ferguson My own personal policy is that as long as someone is not violent with me I will not be violent with them. Once they have committed violence against me they have removed that protection. I may under the particular circumstances  decide that violence on my part is counter productive but there is no guarantee of that. That applies to both men and women. In any case if a woman threw a cup at me I wouldn't just let it go. I certainly can't imagine continuing a relationship with such a person. I like myself and I reject the notion that men should simply absorb violence.  The worst mistake to make in a relationship is to give the other party a reason to believe that abuse will be tolerated. Unfortunately this is not the message we are giving our young men.,2021-02-05T14:06:09Z,1
101,UgwEZa6xm9Fnk0XbWDx4AaABAg,Jared Ferguson,"I think Todd did an excellent job at making it clear that the violence is not acceptable. It seems as though the violence was an isolated incident and not especially severe. That isn't in any way a justification, but as a man your ""natural consequences"" don't seem especially necessary. We're talking about a man who is I'm guessing around 6 feet tall and around 170 verses Amber Heard. It's like a bear verses a fucking chihuahua, we are not talking about Rhonda Rousey here. You say she's moving on to her next ""victim"" but it isn't as Machiavellian as all that. She's just an immature and vaguely mentally ill bitch, it happens all of the time. The most truly damaging things that she did to Johnny Depp were certainly not physical. Going back, you say we've removed the ""natural consequences"" for domestic abuse perpetrated by females, and that now they can operate with impunity, but what exactly is your solution? Should I flatten some chick because she threw a cup at me? How does that work in your head exactly? I don't want to narrow down all domestic abuse by females to, say, throwing a cup, that would probably be sexist against both men and women, but we should be really clear about what it usually means when women get physical with their man in a relationship. They aren't usually going for the jugular is all I'm saying. Men are a little different in that regard",2021-02-05T11:12:43Z,0
102,UgyNFF3mjZjkTxdyLDl4AaABAg,Dr. Todd Grande,Thank you for pointing that out. I trimmed that error out using the editor.,2020-02-12T05:30:08Z,2
103,UgzV1nRiUU253S6d1AJ4AaABAg,Dr. Todd Grande,Thank you for pointing that out. I trimmed that error out using the editor.,2020-02-12T05:30:57Z,2
104,UgwWAEOQLT5n6TLJUrR4AaABAg,MAGAir,"@levityoflonging22 Exactly. I spent four years with complete trust of my ex, only to find she was treating me as a cuck, cheating with whomever she liked.",2020-07-16T05:20:45Z,4
105,UgwWAEOQLT5n6TLJUrR4AaABAg,levityoflonging22,"When he said he made her up in his head, I knew just what he meant. That person is what you want the other person to be, but that person doesn't actually exist.",2020-07-07T20:19:13Z,13
106,UgwWAEOQLT5n6TLJUrR4AaABAg,Supernova,"I’m thinking she has NPD (Narcissist Personality Disorder). If he figured it out and has done his research, that’s sort of part of it. They don’t really have personalities...it’s complicated and a lot to get into but it’s almost like they’re just empty people. They say something and do another and use contradictory statements constantly. They claim to feel a certain way and then say that exact opposite the next day. They lie constantly and try to make you feel like you’re the crazy one. It’s extremely abusive and often feels like they don’t even exist because they don’t have any foundation as a human being if that makes any sense. That’s what I took from that statement because I’ve been through it so it completely resonated with me.",2020-06-16T04:38:09Z,13
107,UgwWAEOQLT5n6TLJUrR4AaABAg,Seri Smith,"@Diane L. Styma considering the phone call you can hear him getting from Amber in the recording, I would say it's safe to assume Johnny recorded it.",2020-02-26T17:56:47Z,1
108,UgwWAEOQLT5n6TLJUrR4AaABAg,Diane L. Styma,Who taped it though.....? Did Depp,2020-02-26T05:52:45Z,0
109,Ugwk4BWw-EjzBILs82h4AaABAg,James Hughes,"I also want to add that Johnny's mother was also really abusive, and he learned his co-dependence from his relationship with her. This would explain why Johnny doesn't come to the realization he has at the end sooner. 

I believe that ​ Dr. Grande analyzed this through too narrow of a scope. All of his conclusions seem to be based on viewing both Amber and Johnny as people who are of healthy and sound mind, with no prior history of abuse, in any capacity. But the fact that Amber has a history of domestic violence matters. Johnny's previous partners stating he wasn't abusive matters. Johnny's previous abuse at the hands of his mother matters. The fear that Amber's parents have of her finding out that they texted Johnny matters. 

Putting out an 'analysis' like this without taking into account the personalities of the people involved, or any of the evidence, is very negligent.",2020-05-08T18:20:53Z,3
110,Ugyp3l-yEFDW3gNR1zF4AaABAg,levityoflonging22,"@MissGreenflower I think these kind of people tell their lies so much that they even convince themselves. My ex will tell blatant lies (like I shouldn't be mad that he refused to work for two and a half years when he has worked to support me for the past ten years. We've only been married for 8 years total, and as I said, he has been unemployed for two of them.) To him, it is fact.",2020-07-07T20:26:47Z,2
111,Ugyp3l-yEFDW3gNR1zF4AaABAg,Jessica Garcia,"Yes! Incredibly Average has done a phenomenal job covering the case and the information coming out. I think Dr. Grande may have a very different analysis if he were to hear more audio and watch Incredibly Average’s videos detailing Amber’s apparent manipulation, abuse, personality, selfishness, and emotional instability. And on a side note, after months of an unhealthy unstable relationship, ever changing allegations, litigation and after most likely finding out about Amber appearing to have multiple affairs while married to Depp while he was out of town with James Franco and Elon Musk, I think it is completely fair for a hurt and beaten down Depp to insinuate that her love may not have been real and true. No it is not a deescalation tactic but human being are flawed and when we’re hurt sometimes we say it even if it may not be the most effective technical decision at the time. However, I think his comment was pretty effective in reminding Amber what she is doing to someone who did appear to truly love her.",2020-04-22T13:40:11Z,2
112,Ugyp3l-yEFDW3gNR1zF4AaABAg,Kitty Caladonia,"@Anarcho Frills Yup  I did a pretty dang good job at hiding the busted nose and 2 black eyes my ex gave me with make up, the thing in my case is my close friends saw my bruises when I wasn't wearing it indoors. In Ambers case I think the real proof of her having no bruises/split lip etc was her I think make up artist making a legal statement saying she had none on the day after at the TV show recording.",2020-02-13T10:39:56Z,2
113,Ugyp3l-yEFDW3gNR1zF4AaABAg,Sneasel,"Second this. There is evidence of Heard applying makeup to herself and then being magically fresh-faced and bruise-free the following day. 

I have really deep acne scars from when I was a teenager, and I appreciate most men would likely not know this, but to cover discolouration of that magnitude (bruises, scarring, even deep redness like I have due to the acne), you need pretty heavy makeup. As in “caked on.” 

There is no way in Hell you’re covering even a mild acne scar with a sheer foundation, let alone a fucking bruise. Amber Heard is a liar.",2020-02-12T19:05:15Z,10
114,Ugyp3l-yEFDW3gNR1zF4AaABAg,MissGreenflower,"@C Dorothy That's the scariest part for me. She recalls facts vividly, the evidences that she led to court and the stories about the allegedly abuse she suffered from him are made by her very credible. But when you go to verify, a lot of the facts came out to be evidently untrue. The TV show story is the most incredible. The night before she was bitten so badly to have ""two black eyes, an almost broken nose and a split lip"" and the night after she is smiling and laughing on TV?! Good make up can create/delete a bruise, but cannot cover a swollen face and wounds. The worst is that she really believe what she is telling! I think that Johnny Depp, in this second conversation, did understand for the first time how capable she is of changing reality, beyond lying. To me he sound astonishing, disappointed and probably a little scared by her behaviour.",2020-02-12T17:00:47Z,14
115,Ugzqb2bgJ48toQGOVPF4AaABAg,Gavin4419 1,She admitted hitting him in the first recording.,2020-07-23T18:11:13Z,3
116,Ugzqb2bgJ48toQGOVPF4AaABAg,Erica,"@Dr. Todd Grande since Depp ex supports him,and gives an extremely charitable discretion of his charector  despite their  divorce and Amber  has been arested for DV shouldnt the benfitvof doubt be given to him ?",2020-04-03T07:31:01Z,2
117,Ugzqb2bgJ48toQGOVPF4AaABAg,Marie M,Dr. Todd Grande Thank you.,2020-02-12T11:13:35Z,4
118,Ugzqb2bgJ48toQGOVPF4AaABAg,Dr. Todd Grande,Thank you for pointing that out. I trimmed that error out using the editor.,2020-02-12T05:31:19Z,16
119,UgzxSAI9tKKRZyZP7rJ4AaABAg,Rock Candy,Dr Grande is being more gaslit than Depp...Amber the queen of gaslighting.,2021-03-23T02:16:39Z,1
120,Ugw3V0mhCX3vaDtYPAd4AaABAg,Cuppy Cakey,"It’s very sad, especially since he’s such a humble, caring person. He deserves better.",2020-07-28T22:22:14Z,6
121,Ugw3V0mhCX3vaDtYPAd4AaABAg,BlueTulipe,I got the same impression.,2020-02-12T07:44:14Z,7
122,Ugw3V0mhCX3vaDtYPAd4AaABAg,Cu,"Well said. My heart breaks for him. I’m not even a fan, just a person whose been through abuse and manipulation and has a lot of empathy.",2020-02-12T07:19:18Z,11
123,UgwX2g28yXGVBeW0xf14AaABAg,Airada Imagery,Bruce Lol!,2020-02-12T04:57:55Z,0
124,UgynWp3P3B4WwWPPUuN4AaABAg,María Elena,She’s an evil narcissist! She had a baby! Poor baby 😳,2021-07-18T03:00:28Z,3
125,UgynWp3P3B4WwWPPUuN4AaABAg,Justin Watson,"@Tamarahope77, your solidarity with abuse victims is admirable, but I don’t think Johnny Depp needs Dr. Grande to go to bat for him.",2021-06-12T18:49:09Z,0
126,UgynWp3P3B4WwWPPUuN4AaABAg,LaraCroftEyes1,Amber is the abuser that she abused Johnny.,2021-02-21T04:05:43Z,8
127,UgynWp3P3B4WwWPPUuN4AaABAg,Tamarahope77,"@caSAMity Psychologists and clinicians who are trained in DV know that being neutral and impartial results in taking side with the perpetrator (because that's what they want), so isn't neutral anymore.",2021-01-19T08:23:12Z,8
128,UgynWp3P3B4WwWPPUuN4AaABAg,caSAMity,"@Tamarahope77 i think he’s trying to remain impartial on this particular recording. if he were to do a video on the situation overall and take every piece of information into account, i would take more of an issue with his perspective here",2021-01-19T01:33:21Z,1
129,Ugw5_0jcy1nhCPWH62d4AaABAg,Ginger Snap,@Dr. Todd Grande Thanks for taking time to respond :),2020-02-12T06:08:58Z,4
130,Ugw5_0jcy1nhCPWH62d4AaABAg,Dr. Todd Grande,Thank you for pointing that out. I trimmed that error out using the editor.,2020-02-12T05:32:00Z,5
131,Ugy7c_8I6jIs-VDtvYt4AaABAg,Cu,"Kira MPD I know, the amount of victim blaming is insane.",2020-02-12T07:27:06Z,1
132,Ugy7c_8I6jIs-VDtvYt4AaABAg,Kira MPD,"Ah of course! ""He deserved it.""",2020-02-12T06:55:25Z,1
133,Ugy7c_8I6jIs-VDtvYt4AaABAg,FH 110,"Actually, he never married his partner of 9 year, the mother of his 2 children. They decided to separate peacefully. He dated ď married Heard after a few months /years. His ex-partner already married & still defends him, mind you.

He did admit he's addicted to painkillers tho. Still trying to stop using them. That's his issue.",2020-02-12T06:44:04Z,2
134,Ugw_SKMWuRiBAJAAhlt4AaABAg,Poppy Fields,😂,2020-02-12T13:12:19Z,0
135,UgzSxZ6Y_lR2V-woAiZ4AaABAg,Junie Moon,"You may be missing the broader sociological implications. She’s become a phony activist for the #MeToo movement. These tapes have hopefully started to wake people up. Women should NOT always be immediately believed, as they’ve suggested. I’m a feminist and yes, Me Too, but you have to draw the line at giving women a blank check. Her speech at last years Women’s March in LA will make you sick, after hearing these tapes. This isn’t your everyday celebrity divorce by any means. This malignant narcissist needs to be put on global blast. And then disappear. Edit: not a blank check but a free pass.",2020-02-12T08:05:19Z,3
136,Ugxlgo1H63oF7YVy5l94AaABAg,Dr. Todd Grande,Thank you for pointing that out. I trimmed that error out using the editor.,2020-02-12T05:32:31Z,4
137,UgykIJlig4MXSWnjVIV4AaABAg,Elizabeth Wolfgang,"@M R 
There's no excuse for Amber's abusive behavior.
If you listen, he knows her buttons. That doesn't mean Depp was abusive, it's more like he knowingly had more control over himself while also knowing that Amber did not have a similar ability. She was an easy bait & switch. Now add drugs & alcohol to the relationship, that's how you get to treating each other like crap. Very sad.",2020-02-12T15:25:16Z,0
138,UgwSZ_zWpXin0ht8vud4AaABAg,H Ibrahim,"A bpd who lives in a different country, accused me of causing problems for her. I tried to reason with her telling her it was physically impossible for me to be the cause of the problem, since I'm in a different country. She kept yelling at me that I should just admit that I did it. So at the end I just gave up and told her ok I did it, to make her shut up. There is no reasoning with BPD's, sometimes you just have to go a long with their crazy accusation, because they won't get it anyway.",2020-11-21T02:57:57Z,0
139,UgwSZ_zWpXin0ht8vud4AaABAg,la214la,"Exactly! He even said at the end, “Ok. Well, you’re gonna believe what you want to believe.” I heard someone who is exasperated and uninterested in challenging her delusions. He knows how their fights go, and he has reached his end in trying to talk to her. That’s how I heard that conversation.",2020-09-25T14:37:19Z,2
140,UgwSZ_zWpXin0ht8vud4AaABAg,Lance Lust,"@Anarcho Frills 
""Oh wow you've read Greenberg too? Damn you really did do your research.""


Haven't read anything but her quora answers, really. But I've don't some, yes.


""I will say that idk if you're scared of her telling more ppl you're ""abusive""


Indeed, I am. Today, people accept a woman's word for just about everything. 


""but I can tell you I've seen this with partners of Borderlines, Narcissists, & even CPTSD.""


Two of which she's been diagnosed with.


""The only thing I know that works is validating their feelings. You basically have to forget about any apologies or any admission of wrongdoing and focus entirely on their feelings to not be the bad guy anymore.""


I was hardly ever the bad guy. Only thing I did was yell at her, because she was so overbearing, and just wouldn't leave. I, too, have issues. But hers are so consuming nothing can penetrate her views, and I wish I could have been stoic, but she manipulated me into many things I regret. Provoking me into yelling at her a couple times was the worst. I should have left, but the nagging, and the never ceasing drama. It turned me into a mess. 




""They will eventually find someone else to blame for their misery. Oftentimes they shift back to Idealizing the ex they once demonized.""


Oh, she's probably going after her dad, as there's an online court hearing I read about. She's always going after someone to make look bad.  


""But don't worry. She can present her distorted victim perceptions to therapists all she wants. Therapists will validate feelings and show empathy but that doesn't mean they believe the clients perspective reflects reality.""


Oh, I understand this. Problem with her is, she talks to a lot of them. I drove her to other counties to talk with more than just one therapist, because between sessions she needed her supply. I didn't know what was going on until after. When I finally decided to add a word into the BPD category, as in vindictive BPD, I was sent to vulnerable narcissism, though I found the other term much more related to her.


""No therapist automatically believes a client's claims because most have some distorted perceptions. To find out if a client's claims are realistic they ask questions such as ""What does him manipulating you look like?"" ""Can you explain more?"" Etc Because some people perceive manipulation where there is actually just a misunderstanding etc.""


Yes, I understand this as well. Hopefully she'll end up getting someone who can treat her in a way needed so they can get something into her to help, but I don't see her future being bright in terms of her drama/attention seeking.


 

""But eventually therapists will challenge the client's victim mentality and this is when Narcissists angrily leave and consider suing the therapist for ""abuse"". 🙄""


Oh, the therapist she used when I first met her...? She left that one, claiming things I cannot recall at the moment regarding something about abuse.

""With PDs usually it's not lying, it's distorted perceptions. They do lie when they feel they ""have to"" though. But they can distort their own memories and can selectively remember/forget certain details. This is what occurs during Splitting. It's wild. There's research on this. Such Cognitive Distortions occur below the level of consciousness.""


Oh, I've been through much of it. I have great long term memory. I remember most everyone, even that which is distant; I just have to dig a bit, and I know some of what I might remember could be distorted because memory loses its reality along the way, this is when I'll say, ""If I remember correctly,"" but even she has said I have a great memory.

""Even if she were to get a diagnosis she would probably be dx'd with Borderline since Vulnerable Narcissism isn't a diagnosis.""


Not a diagnosis, but it's good to know when someone has such a disorder. Them being both on the same cluster spectrum, I would think if one isn't, the other can't be. Diagnoses, I mean.




 ""There is still about 40% of those with dx'd BPD who are highly resistant to therapy and will drop out after only like 2 months. Arguably these might be more Vulnerable Narcissist types idk.""


Some times I think I might be able to be a worthwhile therapist, but if I had to deal with her type day in and day out, I think I would be the party who walks out :)",2020-02-16T07:33:57Z,0
141,UgwSZ_zWpXin0ht8vud4AaABAg,Lance Lust,"@Anarcho Frills Been to both Grande's and Greenberg's, so I have educated myself. This person I dealt with is narcissistic. I've gone both ways with the idea of maybe she's BPD, maybe she's CNPD. I always end up on the latter's definition. I can tell she's co-morbid, but there are times I have witnessed what she actually believes and doesn't. Manipulation, cold-hearted manipulation is her game. Plenty of times she played many different fields, and it took many months of thinking about it for me to come to this conclusion. 


She lovebombed me hard. Told me it was her past guardians who made her mean, and now she's nice. Went on to lie about her dad abusing her, moved in with me. Then went and claimed I abused her. She craves attention. A deceptive attention seeker if there ever was one. She changes her stories in order to calm people down. A friend of hers supposedly watched her being raped, then she said this friend wasn't even in the same room, and she was confused. The details were very thick, and when she changed her mind because she wanted to be friends with this person again, if I mentioned anything to do with what supposedly happened, she'd go into a rage. Blames everyone else for her sorrows. Will only confess to wrong doing if only to get you off her back, then will blame you again later for her own gain.


I observed a lot, and I should have gotten away earlier, but I thought she was truly BPD and had a chance to recover, but every time she went to therapy she'd go onto play the victim, and would leave truth behind.",2020-02-16T05:05:02Z,1
142,UgwSZ_zWpXin0ht8vud4AaABAg,Lance Lust,"@Anarcho Frills The only reason my ex-girlfriend/ex-abuser went to therapy was sympathy. Plus, therapists can be very bad at spotting this. She's a covert, so it's extremely difficult. Thought she was BPD, but the traits of the covert narcissist fit better. All she ever does is lie about her current details, puts in the childhood trauma, and gains so much narcissistic supply. Only if you're around her for a longer period of time will you realize. She was caught once when I went to therapy with her in 2016. Lied about me and her therapist said she was throwing me under the bus. She went silent for more than 15 minutes being caught. It was very awkward. 


It's a constant struggle knowing someone like this. If you're in love with one, getting out is dire. I don't know if I am completely out, because I fear running into her. I wouldn't ever want to see her again, so you'd think ignoring her would work, just walk the other way. It's detrimental to do so with these people, because they are vindictive, thus walking away could have its consequences.",2020-02-16T03:59:18Z,0
143,UgxWlltrEfeElVVX2rx4AaABAg,Dr. Todd Grande,I just checked the video and the error has been removed.,2020-02-12T07:18:17Z,3
144,UgxWlltrEfeElVVX2rx4AaABAg,FH 110,@Dr. Todd Grande The statement is still there. It's better if you pinned your comment explaining your errors. Please.,2020-02-12T07:02:03Z,3
145,UgxWlltrEfeElVVX2rx4AaABAg,Dr. Todd Grande,Thank you for pointing that out. I trimmed that error out using the editor.,2020-02-12T05:32:42Z,2
146,UgwX0kZzzkeO0yJXwR14AaABAg,squeakel,"As a professional, he can't diagnose someone if they're not a patient.",2020-02-12T04:54:51Z,1
147,UgwQMUfTkWmp3CQa3V54AaABAg,B.Biscuit,100%  agree,2021-02-04T10:06:57Z,0
148,UgwQMUfTkWmp3CQa3V54AaABAg,B.Biscuit,Me too. Once I heard these recordings I would bet my life Depp isn't abusive and Amber is.,2021-02-04T10:06:32Z,3
149,UgwQMUfTkWmp3CQa3V54AaABAg,Josey Strife,It's cowardess that's the difference between someone who would rather get into fights with their loved ones rather than strangers also let me remind you Johnny has no history of violence or abuse with any of his family and friends except for the accusations made by Amber who can't say the same,2020-09-27T06:32:13Z,2
150,UgwQMUfTkWmp3CQa3V54AaABAg,Agnes Ollikainen,Josey Strife yeah right,2020-09-27T06:10:13Z,0
151,UgwQMUfTkWmp3CQa3V54AaABAg,Josey Strife,@Agnes Ollikainen getting into fights with strangers while not cool is not the same as being an abuser to the ones you love there's a huge fucking difference,2020-09-24T09:36:52Z,2
