,parentId,authorDisplayName,replyComment,publishedAt,likeCount
152,Ugz_8dPFWjeT_JtUEvF4AaABAg,Eternal Sunshine,"@C Dorothy exactly, it was a pure projection of her own project to demolish him in the open and get a lot of money from a divorce. She got 15 million of it, said it will be donated to some charity who apparently never saw that money coming.

Not only for the money though, because as we learned she ""stole"" the story of her assistant being raped in Brazil to tell it as her own, she was going for the feminist ""I'm a victim"" shtick. She thought coming out from an alleged abusive marriage, was a good PR for her carrier, even became ambassador for abused women in the UN or something. 
When you put things in their historical context, it becomes so much clearer than just listening to a conversation. Because narcissistic manipulative people are experts in getting away with words, ""rebranding"" everything bad they did. But it all falls apart against cold facts.",2020-08-26T03:55:37Z,3
153,Ugz_8dPFWjeT_JtUEvF4AaABAg,mophead (ᮟᮥ),"i think there was a point she slipped up as well in that segment, no? when she talked about the info leaked to the press that ""i'd given them.""

now, i listened to the audio several days ago so am not entirely sure whether she was talking as herself, i.e. _she_ was the one feeding the press, or was she ""mimicking"" JD, i.e. _he_ was the one feeding them (according to her). but i remember thats when JD finally raised his voice and said he'll see her in court, whilst AH tried to backtrack to no avail.

regardless whether that was self admission or accusation to JD, considering iirc all the press ""exclusives"" of the abuse were only from her side instead of his, i feel inclined to believe she had been the one feeding the press.",2020-07-21T10:34:08Z,5
154,Ugz_8dPFWjeT_JtUEvF4AaABAg,C Dorothy,"They can only see what they can see. It's because they are narcissistic, they think others are narcissistic too.",2020-02-12T10:57:58Z,5
155,UgwcIS0nM6amzOcLnpJ4AaABAg,HodgePodge Doodles,@Dr. Todd Grande Props to the doc 🙂,2020-02-12T10:44:28Z,8
156,UgwcIS0nM6amzOcLnpJ4AaABAg,Dr. Todd Grande,Thank you for pointing that out. I trimmed that error out using the editor.,2020-02-12T05:33:03Z,17
157,Ugy04u7eB_b3Cb9C3wx4AaABAg,Dr. Todd Grande,Thank you for pointing that out. I trimmed that error out using the editor.,2020-02-12T05:34:32Z,3
158,UgzT1dZk1xDodYqctKZ4AaABAg,runninginsept,"4:44 - I think a lot of people confused this portion of the conversation with what they thought was an admission by Amber that she faked her injuries. She asked (and I'm paraphrasing) ""What do you think people will believe? That I was in a secret fight club, or that I used make up (to fake the bruises)?""

Secret fight club = their abusive relationship

Therefore, the contrast she was trying to draw was which scenario people would believe more: that their relationship was abusive or that she faked her bruises",2020-02-12T12:01:09Z,5
159,UgzT1dZk1xDodYqctKZ4AaABAg,Daniela Roy,"@Dr. Todd Grande it's okay, anyway this video makes me understand more that there are things that are very complex into their marriage and maybe it's not okay to just put the blame into someone, I think at this level we can assume who is going to win the case due to the evidence already released but if the court begs to differ or says that Amber was abused to, I'm more than ready to apologize for blaming Amber ""prematurely"". I have difficulty to see both sides of the coin in many conflicts but I believe that your video helped me to realize things that I did.not thought first or that they were common, so once again... very thankful of watching this",2020-02-12T05:43:47Z,5
160,UgzT1dZk1xDodYqctKZ4AaABAg,Dr. Todd Grande,Thank you for pointing that out. I trimmed that error out using the editor.,2020-02-12T05:34:38Z,4
161,Ugwm3r7bp-ggTEUQuz94AaABAg,HunterAshe,S S Oh honey. I pray for you.,2020-04-12T08:01:31Z,0
162,Ugwm3r7bp-ggTEUQuz94AaABAg,HunterAshe,S S   Conserving I am having a normal conversation. Normally we don’t have to constantly address people by their names. It’s not rude. Rude would be acting like his not apart of the conversation. Or rude would be what you are doing right now by trying to seem to be smart. And again you don’t normally address people BY name the whole time. So thank you for nothing. Have a nice night. :3 Byeee.,2020-04-12T07:21:46Z,0
163,Ugwm3r7bp-ggTEUQuz94AaABAg,HunterAshe,Ylw Dalia well sure because of that one error it did throw the rest of the video off and was than thrown into a miss reading. Maybe he will do a follow up and correct it. I would love to know what he NOW thinks since that whole line changed everything.,2020-02-13T21:22:54Z,0
164,Ugwm3r7bp-ggTEUQuz94AaABAg,Ylw Dalia,"Thank you for pointing  it out on who said what. Unfortunately, Dr Grande seems to have left out AH gaslighting and abusive ways from recording, so IMO he's not analyzing the whole situation correctly.",2020-02-13T18:59:18Z,3
165,Ugwm3r7bp-ggTEUQuz94AaABAg,HunterAshe,Dr. Todd Grande no worries! Thank you for everything!,2020-02-12T05:39:09Z,3
166,Ugz0msUckG6UgOQQq5R4AaABAg,FH 110,"@missmgmnt I assume based on her behavior, she's a gold digger. 
1. Her friends and her sister lived in 5 of his penthouses rent-free.
2. She's not with him and his mother when she's in her deathbed and went to Coachella. 
3. 2/3 days after his mother died, she filed for divorce.
4. She asked for 3 penthouses with all utilities paid every month, a car and $50 000 excluding other separate expenses paid per month.
5. She got $7 000 000 instead for settlement.
6. Her father threatened to kill him because he refused to pay for her car maintenance / renovation & his plan to use the money to invest in her movie failed. 
7. She cheated him with James Franco and Elon Musk when he's on tour overseas while there are still married multiple times. (witness by penthouse staffs AND the lift CCTV).",2020-02-12T09:57:56Z,7
167,Ugz0msUckG6UgOQQq5R4AaABAg,FH 110,"@missmgmnt I don't know about being narcissistic but why can't people married a much younger partner? If the partner is nearly 30, he/she according to logic should be matured enough not to resort to violence when having a conflict. She already have a career to support herself, have plenty of experience in dating, able make independent decisions on her future, etc. In my country, a lot of people married with a bit of an age gap. My parents are 8 years apart. A few of artists in my country have a 15-20 age gap between their partners because they have a career to persue. Marriage is not just about love. It needs trust, honesty, responsibility, compromise, understanding and dedication.

 Johnny is just a bit older. Love makes people blind and he's made a bad decision. He had painkillers addiction. She had trust issues and violence tendency.",2020-02-12T09:42:22Z,4
168,Ugz0msUckG6UgOQQq5R4AaABAg,missmgmnt,"I don’t know if that makes him narcissistic, but there’s definitely some issue when a person consistently dates a much younger partner - a maturity issue or something. Johnny needs to connect with a woman closer to his age. One a little more mellow and mature. Girls in their twenties are too immature and melodramatic for a man in his 50s. You’d think he’d learn after all this, but his very next girlfriend was also much younger. 🤷🏼‍♀️",2020-02-12T09:07:21Z,4
169,Ugz0msUckG6UgOQQq5R4AaABAg,Junie Moon,She only speaks highly of him. So what does that say? Relationships end. They lasted for like 15 years. Not “discarded.” Still family.,2020-02-12T07:34:58Z,11
170,Ugz0msUckG6UgOQQq5R4AaABAg,FH 110,No. He never married the mother of his children.,2020-02-12T07:03:34Z,3
171,UgyN5_TBgZfTfRj_8RZ4AaABAg,The Fair Haired Boy With The Red Balloon,"squeakel11 He has frequently denied that Incident.  If you read the court document about the phone incident, he clearly spells out what actually happened.  That incident is also disputed by police officers who had been called to their home- They saw no indication of any injury on Amber Heard.  His security guards have also given Testimony that they ran in when they heard her yelling “stop hitting me Johnny”Only to discover that he was about 20 meters away from her !!!   He is only not arguing it here because he knows it will escalate her behaviour- He is trying to reason with her and knows he has to walk on eggshells.",2020-02-27T10:06:06Z,3
172,UgzLvukbvU7y8gLlBt94AaABAg,Jaize Brookstone,@Deedless Deity I love the way you break it down. Spot on!,2020-12-19T16:43:37Z,0
173,UgzLvukbvU7y8gLlBt94AaABAg,Paula Duncan Adams,"@C Dorothy Aww, come on...you can do better than that.   Guano sounds Tres chic!  Bat shit not so much.",2020-08-23T05:11:26Z,0
174,UgzLvukbvU7y8gLlBt94AaABAg,Kowalewicz,"Yes and he also said it was Depp who said ""I'm only defending myself"". That was Amber. Not Johnny.",2020-06-01T05:28:54Z,4
175,UgzLvukbvU7y8gLlBt94AaABAg,Deedless Deity,"@Phoque Ewe In my country, we use the ICD. Sadly, that thing is under ideologically driven attack as well.",2020-02-12T16:06:36Z,0
176,UgzLvukbvU7y8gLlBt94AaABAg,C Dorothy,It just got me at 'why did you try' 😂,2020-02-12T14:30:20Z,8
177,UgwEki99byQXvP6Fo3R4AaABAg,Sunny Sun,He won <3 and will,2020-07-29T11:11:33Z,1
178,UgwEki99byQXvP6Fo3R4AaABAg,Supernova,"Jen Kim What? I think you mistook his comment. I think he meant that no matter what he says or does he’s not going to get through to her so there’s no point trying. I agree, run!",2020-06-16T04:42:18Z,18
179,UgwEki99byQXvP6Fo3R4AaABAg,Ji Mo,So he's the narcissist here!,2020-02-26T12:46:04Z,0
180,UgwuABaU4r2dxiLGYmt4AaABAg,Rebekah Symonds,Personally I think with the parents text they were trying to get him to break the restraining order.,2020-07-25T10:50:34Z,1
181,UgwuABaU4r2dxiLGYmt4AaABAg,Edie Minturn,"I am shocked by the parents especially after just reading the Father threatened Johnny? For Money? After he threw his own daughter under the bus? This is SO dysfunctional. 
Those of you who have kids, think about it for a sec. 
Say your kid IS the abuser. And is in the public eye. And there divorce proceedings and whatnot.
It‘s their marriage falling apart!
Tell your own kid to do the right thing, counsel and give advice to your own kid, do not send their significant other „secret messages“ -that’s so manipulative and dysfunctional. 
Wait till the „kids“ have dealt with their „ufficial/public“ stuff and guide your kid to behave like a good person ffs!
And if you cannot send the message without it being a secret, then there is something wrong with it and you know it.
Do NOT put the victim in the position to have to have a secret with you, what‘s wrong with you ppl?
And if you want to apologize for your ADULT child and say you don’t agree, then do so, but NOT IN SECRET!
No wonder she’s messed up.",2020-02-12T21:35:14Z,5
182,UgwuABaU4r2dxiLGYmt4AaABAg,Emily Rose,@Juliet Tailor I ageee,2020-02-12T05:09:19Z,0
183,UgwuABaU4r2dxiLGYmt4AaABAg,Ride or Dis,N. Johnson - then the father threatened to shoot Johnny if he didn’t pay for care repairs the father billed to Johnny. The whole Heard herd are a bunch of money grubbers and users.,2020-02-12T05:01:34Z,12
184,Ugx7WX44elJGSCC8sJt4AaABAg,Lance Lust,@redremi83 Thank you. Hoping you aren't alone :),2020-02-13T23:54:17Z,0
185,Ugx7WX44elJGSCC8sJt4AaABAg,redremi83,I feel you lance,2020-02-13T22:50:15Z,0
186,UgyzSDjyRJm7OybqCEN4AaABAg,Noorii Al -Hashmi,DissonantShadow I hope you have moved forward from that time in your life and you are now on a more steady and healthy emotional level,2020-02-12T07:26:39Z,0
187,UgyzSDjyRJm7OybqCEN4AaABAg,Dr. Todd Grande,Thank you for pointing that out. I trimmed that error out using the editor.,2020-02-12T05:35:35Z,2
188,UgyzSDjyRJm7OybqCEN4AaABAg,Enigma -,"DissonantShadow hopefully you got out and have healed. Alan Robarge and The Personal Development School are YouTube channels that have taught me so much about why I attract or tolerate toxic people in my life... 
fortunately I haven’t been with one with BPD, but my sister is that person. The level she has screwed people over is mind blowing. Can be charismatic and magnetic and switch on a dime and vindictive and manipulative 😬",2020-02-12T05:24:32Z,0
189,UgyzSDjyRJm7OybqCEN4AaABAg,Geovana Rosa,Exactly,2020-02-12T04:56:08Z,0
190,UgyzSDjyRJm7OybqCEN4AaABAg,DissonantShadow,"I've been in this exact situation. She would taunt me and say that I would be the person arrested should I call the police. She was diagnosed with BPD, I later discovered.",2020-02-12T04:51:43Z,6
191,UgyqV6K-x2YwfXMo3M14AaABAg,K3th. B.W,He does run a way all the time.,2021-05-26T04:09:16Z,1
192,UgyqV6K-x2YwfXMo3M14AaABAg,Twiggy141,"@Ares Royte I dont care about what happened. This sort of toxic behaviour happens everyday in relationships. What I am saying is we  dont know them or their circumstances. I watched this  video as it was a chance listen to behaviours  playing out in real life, that's all. I like Depp, he is my favourite actor and that's all I know. I get the feeling that a lot of others feel the same and are somewhat relieved he is most likely not a woman beater. But these are toxic relationships that always turn real nasty",2020-02-22T18:49:40Z,0
193,UgyqV6K-x2YwfXMo3M14AaABAg,Ares Royte,@Twiggy141 come on you need to look at the fact!!,2020-02-22T17:42:31Z,1
194,UgyqV6K-x2YwfXMo3M14AaABAg,Twiggy141,@Tania Haeussler np,2020-02-13T15:28:48Z,0
195,UgyqV6K-x2YwfXMo3M14AaABAg,Tania Haeussler,@Twiggy141 fair enough. But I'm basing my opinion and comments on the totality of the evidence; not on knowing or not knowing Johnny and Amber personally...,2020-02-13T15:22:47Z,0
196,UgxdS0izxe1z43XHL-x4AaABAg,Denise Vander-Heyden,"I think he's a covert narcissist because I was married to one 35 years.because she keeps saying he disappaers..leaves etc...this drives her crazier.He simply is not available somehow.I do feel bad for Depp because he's tortured but still his""love"" is probably passive aggression and possessive.and she picks up that it's selfish.It drives her nuts and aggravates her fear of abandonement.I hear my marital fight...minus the violence.I have borderline my ex covert narcissim.Just ours was far less complicated by fame, money, media.This bpd/npd dance doesn't work.",2020-02-12T17:53:04Z,0
197,UgxdS0izxe1z43XHL-x4AaABAg,Anony Mouse,"Agreed. Don't know what he's up to, sense that it's just more hidden, covert.",2020-02-12T11:49:50Z,0
198,UgxdS0izxe1z43XHL-x4AaABAg,Cu,"A narc wouldn’t respond like him. And his ex’s have come out and said he’s not abusive. Yes, she’s a narc/bpd but not fair to point the finger at him too. He’s the victim here fgs.",2020-02-12T07:24:06Z,1
199,UgzkGog-q82T0QGfu994AaABAg,Twiggy Zafox,This is one of the parts from the recordings that really get me also. IMO she’s saying I’ll probably get angry and abuse you again but it’s just part of who I am so you would have to live with that. First she basically admits she has physically abused him before and secondly what if that were reversed and he had said that?? There would be a media frenzy focusing on that one thing and she would then be the victim they’d make JD out to be a monster yet I feel like  because she is a woman it’s just been overlooked.,2021-04-19T02:15:02Z,1
200,UgzkGog-q82T0QGfu994AaABAg,glittery,I think Depp has actually stated she has / he believes she has BPD.,2020-12-13T19:03:57Z,2
201,UgzkGog-q82T0QGfu994AaABAg,Rose Harvey,She doesn't believe she should be held accountable for any of her actions.,2020-10-31T12:31:24Z,0
202,UgzkGog-q82T0QGfu994AaABAg,Lorraine Tavares,@JulianaHereOnEarth WOWSERRRS: amazing: but she did donate a ton of money after she split from Johnny: so she has a conscience & guilt: unless it was to make herself look good?¿?!! 🤑🤓🤔,2020-09-23T21:48:58Z,1
203,UgzkGog-q82T0QGfu994AaABAg,Lorraine Tavares,@ILLAngel101 WOW: very interesting & very detailed!!,2020-09-23T21:42:49Z,1
204,UgzbjDBYZfY1ZZXiMgh4AaABAg,Unit-13 FREMSLT,@Noorii Al -Hashmi Oops I totally misunderstood.  Thank for bringing me up to speed.,2020-02-12T04:05:27Z,1
205,UgzbjDBYZfY1ZZXiMgh4AaABAg,Noorii Al -Hashmi,Unit-13 FREMSLT it was Amber who made that statement not Depp,2020-02-12T03:59:47Z,4
206,Ugx1TBI_OJxGjJgzKCt4AaABAg,Martine Kunst,"Xmx2772 agreed plus i do not know if Depp wasn't a or isn't a covert narcissist himself, i think they both are, she overt, he covert. Bc coverts can be tricky like this. Hard to win any evidence with a covert narc, i think they are both to blame and him playing out to be a victim while he really is not. I think they are both at fault. Its easy to point out the overt things Amber did but it is not that easy to crack the code of a covert with multiple masks . Never forget that a real amount of narcissism is needed to get to the top in any career. He is not the poor victim. Both  of them are sick.",2020-02-23T09:00:25Z,1
207,Ugx1TBI_OJxGjJgzKCt4AaABAg,Xmx2772,"She isn't far less attractive.  Both women are attractive.  If Vanessa wasn't attractive then why was he with her for 14 years and had two children?  Vanessa has married since Johnny left, and for the rest of his life Johnny will have to face his children, who know what he did to their family.  The grass wasn't greener and he's living with the consequences.  Hopefully cheaters will see this as a warning.",2020-02-12T11:22:30Z,13
208,Ugx1TBI_OJxGjJgzKCt4AaABAg,IranianDude,She's far less attractive than Amber tho.,2020-02-12T06:56:37Z,1
209,UgyTHu-2lXhnbpyQGxp4AaABAg,Jennifer Spengler,"@Dave Bieleveld I think I understand what you're getting at, but I don't want to assume. :) 
I'm currently inferring that you believe his personal opinions of Amber Heard and Johnny Depp affect his subconscious decisions of how he refers to them.  Am I barking up the right tree here? :)  
(And you don't need to go into detail unless you want to; I just want to make sure I am not misunderstanding!)",2020-02-12T05:21:03Z,0
210,UgxWkDZla5XO0fDhbbV4AaABAg,Lucia,"Lol, that’d be pretty cute",2020-02-12T03:59:06Z,2
211,UgydOUcm16WbLgzcAIx4AaABAg,Ldydi5954,@Christa 777 You explained and said that absolutely perfectly. AWESOME COMMENT.  :),2021-09-25T02:39:32Z,0
212,UgydOUcm16WbLgzcAIx4AaABAg,Ldydi5954,@Carlos Fdz I don't agree. Johnny let this marriage go on way too long. They really shouldn't have gotten married in the first place even their relationship before marriage was extremely toxic. Johnny is guilty by association. It takes two to tango and two to fight. Also let's not forget that Johnny has the wealth to get away from the situation. No matter how you look at it they BOTH are at fault.,2021-09-25T02:37:44Z,0
213,UgydOUcm16WbLgzcAIx4AaABAg,Ldydi5954,To be fair both Amber & Johnny know they are being recorded. I know this is going to sound somewhat shocking but they both are on their best behavior. Also I am sure each one is trying to make themselves seem better on the recording. It doesn't matter who is at fault at this point because they both are. It takes two to tango. Johnny should have left the marriage long ago. In fact neither should have gotten married in the first place. Unfortunately Johnny is guilty by association in a lot of people's eyes.,2021-09-25T02:15:41Z,0
214,UgydOUcm16WbLgzcAIx4AaABAg,G W,"It's true. I disagree with Dr. Grande as well in a respectful way. Amber is female and beautiful. She doesn't get suspected because society believes that men don't get abused. That men don't get battered. Part of being a feminist is recognizing when a man is being abused and truly needs help. I don't trust Amber. Never did, never will. The key to all of this is Elon Musk. I'm sure he won't talk because he was manipulated by her as well. It also wouldn't frame him in a good light. I'll always be curious about this case because in this scenario the man is being abused.",2021-09-22T21:55:37Z,0
215,UgydOUcm16WbLgzcAIx4AaABAg,Islam is my way,"@AlmaDeLuz You got the point. Its not about that simple assumption based on the audios. Only those who ever been in toxic relationship and has come to the point where he or she did act out of character and cant even recognize them self anymore will understand that its actually both party unknowingly or knowingly. Personality disorder and mental disorder is something else but abuse is a decision of an individual. So what ever reason that provoke it or put the individual did that, it still an abuse no matter what.",2021-03-05T04:01:59Z,1
216,Ugx8Jrgnq1h3xnQOwbx4AaABAg,Vanessa Whitehead,"@Carolina thank you. I did manage to get restraining orders on him. It was actually quite funny, I was in front of the judge, she asked why did I want the RO, and I told her that he was threatening and harassing me. She asked me for proof, and I told her he's sending me threatening messages right now, and would she like to see my phone.  She did so I handed it to her. With the phone in HER hands, he sent another message, and she read it for herself, in the courtroom. She was like, ""okay Ms. Whitehead, you have your restraining order, this guy is a nut."" Lol! It was like a movie scene.",2020-07-19T22:33:43Z,2
217,Ugx8Jrgnq1h3xnQOwbx4AaABAg,Carolina,"Vanessa Whitehead Well, first of all, I’m shocked and enraged at what that man did to you. His behaviour is absolutely disgusting and evil. That’s prison worthy. Why didn’t you take him to court?  Why let a dangerous person like that go around the streets?",2020-07-19T17:22:46Z,2
218,Ugx8Jrgnq1h3xnQOwbx4AaABAg,PJ,"It brings flash backs, my husband was the same. It Pisses, me off her playing a victim. I know how Johnny feels.",2020-07-18T03:49:56Z,2
219,Ugx8Jrgnq1h3xnQOwbx4AaABAg,Erica,@Paula hope you get healed from your wounds,2020-04-03T07:32:10Z,2
220,Ugx8Jrgnq1h3xnQOwbx4AaABAg,jazinegrrrl,"@Vanessa Whitehead Oh my god! I'm so glad you not only survived this monster but are now thriving. Thank god for your children. I know the love you have for each other helped a lot. His ass should be in jail. With the rate he is going, incarceration is inevitable.",2020-02-13T21:15:10Z,6
221,UgwFpKnyldqxU8xnNeR4AaABAg,Anony Mouse,risha a yes agreed to both points,2020-02-12T11:55:00Z,1
222,Ugx47hyeL6D3JUH_SGF4AaABAg,Cu,Juliet Tailor victim blaming again.,2020-02-12T07:17:20Z,6
223,Ugx47hyeL6D3JUH_SGF4AaABAg,Sandra H.,Thank god he didn‘t have kids with AH 🤐,2020-02-12T05:29:52Z,10
224,Ugzcb6_gTiPChc_zcoV4AaABAg,parklife87,I hope it all goes viral and gets all the way to Hollyweird community where they can ex-communicate her along with this superiority ideology they keep pushing.,2020-02-14T01:10:18Z,1
225,Ugzcb6_gTiPChc_zcoV4AaABAg,Facebook User,@Jazz Heart yes i understand but he seems to have glossed over the fact i was talking about. where she flat out dares him to say shes the abuser,2020-02-12T04:56:32Z,18
226,Ugz-9BFqBtybdCKfYTh4AaABAg,Ellen Kramer,@Seraph s,2021-11-04T06:07:33Z,0
227,Ugz-9BFqBtybdCKfYTh4AaABAg,Ramiro Díaz García,@Seraph narc fleas are like sh*t tests but weirder,2021-07-28T22:06:31Z,0
228,Ugz-9BFqBtybdCKfYTh4AaABAg,Jackie Rios,Agreed 👍,2021-07-26T16:30:57Z,0
229,Ugz-9BFqBtybdCKfYTh4AaABAg,Karen Oliver,You nailed it! Exactly!,2021-07-06T13:47:19Z,2
230,Ugz-9BFqBtybdCKfYTh4AaABAg,Kevin Johnson,"@amanda shouse if you research the stories and watch the videos that they did etc , it's obvious, she is the narcissist. Doesn't mean he didn't do things or have character issues.  But there is a big difference between issues and someone purposely playing with you.  Evil",2021-07-01T02:39:37Z,2
231,UgzH97EnFU-2tBkuFO94AaABAg,AWI SNOW,It takes two to tango!  Johnny isn't the only victim nor is he the only perpetrator,2020-08-15T19:58:19Z,1
232,UgzH97EnFU-2tBkuFO94AaABAg,LaraCroftEyes1,Amber was drugging Johnny.,2020-08-15T03:44:20Z,0
233,UgzH97EnFU-2tBkuFO94AaABAg,Paula Duncan Adams,"Well, this IS my childhood.   My mother once grabbed a vacuum cleaner and started beating dad with the end of the hose.  After awhile,  he DID fight back.  Very much like this relationship.   Mom married ""for security"" said she didn't love him.  Dad would go out drinking, which didn't help.  He would walk through the door and BAM!  The sparks would fly.  So did the dishes.",2020-08-11T22:11:23Z,0
234,UgzH97EnFU-2tBkuFO94AaABAg,Jennifer Ryan,"Sorry, I understand being careful and trying to stay analytical, but call a spade a spade.  Amber is an abuser.   She has been outed and she is going to take a big fall.",2020-08-06T14:02:14Z,0
235,UgzH97EnFU-2tBkuFO94AaABAg,Simply Helen,@Ian S Indeed. He actually admitted to getting away from her in order to not become aggressive or violent because she was pushing him so hard. She actually got mad because she said he was running from a fight.,2020-08-03T08:02:47Z,0
236,UgyxtXydeFgBRRF-ZBx4AaABAg,R X,That’s because narcissists are delusional,2021-09-23T01:30:41Z,0
237,UgyxtXydeFgBRRF-ZBx4AaABAg,Polarbearsrus,"Exactly, no logic or reason required for a narcissist. She's a sick puppy and definitely the abuser here.",2020-06-09T19:48:29Z,3
238,UgyxtXydeFgBRRF-ZBx4AaABAg,marsha okhiria,@Anarcho Frills yea. But it's easier said than done. He could have left her but he wanted the marriage to work.,2020-02-19T13:45:05Z,2
239,UgyxtXydeFgBRRF-ZBx4AaABAg,marsha okhiria,"@Anarcho Frills if someone is beating me, I have every right to call you all the names in the book of demeaning.",2020-02-17T13:44:53Z,1
