,parentId,authorDisplayName,replyComment,publishedAt,likeCount
240,UgyxtXydeFgBRRF-ZBx4AaABAg,Laura Fulmer,"Anarcho Frills you give an example of JD’s supposed emotional abuse of AH is when he claims she never loved him.  Correct?  When does she claim to love him?  I never heard her say that about him.  He says he loves her, more than once.  All I hear from her is how she is being negatively effected and how he must stop “defending” himself.   She also quickly excuses her own attacking behavior as justified because she was “defending “ herself.  Please explain to me how AH is entitled to defend herself legally but JD is not?  That sounds like manipulation and an attempt to use the fact that she knows JD loves her and doesn’t want to hurt her but she has no problem hurting him or his children by falsely claiming he physically attacked her to the public.  How is this showing her love for him?  He is offering to be reasonable and work things out privately.  She has zero interest in this but only wants him to agree to her demands.  AH also tried to manipulate JD by claiming his attorneys are lying to him and “ don’t let them lie to you”.  That is extremely manipulative and abuse.  JD engages in none of this.  Sorry.  I don’t hear any love coming from AH in these recording.  The only one who shows love in these audios is JD.  But you see things how ever you choose.  AH is delusional and has malicious contempt for JD and he finally realizes it in this heartbreaking audio.",2020-02-13T06:32:17Z,2
241,UgzsbB1rdC9kGIvqNeh4AaABAg,Debra Lucas,It's very hard to listen to - but very educational...if you can stomach it.,2020-02-12T06:06:38Z,10
242,UgzkMRBNrWy7LGSQiSd4AaABAg,Lance Lust,"@Anarcho Frills I completely understand believing isn't earned up front. You'll likely never hear her side directly from her, although I could give you the gist of her complaints. She would accuse me of screaming when I used a normal voice, although I did scream a couple times; she was good at pushing buttons and knew which ones to push. I feel terrible about it; being around her, getting to know her, almost everyone ended up being provoked into feeling this way. Her attitude was very upsetting, and the complexities of her ever changing stories could make me very confused and unstable, which is a reason for yelling. I now know I should have parted ways with her, but she would apologize for her behavior, as would I when I behaved badly. I wasn't entirely innocent in our relationship, however I didn't do anything criminal, unlike herself.


She'd claim I instigated fights. I would question her opinions, but she would think I was attacking her, thus claim I was arguing, not simply asking. Most of the time, if I didn't agree with her, she'd accuse me of arguing, thus a fight would occur. I tried my best to keep volume to a low, but without being able to get much across through my words, it was like talking to a brick wall. Yet one with an incredible sense of spirit.


She accused me of hitting her a couple times, though she was the person who actually hit. I never hit her back; I took the abuse, because I loved her, which is a stupid form of love. She also accused me of stealing her money, which I ended up finding because she wouldn't help look for it because she wanted to keep the front of me being a thief, and once I found the money, she accused me of hiding it.


She claimed I forced her to sign a protective order on her dad, which I was actually against, and then put one on me. This was two weeks after I had talked her out of putting one on him. In fact, while at the courthouse as she wanted to end the guardianship with her dad, while the court assistant went to get paper for her to write on, I tried to get her to see reason by not putting an order on him. When the court assistant came back, I told the lady my girlfriend had just threatened to put a protective order on me because if I wasn't with her, I was against her. 


I agreed to the one she placed one me, because it was a good way to get away from the abuse from her. A month after, a friend of hers said she was causing drama, so I looked on a court website and saw that she placed another protective order on her father. I followed it to see what happened and she ended up taking it off...again. Then her friend told me she was living with her dad again. Just the other day I went back on the court website. Her record read she had another protection order against her dad. It's never ending.


She paints everyone the picture of her being wholely innocent. I am not entirely innocent because I couldn't keep my volume down when in arguments, and the fact I got into arguments.The fact I didn't break up with her for more than a couple days makes me guilty of enabling her. I didn't realize what was wrong until after our relationship ended and I was recalling the skirmishes. I had an idea, and wanted out, but I was afraid she would try her best to put me in jail, which she actually tried doing in spite of my efforts to keep her happy. So, no, I am not a complete victim. I could have gotten away many times. However, I loved her and believed we could survive. I was wrong. About everything. 


I know this is coming from the same side, but maybe you'll believe my observations a bit more...?",2020-02-12T19:24:43Z,0
243,UgzkMRBNrWy7LGSQiSd4AaABAg,missmgmnt,R L at least Anarcho edited her last comment so as not to call you an ass anymore... of course that was after you thanked her for showing her true colors.,2020-02-12T09:52:37Z,2
244,UgzkMRBNrWy7LGSQiSd4AaABAg,R X,Anarcho Frills thanks for showing who you are,2020-02-12T09:36:02Z,2
245,UgzkMRBNrWy7LGSQiSd4AaABAg,missmgmnt,"R L mind blowing, right? Amazing what people will defend in order to avoid dealing with or admitting to their own issues.",2020-02-12T09:32:00Z,2
246,UgzkMRBNrWy7LGSQiSd4AaABAg,R X,missmgmnt My narc defended the behaviour of other celebrity narcs. I commented on some illegal and unethical behaviour of a celebrity CEO and she tried to defend the behaviour and said it’s a fine line between smart business and unethical. Narcs don’t want to condemn behaviour that they themselves exhibit. It’s like they are condemning themselves.,2020-02-12T09:24:33Z,2
247,Ugwx4mYnX1dUkw8f1zt4AaABAg,Polly,"A comment is not a dialogue. Anyway, my own comment did create some interesting dialogue so there's that.",2020-02-12T04:48:35Z,3
248,Ugwx4mYnX1dUkw8f1zt4AaABAg,Mary Wilson,They're comments,2020-02-12T04:15:22Z,0
249,Ugwx4mYnX1dUkw8f1zt4AaABAg,Polly,@Brussel Sprout I tend to disagree.,2020-02-12T03:55:05Z,4
250,Ugwx4mYnX1dUkw8f1zt4AaABAg,havest2,lol,2020-02-12T03:41:16Z,0
251,Ugwx4mYnX1dUkw8f1zt4AaABAg,Polly,"@J.L.W I'm well aware of that, I would simply prefer Dr. Grande didn't pretend that he wants people to comment because it makes an interesting dialogue.",2020-02-12T03:32:20Z,3
252,Ugym4iJ9hmK1cpkfUWF4AaABAg,Kreative Konsciousness By Kim,She suffers from a personality disorder. That is very clear.,2021-02-14T03:58:16Z,1
253,Ugym4iJ9hmK1cpkfUWF4AaABAg,ReyTheJediLady ViaJakku,That makes a good point. It’s a cultural thing and it would be easier for others to believe that Amber was the one being battered,2020-09-26T18:28:10Z,2
254,Ugym4iJ9hmK1cpkfUWF4AaABAg,Points Being Made,Lorraine Tavares I dont judge either of them give em the help needed.,2020-09-25T09:16:04Z,1
255,Ugym4iJ9hmK1cpkfUWF4AaABAg,Lorraine Tavares,"@Miguel Bermudez WOWSERSSS!!! It was EXXXACTLY the same with my ex husband: an extremely, very violent, alchoholic, drug addict: who also never got arrested, although he did go to prison, years later for dealing drugs & having a shotgun!!! It's a MIRACLE that I am still alive & we also had a baby who witnessed his horrendous violence!!! Years later I also knew two lovely women who were murdered by their partners: both strangled: THE weapon of choice by violent men it seems!!! 😟😰😥😓😢😭",2020-09-23T22:55:03Z,1
256,Ugym4iJ9hmK1cpkfUWF4AaABAg,Lorraine Tavares,@Cuppy Cakey Aaaaaaamen & amen: I pray for him too: that he will get his life & health back: he & A H BOTH need a ton of healing: especially her as she is very psychologically damaged!!!,2020-09-23T22:47:22Z,1
257,UgypMOTyW8Y1LiPrBBZ4AaABAg,KoreaMojo,Agreed!,2020-02-12T05:07:49Z,1
258,Ugz18Q5gUOA1Jg-HDrZ4AaABAg,Humanimal,@TrueGamerVed makes sense!,2020-02-12T06:59:39Z,0
259,Ugz18Q5gUOA1Jg-HDrZ4AaABAg,Humanimal,"I saw that clip...wthell is that?
Is it Religious instruction?!?!?!
She is very angry....but she is not acting??

Someone, Please explain!",2020-02-12T03:23:10Z,0
260,Ugwvo-xg6sJuIrvXB4d4AaABAg,Mrs. Reluctant,"@Evelyn Waugh So true, Evelyn! 👍",2020-02-12T20:09:41Z,0
261,Ugwvo-xg6sJuIrvXB4d4AaABAg,Evelyn Waugh,"It is really scary to think how out of control they act when NOT recording, because they are  probably both to a certain extent playing to the audience here:)",2020-02-12T05:53:23Z,2
262,Ugwvo-xg6sJuIrvXB4d4AaABAg,CopperValentine,It is when they lie about you repeatedly. You’d better have a complete record of your interactions.,2020-02-12T04:32:31Z,2
263,Ugwvo-xg6sJuIrvXB4d4AaABAg,Ash,"Men should definitely record when a woman is being abusive.
There are many examples of women who have lied and the only thing that saved the man's freedom was recorded evidence.",2020-02-12T04:01:36Z,2
264,Ugwvo-xg6sJuIrvXB4d4AaABAg,Andrew Boehmer,If someone is lying about you and being physically aggressive you should. Especially as a man you will be blamed outright. Even with these recording some are trying to spin Depp as the problem.,2020-02-12T03:27:49Z,10
265,UgzVJFjJLUMU-UVkRVZ4AaABAg,rumba rumba,Johnny is toxic,2021-05-29T14:00:02Z,0
266,UgzVJFjJLUMU-UVkRVZ4AaABAg,Erica,I guess amber heard,2020-04-03T07:27:42Z,0
267,UgzVJFjJLUMU-UVkRVZ4AaABAg,Palma,"@Phoque Ewe You are lying. Read my comments again. You hallucinate things I never said. 
All I'm saying is Amber being crazy here doesn't automatically mean she has NPD and doesn't automatically mean Depp is not guilty (nor does it implicate he is). 
We just DON'T KNOW. 
You show classical black and white thinking. The world doesn't work like this. 
Few years back everybody ""KNEW"" (for sure) he was an abuser. Now it's the same behavior. I think it's silly.",2020-02-13T16:17:04Z,0
268,UgzVJFjJLUMU-UVkRVZ4AaABAg,Laura Fulmer,UNO not true!  Every female is not here playing devils advocate for AH!  I am not!  She is definitely at fault.  I don’t believe there is any evidence supporting JD engaging in physical violence other than to try and protect himself or get away from AH.  That is justified in my book!  And before anyone says his response to her physical attacks could have been excessive-  I don’t see that at all!  In fact I believe he did everything he could to get himself out of the situation as soon as possible with Amber physically trying to prevent him leaving!  AH continually berates  and insults JD for not staying and engaging her her physical violence!  JD tells her he wants no part of physical fights but she insisted he must remain in the situation to supposedly “fight” for her!  She wants him to engage with her.  I believe it was a goal of hers to push him into these physical altercations in order to get evidence that could be presented in court or to blackmail him with.  Finally I think she just manufactured her bruises in the 2 photos I have seen.  On the other hand there are multiple photos of JD horrific injuries that AD is responsible for!  She has no empathy for him.  I make no excuses for AH!  My sympathies are with JD who I hope is healing from this horrific abusive relationship with a truly sick person!,2020-02-13T12:48:17Z,3
269,UgzVJFjJLUMU-UVkRVZ4AaABAg,MrGabagoo,@Niccole A what i heard was amber trying to counter all the manipulation she was getting from johnny.. Covert narcs will make you lose your mind,2020-02-13T00:47:01Z,0
270,Ugyu_9u7E9-ukt1FvWZ4AaABAg,PollyJean,V Siddos I didn’t know that. It’s such a sad story.,2020-02-13T22:30:24Z,0
271,Ugyu_9u7E9-ukt1FvWZ4AaABAg,PollyJean,"squeakel11 oh yeah, there was definitely something up.",2020-02-13T22:29:53Z,0
272,Ugyu_9u7E9-ukt1FvWZ4AaABAg,Vincent Siddons,Diogenes Yeah her parents said so. She took four meds for depressive psychosis.,2020-02-12T20:22:48Z,1
273,Ugyu_9u7E9-ukt1FvWZ4AaABAg,squeakel11,"@PollyJean I don't know about bi-polar specifically, but there is a some indication that she was having some kind of psychotic break.",2020-02-12T04:12:44Z,1
274,Ugyu_9u7E9-ukt1FvWZ4AaABAg,PollyJean,V Siddos you think she was bi polar? I guess...interesting theory..,2020-02-12T03:20:18Z,0
275,UgzFj8Bzf1emC_qxFqJ4AaABAg,Tania Haeussler,@Hemlata Gupta it doesn't matter what gets buried now. She's been exposed...,2020-02-12T17:22:09Z,1
276,UgzFj8Bzf1emC_qxFqJ4AaABAg,Tania Haeussler,@Hemlata Gupta true...,2020-02-12T11:48:52Z,0
277,UgzFj8Bzf1emC_qxFqJ4AaABAg,Tania Haeussler,"@Humanimal she is just plain evil. And she's 33. Hary a child. She should know better, but chooses to treat people badly. Go to the Incredibly Average channel and watch Brian's videos. You will see Amber for exactly what she is...",2020-02-12T10:48:15Z,1
278,UgzFj8Bzf1emC_qxFqJ4AaABAg,Humanimal,"@Ride or Dis people, both men and women, n3ed to not mess with other people's lives! Out of hurt, oiut of pain and fear. It's serious. And ing not many people have the resources to fight the accusations properly either.  

When will values make their way back into society.",2020-02-12T06:45:23Z,0
279,UgzFj8Bzf1emC_qxFqJ4AaABAg,Hemlata Gupta,"@Tania Haeussler hmm.... Yeah that's why johnny depp filed defamation suit against her with 80+ video clips of amber being violent towards him, confessions of other people claiming amber being the violent one. Plus these audio recording of her admitting to it. I don't know how much johnny depp is allowed to release these evidences. But i know for sure there are a lot of worse things that amber heard lawyers will make judge bury and never release it again to the public that we will never know of.",2020-02-12T06:15:12Z,2
