,id,comment,author,likecount,publishedAt
598,Ugx0oon_si-lSq4nMld4AaABAg,"(Copy of my comment on YellowFlash's video)

I was curious as to why Holy Terror was being called Islamophobic. So I went and read the book, and MY GOD are people dumb....

The Comic never called out Islam or Muslims in general, but the Al-Qaeda, who in the name of Islam committed horrible acts including 9/11, I never really saw any Islamophobia other than just naming one of the Terrorists ""Mohammed"", which to be fair is a common name, but other than that all I read was Batman and Catwoman rip-offs just going Punisher and killing them just as they were about to blow up a city,(they already blew up the symbol of justice in that City) and literally nothing else...

People who say that this book was as they so put it ""Islamophobic"" really didn't even try to read the damn comic or understand where this story came from.. and to associate Al-Qaeda as Islam is an Insult to the religion of Islam that I can't bear to accept.
Look I get that people may misinterpret this book and that Christianity ain't exactly clean(more in reference to the Crusades and other things) but that doesn't mean that You should the ""Al Qaeda"" represented Islam when what they did was an outright offense to the religion itself. Islam was always about love and acceptance of other cultures for me, and not what Al Qaeda was...

Frank Miller may have made an Extreme comic but he shouldn't have had to face such biased criticism.",Exor Warren,0,2021-07-29T18:11:28Z
599,Ugy-hEkMmhndyf9Cal94AaABAg,"""This is what you'd do in a religious cult, isn't it?""
Welcome to the far-right group (which is just anything from center-left rightwards).",Dracannia,0,2021-07-29T18:11:17Z
600,UgxYnqUgAs_KRv9PEyN4AaABAg,At this point being kept out of this crap stuffs is a win.,M Mark,0,2021-07-29T18:10:46Z
601,Ugwj6lEMaM7NwuXJpfV4AaABAg,Those without sin - cast the first stone.  I guarantee none of these bastards on Twitter are without sin. They will all answer for their own bigotry when it finally comes down to it.  Satan has plenty of room for all of them.,kingdude1999,0,2021-07-29T18:09:59Z
602,UgzdAG71JGxMwaHVCMJ4AaABAg,These people all need to get sued.,Rommel F,0,2021-07-29T18:09:54Z
603,UgxqJFMREPHNkoEpQu94AaABAg,"Not surprised, it's the same thing as everywhere else: kill the icons, kill the heroes. Substitute them with... whatever.",Neal Sterling,0,2021-07-29T18:07:22Z
604,Ugwgb0OXxu_v3T8xpvx4AaABAg,"Ommg I'm a mailman and was listening to this while on the road and when kneon went of ""I cheated on my wife, had kiddy photos and ate cake"" I about SHIT!!!!! LOL",Citric 19,0,2021-07-29T18:06:50Z
605,UgzQiUyJyaAhvF1hmo54AaABAg,This is pure craziness the guy is a legend. I personally didn't know about the controversy surrounding him until this video so I went and looked into it a little more and the book they are calling anti Muslim was actually a book about fighting al-quida so I don't see why they have such a problem with it,Lierous Henry,1,2021-07-29T18:06:42Z
606,UgztnMsUzC3Ovujqmq14AaABAg,The only thoughts we allow are the ones in our bubble.,Jeff Berger,0,2021-07-29T18:06:16Z
607,UgzPhvk2WUVqyvYsW_p4AaABAg,"Frank Miller's one of the true greats, and that includes his Sin City books (since that's one thing he's being attacked for that I've read). These propagandist thought police ""pros"", their promoters and their supporters, all 200 of them or however many, are all F*ing parasites. I haven't read that book about islamic terrorism (going by the title and the response), but it sounds like he's yet another person being canceled for telling the truth, and for failing to conform to their damn intersectional cult. Don't compromise with them at all. I don't care if Frank said something somewhere they don't like or not. F# 'em.",cindercatz,0,2021-07-29T18:06:15Z
608,UgxdzKZlFnBY_fJtUo54AaABAg,I kind of blame top the fourth wall and that show he had a segment called Miller Time and he did an episode of holy terror he was talking about how that book was made and was doing the heights of 9/11 at Frank Miller hated Muslims because he was at New York when 9/11 happened and fun fact that book was supposed to be a Batman story,dr orin niro,0,2021-07-29T18:05:56Z
609,UgyvRLjmwQOnCKVS9nt4AaABAg,We want this to be an inclusive space while also making a social pariah out of anyone who doesn't share our veiws. Gotta love the intolerant pretzel logic.,Timothy Oakhart,0,2021-07-29T18:04:48Z
610,UgxulwX_i023-0s9OAh4AaABAg,It does not appear Thought Bubble thinks at all.,Bertdog,0,2021-07-29T18:03:54Z
611,UgyPN4yBDbSsX8qmo8t4AaABAg,"They now deserve every consequence than comes for being
stupid enough to pay any attention to what SJW mobs say.",ObservadorCeleste,0,2021-07-29T18:03:28Z
612,UgxGwy80ej5nJWBb-UZ4AaABAg,"The irony is seeing the vultures jump over the convention itself and shred it to pieces, while the organizers keep bending and saying ""I'm sowy, I'll dubetter...""
As my mother always said to me, ""If you bow your head too much, your ass is gonna show up!""",Karine Fonte,12,2021-07-29T18:02:32Z
613,UgwG4IlnqHl3vP-w-9J4AaABAg,"Wait hold on.... so now a hero fighting Al-Qaeda terrorists is bad? 

Don't these idiots realize that they're the real ones issuing damage by basically saying that terrorism is totally fine as long as it's not from white people? With their accusations of ""Islamophobia"" they're indirectly saying that all Muslims are terrorists.

All these idiots do is make EVERYONE look bad. And the fact that the media actually thinks THESE are the people to listen to is mind-boggling.",Gamemediafan 17,0,2021-07-29T18:02:20Z
614,UgzAQmj959cv4Y7sgBZ4AaABAg,is frank miller anti islam if so that doesnt make him anti muslim .... one is not the same as the other ....,tony immed,0,2021-07-29T18:02:20Z
615,UgwoyroY982ljkgA-hx4AaABAg,"FUCK I hate that stupid term ""safe space"". Safe space = safe as long as you agree with the SJW movement.",Momus Mouse,0,2021-07-29T18:01:54Z
616,UgwquJWkbcvf6lT8Vyp4AaABAg,"The problem that these individuals are retarded have serious mental problems , They should never be listened to , If they do not like the attraction they will watch something else , their goal is to cause harm , I bet most of them have never even stepped on these conventions",Rheyndraziel,0,2021-07-29T18:01:32Z
617,UgwAuXl1Bpg6n50M1Nt4AaABAg,I don’t think people realize 9/11 was a thing. After the attack it ignited America to action to seek those responsible and fight a war on terror. Books like that or material written over or based on actual events is not uncommon. If your going to cancel Miller over a book he wrote 10 yrs ago then you need to cancel or ban everything in correlation to it. I remember playing COD: Modern Warfare and I loved that game but the same people would find it controversial because you’re fighting terrorists. We already see civil war history being redacted and changed so it’s only a matter of time the stands rewrite 9/11 and everything else they find controversial.,xXDark PersonaXx,0,2021-07-29T18:01:25Z
618,UgzFtAvd6x0p9wtDBoN4AaABAg,So his TDS and cow-towing did not protect him? Wipipo gotta go I guess...,Br1cht,0,2021-07-29T18:01:01Z
619,UgxrkA08kTy5xnzwmOJ4AaABAg,"Frank Miller's old comics still outsell every new comic that comess today. Batman Year One is the only comic that come even close to the monthly sales of Manga dominating the industry.

Why would you ever boot the man who's work is the only thing keeping the comic book industry on life support?",samzilla567,1,2021-07-29T18:00:42Z
620,Ugwb1svatn8vrTwlbFt4AaABAg,""".....He's cancelled.  Frank Miller is cancelled""

""There you see, Lord Twitter, they can be reasonable.  Continue with the operation, you may tweet when ready.""

""WHAT!?""

""You're far too trusting....""",2097Pyros,3,2021-07-29T18:00:28Z
621,UgwNWfwWLK3Gn7RoqQl4AaABAg,This sort of bullshit is becoming a daily occurrence.,Paul A Burrows,0,2021-07-29T18:00:28Z
622,UgyfdGulpkMEdrKkYft4AaABAg,"This is one time I agree with the Twitter mob. Frank Miller's written some horribly racist, Islamophobic, sexist, and pro-fascist works ever since The Dark Knight Returns; just watch a few episodes of Atop The Fourth Wall to see what I mean. He's completely lost his touch as a writer and his legacy's been tarnished, so the fewer chances he gets to stand on his soapbox the better.",Furious Sherman,0,2021-07-29T18:00:12Z
623,Ugw2tbL-4WTWSEbMhQ54AaABAg,"Frank deserves this. Not because of holy fury or offensive books but because he himself poandered to the woke hoards.

It's fitting he be eatten by those he tried to appeal to for when you live by the woke you die by the woke",Von Faustien,0,2021-07-29T18:00:09Z
624,UgwHlvn-nWmc8dO7TYZ4AaABAg,WTF kind of comic creators are these? This would be like celebrating 50’s rock n roll and cancelling Elvis.,LifesDeath,2,2021-07-29T18:00:02Z
625,Ugw2IFN2GYm1oPIDs8J4AaABAg,TAWTTER BLOWS,EpicFail,0,2021-07-29T17:59:50Z
626,UgzVmmSi2MLHyiGSFwV4AaABAg,Alright. Now we're seeing some action. How will the Batman fans react? They'll just take it.,qtsssim,1,2021-07-29T17:59:31Z
627,UgwrmFdXcmLAmo7l47V4AaABAg,That actually sounds smart of them to not have Frank Miller. Hear he's a real creep.,MegaKnight2012,0,2021-07-29T17:59:18Z
628,UgwPH7wh3ZiSPH9Ygv94AaABAg,"""We are dedicated to comics for all"" *Quickly whispered under breath* ""Except straight white men""",Andrew Miles,3,2021-07-29T17:59:14Z
629,UgzMVHYB1EmpcEDDIs54AaABAg,"Funny enough, the person who accused Frank miller suddenly has her kickstarter project approaching  to thousand box preorder after accusing Miller, lmao. Gotta love woke publicity",Sero Cloud,505,2021-07-29T17:59:12Z
630,UgyZzthKY77GP-pwjd94AaABAg,"Those complaints probably came from people, who are not comic book fans, and had no intention of attending the convention.

As usual, conventions and companies cater to angry people, who don’t know their ass from their elbow.",Laurin Standfield,0,2021-07-29T17:58:49Z
631,UgwaXZ63JZJEthCfC-t4AaABAg,"I would call it a shit fit or a tantrum, but I wouldn't call it an ""outcry.""",Cyberpunk VII,0,2021-07-29T17:58:36Z
632,Ugz93T9Ye3Nr7YWAMip4AaABAg,"I guess the UK is turning muslim.  Shame.  The US is turning into a third world country also.  

Does not sound like that convention is the place to be.  One big safe space.",Bertdog,0,2021-07-29T17:58:30Z
633,Ugz5JXEmU4L4_P8YoqJ4AaABAg,Funny how these guys who were lauded for their edginess in the industry are now scaring the industry itself for their edginess.,Chris Hamilton,0,2021-07-29T17:58:23Z
634,UgzNbX_UDWVlzmpn7VV4AaABAg,And they cancelled themselves when that Con will lose like 70-80% of visitors.,Thundersub,22,2021-07-29T17:58:13Z
635,UgwbspJZmWevkxkdJaV4AaABAg,"Shouldn't the twitter mob already have cancelled enough people for those cancelled ones to make their own convention (and then please call it ""no twitters con"")?
But riiight, cancel culture doesn't exist.....",AnotherYoutubeWatcher,0,2021-07-29T17:58:01Z
636,UgwevXH82kUTzKUJ4ah4AaABAg,"I'm of two minds on this. On one hand, it's Twitter, being full of twits. And SJW creators being petty & drunk on power.

On the other hand, Frank Miller has fallen far from grace. The sequels to Dark Knight Returns were bloated with political commentary, ironically in similar manner to many Woke comics, today--just from the opposite end. Add in stuff like All-Star Batman & Robin, and the infamous Holy Terror...it's not hard to see some of the SJW's point of view on him, and it feels inevitable, for them to snub him.
HOWEVER...What has been Frank Miller's RECENT behavior? I genuinely want to know. If he truly regrets his past behavior, and has tried to rectify it, then they shouldn't try to exclude him, for comics he made over a decade ago.",NoOneInParticular,0,2021-07-29T17:57:53Z
637,Ugy3vLLzTqWiqujs7_14AaABAg,"Wait they said their was a list, like they tweeted  it, isn't that an admition of a black list and grounds for a lawsuit?",kidaver1,0,2021-07-29T17:57:17Z
638,Ugx7X9Pq6pT5FLzP3Hx4AaABAg,they're the puritanical zealots of atheism,Night Master,2,2021-07-29T17:57:12Z
639,UgxeQ5POzzs7rXtXTAB4AaABAg,How many of these people that said we're not going we're going anyway I bet if you look at these people on Twitter the majority of them are not even in England,dragonvolador x,2,2021-07-29T17:57:09Z
640,Ugz55aW0BBqnDj3q0Ql4AaABAg,I'm just waiting for someone to apologize scourge in hand flagellating themselves.,GrimTimTim,0,2021-07-29T17:57:06Z
641,UgxgV1E_PA22epu4vvt4AaABAg,"What are the odds that this causes a surge in sales for Holy Terror? Every time I hear about ""that evil outrageous thing"" I google it strait away.  It's a 10 year old book that everyone had forgotten about. Now they've reminded the world it exists and motivated people to check it out",Gideon Schlen,0,2021-07-29T17:56:36Z
642,Ugw5JWv5_pxQNB7CXZJ4AaABAg,How many people will now ask for a refund because Miller isn't going?  I think they are gonna lose a hell of a lot more money from that than the few who got mad over a graphic novel from 2011 that Miller has already come out and stated he is now capable of writing as he doesn't have that anger in him anymore.  Miller has stated many times that Holy Terror was inspired by the 9/11 terrorist attack on New York and that as he was to old to join the Army this was his only way of fighting back.  When does a man's life's work stand for more than a few Twitter users and companies that don't want to get bashed by the Twitter mob?!,UK Media Warrior,0,2021-07-29T17:56:15Z
643,UgxpR6MRBEI_Gk3blRt4AaABAg,"There's a funny congruence here for who ShortBox is offended on behalf of (Al Qaeda, who THEY, not Frank Miller, are conflating with Muslims in general) and their tactics of ""private approach"" followed by public intimidation and humiliation. . .we called them ""Night Letters"" in Kandahar.",SII117,0,2021-07-29T17:56:04Z
644,UgwhA8V3qne9g0HOaP94AaABAg,"An event called ""thought BUBBLE"" kicks an artist with a stellar resume and worldwide fame because of his opinions. Couldn't be more fitting",Duke Magus,5,2021-07-29T17:55:37Z
645,UgxJ4FTkXzZCnkg7n4R4AaABAg,I'm just glad I came from a generation where young folks were not near as foolish as today.,Alvin Marcus,7,2021-07-29T17:55:35Z
646,UgyiEdhUcmTZ8GmGEsV4AaABAg,"People criticize others like Frank Miller for his strong opinions as if their own grandparents arent the slightest bit misogynistic or racist. People between their 60s and 90s right now grew up in a different era. Yes we should be better in current generations but why ostracize old people for stuff they just thought wasn't wrong. Making a big deal out of it just makes it worse. If you don't like something, ignore it and it'll eventually be forgotten",Jun G. O.,0,2021-07-29T17:55:31Z
647,Ugxr6OoatuZhihhxQ7J4AaABAg,"Well, looks like those that have no actual talent can only ""outcry"" to achieve some form of ""recognition"".
Never heard about ""ShortBox"", but i'll keep an eye out for anything from them to avoid it.
I really hope a lot of people are trying to get a refund for their tickets...
Anyway, pretty sure that will also only drive more people towards Manga - good job!",Peter Bach,12,2021-07-29T17:55:30Z
648,UgwpJaNOw1jANPC6zV54AaABAg,"""Whose work has done real harm.""  Uh.... what?  I highly doubt reading a comic book has done real harm, pretty sure the only harm he would have caused is wrecking the confidence of these no name creators by doodling on a napkin.",Menelker,3,2021-07-29T17:55:28Z
649,UgyPOfgAeL_KqkU9pAZ4AaABAg,"These worthless subhuman witless worms do not deserve to even stand in his presence, much less speak.",Mozoto,0,2021-07-29T17:55:18Z
650,UgxGe_H-el2ipmfkZhF4AaABAg,"“It’s amazing how much you know about someone you’ve never met.” - Simon

I’m quoting Chipmunks now? Seriously? I have to reference a moral from Chipmunks about not judging people on the word of mouth of the angry mob?",Jack All-Trades,76,2021-07-29T17:54:57Z
651,UgyhlVnKIf2rzF_grqd4AaABAg,Tag line could have just been Twitter sucks 😆,Daniel Pohl,0,2021-07-29T17:54:50Z
652,UgzXJiTc1QtDRtPscOB4AaABAg,"At this point, does it even matter? The age of Western comics is over. I'm going back to reading my manga now.",Tonberry Queen,0,2021-07-29T17:54:40Z
653,Ugz4R4NIAIFezrULOcR4AaABAg,Any convention that has Gail Simone and G. Willow Wilson on the bill will get a WIDE berth from me!,The Talons of Wayne Chiang,0,2021-07-29T17:54:33Z
654,UgxzhLpHmoUfjHtpAvR4AaABAg,Any convention that has Gail Simone and G. Willow Wilson on the bill will get a WIDE berth from me!,The Talons of Wayne Chiang,0,2021-07-29T17:54:21Z
655,Ugx-e39HDaej58wPkhV4AaABAg,All the people who bought tickets to that event should call and cancel their tickets. This cancellation is beyond outrageous and insulting to all comic book fans.,dan henry,3,2021-07-29T17:54:10Z
656,Ugwr1V_d98qVWMC6bvZ4AaABAg,"“I hope you are paying reparations to those that put themselves in the firing line and now have to deal with an onslaught of abuse” Okay one, if they put *themselves* in the firing line, then why does *anyone* have to pay them reparations? And two, what abuse? Just thinking about Frank Miller is somehow abusive to them? 🤨",Hawkcam1996,4,2021-07-29T17:53:39Z
657,UgzHCOiZuAG1gN2AFvF4AaABAg,These people are evil.  Change my mind,Shane Nolan,0,2021-07-29T17:53:27Z
658,UgywuWstIVkj2z6spb54AaABAg,"who are they that they're standing up for ?.... and what is they are standing for ?,  utterly mental .",Alexander Mcgill,0,2021-07-29T17:53:16Z
659,UgwKBmyu88sKMiN3otl4AaABAg,"Okay seriously. . . Why is she caping for _tеrrоrists?_  Because THAT'S who Frank Miller is ""insulting"" in that book.🤷🏾‍♀️
I lost a good friend on 9/11 and when I was at the WTC Site, there were people of all different races and religions and ethnicities who had ALL lost family or friends.  There were Muslim-Americans whose family had worked there, and had been killed, and they hated AlQаеda just as much as we all did!

I'm Christian and if Frank Miller wrote a book about Batman fighting the Inquisition, I wouldn't take it as an insult because those ""Christians"" were evil.  I don't identify with them.  And peaceful Muslims don't identify with tеrrоrists.",zxy atiywariii,0,2021-07-29T17:53:13Z
660,UgxqCZ_ANmbW5y8dPfd4AaABAg,"There are so many people who are suffering now because other people hear one thing about them that gets interpreted as being bad, assume the worst about a person, and then try to get attention by being as dramatic as possible about how horrible they think the person is. If you are so intent on speaking out to make the world better, how about forgiveness? You don't have to be so prideful that you won't give anyone a chance to be a good person. We've all done bad things, but that's not the same as being a bad person.",Nikole Finger,8,2021-07-29T17:53:10Z
661,Ugy3sWhGvJtgLj4emwl4AaABAg,"Though Bubble has gone full ""Lightbearer Linkara""...",Sam Mjolnir,0,2021-07-29T17:53:10Z
662,UgzT53jBnn9O4uAgGTx4AaABAg,I hope in 10 years time these twats get judged and cancelled using 2031’s sensibilities for what they have done and said in 2021.,The Talons of Wayne Chiang,0,2021-07-29T17:53:02Z
663,Ugyhl4GX5HWHWxIP5-x4AaABAg,"Twitter shouldn't exist in the first place. This is fucking pathetic how low can we get? Who's next? FFS!!!! 

Love you Grandpa Miller! Legend!",daredevil fan,1,2021-07-29T17:53:01Z
664,Ugxgv0JlNqp3P0vTJq94AaABAg,Manga wins again…. Comics are in a race to oblivion,Captain America,0,2021-07-29T17:52:53Z
665,UgypdoOxpBv2hdQCcKB4AaABAg,Frank miller is no way talented now a days but he’s a zillion times more smarter and talented and actually has more heart than those nazi communist loving asshole’s from Twitter,A Dog,1,2021-07-29T17:52:31Z
666,UgwgiaQ4ml2ywFSubXV4AaABAg,At this rate there won't be any more conventions to go to cuz you're afraid of inviting the wrong person.,ZGundam64,0,2021-07-29T17:52:10Z
667,Ugw7h4DC4er6CrI4aYl4AaABAg,The only terror are these self righteous people that don't know or care to know the people they are cancelling because they are trying to prompt themselves up for relevance.,Shinkai Atsuya,0,2021-07-29T17:51:51Z
668,Ugw4Bp6PftpTVBwHHLV4AaABAg,Yet another life ruined by the Glitter Gestapo and the Waffle SS.,MadMachine,0,2021-07-29T17:51:43Z
669,UgyY1hcp108Rk0NHTMR4AaABAg,"And the UK convention wonders where the audience went...
Just like connecticon after they saved and banned vic...
They will realize what happens when the audience is told to screw off, they don't have one anymore...",ccateni28,1,2021-07-29T17:51:31Z
670,UgxvYbH4Qf4MsSr4NuR4AaABAg,I can't believe he is actually reading all this.  Sweaty money?,Joel Christensen,1,2021-07-29T17:51:27Z
671,Ugz9u_5y06p8Y9Ly_Hx4AaABAg,Weaklings like this are the reason why Comics industry is failing. That's not fair to anybody else who wanted to see Frank Miller they just deprived them of that privilege to do so,Hero of light,0,2021-07-29T17:51:25Z
672,Ugy6DaWkVc8sUV6IC8N4AaABAg,"If the likes of frank miller are banned, then frankly this is not an event for comic fans, its one for cosplayers and fake nerds, as in not for the industries customers",DED DOA,0,2021-07-29T17:51:05Z
673,UgyOBQGdaXrozfe_y_14AaABAg,Pussies. 😑 If I was Frank Miller I'd buy my ticket in and wander around. Maybe take a break outside...or across the street. Just out of cackling spite.,crimsonda,0,2021-07-29T17:50:59Z
674,UgyBnsXKGzylhc5Woed4AaABAg,They might as well cancel the whole comic con......because NOBODY wants to see the rest of those talentless hacks.......unless some Manga writers will be there. 🤔,Commander Bracey,0,2021-07-29T17:50:30Z
675,Ugy_8M0-6UVNSkUuUgB4AaABAg,do you research Dennis O'niel and Neal Adams reinvented Batman with issues 232 which introduced R'as and talia not Frank Miller.,JAMES Lhota,0,2021-07-29T17:50:13Z
676,UgwHFA4S_n438OgvJGt4AaABAg,"The response by Thought Bubble sounds like a religious confession?

The attacks on people smack HEAVILY of religious Inquisition tactics.",2097Pyros,8,2021-07-29T17:50:07Z
677,Ugxe1HW9CIO7vxHLA1N4AaABAg,"It's called Public Flogging"" Neon. These people think they are roman emperors in the coliseum...",LeChevalierduLys,2,2021-07-29T17:49:36Z
678,UgzggBth0LA_pHN52iN4AaABAg,Holy terror is so good!!!,Into the break,2,2021-07-29T17:49:35Z
679,UgzBX0WWuMO8askHBtV4AaABAg,Iron Law of Bureaucracy meets Slave Morality,Garomcfbgdd,0,2021-07-29T17:48:56Z
680,UgyT9hTo_UPFhNgzLnt4AaABAg,"Damn, Kneon has gotten some of that Geeky fire lately lol. Also, Miller has already expressed regret for Holy Terror in a 2018 article for The Guardian",Adam Ramos,12,2021-07-29T17:48:50Z
681,Ugxb6GFbu9nKdgnIWgF4AaABAg,"Scarlett Johansson sues Disney over ‘Black Widow’ streaming release, report says",Cameron Davis,0,2021-07-29T17:48:42Z
682,UgyiCypIWCslANdypoV4AaABAg,Theres a big comic con in Harrogate? I live 30 miles from there and never knew about it. So glad I didnt find out after it that Frank Miller had been there.,liam fitzpatrick,0,2021-07-29T17:48:35Z
683,UgzonIgYpDgRa7maBu14AaABAg,I mean he agrees with their logic though,miliboy0522,0,2021-07-29T17:48:34Z
684,UgzQYqbHhusjF-Foful4AaABAg,The word “NO” needs to make a comeback. Especially when it comes to Twitter.,Jacen Haggard,257,2021-07-29T17:48:26Z
685,Ugw4Twm_U2B4qD2JCCB4AaABAg,#ThoughtBubbleThoughtless,Ashton Menzies,0,2021-07-29T17:48:09Z
686,UgzkmV_D4KScX1OYwtp4AaABAg,Sad that it’s cool to side with the enemy these days,Giovanni Ayala,0,2021-07-29T17:47:58Z
687,UgwppmdRFFStxXD8-Dd4AaABAg,"A legend in the comic book industry.
A bunch of talentless hacks who can't write worth shit.

Nice logic, Thought Bubble.
Enjoy losing revenue.",lightning116,0,2021-07-29T17:47:58Z
688,UgyyhKs326hE_NAeVPx4AaABAg,GATEKEEP is NECESSARY folks....its time to keep the infiltrators out...,L4w1N c0l,25,2021-07-29T17:47:50Z
689,UgyuXBy2oNYj0qt5e4J4AaABAg,"The proper response the convention should have made is to pay for Frank Miller's trip out there instead, not to give in to a bunch of crybabies. There will be a lot more people refusing to go now that Miller is cancelled than would have if they did nothing.",obsidianmoon13,0,2021-07-29T17:47:45Z
690,UgxONbUBz3F-AOEwf094AaABAg,"Ok so I did some research on this claim of Frank being anti Muslim. So apparently it's because in 2011 Fank wrote a story where Batman fought Al Queda after the attacked Gotham City. Since when was it problematic to be against literal terrorism. It was fucking AL Queda Batman fought, not some kids from the Mosque down the street.",Barbarossa_Togasa,2,2021-07-29T17:47:25Z
691,UgxBFvYhQnImmukTxm94AaABAg,"Cancelled till proven innocent, and then still cancelled.",Jonas Larsson,0,2021-07-29T17:47:20Z
692,Ugz8kn10VUNR0EVMVwZ4AaABAg,Anyone to the right of Stalin is an enemy to these cultist. This is what college gets you.,iy fan,0,2021-07-29T17:47:14Z
693,Ugy9Efq62HXanjfqaUR4AaABAg,Frank Miller does great work...... the Twitter crowd hates it. Twitter is just the vocal mob of crudspewers. They aren't the ppl that would actually even pay to attend an event...... next news... the event didnt make money....,Evil Minion,0,2021-07-29T17:47:00Z
694,UgzkewB8J8Rt3WTWTZ94AaABAg,Who listens to these weirdos? Im glad i dontlive in a woke craphole like US,Jacob Fullton,0,2021-07-29T17:46:48Z
695,UgzEaEu5DyE9sjMUhRJ4AaABAg,"Damn ideology wussies ruining everything. More reasons why I go to anime/manga.
I wish Frank Miller good luck and hopefully get support from fellow fans.",vEggs Bacon,2,2021-07-29T17:46:39Z
