,id,comment,author,likecount,publishedAt
380,UgxZcFC_kNz9TfFs_hJ4AaABAg,The irony of the fact that Frank Miller is likely one of the people that made events like Thought Bubble even capable of existing in the first place and they're canceling him because of woke crybabies is just so very very sad. It truly showcases how wokeness is nothing more than an excuse to try and erase the past and claim someone else's accomplishments as your own without doing any of the work needed to achieve it.,NL Paradox,0,2021-07-29T20:38:47Z
381,Ugy3T57M5-SqA7oy8oB4AaABAg,Well.. just cancelled my visit to that event.,Manga Mania,0,2021-07-29T20:37:15Z
382,UgzbZW_YzVWesFCbVnd4AaABAg,This is how Comic Cons lose relevancy,Jord IL,0,2021-07-29T20:35:00Z
383,UgyYAqmDR0rfNMdVaTt4AaABAg,"Frank Miller's anti- book was being written when 911 happened, which heavily influenced the ""what would comic book heroes do in this situation"" plus I am sure some personal rage at the the time.   Context or lack of, every time from the twitter mob.",Damace,0,2021-07-29T20:34:28Z
384,Ugzf3ipfDoeaySAeuR14AaABAg,Their lose on multiple levels!,FlyN Saucer,0,2021-07-29T20:31:45Z
385,UgwKXwN2oVl8S-Z5ldZ4AaABAg,300 is a masterpiece of a comic its has none of that stupid queen strong women shit in it that was in the movie,cpt191021,0,2021-07-29T20:29:57Z
386,Ugw8Y_yoybCnMXJ-flt4AaABAg,"Spoilers : As they seek out new victims in their WOKEness, they'll cancel more and more panels and artists until the conventions are ONLY going to be the woke attendees ... no comic artists ... no sales booths ... no panels ... Just ... the attendees ... And it'll be blandness for EVERYONE ... and everyone will be happy because there won't be anyone that makes them sad (awwwww)",Yellowmane,2,2021-07-29T20:29:12Z
387,UgxL-tKYK6UnFNAk-Rd4AaABAg,"I agree if you want to not invited him fine...but enough with the ""I'm SO sorry letter"" crap",JenTA102,0,2021-07-29T20:28:42Z
388,UgyVcNxpFFAJHf51uk94AaABAg,He's welcome to his opinion. They also don't have to kiss his ass.,Enigma2K99,1,2021-07-29T20:26:26Z
389,Ugx8dw8z9NJ5P4f2x8p4AaABAg,Ha!... perfect time for a new talent to run a convention down the road WITH Miller (ha)... I wonder where the fans would go.,Ardath Bey,0,2021-07-29T20:26:11Z
390,UgwNJOelKgvj2PHuw0l4AaABAg,once you have paid the Danegeld...,Jesse Barrett,0,2021-07-29T20:25:28Z
391,UgxFdT_2Ki-AIfMvTgV4AaABAg,"PSA from ThoughtBubble's FAQs: ""You can get a refund for any reason up to 6 weeks before the convention too. Please email us at info@thoughtbubblefestival.com""",Jan Van Hoogstraeten,0,2021-07-29T20:25:27Z
392,UgwV4w5EpldTVEGzlBN4AaABAg,"I am proud to say, that I dont have, and I will never have a Twitter account! Fuck them!",Safonso,1,2021-07-29T20:25:24Z
393,UgzZIH2cVEYz_cCNruN4AaABAg,"Frank Miller's ""Peers""!?
ROTFL!!!
Todd MacFarlane, Erik Larsen, Rob LIefeld...  Actually he'd be a bit above even them...  And now that Stan and Jack are gone...  Maybe Jim Starlin if he's still around.",Ben B,1,2021-07-29T20:25:03Z
394,UgyblohIknMKwFJv0FJ4AaABAg,"Ok, I haven’t read whatever the thing is, but if Frank Miller IS a bad bad, then why can’t we accept them and just tell em “hey no that’s bad don’t do that” instead of banning him from existence? Jeez.",EnablingTrash131,0,2021-07-29T20:21:54Z
395,UgxfHJ_2t5EWuQ6ytQJ4AaABAg,Wow after Frank 😬,James Burnette,0,2021-07-29T20:21:17Z
396,UgzkY4YH-LKZz-cR1wp4AaABAg,I'm sure Frank Miller is soooo sad that he doesn't have to show up and help people who hate him make money.  Those of us who love creators of good content are already gone.,Jason Rosenberger,0,2021-07-29T20:21:03Z
397,UgzqeICKIPqZpRvVeKp4AaABAg,"I feel like all the Frank Miller fans should express how uncomfortable and excluded THEY feel after Thought Bubble's actions (if they truthfully do feel that way, of course.)

sometimes you have to fight fire with fire.",Tim5corpion,0,2021-07-29T20:20:04Z
398,UgwPR_F64tWjHY_VvCd4AaABAg,"I will say Holy Terror  was a rather bad book.  There was a video on Atop the fourth wall that talks about it and I will prefer that over reading it.

That being said, is there anything else more recent(lets say last 3-5 years) that one can present that can back people stepping away and canceling Frank Miller?  I will say that  the book from 10 years ago is punishing, but I've also learned that in 10 years things can change quite a bit and if he has not done anything else damning then he should be given a little slack or at least a watchful eye.  With how things are going we are eventually going to cancel people for things they did in grade school as a little kid.",starblaze27,0,2021-07-29T20:16:18Z
399,UgxRix9zkctlmeuO-2N4AaABAg,"🤦‍♂️🤦‍♂️🤦‍♂️
I think you nailed it Kneon. It's just people wanting to be vindictive to any and everyone.",Daniel M,0,2021-07-29T20:15:30Z
400,Ugw8bDTlvzp0FYKfA5l4AaABAg,"Fans: “This is unbelievable! How dare they do this!”
Also Fans: “Two tickets please.”
This problem has the easiest of solutions. Stop giving your hard-earned money to people/organizations/events that pull this kind of crap. It’s hard to push your woke SJW beliefs when you’re out of business.",Jonah Rains,1,2021-07-29T20:14:20Z
401,UgwMklYtcxzGekzi_ul4AaABAg,"Holy Terror was a comic against al Kaida (not sure of spelling), a terrorist organization, at least claiming for the deaths of Americans in 2001. Remember, every twitter person who has cried out against this, are supporting Terrorists to kill whomever, whenever, they want. At least until one day its their family killed. So the ShortBox woman is a terrorist?

Thought Bubble, cancelled frank Miller, you killed your con. Everyone going there for Frank Miller, should just cancel too.",Ashura Dragosani,0,2021-07-29T20:14:20Z
402,UgyieZduAps8Fe7wb4R4AaABAg,I don't understand why everyone keeps caving in to the stupid ass twitter bullshit mob.,Daniel Watts,0,2021-07-29T20:14:17Z
403,Ugy7jHoFC0CNc7WDVsV4AaABAg,"I hope people realize that once cancel cultists have finished unpersoning every ""problematic"" creator they can find, they're going to turn on the works of those creators. Unless these NPC drones are dealt with, one day you're going to see 'The Dark Knight Returns' and other important works OUTLAWED by the marxist morality squads. They will make possession of them illegal and they will attempt to locate and destroy every copy they can get their hands on. That's the future we have to look forward to ... if we don't put an end to cancel culture.",Wrath Oranos,0,2021-07-29T20:13:33Z
404,Ugw30AjTZb9f_eNAKPF4AaABAg,"You know last I time I checked people are allowed to have an opinion, not everyone thinks alike, he should push back anyway he can this is more bullshit.",Daniel Watts,0,2021-07-29T20:12:24Z
405,Ugx2i9BziAfa9_DK8yh4AaABAg,Yay!!! Another one bites the dust. Never piss off an artist of this caliber. See Ethan van Scryer,Gungnir Productions,0,2021-07-29T20:11:44Z
406,UgySu_SV8yozjHge7Xl4AaABAg,"Frank Miller could have his own online convention. On Twitch? Or YouTube. Livestreams, fundraising, and autographed giveaways.

Regain positive publicity. Clarify his stance on the accusations. See if he's willing to make amends with the Muslim community. Or at least one specific one. Seems pretty easy.

And, the best part of it is, he could have the autographed giveaways be eligible only if you retweet your favorite moment of the online convention.

Invade Twitter. Make them lose their minds. I'm just surprised no one is running counter culture movements on their home turf.

They are a bunch of crows. Scavenging on corpses. They won't stand for victims if it will cost them something or they have nothing to gain.

We are all bullies. Power doesn't change. It reveals. What was I talking about?",Kevin Hwang,0,2021-07-29T20:11:28Z
407,UgxazUJqxj3yJKtvesx4AaABAg,I thought I'd seen it all but wanting reparations for being offended on twitter really takes the cake,Archibold Terwilager,0,2021-07-29T20:09:38Z
408,UgxXVdjgQRmdmoFAGD14AaABAg,Twitter strikes again!,PT Rothschild,0,2021-07-29T20:07:15Z
409,UgyT9GWYhBFkkvmrEad4AaABAg,"""It has no balls and smells like tuna""
-Geeky Sparkles
I think her quote about MOTU sums this up as well.",Joe Hasskamp,1,2021-07-29T20:07:11Z
410,Ugzsrl5gsPfZNeicr9J4AaABAg,Time to join comicsgate frank,BlackliketheSun,0,2021-07-29T20:06:25Z
411,UgxER2cm2jDN0GlujPJ4AaABAg,"So sick of Twitter mob, maybe is time for us to cancel Twitter as a whole",rriosl,0,2021-07-29T20:03:31Z
412,Ugz7K4NP4H4lvT76E_Z4AaABAg,"So is things like Webtoon, Tapas, Manta and LezhinComics winning again?",Tabitha Monaco,0,2021-07-29T20:02:46Z
413,UgxbjYKRDD7rohkoxuB4AaABAg,"I find so annoying they use the term of ""safe space"", like...all I can think off when I hear that is a bunch of cry babies, in a corner and if anyone without their permition comes too close, they start to hiss like a bunch of snakes, they cry for their mama...even for them, it makes them sound liek a bunch of losers that can not stand a lil bit of critic or have a different opinion...is just a pathetic sight.",Rachel Marie Cabera Pacheco,0,2021-07-29T20:02:39Z
414,UgxeTlK94fxxbpA11kZ4AaABAg,CAN WE NOT JUST FUCKING ENJOY THIS SHIT?! DO WE REALLY FUCKING NEED THAT ONE PERSON TO RUIN EVERYTHING FOR US?! This is why I like manga more than comics,GamingWith Joseph,0,2021-07-29T20:02:22Z
415,UgxNF8Xw0rrBcd1YmQd4AaABAg,hearing kneon rant like this is rare. but sadly he is not wrong,Rafael Illan,0,2021-07-29T19:59:18Z
416,Ugx1N3sdzup93xNke_l4AaABAg,"I live an hour or so south of Portland.  If anything, Portland is worse than how you joke about it.",Peder Georg,3,2021-07-29T19:57:09Z
417,Ugy85WYtKdJ7uZXLh8B4AaABAg,"These ""attendees"" need a stiff dose of their own medicine. #meltthesnowflakes",Rose Prevost,0,2021-07-29T19:55:45Z
418,UgxSuWaTC9a7QrfRmhF4AaABAg,Granted while miller usually is pretty prejudice towards middle eastern people the people calling him out are even worse,Zoron,0,2021-07-29T19:55:31Z
419,UgwCjspN1mrDOZ4FiLt4AaABAg,So why are they all pissing themselves over frank?,TheBlackoutExplorer,0,2021-07-29T19:53:53Z
420,Ugwu_hGNXkcPdQrBtCR4AaABAg,Huh......if they ever get garth ennis canceled we can start a super group.,John Aeryns,0,2021-07-29T19:53:26Z
421,UgwiTIF-gZpFvg3JouR4AaABAg,"Comic Book Convention: buys into fake hate on Twitter; ocnsiders vitual personas more important than real fans

Also Comic Book Conventions: why are fans abstaining? why are we losing credibility?",Ber Nie,0,2021-07-29T19:52:33Z
422,Ugz7rBV3RFstVkw2stx4AaABAg,If he is anti CRT give him a medal,Thomas Eriksson,0,2021-07-29T19:51:24Z
423,UgwLo1vTDArt1xvCTXR4AaABAg,"I hope they have a good refund policy, they're going to need it.",spiritofthewolf15x,0,2021-07-29T19:51:15Z
424,UgxRuhCUgESdKbLt0ul4AaABAg,"Yes, the mighty power of Shortbox. The home of Fun and Fine Contemporary Comics... that you probably have never heard of or cared about. And will never generate movie cred such as 300, Sin City, The Spirit or Batman, Dare Devil, Electra... if the comic industry is a sinking ship, it redefines bottom feeding. Can't say I'm a fan of Frank Miller's post 911 politics but what about his safe space and that of his fans? Gotta love people crying safe spaces while pulling the pitchfork mob crap. But no, Cancel Culture doesn't exist. My ass.",Minxi Mayhem,0,2021-07-29T19:51:05Z
425,UgzA73uD-DbTwUTFg5V4AaABAg,"huh, what about me? Im arab and also a vet who was in the process of enlisting on 9/11/2001. Does that make me bad? Hell we invaded the same country grandfather was born and raised in.",krimlon,0,2021-07-29T19:50:57Z
426,UgwsDi3rRp6DtWreWSN4AaABAg,Frank Miller honestly should just start his own con this year and bring all the people who have been cancelled throughout the years.,komics_ kid,0,2021-07-29T19:48:13Z
427,UgzmuhYFbde2yIUn_gR4AaABAg,"Is no one reaching for the low-hanging fruit here? Fine, I will.
*Ahem*
Are we really surprised. I mean, the twitter mob doesn't want Miller to pop their ""Thought Bubbles.""",Samuel Zuleger,0,2021-07-29T19:47:55Z
428,Ugydd0sh9AAI9aZuRjZ4AaABAg,"Easiest solution, cancel the cancelers",Darkfireice,0,2021-07-29T19:47:17Z
429,Ugxw6xC_CmMo4MiqdPl4AaABAg,"Islam is a Death Cult, and the 'prophet' was a pedophile, warmonger, and slaver. These are not insults, but rather, demonstrable statements of fact.",Uncle Verum,0,2021-07-29T19:45:39Z
430,UgxYnI0vQZiqRGjp5i14AaABAg,"I know this has nothing to do with this video but I just saw a trailer for Ghostbusters Afterlife and I’m hyped! Looks so good!

God I hope it’s good.",Lemony pie,0,2021-07-29T19:44:36Z
431,UgwUz5oBoevu62oOMfx4AaABAg,"As if they didn't realize who the hell he was. Miller has always been called controversial, so if they really had a problem they wouldn't have booked him in the first place. But the moment some rando complains, it becomes a problem",SpideyFreak2099,14,2021-07-29T19:43:52Z
432,UgzBH-pIcjpxgZ9lAId4AaABAg,"The Thought Bubble should have asked Zainab Akhtar how many lashes the organizers should give themselves before they're forgiven...or they should be stoned to death. Miller is 64 going on 90 due to his addiction (very very sad). I would have responded with a gif of Pocahontas waving goodbye saying ""Bye Felicia."" Well, enjoy those empty rooms Thought Bubble!",J. T.,0,2021-07-29T19:43:45Z
433,UgzmR03XK0rTbZ5bUAV4AaABAg,"To be honest, I don't know what he's been up to, recently... but the thumbnail picture you used displays an image that looks like it belongs at a snuff-film convention on the Dark Web, so, based on that image, f*ck this guy.",CheshireKat,0,2021-07-29T19:43:43Z
434,Ugz_ihWu055KVwgUkop4AaABAg,"Oh boy, this sounds like they were just getting rid of him because his shit work outshines their best work any day of the week.

But whatever, bet attendance will drop enough to be a notice.",Brotha Darkness,1,2021-07-29T19:43:02Z
435,Ugzr8dK3V0GpqnODPXF4AaABAg,"I wonder if there have been comic books artists who have demonized Christian, White people, or men invited to that convention.",Barry On,1,2021-07-29T19:42:06Z
436,Ugwhpk9XpJBT8Vv4Yvp4AaABAg,That nutjob says she's harassed when she dresses like a table cloth (which I don't believe). Ask her what would happen to a woman if they dress in their western attire in Saudi Arabia.,HammerU,0,2021-07-29T19:41:50Z
437,Ugx983lfpcAzAB67i4x4AaABAg,"Batman Year One, I have the floppies Brilliant",M Sparks,0,2021-07-29T19:39:25Z
438,UgwB8Pn4alKn3_q8xz94AaABAg,"Making wild accusations is LITERALLY the playbook for talentless unlikable people to gain attention, publicity, and validation. They often just ""happen"" to have something to sell coming out or some sort of campaign you can send them money to help them through their traumatic times.",candidpaul,0,2021-07-29T19:39:08Z
439,UgyPeR-7dKKXyXq-Dxd4AaABAg,"I only know the adaptations of his works, but that is the same thing we had with Orson Scott Card at Pyrkon in Poland.",Kamil Muzyka,0,2021-07-29T19:38:13Z
440,UgxCmvZLh0PP4Z5T7wl4AaABAg,"So Twatter got so mad at Miller that they blacklisted him from a British Comic-Con all because of a comic he did depicting Muslims as terrorists  pfft the man has he's thoughts and is a legend leave him be, the only terrorists I hear about now are the ones on social media  what a shame.

sorry for the rant if it's TLDR",Cisco Deer,0,2021-07-29T19:36:52Z
441,UgzAg76Lq5PWl3LV3OJ4AaABAg,"I think this is great they are doing that shit, mistake after mistake, it won't be for long when turn their backs on these good for nothing sjw hypocrites.",Abel Salazar,0,2021-07-29T19:33:58Z
442,UgyWVFSYFYaX11BYHMh4AaABAg,"Japan: let’s honor what came before us. 
US: let’s just burn our history to the ground.",SnakeEater,30,2021-07-29T19:32:08Z
443,UgzE2HSWwMLqacXnF4B4AaABAg,"I'm just assuming that this was supposed to be his first appearance at that con? Otherwise, it makes no sense why they're suddenly going nuts -- although, it's not like these kinds of ""people"" need a reason to go nuts.",crypto66,0,2021-07-29T19:31:49Z
444,Ugy8Olt-tqGv8x0Qm2p4AaABAg,"start up a con called ""speech balloon"", shit on twitter fucks, advertise as unsafe, as exclusive. There is way, way less of them.",Don Fairfield,0,2021-07-29T19:30:44Z
445,Ugw4XU5Y5zlSdmNY1yd4AaABAg,Worse most authoritarian bratt Lord of the flies generation and need to be stopped.,Atticus Herodes,0,2021-07-29T19:30:25Z
446,UgzZMJuVUQe34gh_15Z4AaABAg,"never thought I would see the day, that twitter would go pro-terrorist, oh, the politically correct mafia cancel mobs use similar tactics, so I guess I'm not surprised, lol.",Zarcondeegrissom,0,2021-07-29T19:29:33Z
447,UgxPOqnhQcO0SeKk9HB4AaABAg,Honestly 2 comic book industries sounds great right about now. They can have their I'm Not Starfires and we'll have our Killing Jokes. Everybody wins.,greenraven22,0,2021-07-29T19:29:15Z
448,UgyPcVwVJek2BZVKh1d4AaABAg,"Meh, that's on them. It's going to be a broke bust for once again caving to whiny little tards on Twitter. Edit: Oh yeah at this point in time the Twitter Mob is a cancel cult to anyone that doesn't think nor vote like them.",Crio Yaroi,0,2021-07-29T19:27:49Z
449,Ugxg1Ozc7ic2AyXXP6x4AaABAg,"Have you read Holy Terror, Dark Knight Strikes Again, or All-Star Batman and Robin? How much shit does a guy have to make to stop being called a 'legend'?",Salty Calhoun,0,2021-07-29T19:26:20Z
450,UgzNXeeEnRA5SslbjkZ4AaABAg,"lol, i bet none of them were going to Thought Bubble.",Don Fairfield,0,2021-07-29T19:26:11Z
451,UgxlVhbXku583gOwmal4AaABAg,I've always blamed Buffy the Vampire Slayer for how people talk on Twitter. These people always sound like bad Joss Whedon caricatures.,nightwishfan1991,0,2021-07-29T19:23:49Z
452,Ugwogp75fpaVidqu-UZ4AaABAg,"14:06 Dude this person literally cried about not being heard and then proceeded with ""Thanks for doing the right thing. I won't support you though"". This is the kind of shit that should be running companies into the ground. Keep listening to non-fans and soon you won't have any fans or even a company. STOP... LISTENING... TO... TWITTER. They aren't buyers.",KillerLuvsPie,5,2021-07-29T19:21:56Z
453,UgyJAgR3kGC_li4iwQ94AaABAg,I don't think the guy gives a fcuk! about twitter.,Anton Caligari,0,2021-07-29T19:20:58Z
454,UgzaGJvyP3AY28xAafZ4AaABAg,FUCK islam. Miller did NOTHING wrong.,jamyers1975,1,2021-07-29T19:20:14Z
455,UgxgzYp-ioU-RqIRvG94AaABAg,"NGL i was planing on flying there(like 5 minutes before Yellow Flashes video i was looking at ticket prices) just to have my Dark Knight Returns and Dark Knight Strikes Back signed now there is no reason for me to go at all.

It saved me money but still big fan of Franks work and this might have been my onlye chance to meet. I finale had free time and this happened. I hate Twitter.",Pera Papić,0,2021-07-29T19:20:03Z
456,UgwnQMHoc47pu53F4Kd4AaABAg,"Sounds like jealous people wanting to cancel a successful person.

He should have asked, how many people actually came to the event organizers to complain. I guarantee it was about five people. Where is the proof that these people on Twitter actually attended this convention for years?

There are those who think that by canceling Frank Miller they will have a shot success and get consumers to buy their stuff. In reality, they can’t sale their own stuff.

Some of these people probably weren’t even going to this convention anyway. And Twitter never accepts apologies or bent knees.",Random Jasmine,0,2021-07-29T19:18:54Z
457,UgzFsdNJhnyl2b1dFih4AaABAg,"Thought Bubble...
Welcome to the echo chamber! I'm Dr. Mac.",Miyami Yuki,0,2021-07-29T19:18:01Z
458,UgzFEmQImVEBQKA2_P54AaABAg,"People with no talent and no ability should be ""underrepresented"", in all industries. Competence matters, not politics.",lookonthebrightside,1,2021-07-29T19:16:46Z
459,Ugzp4MJ3ELjk3klfloJ4AaABAg,Devils advocate: he did write Holy Terror which was disgusting. However I've always maintained that you are allowed your opinion even if i disagree with it. People shouldn't be cancelled for thinking what they think.,superdoctor14,0,2021-07-29T19:16:41Z
460,UgzHoEIbvwl_5InRd6N4AaABAg,"cancel culture morons...Frank's lost it some time ago, but FFS.",Don Fairfield,0,2021-07-29T19:16:37Z
461,Ugw9ODJTXQgzssbwIB54AaABAg,"Thought Bubble is going to double down and tell people, ""If you don't like our politics, don't come to the show"".
That always works :)",Jerry Oswald,0,2021-07-29T19:16:25Z
462,UgyU64gvDcL62rA7jLN4AaABAg,"Bro it sounds like a cult because it is a cult. Leftism has become a religion, and frankly its one of the more hardline and radicalized religions out there.",Fujimora Pantsu,0,2021-07-29T19:15:23Z
463,UgyEQMpe8PUWVqcV0bV4AaABAg,It's the 1950s all over again.,athos1029,0,2021-07-29T19:14:46Z
464,UgyId_ihH9N2VZqbBb54AaABAg,Conventions have mission statements? Lol,Naheem Quattlebaum,0,2021-07-29T19:14:41Z
465,Ugzoq8kyyScImxo6PwN4AaABAg,A great example of how the woke comicbook industry is literally digging their own graves.,Vreidicus,25,2021-07-29T19:14:16Z
466,UgxQdR5uFpIP6U3Lz0B4AaABAg,Disgusting.,Pete harmony,0,2021-07-29T19:14:15Z
467,Ugwl3j7eKntE5btRsMB4AaABAg,Cult is the right word.,Brian LeBlanc,1,2021-07-29T19:14:08Z
468,UgyYAR3Nx7Cn5AQscWd4AaABAg,Tough Bubble? More like Ideological Echo Chamber.,Rodrigo Faria,0,2021-07-29T19:13:07Z
469,UgzQ97leaw86Q6ZAjit4AaABAg,I'm not going to defend Holy Terror but from what I've heard not even Frank Miller Will defend it anymore.,Epic B,0,2021-07-29T19:11:45Z
470,UgwqzFnPpJSiN2P0s894AaABAg,"He is anti muslim? 
Based",Pablo Camargo,1,2021-07-29T19:09:40Z
471,Ugztap9YdjLSo1nKpsx4AaABAg,"I didn’t read Holy Terror either. I saw the review by Linkara, formerly of Channel Awesome. I don’t watch him anymore, but from what I remember of that review, yes, the book is as bad as Twitter says it is, and very Islamaphobic. Though I’ve also heard Frank regrets writing it.",Kevin Corey,1,2021-07-29T19:09:17Z
472,Ugy22n2E7q1ELI6z_Gl4AaABAg,Looks like japan found a new ally. The enemy of their enemy is their friend. I am really embarassed for these sick woke wackos.,Memento Mori,0,2021-07-29T19:08:08Z
473,UgwX_L7rs9FkYz5W0bl4AaABAg,"What are the accusations?, what are not the accusations, given today's neo victorian standards, his career and just the fact that he is very old, they should be accuse him of being everything phobic",Gecko o,0,2021-07-29T19:07:19Z
474,UgzT1H_DDOFzb1ptvHB4AaABAg,Shortbox are nobody they’ve done nothing and some rip off of cowboy bebop.,The Principal Officer,0,2021-07-29T19:07:15Z
475,UgyDIxq809DzXY_1uQp4AaABAg,"I haven't read that Frank Miller book in question.  But, I find it hard to believe that a fictional story is intentionally trying to encourage real-life hate against a group of people.  If the book has characters that are bigots, telling that story is not the same thing as endorsing it.  I watched a ton of Ninja Turtles growing up and I've never once thought to make and eat turtle soup like Shredder kept insisting. =P",Sad Panda,0,2021-07-29T19:06:51Z
476,UgwQh3sDHcbwHlGP5PJ4AaABAg,I always hoped Frank would come back to Marvel at some point and write Daredevil again. Daredevil #219  is one of the greatest single issues ever crafted. Go read it if you haven't.,Kevin Thomas,0,2021-07-29T19:06:05Z
477,UgychBGDIKNMdBtb4qd4AaABAg,"Once again only Twitter matters to the main stream comics industry, not me who supported them for decades.",Usual Motives,0,2021-07-29T19:05:26Z
478,UgzT0REOTrnRhWG-0Dx4AaABAg,Outcry is an individual.,koffeekage,0,2021-07-29T19:04:51Z
479,Ugw6NCRpLukWYSdluWt4AaABAg,"We need to change the terminology from Cancel Culture to Cancel Cult.  If you dare to think for yourself you are hunted, harassed and ostracized.  This is exactly what a cult would do.",Lisa Rees,0,2021-07-29T19:04:41Z
480,UgxgHyEXTjVX8uQ9Hfh4AaABAg,Twitter is problematic. I call to cancel Twitter.,WM2022,0,2021-07-29T19:04:23Z
481,Ugz6_C86uJyEiVDzbuN4AaABAg,"The takeaway lesson from this ""cancellation"": the comic industry DOES NOT WANT Frank Miller or Batman, Sin City, 300, Daredevil, etc. fans in their audience.  They want the WOKE Twitteratti who make comics about POC Lesbian girls or the fans who cheer when one is published (they don't, of course, actually _buy_ the aforementioned comics - they read How To Be A Werewolf for free on the internet).  They want ""their"" hobby to be purged of all those ""toxic males"" that ""stink up the place"".",liljenborg,0,2021-07-29T19:04:12Z
482,UgyhaBRIEEbOjfYKsMt4AaABAg,"And this is how we got to the point we are now at with single issues of Japanese Manga outselling the entire yearly output of the American Comic Industry because the SJW' Twitter Mobs have chased out all the people who had the talent that made the comic books people wanted to read!
Yep I can see people like Miller going independent but the new crops of comic book writers and artists just simply are never going into the trade when they can earn a better living without all the PCBS that now gives us unreadable (CENSORED) like Not Starfire produced by the no talent SJW PC crowd!!!",Kenneth Kaczypenski,0,2021-07-29T19:04:08Z
483,Ugx-w-A5vd3oZY2hsN14AaABAg,Example 27582 showing that saving in to a Twitter mob does nothing but hurt you even more. You're already a sinner to them and their faith has no path to forgiveness.,Youtube User,0,2021-07-29T19:03:54Z
484,Ugz_nTFgfyWL608kVbx4AaABAg,"No proof of allegations or anything from these parasites just empty claims, Lol I hope they like a empty dead convention cause NOBODY is gonna show up for talentless hacks.",Gameboynitro 9,0,2021-07-29T19:02:24Z
485,UgwOR0Zzb1IUHjq8_2F4AaABAg,How dare he make a book in response of 911 I mean what did they do crash a few planes into two buildings big deal Amarica had slaves over a 100 years ago!,Noah Sprague Studios,0,2021-07-29T19:02:12Z
486,UgxicWQ1FnafckV_3SZ4AaABAg,I wonder if they have meetings to decide who to cancel next,justmeok2,1,2021-07-29T19:01:50Z
