,id,comment,author,likecount,publishedAt
0,Ugzoo_58ATK2o_8MKMt4AaABAg,Johnny Depp is a wife beater . Eff him. Why would Amber Heard deserve backlash? She's the victim,MegaPodTastic,0,2020-11-10T20:49:15Z
1,UgyuTwDuRsYa0ssEhNR4AaABAg,"I've followed this a little throughout the past months and it's clear Amber's no innocent 'though it's difficult to assess at least for me from the outside looking in, who bears the weight of blame.  I think like most couples it's fault on both sides during a breakup.  I feel Johnny's been unfairly demonised in this situation.",vascoe myer,1,2020-11-10T19:00:15Z
2,Ugx0XmX6Otg44OD0Lml4AaABAg,"https://www.youtube.com/watch?v=XReXNry04ik&t=7s CONNECTON BETWEEN WARNER BROS AND THE SUN EXPOSED .
https://www.youtube.com/watch?v=lPkNBpe8JRo&t=4s CONNECTION BETWEEN THE JUDGE AND AMBER HEARD EXPOSED . #justiceforjohnnydepp",Maj,1,2020-11-10T02:40:35Z
3,UgxhMYQzYTQcDr1pvVt4AaABAg,The whole situation with Amber Heard and Johnny Depp is a HOT MESS! And it also shows the double standards when it comes to supporting male victims.,Kevin Jones,1,2020-11-09T22:43:23Z
