,id,comment,author,likecount,publishedAt
134,Ugx0GyuE2oaSkZEFqCB4AaABAg,"Bet she is regretting writing that article now, should have just taken the money and moved on lady. At this point I hope he gets everything, it would be absolutely horrible and would set such a horrible precedent if she get's away with this.",JellyBabie1984,0,2020-09-08T02:29:59Z
135,UgzhYV9Qi3Qn6YkBz0t4AaABAg,That's The Problem When You Lie You Have To Remember Exactly What The Lie Was....  And Who You Told It To!,Dawn McCarthy,0,2020-09-08T02:21:59Z
136,UgwIFu0gy6pmP8NVQUJ4AaABAg,"Thank you IO. Truth needs to get out , and you guys did an awsome job bringing it to the masses.♥️",Coucouu,0,2020-09-08T02:18:20Z
137,Ugz0wCVIO64HcA8MPzp4AaABAg,"It’s okay to not believe in something, but you don’t have to always berate it. Let me just say that I’m not very religious, but there is just so many kinds of ppl that watch this channel and you never really know if you could be offending some of your viewers that tune in to watch you and that like your content 🙂. Sorry if I am getting on anyone’s nerves with this comment...
It’s just, this is the 2nd time I’ve seen this host call a historical figure “an imaginary friend”.",Victoria Renee,19,2020-09-08T02:10:54Z
138,Ugw7dYA6j0Rw5Bmr_U14AaABAg,"HA! ""He'll quit and move on"" he's been after her for 10 years omg he's like a mentally unstable stalker, only reason people aren't calling him that is because he has money.",Maxine Mars,0,2020-09-08T01:31:06Z
139,UgxVa5wf261QoEIcwwZ4AaABAg,"Thank you for covering this. It's so important to shift the media conversation on Amber Heard.
She's not a victim; she's an abuser and a con-woman.",Breathe Beloved,6,2020-09-08T01:15:29Z
140,Ugx8pCOJK9D0jk725Xl4AaABAg,She's a compulsive liar and a narcissist,PureSparkles22,2,2020-09-08T01:11:29Z
141,UgwtWb1t6bpBkFlkNf94AaABAg,Not to mention when she was on the talk show if she had a broken rib she would be wincing when she laughed I think,Jennifer & Tylor Caneda,10,2020-09-08T01:09:16Z
142,Ugz9eXe0Qy99ge-7u5N4AaABAg,Amder heard yuh nasty 🤣🤣🤣🤣🤣🤣🤣🤣🤣🤣 funny as hell,Sammy28 mcintyre,0,2020-09-08T01:01:02Z
143,UgzD9HwL-W0loQDqv9V4AaABAg,The fact that Johnny had to be fired from his job and have his reputation torn down because of one lie and Amber's bs is unfair because Johnny obviously had nothing to do with all these allegations.,2E2_03 Chloe Sim,1,2020-09-08T00:45:43Z
144,UgznFw25FfXn8pllOGp4AaABAg,"Yeah, there were pictures of that turd and no way a yorkie made one that big.😂 #amberturd",Me,4,2020-09-08T00:40:29Z
145,UgzNnVTTG8PvGXON-bp4AaABAg,"Anger turd smh as the saying goes by a wise ol starfish from a place called bikini bottom. ""Liar liar plants for hire""","Well, well, well, how the turntables",1,2020-09-08T00:24:16Z
146,Ugxq78jTXGujWInkAhh4AaABAg,Sharting dogos,Karen Johnson,0,2020-09-08T00:13:34Z
147,UgzSNqIlE0ctw1mXnbt4AaABAg,I’ve been following this story of Amber and Johnny for months and I’m just wondering when they’re just gonna lock her up lmao,Serena Mighte,3,2020-09-08T00:12:55Z
148,UgynlBSdf69h2cf6Zc94AaABAg,"As an Aussie, I want her back here to face perjury charges!",Peta Bulmer,22,2020-09-08T00:06:10Z
149,UgxXF0cYuQi8EeQ7zZp4AaABAg,"I don't owe anybody anymore thanks to, *p  a  i  d t o b e h o m e .c o m*",Hanna Mckenzie,0,2020-09-08T00:04:20Z
150,UgxtdogHXfTGiiXfzVB4AaABAg,"Anytime I ever look at her all I can think about is her pooping on Johnny’s bed and The picture of it. 
She grosses me out so bad",A. Allison,35,2020-09-07T23:51:09Z
151,Ugy3mWOY0pz9NEvISvN4AaABAg,Johnny's comment replies made my day! 😂😭 love you Johnny 💙❤,Ali _hoochthepooch,0,2020-09-07T23:37:31Z
152,UgzPM4gpmQ4sPCy6whd4AaABAg,"6:23 ""Stop using your imaginary friend in the clouds to excuse your own personal actions"" SAVAGE!",paoolina blue,2,2020-09-07T23:33:59Z
153,UgwJS43AbayXGXloRS54AaABAg,I understand that everybody is entitled to their opinions but referring to our beliefs as “imaginary friend in the clouds” is seriously offensive,Mbalenhle Mogotsi,1,2020-09-07T23:23:44Z
154,UgyABojfXj82_utPuHh4AaABAg,"Hey Potato, it Smool-yeah (Dave Chappell forever messed this guys name up for me. He will forever be the french actor who isn't french named Smool-yeah.😂 edit: or was it Smool-yay.",Dizzy Ness,0,2020-09-07T23:23:42Z
155,UgybhgUhvjLEdBC99uh4AaABAg,Brock vegas?,J P,1,2020-09-07T23:17:41Z
156,UgwNgkL8cUtlPs-aW_R4AaABAg,"turd, you're not A-list celebrity, STOP THINKING YOURE ABOVE THE LAW.",Stefani Liu,1,2020-09-07T23:12:52Z
157,UgzGTJwGdF1czAMAnpB4AaABAg,Amber needs charges. No question.,Chantel Sanchez,2,2020-09-07T23:02:20Z
158,UgyL9aTxwATCKbQsK7Z4AaABAg,Kanye needs help in a serious way,Chantel Sanchez,0,2020-09-07T23:01:40Z
159,Ugyj142wB-fJ9aabQsZ4AaABAg,"Is it me, or is Amber’s lower lip naturally lopsided?",merdelune9,0,2020-09-07T23:00:31Z
160,UgyzCkywVhgeMIUuAPB4AaABAg,I just hope everyone realizes IO is most likely part of a content farm and the people we love are just employees .....😳,Cindygr8ce,0,2020-09-07T22:56:48Z
161,UgzxoN1MCP5POJ24ftl4AaABAg,Kanye will most likely quit and move on... ten years later?,A P,0,2020-09-07T22:50:27Z
162,Ugx7qLALz9AbeMOVqy94AaABAg,"If anyone needs a good 2020, it's Johnny. I hope he wins his libel trial 🤞 
Also, in the defamation case, she needs jail time 🤬",Renee Crockett,2,2020-09-07T22:20:55Z
163,UgxjSERvcdzu0B0GLPJ4AaABAg,"It's okay Amber, Australia doesn't want you here anyway, keep your crappy apology 😂",Janelle Elizabeth,1,2020-09-07T21:43:35Z
164,Ugxc1NWRKNT--SJ0WWZ4AaABAg,"Compulsive Liar
Abuser - Narcissistic - Nasty Talentless how many terrible qualities does this woman posses! Jeez",Age Of The Witch,0,2020-09-07T21:34:49Z
165,Ugwb2ATnJZO7TfeQNXt4AaABAg,Poor Johnny I remeber when everybody thought he was harming Amber and I didn't believe it 😭. I was jumping for joy when I found out Amber was lying 🥳,Eve,4,2020-09-07T21:22:06Z
166,UgymacuniQ6mH_-4hhl4AaABAg,Heard is just a hot steaming turd wrapped in a thin gold foil.,Doris Barkler,14,2020-09-07T21:13:26Z
167,UgzQh-mxvkjyr1gRB-p4AaABAg,My dude. Talk slooower,Ruby Quinn,0,2020-09-07T21:09:17Z
168,UgwOoG7PbtNcqIM6PkR4AaABAg,She needs to be put in prison. She has caused so much damage to already suffering DV victims and cares about nothing but herself,Hadria,1,2020-09-07T21:07:38Z
169,Ugzmrbk4aM29mGUmv894AaABAg,She tarnished johnny reputation and should be held accountable. She lied under oath which i thought in itself is a crime #justiceforjohnny,Stacyjo B,1,2020-09-07T21:00:55Z
170,Ugy2fGtv-XmeJCEzfC54AaABAg,The Cap Goddess,Cyber Justiciar,0,2020-09-07T20:56:46Z
171,UgwRhZjHk5Guh2t0DSx4AaABAg,"imaginary friend in the clouds"" well that hurt little bit ☹️🤨😪",Vision Wonken,10,2020-09-07T20:54:12Z
172,UgyjnHTAyO1e52zWdUt4AaABAg,Is her name even Amber Heard? 🤭🤥,The Magic Conch.,2,2020-09-07T20:51:14Z
173,UgwYb7rBvC57sUIIkgV4AaABAg,This woman is a straight crazy pathological liar. 💩head woman ...,Romeda Valera,0,2020-09-07T20:27:22Z
174,UgzJgnEMrw1R8_xtVpZ4AaABAg,"The day I see Amber Heard paying for her actions, will be the day I resort my faith in justice...

 well some of it.",fran ran pan,2,2020-09-07T20:03:27Z
175,Ugzx4EHGN_MHvT9tqgl4AaABAg,"Kanye doesn't know what taking responsibility is much less its meaning. I think he's obsessed with Taylor. Taylor girl, you may want to watch your back!!!",XZanayu,0,2020-09-07T20:00:20Z
176,UgyeQaRaG6h9_GBgXL14AaABAg,Can you please speak slowly. I can barely hear a single word,MsTecnofan,0,2020-09-07T19:57:30Z
177,UgyPwgCi6pcaskl9Yxl4AaABAg,i can’t stand her,Mercedes Bentley,1,2020-09-07T19:56:57Z
178,UgwzG6U-Tm8omBkmU7x4AaABAg,Mrs. Trump??  No 👎 one can lie more than he does.,It just me manning,0,2020-09-07T19:43:18Z
179,UgzqTJFkD8anuQx_dcJ4AaABAg,You know you kind of don't make sense. You're totally using Kanye West mental breakdown as an excuse to hate on God. The only reason Kanye West is saying these things because he is in fact mentally ill. So essentially you're making fun of him which you just told your viewers not to do,ireallydont know,10,2020-09-07T19:33:22Z
180,UgzOooLd3_ptQeKa1bB4AaABAg,Imagine Depp's patience when he needed to stand by her side and went through all those mess.... I would've left her long ago if I were him 🤷,The Black Baby Goat,43,2020-09-07T19:25:13Z
181,UgyzyDIx-tgPz0wE7oZ4AaABAg,you are not wearing black !!!!!! woooow,Lucia Galit Mendez,0,2020-09-07T19:18:59Z
182,UgxtXDb2A2x0NbHWmal4AaABAg,"What they need to do is just be done. Throw her lying conniving butt in prison. And make her be accountable for trying to ruin a innocent mans life, lying to the court to try and make herself look angelic and harmless. And just being a bad person all together. It is because of women like her that actual abused women don’t feel like people will believe them. What a horrible horrible person. #justiceforJohnny",Mary Allison,0,2020-09-07T19:11:21Z
183,UgxgCClMrCxSMJ7ZjdN4AaABAg,"She is making it so hard for actual victims to be believed. I hope she gets charged I know she wont actually spend time in jail because courts are pretty lenient with pretty, rich bitches. Though apparently she is counter suing Johnny because she might lose her part in Auquaman 2",Kat Lloyd,0,2020-09-07T19:09:52Z
184,UgxaBEU0KeP3rzpKyuR4AaABAg,I HATE cancel culture BUT Amber Turd deserves to be canceled,Chanel Cupcake,1,2020-09-07T19:08:23Z
185,UgzCPf20PCWBRXsA9Xl4AaABAg,AMBER DESTROYED JOHNNY,Rui Busto,0,2020-09-07T19:02:19Z
186,UgyPt3GSKB36DRt8SgZ4AaABAg,"If juicy smullet can go to jail for lying to police as black gay man, heard can get her ass to alcatraz for all i care lmao",Miss Lawless,0,2020-09-07T18:58:44Z
187,UgyPDbP61iGuplAn50p4AaABAg,#JusticeForJohnny 💙,Jessa Lou,2,2020-09-07T18:57:41Z
188,UgzFMrvzi-4i4hmstI94AaABAg,Me and my friends love the updates. Thank you 💕,Jasmine Dryer,0,2020-09-07T18:56:37Z
189,UgzKqxs_MYXKlsVkGTJ4AaABAg,And she wonders why people dislike her 🤔,Teresa Perez,1,2020-09-07T18:47:51Z
190,Ugyl9zuUDrlWAhC0b9R4AaABAg,Are we suprised she is a actor......,KIMBO LIMBO,0,2020-09-07T18:42:18Z
191,UgyTbWUiJjGdsKmoTc94AaABAg,"""Imaginary friend""....? ..lol I guess",Kassy Sanchez,2,2020-09-07T18:39:00Z
192,Ugzof6SNj5J_0gGV54R4AaABAg,"I truly believe Amber has some serious mental issues! Mental issues that go way deep down! She's extremely destructive towards everyone around her, especially towards those she supposedly loves! That's not normal and it certainly isn't healthy!",Amanda Cox,2,2020-09-07T18:31:12Z
193,UgyICS6Bv5joNN6wWQB4AaABAg,Do you know what- there are some people who actually believe in God and their faith is what gets them through.. so mocking people probably isn’t a great thing to do on the Internet. One man with a mental illness letting fame go to his head is one thing- but you’re actually offending whole people groups right now in the comment section of this video.,Nixijo Kenzi,13,2020-09-07T18:30:54Z
194,Ugzv_sm7qn_Zslh2lax4AaABAg,"Lol , are you really quoting Ghandi ?",Gwendolyn,0,2020-09-07T18:22:56Z
195,Ugz9JaPmiYL4h75OFI94AaABAg,"""Imaginary man in the clouds""? Well, that was disrespectful. 😐",RShipwash,23,2020-09-07T18:21:37Z
196,UgyfM4PYDlyHJB66g9N4AaABAg,Oh Johnny....being scandalous 😂😂 I love it. Don't mess with their imaginary friend in the clouds!,victoria tunney,0,2020-09-07T18:09:23Z
197,UgxojTZKPsKTJ__RpiR4AaABAg,What is wrong with this woman? 🤨😒,Lost N Sauced,1,2020-09-07T18:08:55Z
198,Ugz4XHxs0Gkxpw2E-0x4AaABAg,"Love the channel  Johnny, keep up the great work (God made me say this) lol",Lone Wolf UK,0,2020-09-07T18:02:08Z
199,UgxtIja_PalQ1SKcfdt4AaABAg,This could have been the top 150 times Amber Heard was caught lying.,Astrid J,65,2020-09-07T17:44:16Z
200,UgyymgwGoHpowSzz-LJ4AaABAg,"You can criticize the way people use religion to excuse bad/abhorent behavior. But saying ""imaginary friends in the clouds"" is disrespectful. Let people be religious if they want to.",Palm Spirit,9,2020-09-07T17:43:14Z
201,UgzwJyZgQHpyeE-w5vR4AaABAg,I really hate Amber heard she is a big Lier and she has done some evil things,sarah hilton,0,2020-09-07T17:40:10Z
202,UgzLamglfS42UGZOlkV4AaABAg,"Hey Amber Heard, why you always lyin'!? #JusticeForJohnny",fidielio,0,2020-09-07T17:31:29Z
203,UgyrVFTaz2V80CsQ9nB4AaABAg,Please BREATHE between words.,Pascale Nimuë,0,2020-09-07T17:30:15Z
204,UgyiEBCIjIqbmuAhAP14AaABAg,"Such a horrible person, who continues to act like she is an advocate for women’s and LGBT rights. She’s a complete psycho, and everyone in Hollywood needs to kick her to the curb.",Elle Wudds,0,2020-09-07T17:30:03Z
205,UgzK-WK__Oy2DNcKZoZ4AaABAg,Blows my mind that people can get caught in a lie and double down. 🙄,Megan Lynn,11,2020-09-07T17:28:59Z
206,UgyJnYkshNLig9KKQI94AaABAg,Hold this liar accountable she’s such trash. #justiceforjohnny.,Shelly Brown-sellers,0,2020-09-07T17:25:59Z
207,Ugw1WzVdDQNmIsZvdsR4AaABAg,Why tf is this so entertaning!?!?!?!??,🏳️‍🌈RayTheGay,0,2020-09-07T17:25:03Z
208,Ugz04KVxRU44ZEpAKa94AaABAg,So we can say the name of AH now? Already get used to treat her like Voldemort,Lorenzo,15,2020-09-07T17:24:01Z
209,UgxMwoO_UeqL8i6RW0N4AaABAg,"if she's proven guilty, she needs to go to jail",Dottie Ndots,230,2020-09-07T17:14:45Z
210,Ugw-5t0X1NRXEF2b5ih4AaABAg,Is there such thing as toxic personality disorder?,Sky Love,1,2020-09-07T17:13:52Z
211,UgwF_bl5uQDnXUWoqul4AaABAg,"I may get a lot of crap for saying this but after this whole situation, I don’t think it’s about believing all victims, because as we can see, not very accuser is innocent. I think what we should do is take ALL allegations SERIOUSLY, and investigate thoroughly to find the truth, whatever that may be. Had whomever she told her allegations to just took them seriously and investigated, they probably would have seen early on that she is not telling the truth. We can’t forget Due Process. Instead of making immediate rash decisions, like firing Johnny immediately, maybe we should take the time more to find the truth. Lives and careers are being either destroyed or severely damaged because of lack of due process.",The Ancient Lantern,0,2020-09-07T17:13:01Z
212,Ugz4yNR09JqMXCzu6Jl4AaABAg,Em what Depp saw in her? 😂,Cath (Catastropheshe),0,2020-09-07T17:12:08Z
213,UgyROwiVhBlp6gUoj5F4AaABAg,Heard never filed a police report. The cops even testified she was uncooperative and uninjured. she did file for a restraining order which was dropped three months later.,BetweenTheRaindrops,0,2020-09-07T17:06:12Z
214,UgwCt_zUipaIRYsnoc14AaABAg,-1:12 💯 💯 you said it perfectly,Lucy 21,0,2020-09-07T17:04:24Z
215,Ugzp_4kQZgqNdKXhNh14AaABAg,I think it would be more informative to list the Top 5 Times Amber Heard Was Caught Telling the Truth...if you guys could find 5...,Mary Turpel,7,2020-09-07T17:04:03Z
216,Ugyt-tOBl_0ubUHZfmt4AaABAg,Imagine Kanye was watching 👀🤣,Cool & collected,0,2020-09-07T17:00:43Z
217,UgxhaBBQYVMu9ZYgyAB4AaABAg,"Johnny ,    ""This lady"" (Ms.Amber Heard), suffers from a mental illness and was told by GOD to lie lie lie etc etc",Voo Zoo,2,2020-09-07T16:58:42Z
218,UgxZF30VhSRj6oEwDcd4AaABAg,"@5:00 - YES!!! Preach it, sir!",Chadimous,1,2020-09-07T16:58:34Z
219,UgwkY3xwOB2X_rH5PWJ4AaABAg,# justice for Johnny Depp  # I hate the Turd  # cancel Amber Turd # I'm not a bot.,Brian McKenna,1,2020-09-07T16:55:15Z
220,Ugy3-f8Wlnp6Q7UTcVR4AaABAg,I have never hated anyone as much as I hate this woman.,Jess G,0,2020-09-07T16:54:44Z
221,UgwrID-6GjuWiOXjLu94AaABAg,"""Imaginary friend in the clouds"", lol",Cyn The Knitter,0,2020-09-07T16:54:34Z
222,UgwfF1GysZMPgQnVxA54AaABAg,"Johnny ,    ""This lady"" (Ms.Amber Heard) is full of $#!+. . . . . . . . LITERALLY !!!!!!!!!!!",Voo Zoo,0,2020-09-07T16:54:24Z
223,UgybvoRc9qli_k0IW7h4AaABAg,"@johnnyrogers....are we being a hater much?.. this episode isn't even on Kanye... the misunderstood always gets ""labeled""..just because you simpletons don't understand him, doesn't take away from his brilliance.. instead of looking down on how he's ""portrayed"" in the media, you all should go do your own research on this man..he's phukin revolutionary..#iPhucksWitKanye",Jean McKee,0,2020-09-07T16:53:24Z
224,UgxfzGdqCarbk4t7keR4AaABAg,Hey can you guys watch my video and comment what y'all think ☺️?,Diiorrdoll,0,2020-09-07T16:50:12Z
225,UgxOSoQ3-z08onWAAON4AaABAg,"TW// SU!C!DE 

hey! please cover the story of the man who sh0t himself in his head during a tiktok live. it’s very gruesome to watch, and it would help the ones who haven’t watched to beware and save themselves from unintentionally clicking on that vid is being posted on social medias without any warning. thanks",deepraj,0,2020-09-07T16:49:28Z
226,Ugzn3wsPovRzicXgPLx4AaABAg,"What’s crazier, she’s beautiful so someone else will fall victim to her. 🙄🤦🏻‍♂️",Karissa Davis,2,2020-09-07T16:47:46Z
227,UgxxQbT7wmQIHpMpp4p4AaABAg,For some reason when I heard Johnny I got excited because I haven’t watched one of his videos in a while-,Pedal,1,2020-09-07T16:44:17Z
228,UgwLTpjJXQhqsMpekkB4AaABAg,"You don’t have to be great to start, but you have to start to be great.

-The Shades",Shazistic,0,2020-09-07T16:43:54Z
229,UgwNnviYFDrFcoiLQSV4AaABAg,Hi Chris. 👋🏻,Michele Womack,0,2020-09-07T16:43:54Z
230,Ugwv8p3_WnTIAg6qH7R4AaABAg,Thank you to all io hosts and editors. 👍🏻🏴‍☠️🥓,Michele Womack,1,2020-09-07T16:43:23Z
231,UgzSGOVJi7aoJb5asOh4AaABAg,Only 5?🤣,Sexymaya Green,1,2020-09-07T16:38:07Z
232,Ugxo_h3XJS5lP0-4aKN4AaABAg,This is why she is not to be trusted she is a massive liar and jerk also she will lose the case against Johnny I’m on Johnny side all the way,jacob farr,0,2020-09-07T16:36:11Z
233,Ugye4KPBZ6OEJMPsy2l4AaABAg,I hate cancel culture but amber heard DESERVES to be cancelled.,ONE POTATO TWO POTATO,157,2020-09-07T16:23:49Z
234,Ugx5XqCgicDUIFd4rs14AaABAg,Justice for Johnny!,3 Sisters& Wine,3,2020-09-07T16:22:16Z
235,Ugxfx0ifriKSKa5l5fB4AaABAg,"sky-daddy free zone, no one to blame but yourself xD",Lara Will,0,2020-09-07T16:21:23Z
236,UgzVoPro3acuB-xYeed4AaABAg,Why is she not cancelled yet?????,Griffin33 3,1,2020-09-07T16:20:52Z
237,UgyRkybzFGnZHMhSsTd4AaABAg,"he only got the movie roles cause he had good friends to help him out for years he didn't have any roles and aquaman earned millions. his name was destroyed for something he didnt do while she got sponsored by l'oreal and went on womens marches where she spoke as a guest speaker against abuse while being a abuser. the news barely mentions the audio tapes or how he was abused i had to find out on youtube which most ppl probably did they don't want to show him as innocent. he isn't the first man (ive heard of at least 50 different stories of something similar happening and some were lucky if they found the proof others their life was ruined even after proof was found and some killed themselves from the hate they got. to go through something like this cause there will always be ppl to take advantage of the system. and it isn't right for men or women, its not right for the ppl actually abused and it isn't right for men being portrayed as trash or all r*pist or abusers. yes there are bad men but there are also bad women there will always be bad ppl but i believe a majority of ppl are good. a huge majority of men hate the men that do such a thing the fact that even in prison they make it a living hell for them shows that even some of the darkest ppl dont agree with it. and i know as a man most wouldn't listen to me cause theyd think im sometime of women hater for saying these things but in truth i dont believe in feminism anymore the more i heard men are trash and all the misandry being confused for feminism i decided to be a equalist. and for those thinking i wouldn't understand i am the victim of abuse, for most of my life i was severly abused by my mother. my father wanted to help but she had parental rights if he wasn't in my life i probably would have killed myself. but he made me have hope that things would get better. thats why i don't like when men are only portrayed as bad when there are a lot good hard working men that just want a good life and don't want to harm anyone. ( and i know its always better to be cautious) if anyone reads this thank you sorry for the running sentences and how long it is.",Thee BattleMedic,25,2020-09-07T16:19:07Z
238,UgwRHjjr814X0w0zdVl4AaABAg,Blows my mind that she is now suing him on claims that he is making all the petitions to have her removed from Aqua Man and L’Oréal campaigns. She is so delusional that she can’t even comprehend that no one believes her stories and no one wants to support her. It’s truly amazing,alexandra,125,2020-09-07T16:17:27Z
239,Ugx9dOAOMdMEGp6jC394AaABAg,"What makes me lose my mind is that the mainstream media and a few feminists insist on defending this woman as if her story made any kind of sense. What they're doing to Johnny should really be punished criminally. Unfortunately, he can't pursue this venue anymore.",Princess Consuela Bananahammock,0,2020-09-07T16:13:32Z
240,Ugx6OpP9bBJyZLopWDl4AaABAg,K💩REN,LuvJoyMuzik,1,2020-09-07T16:12:59Z
241,Ugx14qNm56ZuowRaDhN4AaABAg,THANK YOU FOR REPORTING ON THIS!!,Lara Will,9,2020-09-07T16:12:20Z
242,UgwbwXze3P-6iVT_vzt4AaABAg,She’s sad and pathetic,xx_Austin is thicc emo potato_xx,1,2020-09-07T16:10:57Z
243,Ugwrwctz-TNz25G3_IB4AaABAg,Oh tea,MooMoo But On Icecream,1,2020-09-07T16:10:16Z
244,UgwuR4a07wVWERt9aA14AaABAg,These liars need to do JAIL TIME PERIOD.,Modern GEAIsha Music,0,2020-09-07T16:08:47Z
245,UgyQUhvsVshFGgVyLCJ4AaABAg,"99% won’t see this but 1%







Have a nice day and remember your beautiful ❤️🧡💛💚💙💜💗",Subbing anyone who subs to me,97,2020-09-07T16:05:36Z
246,Ugz8VjJ3SExN7V1NO0V4AaABAg,I hope she goes to jail!,DirectorG,0,2020-09-07T16:04:53Z
247,Ugznsw4D3LQSVuZgpEN4AaABAg,She should be jailed for what she done.  But it wont happen.,Lisa Ibrahim,3,2020-09-07T16:04:41Z
248,Ugwsw8xKstM7NL9cASV4AaABAg,Why did you stop at 5?,Sam Charles,1,2020-09-07T16:03:38Z
249,UgyS3d76LDF9fuv8o3p4AaABAg,Everyone should share this,Brayan Lliguicota,0,2020-09-07T16:00:32Z
250,UgyTn0WtNwIEQbh7A_54AaABAg,She knows damn well that 💩 was too big to be from those little dogs.  🤦🏽‍♀️ She's an idiot.,India Shanté,0,2020-09-07T15:58:53Z
251,Ugy21KQf1LOAtnN6X3t4AaABAg,Just give this video to court every time she tries to do something,Dio m,30,2020-09-07T15:57:17Z
252,UgyKodZ5O3lSarvqTj54AaABAg,Johnny honestly deserves better.,Kgomotso M,0,2020-09-07T15:55:24Z
253,Ugwai8i5GEfszUBbStR4AaABAg,Amber Turd will live on in infamy,theotherkat722,1,2020-09-07T15:55:11Z
254,UgwQ85K2Rvghi5pzbFd4AaABAg,"I found io
I watched io
I liked io
I fell in love with io
Now I wanna work at io",NotTaniko,0,2020-09-07T15:54:13Z
255,UgyYhSg_sXDR5-2ewUJ4AaABAg,"Yes! A thousand times YES!!! Cannot like this video enough. Also worth noting that the make up artist who did Amber's make up before James Cordon's show actually testified she saw her face bare and there was absolutely no sign of any injury or swelling at all. She did the make up without Amber showing pain at any point. Also as the footage shows she is actually drawing attention to her face which one hiding domestic violence would certainly not do. Perjury is a serious crime and she needs some sort of consequence to finally make her realise she is not above the law. Bring Miss Turd back down to earth. As beautiful as she is, no one looks cute squatting for a poop on a bed. Seriously gross!",Lilly Jacob,0,2020-09-07T15:53:46Z
256,Ugz8QyVAJ9W9bL4ZO-J4AaABAg,Yeah.... went a little too far at the end there.,Alec Snead,8,2020-09-07T15:50:02Z
257,UgzSFRlqYdEcOT5Z9Mh4AaABAg,"Ah yes, pretty privilege.

Also, if you love Amber Turd, how? Just how?",Leslie Smith,4,2020-09-07T15:49:36Z
258,Ugwy5qfJ707_22UinOJ4AaABAg,God told me I could slap you,365retrofuture,3,2020-09-07T15:46:28Z
259,UgyWeKxYPm2gNqUQcCh4AaABAg,This woman is TOXIC to the core i hope JD gets his reputation restored and AH slander and character assassination of him is discredited,OBTrice,0,2020-09-07T15:40:34Z
260,UgwLB1eeRiIA5UCw1ct4AaABAg,“Amber Turd wants to be heard and so she says stuff that’s completely absurd!” One of my favorite nursery rhyme’s!,The4Tier Bridge,247,2020-09-07T15:40:00Z
261,Ugxmuo5f-jXLnZoXf7J4AaABAg,Lol,Kimberley Gray1990,0,2020-09-07T15:39:39Z
262,Ugy6nsJ40FTNkfvQyZp4AaABAg,Second biggest cop out the devil made me do it. SMH.,serena Norris,0,2020-09-07T15:37:21Z
263,Ugzb7-Ta-eSDZhfBW6N4AaABAg,Alternative title: Top 5 time Amber Turd was caught lying.,Sierra Hestum,136,2020-09-07T15:36:53Z
264,Ugyc_yaDjRS6Re_km554AaABAg,"Just listen to Eminem's Kings Never Die that song describes life as a whole, and I'll take that over the negativity and overwhelming week that I had recently any day the week.",Bookish Raider,0,2020-09-07T15:33:44Z
265,UgzNQAJL5sXm0GANh8x4AaABAg,"I don’t think Johnny was perfect and might very well have been abusive verbally or mentally, but Amber has lied about so much who can believe anything she says? It’s women like her that make it so difficult for women who have been abused and try to speak up about it.",J Marshal,3,2020-09-07T15:32:51Z
266,UgzFXi4UhqCCfczQy7x4AaABAg,"She ain't a lady, she's a sociopathic-subhuman with a pretty face 😅",MasoKitsu,1,2020-09-07T15:32:35Z
267,UgzfaSxsBYYeQ_ZAnqR4AaABAg,"""Ambers"" are the millennial version of ""Karens"" perhaps even more dangerous, they use photoshop  to alter reality...",Elle Hoods,57,2020-09-07T15:32:08Z
268,Ugxz6cydJkxLPArlnmJ4AaABAg,I love your shirt!,face plant,1,2020-09-07T15:28:30Z
269,UgwPlwOL7uo2j7Ps4Dx4AaABAg,"I don't appreciate you referring to God as an ""imaginary friend in the clouds"" but I def see your point that people need to hold themselves accountable for the decisions that they make.",Obieze Eze,20,2020-09-07T15:28:25Z
