,id,comment,author,likecount,publishedAt
0,UgwAjufBP2HgXsNCZCl4AaABAg,#fire amber heard,Cburke502,0,2021-07-12T08:44:38Z
1,UgzdwSwNWXzbEjrMDgx4AaABAg,I don’t like your video. There are too many photos Of the most hated womab of the movie world. Next,Cataleya JR.,0,2021-07-11T05:19:14Z
2,UgzaO0tOYmYdURQ-C0p4AaABAg,Wont watch it!.,Stormer the misfits,2,2021-07-11T03:34:49Z
3,Ugzu91PZ3bDr4WP7QCx4AaABAg,How the studio will work around the no one is going to buy tickets to the theaters is they’ll release it on HBO or something like that and that’s how they’ll make their money and get ratings. Such BS! Justice for Johnny!!,Jennifer Lauben,4,2021-07-11T01:30:45Z
4,UgwXJuPqJnYraZYDa-l4AaABAg,I love Jason Momoa. I will NOT go to AQUAMAN 2. and i always go to these silly kind of mivies. Love those movies but will miss it.,Laura Rooney,6,2021-07-11T01:08:13Z
