,parentId,authorDisplayName,replyComment,publishedAt,likeCount
0,UgzFS8KsW8HyWUIv0G54AaABAg,Stephanie Corcoran,"Thank you so much Shelby ""Soups"" 😘",2021-06-24T18:09:31Z,0
1,UgzFS8KsW8HyWUIv0G54AaABAg,Doctor Soup,Hey Stephanie! Here you are! https://youtube.com/c/TefiShow,2021-06-24T16:47:00Z,1
2,UgzJET47szqjQsb6iJh4AaABAg,Doctor Soup,I second that,2021-06-15T18:33:31Z,0
3,UgyZ6iQFsXKKxCuP3Wt4AaABAg,Doctor Soup,I am completely fine with that.,2021-06-15T03:11:07Z,0
4,UgzY973kPgnbZyTF0SF4AaABAg,Doctor Soup,Thanks so much for watching!!!! So glad to have another Katina here!,2021-06-15T18:34:07Z,0
5,Ugwne9u9BYO9x_pLI5Z4AaABAg,Doctor Soup,Oh for sure. All of that is BS.,2021-06-15T18:34:26Z,0
6,UgyBvv6CbzKQcoNFqwJ4AaABAg,Deborah Mcgee,Don’t like Jason  something about him I can’t put my finger on so I’m not worried about seeing it   I didn’t see the first one anyway so no loss to me. I have been so mad about what happened to Johnny that my children and grandchildren won’t be going to see it because they think it’s very unfair,2021-06-15T21:10:42Z,5
7,Ugyrdt3Xd6H-AaPcP254AaABAg,Doctor Soup,thanks Carla!,2021-06-14T14:51:21Z,0
8,UgxMP2JaM8xnrN8lBDt4AaABAg,Doctor Soup,"Hi Laura. At the time Heard was hired, the amount of evidence against her, was not as clear as it is now. 
As far as her getting fired, it’s possible he is unable to make that decision as well. Thanks for the comment! ❤️",2021-06-14T14:50:38Z,2
9,Ugx5H52UrRqdG_pTsmV4AaABAg,Jennifer MARA,*ago,2021-06-13T15:13:28Z,1
10,Ugx5H52UrRqdG_pTsmV4AaABAg,Jennifer MARA,He's on her side though. He showed her support like 2 months,2021-06-13T15:13:16Z,2
11,Ugx6iBJc9TwJYKzsE7V4AaABAg,Doctor Soup,I agree with you Christine. I would like to believe that he is a good person and likely doesn’t have a hand in firing her.,2021-06-14T14:48:56Z,4
12,Ugxqx-6p7mCwU-nDnEh4AaABAg,whatsup who,"she ruined my movie btw, the zombieland, all the movies i enjoyed watching, with super man, etc.",2021-06-13T06:22:11Z,0
13,Ugw8_OobMahqSYGIOBh4AaABAg,Doctor Soup,No worries Sabine!,2021-06-14T17:39:24Z,0
14,Ugz8pkYiRk1E1iq-F7R4AaABAg,How Are you,TEFI,2021-06-13T08:07:30Z,0
15,Ugw5vzpJTGCvItWpiHt4AaABAg,Linda Duvenage,i think elon pay them,2021-06-13T04:50:43Z,3
16,Ugym2xKJPstv3UpHECx4AaABAg,Doctor Soup,Same here,2021-06-14T14:51:11Z,1
17,UgwoSqq2RMc5KcmiRsV4AaABAg,stealth women,"don't care for jason either. he , turdette, musky balls can all play together",2021-06-14T04:12:22Z,1
18,UgwoSqq2RMc5KcmiRsV4AaABAg,Maria Hernandez,😆,2021-06-13T04:47:02Z,0
19,UgxOTFDJviKgUP4NB-h4AaABAg,Deborah Mcgee,@Marianne Lloyd believe it or not I didn’t know who he was till all this happened. But when I saw her with him I said he must be rich because he ain’t no Johnny   I wouldn’t give Johnny’s little finger for all of Elon’s money,2021-06-15T20:59:24Z,0
20,UgxOTFDJviKgUP4NB-h4AaABAg,Deborah Mcgee,@Kim Coyle 😂🤣😂,2021-06-15T20:52:09Z,0
21,UgxOTFDJviKgUP4NB-h4AaABAg,Spamachu Chan,"@Kim Coyle I still stand by the rocket ship is free to return, so long as the ship left EM and AH on Mars 🤣. Like the item can return without the people. Hell the rocket could bring back aliens, so long as it left EM and AH, I couldn't care.",2021-06-15T12:59:24Z,1
22,UgxOTFDJviKgUP4NB-h4AaABAg,stealth women,yes i agree he would pay money out of his pocket just to boost ratings..what a simp..'douchebag,2021-06-14T04:09:29Z,2
23,UgxOTFDJviKgUP4NB-h4AaABAg,Kim Coyle,"He would, he wants to be the King of Mars, take her with you Elon, rule together and may your rocket break when you land.",2021-06-13T15:59:47Z,5
24,Ugy9mYlmpBDL96ENOuF4AaABAg,Jennifer MARA,"@bruceleena for real though 😂 just like at work. Have to act ""professional"" even with the people I hate the most lool. But when work is over, my professional side is over too and that person can go to hell 😂 that's why I didn't understand when he showed her support. Musk is 100% scared of her. Don't forget that she still the embryos that he sued her for. If he doesn't act right, boom a baby. And he'll be attach to her for life. Plus, she has a bless to always record people without their consent. I'm sure she got dirt on him 💯",2021-06-13T22:22:11Z,0
25,Ugy9mYlmpBDL96ENOuF4AaABAg,bruceleena,"Yeah.  I personally if I was working with Amber. I would stear away as much from her drama and treat her as a professional actress. Then when I get home,  I can talk to my mate about all the crazy things she does lol.  I wouldn't want to get sucked up into this mess.  Look at Elon, the guy seems scared of her and staying as far away as he can.  He's next after Johnny.  I weep for the next guy",2021-06-13T22:13:13Z,1
26,Ugy9mYlmpBDL96ENOuF4AaABAg,Jennifer MARA,"@bruceleena you're right on that one but another thing is that the other side of the ""truth"" is outta there. Even the court documents. I'm not saying that they should take time to look at it because they don't have too. All I say is that is that they shouldn't blindly ""defend"" her when they don't even wanna look at both sides of the story",2021-06-13T21:55:03Z,1
27,Ugy9mYlmpBDL96ENOuF4AaABAg,bruceleena,"Well, I don't see it that c way.  I see that she's charming and can get people around her believe her BS. Maybe people don't want to say anything because they just want to work.  Her contract must be pretty good and WB can't get her out of it. I don't want to assume,  because he's only hearing one side of the story",2021-06-13T21:24:08Z,1
28,Ugy9mYlmpBDL96ENOuF4AaABAg,Jennifer MARA,"Don't feel bad for the lead role, he showed her support like 2 months ago when she announced that she was ""back"" in Aquaman 2. He's abuser enabler",2021-06-13T15:12:35Z,2
29,UgxYxA_shUR_VWHuhNF4AaABAg,M P,@Josette Berryhill who needs James Franco? He's no use to anyone. I think you maybe meant she 'had' him.,2021-06-29T07:06:42Z,0
30,UgxYxA_shUR_VWHuhNF4AaABAg,Josette Berryhill,Cburke502 I wanted to say he found her in the gutter but she does have James Franco and Elon and a few others,2021-06-29T01:30:29Z,0
31,UgxYxA_shUR_VWHuhNF4AaABAg,Josette Berryhill,No johnny doesn't need her money plus she is servicing a few very rich guys.  Why give her any plubisity  fire her,2021-06-29T01:27:40Z,0
32,UgxYxA_shUR_VWHuhNF4AaABAg,Cburke502,Lol. Thats my thought too.  Elon musk will probably pick her up out of the gutter,2021-06-28T22:38:59Z,0
33,UgxYxA_shUR_VWHuhNF4AaABAg,M P,That's what Elon for. Nope fire her.,2021-06-13T22:18:25Z,7
34,UgzFnFtz7phImbY-Ojt4AaABAg,Elizabeth Briggs,I will not watch anything shes in nor will I use L’Oréal products until she done. I use oil of Olay instead. People should give it a try and it’s a lot cheaper. So get her out of L’Oréal then people will return,2021-06-16T16:55:55Z,2
35,UgzFnFtz7phImbY-Ojt4AaABAg,Lady MF Unicorn,"I didn't know who she was until the divorce. I even watched her movies. Lol 
I knew he was married I just didn't like it. So I didnt look for his wife. Lol",2021-06-15T14:20:57Z,2
36,UgzFnFtz7phImbY-Ojt4AaABAg,bdhu2001,"I had no idea of how she looked until all this press.  Even with this, I have to have a caption to realize who she is.",2021-06-15T12:03:26Z,5
37,UgyPboNIJfv-Yd2BY6p4AaABAg,Julissa Renteria,His one of them,2021-06-13T13:39:24Z,3
38,UgyPboNIJfv-Yd2BY6p4AaABAg,Susan Mcknight,Elon is the reason That's why she's so confident too,2021-06-13T07:47:18Z,5
39,UgyPboNIJfv-Yd2BY6p4AaABAg,Julissa Renteria,"The fact that the ACLU' is backing her up makes me suspect that their is also very powerful people backing them up I'm sure they have connections to producers and what not, my guess",2021-06-13T04:07:06Z,6
40,UgxCV8r96W7E8rYsBgt4AaABAg,Theia_Loki,At least we're not short on chairs.,2021-06-14T02:51:37Z,0
41,UgxCV8r96W7E8rYsBgt4AaABAg,costenita soi,😂😂😂😂,2021-06-13T05:59:58Z,0
42,UgxCV8r96W7E8rYsBgt4AaABAg,"Well, well, well, how the turntables",🤣🤣🤣🤣🤣,2021-06-13T01:12:16Z,1
43,UgxJ-X84opTb_i8KVnJ4AaABAg,tabeth mutingwende,Exactly,2021-06-14T06:42:44Z,1
44,UgxJ-X84opTb_i8KVnJ4AaABAg,Scout Princess,Yeah,2021-06-13T11:04:04Z,0
45,UgzO0Ae-W_lilgtmNTx4AaABAg,Kim Coyle,"Yeah is the oldest trade-in the world and I'm not talking about a nun!:At least the same principle, instead of cash, she asks for a part in a movie..",2021-06-13T16:24:00Z,4
