,id,comment,author,likecount,publishedAt
204,UgxrK2hLwIjQdy_HRm14AaABAg,"I’m slightly disappointed. I was hoping Kaplan was going to go down with Amber. These people are all terrible. Willing at any moment to throw each other under the bus to save themself. Albeit small, this is a victory for now so I’ll take it.",Capt. Obvious,25,2020-06-15T15:17:49Z
205,UgybjpTblXaHQEWjbP94AaABAg,I’m gonna grab some popcorns and watch how the ship sinks. Gotta love how there was a “memorium” created for this.,Drake Lim,11,2020-06-15T15:16:43Z
206,Ugz3JKeuZYpy-34WN194AaABAg,Wat a bit of news great vid man,Kenny Riley,1,2020-06-15T15:14:30Z
207,UgwgYw7c_82rnZ8qDDN4AaABAg,I think just losing will cause her narc head to pop off...,Joanna Kirkwood,6,2020-06-15T15:12:51Z
208,Ugz92tb9wy-A0aENmxJ4AaABAg,😂 😂 😂 This is such good news. Amber Turd needs to just say she's guilty for lieing and trying to ruin Johnny's name. Yes!!! 😂 😂,Kelly,1,2020-06-15T15:10:34Z
209,UgycUJPIYGCbn9dPZ_14AaABAg,YES! I don't think lawyers can make statements about a client's guilt or innocence. The only thing AH has going for her is Elon Musk. He has a new family so he may distance himself too...to bad witch maybe when she's in prison L’Oreal will make her a new fragrance ”Douche L’Orange”,Sandra Stone,7,2020-06-15T15:08:10Z
210,Ugzd_noty6whYj6MC-d4AaABAg,Stay calm for now. May not be what it seems.,Katherine Lange,1,2020-06-15T15:07:02Z
211,UgwX39KZOZLZ94YOY0p4AaABAg,"this is a dangerous move on the lawyer. Kaplan can lose not only her job, but also her ability to practice law. Abandoning a case or client midway, is a disbarrable offense.",Orange Hat Reviews,2,2020-06-15T15:05:35Z
212,Ugw62bJsgsLvPbwLAbJ4AaABAg,"She just as likely left because Heard fired her. She can’t speak about her reasonings. If Heard has any brains, she knows firing this attorney is the smartest move she can make.",Kim Whitehead,0,2020-06-15T15:05:33Z
213,Ugy-riR-1XuYIM-8JKp4AaABAg,Keep up the good work EH - appreciate your time & effort.,D. Pensak,1,2020-06-15T15:04:51Z
214,Ugw0prySEenMdYiweKp4AaABAg,is AH still alive??!!,Liberam Zelic,0,2020-06-15T15:04:06Z
215,UgzKAuJFM8dcm1Fw1FF4AaABAg,Elon stopped paying Kaplan’s bill for Heard ?,Ride or Dis,52,2020-06-15T14:57:42Z
216,Ugw2NtiB-TIDHNLhysN4AaABAg,"With my experience with attorneys. Whenever one request to be removed from the case, its because they feel there's no case or its a weak case. It would be a waste of said lawyers time and resources to continue. So my guess is, this just proves AH doesn't  have a leg to stand on.",Shelly Hebert,10,2020-06-15T14:56:00Z
217,UgwxGbi11omJ8N7uThJ4AaABAg,Looks like her luck is running out...🤭,Seas _Wallace,7,2020-06-15T14:52:28Z
218,UgwEwxor31h1nymDdS54AaABAg,Best news in weeks,Rose W,1,2020-06-15T14:51:30Z
219,Ugy99IjOzNIs0zpEo4t4AaABAg,"My birthday is the 27th, but this news made me feel like its today!
Thank you EH!",Jessica,10,2020-06-15T14:48:53Z
220,UgyApI_sFQsX5nw3x154AaABAg,All the people who have gone this far to defend her have to make a decision soon. They will have to choose between dogmatic support for an abuser and saving their own reputations. I think the cowards will drop Amber like a hot turd.,Kevin Gault,1,2020-06-15T14:48:14Z
221,UgwgcUH31xAYXaP2dTV4AaABAg,"Thanks for covering this, seems like genuinely good news. If her lawyer actually decided to take her leave before the final show-down in court it probably is a strong hint that Johnny (and therefore justice, in this case) will win. Awesome! Edit: And if the reasoning for her leave is as you quoted at the beginning it is almost 100% sure that things will be right in the end, for once.",MournfulDust,2,2020-06-15T14:45:37Z
222,UgyYmUhdFLuFyynamjx4AaABAg,"In the words of Captain Ginyu from Dragon Ball Z: “I shall now initiate, the DANCE OF JOY!”

Great video as always sir. 👍🏼",Mathew Majo,62,2020-06-15T14:43:15Z
223,Ugx3tzRZdksm-6Q9cLp4AaABAg,She will be punished sooner or later. Weinstein went to jail for the stuff he had done ages ago. The evidence against Heard is overwhelming. Once this idiotic time of SJWs is over she will get what she deserves.,Lily K,48,2020-06-15T14:42:43Z
224,UgwCVKWYKYMEzALIPxt4AaABAg,I wonder if it has anything to do with the charity money being in question? I mean aside from all of the other obvious reasons lol,Oh it's just me,4,2020-06-15T14:41:17Z
225,Ugx8YJ3coE_3fxJTycB4AaABAg,Yes! #justiceforjohnnydepp,Venom Neff,0,2020-06-15T14:40:24Z
226,UgwoxVwabbBdhfCVrzB4AaABAg,This is awesome news 👏👏👏👏👏,Renee Crockett,2,2020-06-15T14:39:56Z
227,Ugxm1USn9XiTW24gvw54AaABAg,"JPJ quoting you ""Yes... cant get better than that ""  This is serious bad news for her...",Guy Mercier,6,2020-06-15T14:38:25Z
228,Ugx4Oec5QEnsNy9_YRN4AaABAg,Great content as always. Amber Heard keeps losing people on her side. It says a lot when someone like Kaplan doesn't want to jump ship.,Lauren Rhoads,12,2020-06-15T14:32:16Z
229,Ugz3lVSCVbrKH486sR54AaABAg,This video just made my day. I feel like I can be productive now. Enjoy your home made bread behind bars Amber.,Ya Boy Gary,3,2020-06-15T14:31:55Z
230,UgzI0Rnfp0NnEaJVFlF4AaABAg,"As much as I want Amber’s case to be destroyed, it isn’t the case yet. It’s a setback, but unfortunately someone could take up her case still. 

Hopefully, no one else does and she suffers the consequences for lying and trying to destroy someone that loved her unconditionally.",Katayi Kaskas,55,2020-06-15T14:31:28Z
231,UgweVWLhGa8N33LZVZt4AaABAg,"Wow, just wow.",Zoë Way,1,2020-06-15T14:29:47Z
232,UgwzAGl-Elt5J6-2ZIh4AaABAg,This is also part of her master plan. 😂,Suraya Roos,1,2020-06-15T14:29:36Z
233,UgzL_cmSFl1gsdUwAAh4AaABAg,"Can't watch this until ive made a brew, 1 sec lolololol i need the tea",T4TWO,1,2020-06-15T14:29:25Z
234,UgwfChaK7gducnY4y_54AaABAg,"Hi Jon I Have Listened
Still Subscribed
Like button Illuminated !!!!!!!
I Don't Think Mr. King will Care that she lost her Lawyer.
And for Amber We all see that truth might prevail as the walls close in and her charity RUNS OUT.!!!!",yellow beard james gibson,0,2020-06-15T14:28:16Z
235,Ugxkdkh-7r-n3Hu__eJ4AaABAg,Damn,Ashlie s. Christie,1,2020-06-15T14:27:38Z
236,UgxEv3aYC5xwiRfcbUZ4AaABAg,AH is sunk. Slam dunk for Team Johnny.,H. Borter,41,2020-06-15T14:26:26Z
237,UgwUOXbfD5xR6Dyyp7R4AaABAg,"HMM????    Life does return to you what you reap.....I think the heat on twitter,,,,,and instagram was way too much for her,,,she saw where the case was going,,,she knew AMBER was making up her issues,,,,,,& an attorney of a high profile case like this does not want her name attached to the losing side,,,,,Just got too much for her,,,,,KAPLAN knows exactly the outcome of this case,,,,,,,,Amber is paying a high price for her actions,,,,and I will say this until I die,,,IF she did not want to be married to JOHNNY anymore,,,,,,why did she not just walk away,.....file for divorce,,,,and go,,,,, I will never get her ""OUT THE DOOR"" torture method,,,,,,& she truly thought JOHNNY was going to roll over,,,& take it all,,,,thats what a narcissist,,,she is....SHe definitely,,,more than anyone I have seen ,,has LOVE FOR SELF,,,,,before anything,,,,,I hate to say it,,Unless Amber has some PLAN B in action,,,,,,she may want to start saving for that defamation suit,,,,",Lori Citero-Bunker,15,2020-06-15T14:25:34Z
238,UgyFfaYUggIjwLeQvB14AaABAg,"Hallelujah! She finally had enough of Amber's BS.  She knew she couldn't win, so the only thing she could do was quit. #justiceforjohnny.",Judy Alexander,0,2020-06-15T14:23:54Z
239,UgzrRrCX-iiLGzpoi2t4AaABAg,Holy Sh*t!!!,Crystal Hannah,0,2020-06-15T14:23:40Z
240,UgxFOefALSN-H3WjbVB4AaABAg,"How much more proof do we need, when even an attorney  won’t stick it out?",Adega Outlaw,136,2020-06-15T14:19:47Z
241,UgzzsMDNAHbMK2h3fEJ4AaABAg,Abandon ship mates 🤣,Man Of Beard,104,2020-06-15T14:19:31Z
242,UgzJUVUWLxobSF3uiVd4AaABAg,I haven't seen your videos lately been busy lool but hearing this news makes me sooooo happy keep going bro,Golden HD,8,2020-06-15T14:17:19Z
243,UgxaDiSgccA_-QyWm3F4AaABAg,👏👏👏👏👏,Tired of it All 👀,1,2020-06-15T14:15:54Z
244,UgzBZy8omMk7TNLyiKF4AaABAg,"🎉🎊🎉🎊🎉🎊🎉🎊🎉🎊🎉🎊🎉 she knows she can’t win , amber never stops lying and continuing  it to make up more shit and fraudulent stuff .",Joe Wilkes,68,2020-06-15T14:14:04Z
245,UgyT4SiD524V3nvPj3J4AaABAg,Her case is proving un winable,Ryan Hernandez,11,2020-06-15T14:12:17Z
