,parentId,authorDisplayName,replyComment,publishedAt,likeCount
165,UgxPJIY71SACX3cyqgx4AaABAg,Shane Keena,"Postmodernism attempts to make quirks out of sensible solutions. Its predecessor, Modernism, attempts the diametrical opposite. Say you have 16 acres of prime Lower Manhattan real estate and there's a ton of inefficient-yet-quirky buildings on that site that make up a rather charming little enclave. Your ownership, through the power dynamics it enables, allows you to effectively call the shots for that neighborhood. Ownership of that site for instance, has little real impact on the new buildings happening to pop up in Midtown, if no action is taken by the owner. You know what does have an impact city-wide? Building 7 brand-new, state of the art buildings in that neighborhood, 2 of them the largest-ever towers built to date, creating an attraction that would transform the skyline of Manhattan as a whole. We shouldn't look at power differentials as oppression in and of themselves. As long as a free exchange of goods and services is being provided, and fair compensation is given to each side, that's all that matters. As long as the tenants of the older buildings were being paid enough money to buy them out from the rest of their leases and as long as no tenants raise undue criticism, nobody should care on that front. We should look at whether or not people are abusing power differentials to effectively tangle up people's personal lives and extract what they can from said suffering for their own benefit. That's oppression.",2021-06-13T06:54:26Z,0
166,UgyPMutUwpv3_NVb03x4AaABAg,Margaret Gerdes,It makes one wonder of it is by design.,2021-09-15T20:59:24Z,0
167,UgxJxUl-Nsu6wcM_aqZ4AaABAg,Patrick Hall,"""And there’s no such thing as toxic feminism bc it’s just toxic masculinity masked as feminism."" 
You've got some 'splainin' to do. Simply asserting something as true is not an argument. How is this statement true? How is it possible that there is toxic masculinity but not toxic femininity? How is the latter actually just the former? You've studied these subjects, please enlighten us with an actual explanation.",2021-05-20T11:34:57Z,1
168,UgwRIc6nZiuBJzCXVmR4AaABAg,Ham den langhårede,Some thinkers would say postmodernism is liberating. They would rather choose their own value system than have values imposed upon them by grand narratives.,2021-04-19T22:03:24Z,0
169,UgwnBeUoNv3KhkdLE2t4AaABAg,Travis Morgado,"Oh no, the poor, oppressed millionare",2021-04-15T07:44:34Z,1
170,UgwPj9ll8j4iZ1zN8d14AaABAg,Ascent,"What I’d like to know, is how many donators could never even dream of owning a modest home of their own? Who helps millionaires buy million dollar homes? There’s still homeless people in the world right?",2021-10-13T14:39:16Z,0
171,UgwPj9ll8j4iZ1zN8d14AaABAg,Ouloufa,I couldn't believe my eyes when i saw that. Disturbing af🙃,2021-09-22T11:44:26Z,0
172,UgwPj9ll8j4iZ1zN8d14AaABAg,Monica Gambino,It’s disgusting,2021-08-04T19:51:45Z,0
173,UgwPj9ll8j4iZ1zN8d14AaABAg,Legal Tender,"well, millionaires, not billionaires.",2021-07-04T22:33:38Z,1
174,UgwPj9ll8j4iZ1zN8d14AaABAg,CManJ789,"Horrified hearing ""gofundme"" for this 2 fools  come on people  sure you can't be so stupid, can you",2021-06-16T22:54:39Z,3
175,UgwSItXmyqPiwW030VF4AaABAg,Stephan Watson,"Not to spread drama I just have gone through this myself repeatedly and have seen it alot as well and it pisses me off to no end. You sit there and attack someone and abused them, then you also go around claiming they are the violent ones and they are the problem",2021-04-14T21:14:17Z,0
176,Ugw7c_BGQY_iZEA6zuJ4AaABAg,TheBoots72,Yup..,2021-04-16T18:20:34Z,0
177,UgwyLCdWfjO57MEiiRJ4AaABAg,m,@Gabriyel Mastrianna Yay! that's exciting!,2021-06-15T04:11:52Z,1
178,UgwyLCdWfjO57MEiiRJ4AaABAg,Gabriyel Mastrianna,"@Guillermo hey man, that meant a lot and I strongly agree with you. Things better be good for you or imma be suing someone haha. Things have gotten better, I'm moving and getting a job that leads to my dream!",2021-06-12T02:42:27Z,2
179,UgwyLCdWfjO57MEiiRJ4AaABAg,Guillermo,"I hope things have gotten better for you, and/or that good things continue to come your way, maybe even a new lady in your life. :) 

It is truly absurd to think that because us men are (on average) talller and physically stronger, no female partner can ever be abusive, dangerous and violent. Does a knife or a broken beer bottle not cut both women and men? Does fire not burn the flesh of anyone, male or female? To what extent does a man have to be hurt physically and damaged psychologically before we can say there is domestic violence and spousal abuse and he's the survivor not the perpetrator? That's what happened to Johnny Depp, and to yourself (but differently, I am sure). It's really offensive how people think being male somehow makes us impervious to insults and calumnies, emotional manipulation, and even physical hurt. 

I know saying ""I'm sorry this happened to you"" doesn't fix anything at all. I can only hope that there were and there still are good people in your life who helped you.",2021-06-11T23:52:39Z,5
180,UgwyLCdWfjO57MEiiRJ4AaABAg,Gabriyel Mastrianna,@Vivien Tóth thanks that means a lot!,2021-04-14T21:34:06Z,8
181,UgwyLCdWfjO57MEiiRJ4AaABAg,Vivien Tóth,"I hope you’re gonna get better♥️ ask help if you need it, or talk with someone!! Wish you the best x",2021-04-14T21:24:44Z,8
182,UgyQ1Hp7qx65lbdn8mV4AaABAg,Carol Flann,"@hyfoxus You were right when you said by brainwashing. It can happen anywhere. But in some Countries more than other's. In USA it will start-out and only go so far and will be shut down, because we do not believe in nonsense that people try and stir up.",2021-10-26T07:46:02Z,0
183,UgyQ1Hp7qx65lbdn8mV4AaABAg,Balance Is The Only Truth,Oh how happy i am that i'm soon 32. I don't have to grow up with this bs. I feel sorry for the next generation.,2021-10-26T07:30:38Z,1
184,UgyQ1Hp7qx65lbdn8mV4AaABAg,Carol Flann,Elasmotherium you sound pretty advanced and intelligent for your young age. That's really great! Did you ever think about becoming a Lawyer? We need good Attorney's out there who focus on all of the real facts and evidence in all cases...,2021-10-22T06:18:10Z,1
185,UgyQ1Hp7qx65lbdn8mV4AaABAg,Correndous Hunt,"I'm 36, and honestly - for someone of 18, you sound as though you have a very good head on your shoulders. Just generally speaking, in fact (age entirely aside). Keep that mentality and you'll go far in life. 

I have been on the cusp of all this weirdness. Social media wasn't a thing when I was in school, and in its infancy whilst I was in college. I feel blessed that I grew up having a 'normal' childhood. 

Stay strong! Keep your head held high.",2021-10-22T05:31:40Z,2
186,UgyQ1Hp7qx65lbdn8mV4AaABAg,Carol Flann,History has a way of repeating itself because certain people try and make it that way. It's best to go by your own opinion's and not alway's give in to those of others...,2021-10-22T02:18:31Z,0
187,UgwcCpwx7WDo8LiW-Ep4AaABAg,Vendetta,"Otherwise just keep it to yourself and if you do say an opinion and somebody disagrees with you just move on, it will go nowhere",2021-04-12T06:04:19Z,0
188,UgzlvvSvkRgOf72ajqZ4AaABAg,Baggage Claim,Haha,2021-04-12T00:52:55Z,0
189,UgwYxZhV7yE3vv9fRXV4AaABAg,Julius Quasar,“You can’t fix stupid!”,2021-04-11T16:59:04Z,1
190,UgwbouGXFIeuWGAducZ4AaABAg,gina g,👍🏼👍🏼,2021-05-17T05:27:24Z,3
191,UgwtTX0QwKcHMnL-6aF4AaABAg,Jane Tamplin,We The PEOPLE WERE NOT ASLEEP. WE were SILENT or SILENCE . Say Wwwwaaattthhh. Who said that.,2021-05-23T02:32:49Z,1
192,UgwtTX0QwKcHMnL-6aF4AaABAg,Momentum Stocks,You think so? These people live in a parallel universe.,2021-05-20T09:45:14Z,0
193,UgwtTX0QwKcHMnL-6aF4AaABAg,Paige Arnold,"Yes, because most of us are getting very sick of it.",2021-04-13T01:48:48Z,10
194,Ugy46pum6nBoYSGPEzh4AaABAg,Mick S,"And yet more irony:

     Free thinkers need to be re-educated because they have been brainwashed into believing that free thinking is good.",2021-04-11T01:04:30Z,1
195,Ugxv0DG4gy2KSxUHq6J4AaABAg,Jennifer Power,Oh I do hope so.,2021-05-04T14:51:39Z,3
196,Ugxv0DG4gy2KSxUHq6J4AaABAg,george,Oprah is a snake.,2021-04-25T00:11:21Z,5
197,Ugxv0DG4gy2KSxUHq6J4AaABAg,Amelia B,Oprah has no shame as well. All for money.,2021-04-22T05:48:31Z,7
198,Ugw0l0MHE_DNzj7l9794AaABAg,Paladin,"@Linkon Abe Serena committed violations, slamming her racket and calling the umpire names. After being penalized she used sexism as an excuse for the umpire's decision. The crowd (completely gullible) supported Serena and was unhappy with the fact that she lost. After the match Naomi was in tears, she was the first person from Japan to win something like this; yet something that was supposed to feel like the biggest achievement in her life got completely ruined.",2021-05-19T00:36:23Z,13
199,Ugw0l0MHE_DNzj7l9794AaABAg,Linkon Abe,"What the actual hell??? There was a match, someone one and had to apologize for winning?!?! Please tell me this is a lie?!?!😶🤥😬",2021-05-18T23:43:59Z,2
200,Ugw0l0MHE_DNzj7l9794AaABAg,Sandy No,@Анна Коломиец  Their common ground is that they both fancy Serenas husband.,2021-05-13T09:00:23Z,4
201,Ugw0l0MHE_DNzj7l9794AaABAg,N. V.,@Анна Коломиец NAILED IT THERE !  BIRDS OF THE SAME FEATHER FLOCKED TOGETHER.,2021-05-12T18:25:03Z,8
202,Ugw0l0MHE_DNzj7l9794AaABAg,Анна Коломиец,I think that's why Serena and Megan were friends. They found common ground,2021-05-11T14:23:55Z,26
203,UgzdYLZi1hvaAQTx53p4AaABAg,Smirking Nick,"your truth = your story

... a story that may be complete BS",2021-04-11T12:17:36Z,0
204,UgxxyPvrjp3Tg4m2oEF4AaABAg,Jayson T,@Selina Kyle Amber is a douche but she is a professional level actress. Cheap shots like this only succeed in devaluing the honest and more accurate insults given to her.,2021-08-16T16:40:43Z,1
205,UgxxyPvrjp3Tg4m2oEF4AaABAg,NaturPur,@Isakaldaz Wulfazizsunus right!,2021-05-21T12:25:14Z,1
206,UgxxyPvrjp3Tg4m2oEF4AaABAg,Isakaldaz Wulfazizsunus,"This is also what infuriates me when actors start giving sanctimonious speeches about moral values or political talking points. Those people are professional bullshitters and that usually is their only qualification, why do we have to be put through those speeches? We can't give them any value whatsoever anyway. On top of that most actors have a narcissism-related mental disorder or are emotionally unstable, so their moral values are usually based exclusively on what's fashionable at the time.",2021-05-21T11:20:33Z,2
207,UgxxyPvrjp3Tg4m2oEF4AaABAg,Chris G,Meghan markle is not a professional actress. She's a professional wannabe actress.,2021-05-20T01:13:53Z,5
208,UgxxyPvrjp3Tg4m2oEF4AaABAg,Selina Kyle,That's a pretty generous discription,2021-05-18T15:46:45Z,3
209,Ugw3JgljeGoBBF6H-Op4AaABAg,firestorm,"Also, remember to always LISTEN AND BELIEVE people!",2021-04-10T13:25:03Z,0
210,UgzF3ccgoA3WbLv2lGx4AaABAg,SnackiChan,Maybe he shouldn't let a woman boss him around. It was his choice to marry her and I hope he regrets it.,2021-05-14T09:38:43Z,0
211,UgzF3ccgoA3WbLv2lGx4AaABAg,Angela Vitulli,I don't know he must feel awful,2021-05-08T23:44:44Z,0
212,UgzF3ccgoA3WbLv2lGx4AaABAg,KazKaz,"I have only just watched this video so am commenting after the fact. Sadly, Haz has proven that he DOES NOT regret any of his actions. He does not seem to have any self-awareness of what he has done or how disgusting his behaviour has been.",2021-05-08T13:18:54Z,3
213,UgzF3ccgoA3WbLv2lGx4AaABAg,Lynne McAllen,"You're right and hopefully the seed of his resentment for her will be planted. Removing the mask of a narcissist can, for the victim, take a really long time (if it ever happens) but no one can remove the mask but him. She is giving him children, very early in the marriage, as a means to tether him to her and it's a very powerful rope. The likelihood of him leaving her before his children are grown, even if he discovers who she genuinely is, is practically nil.",2021-05-06T21:51:05Z,9
214,UgzF3ccgoA3WbLv2lGx4AaABAg,vordman,He didn't speak to his grandfather for the last year of his life. That's shameful. One day when he's older and wiser that truth will crush him.,2021-05-05T12:06:53Z,15
215,UgxZLKgOzcCV4NoXtlx4AaABAg,k,"Oh, sublime! Very well said!",2021-08-05T11:22:45Z,0
216,UgxZLKgOzcCV4NoXtlx4AaABAg,Bahar ALTOH,Absolutely spot on,2021-05-18T11:38:29Z,0
217,UgxZLKgOzcCV4NoXtlx4AaABAg,Dustoff19,"Well said...  I remember Oprah talking about ""Her truth"" (Megans)  I almost thew up
""Your truth"" is SELDOM the real truth",2021-05-17T17:16:27Z,1
218,UgxZLKgOzcCV4NoXtlx4AaABAg,Adrian Edwin,@MaggieCandy it already is...,2021-05-15T09:11:46Z,0
219,UgxZLKgOzcCV4NoXtlx4AaABAg,Christine Murphy,"Sadly I have already seen this happen.  In the late 90s a young girl, who was in foster care, didn't like the rules her foster parents were setting, so she lied and reported the husband of the couple for sexually assaulting her.  Some time later, after he had been registered for a while, she admitted that it wasn't true.  Was his sentence reversed? No.  It did not matter that he was an innocent man wrongfully accused and convicted.   It also almost happened in the early 2000's again.  This time two girls who saw an episode of SVU, decided to lie to people that their male teacher touched them inappropriately.  Other students came forward and stated that the 2 girls were not alone with him at anytime they had claimed.",2021-04-15T22:29:46Z,11
220,Ugy6XUQVdsxlhw8bdDZ4AaABAg,Tara Walsh-Arpaia,You've met her or is this just what the media said while trying to sell more papers by creating 'fights' and 'comparisons' that had not actually existed.,2021-05-11T21:46:01Z,1
221,Ugy6XUQVdsxlhw8bdDZ4AaABAg,VegasGirl35,"Narcs are always like that. They're very skilled at playing the game to get what they went, then their true colors come out.",2021-04-25T03:17:53Z,12
222,UgxAwY_7TRSGxkGywSV4AaABAg,Kathy Dean,"Most people will think theyare  a good and kind person, but are human enough to admit to some flaws. .Everyone Sometimes makes mistakes and sometimes says things that.are.mean and unthoughtful, Sometimes get.angry and forget there are people worse off than they are.  They will however have the grace to apologise for their misdeeds, and accept that they were wrong and  try to put things right.There are,  however, things a decent person would never do, for instance who would bully a young child out of spite because of who their parents are. Who would accept millions.of.pounds from someone to provide a luxury lifestyle, then complain that that person has let them down financially.. Who would verbally  attack an elderly lady while her.husnand of seventy years.was dying.
The answer is  a vile woman who does not admit one mistake, one act of unkindness, one fault of any kind, one lie ,and never, in over 4o years needed to apologise to anyone.
  This perfect self.proclaimed paragon of every virtue, this perfect woman, an untalented nobody is called Mrs Harry Windsor, but prefers to be called  Duchess.
.",2021-09-07T16:12:19Z,0
223,UgxAwY_7TRSGxkGywSV4AaABAg,N. V.,@Nia keys EXACTLY,2021-05-12T18:23:23Z,0
224,UgxAwY_7TRSGxkGywSV4AaABAg,Nia keys,@N. V. I know that.,2021-05-12T18:10:14Z,0
225,UgxAwY_7TRSGxkGywSV4AaABAg,Rob Alfie,Um. What? They are different people they have different experiences .But hey if you know them all personally! Good for you :-),2021-05-12T00:45:56Z,1
226,UgxAwY_7TRSGxkGywSV4AaABAg,Fatima ezzehra Fa,"@Yvonne Bechara no it’s not a gender issues cuz if the gender we swapped and it was a normal men meeting a princess we would have compared them anyway, it’s not putting women against women that’s just an excuse.",2021-05-08T21:35:58Z,0
227,UgxNkMkTp6oGIxVaPjF4AaABAg,ThePlataf,"She's had stacks of work to look *white* (which she mostly is) but her trip to Africa saw her trowelling on the bronzer as she pranced around in her Givenchy and Laboutins, telling the locals that she's *one of them* . Ha!",2021-04-18T14:28:01Z,9
228,UgxlzTSPwaEml0-MNoZ4AaABAg,D Soule,"@Daniel Wynne she kept interrupting him and speaking for him,",2021-05-12T01:07:21Z,0
229,UgxlzTSPwaEml0-MNoZ4AaABAg,Susan Kirkbride,@ThePlataf A member of the queen's staff aledgedly said she was pregnant and thats why they wed so fast. False alarm she said after the garden party I belive.!,2021-05-11T01:52:20Z,0
230,UgxlzTSPwaEml0-MNoZ4AaABAg,Vy Nguyen,Yeah me too ... I was already painting her as a gold digger and that she'll pull out the race card even though I didn't know she was half black half white lol...,2021-05-10T23:36:05Z,0
231,UgxlzTSPwaEml0-MNoZ4AaABAg,Liz Frost,"Exactly, she wanted to be in charge throughout the engagement interview. He has not looked happy since Archie was born.",2021-05-08T18:22:53Z,1
232,UgxlzTSPwaEml0-MNoZ4AaABAg,Cat96,Same..👍,2021-04-24T14:08:44Z,2
233,UgymQa1KrJyA18d2g2J4AaABAg,PipersSon,"@vordman *Actually, someone let Kate know that Megham held a private conversation with a dressmaker from Givenchy (the wedding dress designers making the wedding and bridesmaids dresses for Meghan), who afterward was reported to have described Meghan remarking (to this designer) that Prince George and his sister Princess Charlotte - were ""those two spoilt brats"" with Princess Charlotte being the one with the posh accent. As if this gaffe was not bad enough she then imitated Charlotte speaking voice.  When you hear this you can sense Tower Bridge being closed on her. This bad omens ahead news spread and it was downhill thereafter.   The LA street kid was an LA street kid and had just proved it. Goodbyeee*",2021-05-05T14:18:49Z,3
234,UgymQa1KrJyA18d2g2J4AaABAg,vordman,"PipersSon   Actually, those two were late to the party. Most people could she was a wrong 'un from the start. Including Prince William.",2021-05-05T12:10:00Z,2
235,Ugy_VzKRXthYvZzcDRJ4AaABAg,Indy Colbie,"Girl, she identified as white for years and married white guys. Who is racist now?",2021-04-03T20:59:30Z,0
236,UgwQ-buSsOfbYjIbdQ14AaABAg,Tammy Mangrum,Or your point of view.,2021-03-28T00:02:30Z,0
237,UgzE6yacyj2EZ93NSF14AaABAg,18MWM81,"Sadly, Heard is the only one who has been kinda taken down a peg",2021-04-14T06:05:21Z,5
238,UgzE6yacyj2EZ93NSF14AaABAg,Anissa Diraa,i think she is and harry just keep following her! he cant stand for himself,2021-04-12T17:50:15Z,8
239,UgzUa6VVsISejelvyhF4AaABAg,Tom Norton,"@Kim S Body language experts can be full of shit simply because everybody has different mannerisms. The way one moves and expresses themselves varies so wildly from person to person that you can't guarantee that a gesture or expression means what you think it means.

With that said, Amber Heard's definitely an evil skank and I wouldn't be at all surprised if Megan Markle is too.",2021-05-28T08:48:36Z,0
240,UgzUa6VVsISejelvyhF4AaABAg,Ania,"Yes, yes and yes. And I think it's important to remember that they very well can have a traumatizing past that has led them to be mentally disordered, which is what narcissism is. But you can have sympathy without letting any of the behaviour affect you personally because unless you are their parent or legal guardian, it is best to avoid narcissists as much as possible, and seek resources that help in dealing with narcissists when that is not possible.",2021-05-10T03:55:59Z,0
241,UgzUa6VVsISejelvyhF4AaABAg,Murdock,"Or 
M",2021-05-09T13:01:28Z,0
242,UgzUa6VVsISejelvyhF4AaABAg,KiloWatt,"@Sharon Richardson you hit the nail on the head here, also, in the video there's talk about ''your truth'' with some thoughts of baggage claim included about the matter. Then when i heard Oprah say ''your truth'' it sounded more like she was distancing herself from the story with it. Oprah knows🤣",2021-05-09T11:08:33Z,1
243,UgzUa6VVsISejelvyhF4AaABAg,ZaraBee28,Anyone who’s seen even one episode of Lie to Me sees their duper’s delight 😡,2021-05-09T08:25:57Z,0
244,UgyVmtmShpx_SYUXqWx4AaABAg,Pikachu smile,@MyMagical1 she'll never know 😆,2021-05-10T22:46:53Z,0
245,UgyVmtmShpx_SYUXqWx4AaABAg,MyMagical1,Pikachu smile President is that enough for her? 🤔,2021-05-10T21:36:39Z,0
246,UgyVmtmShpx_SYUXqWx4AaABAg,Pikachu smile,"MM apparently wants to run for President in 2024. God help us all, and here I was thinking Trump was the worst thing that could happen to the WH. But just like moving back to America we can't technically stop her. But she's a lot more unpopular here in the States then the woke media would like to admit. Anyway ❤️ from 🇺🇲",2021-05-09T22:44:06Z,1
247,UgyVmtmShpx_SYUXqWx4AaABAg,Bonnie Howell,"@Debbie S well said! By making vague accusations and not giving names only created speculation. That speculation alone is equally just as damaging as giving a specific name since now people are accusing people who may have not have been involved in that alleged  conversation, or are now generalizing the entire monarchy of being racists. We also do not even know the context of it to know if it was even racially charged. 
Even after Marckle's claim that multiple conversations were had while she was pregnant on regards to Archie's skin color were contridicted by her own husband, people still believe her version of events.",2021-04-15T03:57:21Z,1
248,UgyVmtmShpx_SYUXqWx4AaABAg,MyMagical1,"Debbie S Good points Debbie. I’m so fed up with the LA Runaways.  I see them everywhere, my goodness what do they want? Cant they just be quiet for peace sake?",2021-03-30T22:39:16Z,4
249,Ugyoepqmjk9q7XXkqVh4AaABAg,Pearl Nthiyane,@Armita Natura 😊😘,2021-03-30T14:37:42Z,0
250,Ugyoepqmjk9q7XXkqVh4AaABAg,Armita Natura,@Pearl Nthiyane so true!! Hate is just such a strong and like hurtful thing to read 😭 even for others. I appreciate your understanding and empathy so much Pearl! God bless you in Jesus name Amen❤️✝️😘,2021-03-30T14:30:40Z,1
251,Ugyoepqmjk9q7XXkqVh4AaABAg,Pearl Nthiyane,@Armita Natura thanks for the clarification. I'm not a Meghan Markle fan but it hard to watch and read comments hating on someone.,2021-03-28T06:37:41Z,0
252,Ugyoepqmjk9q7XXkqVh4AaABAg,Armita Natura,"I don’t think she hates her, and has stated she doesn’t hate her. She has videos on other royals as well and celebrities. These videos are just more popular and maybe right now more relevant to make. Also this video wasn’t really about just Meghan but Amber Heard too with postmodernism. But I definitely don’t think she hates Meghan or has any reason to.",2021-03-27T23:05:13Z,0
253,Ugz_1aXk6UxyxS4R2sZ4AaABAg,Baggage Claim,Wow!!! Love that,2021-03-27T20:35:58Z,0
254,Ugwau-rTi8LlA-GDmCJ4AaABAg,andy m,Mmm. Bit of cancel culture going on here I think. Let me guess....you think Markle is telling the truth ?,2021-03-29T17:48:31Z,1
255,Ugwau-rTi8LlA-GDmCJ4AaABAg,still_here,Dont like it... Dont watch,2021-03-28T16:15:54Z,2
256,UgyvuSExxYbzqce_sPx4AaABAg,Theresa Rolle,She would end like all those before her who tried to do it. While climbing trying to destroy others. God's ways are usually very sudden and traumatic and complete.,2021-03-28T14:58:57Z,0
257,UgwyBBWKHYx5iJlliRJ4AaABAg,manbearpig,Amen,2021-03-28T17:54:51Z,0
258,Ugw7eZeh4CriJlNGUX54AaABAg,Milo Balcziunas,Sounds like alternative facts,2021-05-13T00:21:28Z,0
259,Ugw7eZeh4CriJlNGUX54AaABAg,Sandy No,@krystal cz  How do we cancel Harry’s old lady.,2021-05-07T12:18:05Z,1
260,Ugw7eZeh4CriJlNGUX54AaABAg,Beth Langlois,Logos,2021-05-07T00:27:44Z,0
261,Ugw7eZeh4CriJlNGUX54AaABAg,Roonarific,I like this. This should be on a t-shirt. I may make this t-shirt.,2021-04-24T00:03:02Z,1
262,Ugw7eZeh4CriJlNGUX54AaABAg,Vincent Guy,Beautifully put!,2021-04-23T01:28:48Z,1
263,UgyJ4N6Lt6D4c6Kezc14AaABAg,Gwen Nelson,I Have to admit this comment is one of the funniest I have read in a very long time!!!,2021-05-09T01:17:46Z,0
264,UgyJ4N6Lt6D4c6Kezc14AaABAg,MrsCitrine,I screened shot it so funny but true,2021-04-01T13:25:21Z,0
265,UgyJ4N6Lt6D4c6Kezc14AaABAg,still_here,Hilarious comment,2021-03-28T16:13:27Z,1
266,UgyJ4N6Lt6D4c6Kezc14AaABAg,Theresa Rolle,Lol!!,2021-03-28T14:47:04Z,2
267,Ugyof0NJ61jVRfN-sol4AaABAg,davidlacoste,"@Anne Mary Note that this ""philosophers"" are really not that famous in France outside of academic and journalistic circles. The average French, when looking for philosophy, will go to the old Greeks, the 18th century Frenchs, or solid name like Nietsche, Kant, Spinoza, etc. Not to Foucault or any one of the ""new wave"" of the 60s/70s.",2021-05-05T20:43:03Z,1
268,Ugyof0NJ61jVRfN-sol4AaABAg,Lorena,"Same in Brazil, sadly... This has been here for a while now. I believe the most religious countries are the safest, Brazil is supposed to be very Catholic but apparently not enough. Poland comes to mind now. It's a good place to live away from this madness, according to friends who live there.",2021-04-27T20:35:51Z,4
269,Ugyof0NJ61jVRfN-sol4AaABAg,Cen A,eastern europe here....we've recently started to detect that too...not happy about that,2021-04-27T15:55:35Z,1
270,Ugyof0NJ61jVRfN-sol4AaABAg,Sunbeam,@Lone Battle Droid Not too sure about what's going on in Canada right now but I know Trudeau is Prince of woke,2021-04-23T18:50:02Z,3
271,Ugyof0NJ61jVRfN-sol4AaABAg,Sunbeam,@A X definitely some link there. I see it now,2021-04-23T18:45:47Z,0
272,UgyjLCwI4HOV96DsiTB4AaABAg,Princess Of the Past79,Exactly 👏🏻👏🏻,2021-04-29T16:00:55Z,1
273,UgyjLCwI4HOV96DsiTB4AaABAg,Metaphysical Cookies,"uhm.. i don't think individualism has anything to do with narcisism. What's  more important and to the point is that we need to lookat ourselves and be capable of pointing our own character no flaw and correct it. Self awareness is important. Whether you are an extrovert or an introvert, you can always have self awareness or be a narcissist. You choose.",2021-04-16T23:23:06Z,6
274,UgyjLCwI4HOV96DsiTB4AaABAg,mogznwaz,"Not just individualism, objectivity and critical thinking.",2021-04-14T20:26:09Z,3
