,parentId,authorDisplayName,replyComment,publishedAt,likeCount
75,UgywjGFQhEsM0ktgNnJ4AaABAg,Treva Spinks,"@A 2 I'm done trying to reason with someone with more conspiracy theories than a believer of the ancient alien theory and glossing over really issues other than the weak idea that “ she lies” or “ they have something to hide.” Have you ever thought that maybe they don't owe us a damn thing nor have to explain themselves to anyone, least of all you or me? Or perhaps they want to live their lives the way they want. And you're still glossing. Over some of the issues I have brought up in my previous response, why is that? 
You keep going back to the Royal family and ignoring everything else I've said.",2021-05-15T01:35:50Z,1
76,UgywjGFQhEsM0ktgNnJ4AaABAg,A 2,"@Treva Spinks Okay question - if the Royal Family are trying to kill Harry/Meghan and that's who the threat is from, why do they want the Royal Family to provide their security. Surely if the Royal system was the issue and the threat they wouldn't want Royal Guards sent by the Queen.",2021-05-14T17:26:18Z,0
77,UgywjGFQhEsM0ktgNnJ4AaABAg,A 2,"@Treva Spinks Why would they get Royal security guards when they don't work for the Royal Family? That's normal too in the Royal Family only the direct line succession lot even get the security in England, let along abroad. Even the Princess Royal doesn't get 24/7 security in England and she actually works for the country. There's eleven Royal children under 18 in England and 8 of them have zero security when they go to school. I really don't understand why Harry and Meghan thought they'd get it after they quit in Los Angeles? The British can't permanently station Royal Guards on American soil, that would be insane and a huge diplomatic and political problem.",2021-05-14T17:24:36Z,0
78,Ugyo4ah-wl22GC4IPet4AaABAg,Dispropanganda,Didn't GOP just cancel Liz Cheney lmaoooo,2021-05-15T09:42:56Z,0
79,UgxUes4-eoiGggIrJDl4AaABAg,nothereforit,"Free speech only means that the government won't come after you, not people turning away from you. At the big age of 63 you should know. People has always been the same, this new medium(social media) only amplifies and pockets the voices.",2021-05-24T18:28:30Z,2
80,UgzRc_9H5165xqg0SdB4AaABAg,Sumita,"Dispropanganda where ru getting all this from? Instead of reading selectively about the inquisition and the reformation, start reading from the early church immediately after the ascension of Christ. Try justo gonzalez history of Christianity.",2021-05-15T12:43:44Z,0
81,UgzRc_9H5165xqg0SdB4AaABAg,Dispropanganda,"Anyone even remotely familiar with the history of Christianity wouldn't dare to assume it was based on truth. No maam, Christianity got to where it is through gory violence, and rapes,  manipulation and lies.",2021-05-15T09:52:06Z,1
82,Ugyt0EXhSVRaIvCfLuh4AaABAg,Dispropanganda,"I did not know this, thanks for sharing!",2021-05-15T09:58:09Z,0
83,UgwYf0c5h3yuL-PgO9p4AaABAg,Dispropanganda,"That is great that you have cultivated bravery. Now please stand up for what's right. ""Thinking of oneself as a victim"" and ""being victimised"" are different. The latter is based in truth (not his truth, not mine or yours, but the complete truth) and yes, that includes hearing out the victims. Because more often that not, there are institutions of power who want you to believe in one narrative over the other. Which one you choose to is critical as it either reinforces it or erodes it.",2021-05-15T10:03:29Z,0
84,UgzBCUehbgSQqC0ILiV4AaABAg,Carol Flann,@Leela Koffa I didn't see that one. What another joke! She seem's like she's turned into a real snob!,2021-10-22T02:07:23Z,0
85,UgzBCUehbgSQqC0ILiV4AaABAg,buttercxp draws,@Ladybug I’d say so.,2021-10-14T08:37:44Z,0
86,UgzBCUehbgSQqC0ILiV4AaABAg,buttercxp draws,Pretty sure it was made sarcastically.,2021-10-14T08:37:25Z,0
87,UgzBCUehbgSQqC0ILiV4AaABAg,Leela Koffa,This reminds of when people was donating to  Kylie Jenner gofundme to become a billionaire😂😂😂,2021-07-16T19:58:25Z,11
88,UgzBCUehbgSQqC0ILiV4AaABAg,Kecy M.,nice,2021-06-27T13:25:30Z,0
89,UgybDEet9RFACVlZbS94AaABAg,No Named Liz ¿,She didnt call meghan an abuser tho,2021-05-10T19:33:28Z,0
90,Ugw-9JL8qBtXVHuz8ZV4AaABAg,No Named Liz ¿,She's mixed,2021-05-10T19:36:06Z,0
91,UgyMIZn9QzXZTGGto4h4AaABAg,No Named Liz ¿,How so,2021-05-10T19:36:42Z,0
92,UgwjziTXZ_ode5Jl1a54AaABAg,Abby Bear,@Around the Net in a Day you worded it perfectly.,2021-05-08T18:37:17Z,0
93,UgwjziTXZ_ode5Jl1a54AaABAg,Around the Net in a Day,"Yes, I agree. Maybe you won't agree with the following (and that is of course perfectly alright) but I think it's the old ""If you're not with us, you're against us"" mentality that was - and is - found in totalitarian thinking like Islam, Communism, Nazism and such now taking shape also in a more individual setting. Markle represents, to me, the prototype of a person that constantly needs an ""enemy"" to elevate herself.  It is this hate combined with the standard human narcissism and fascism/chauvinism that today is mainly being represented by the so-called WOKE community - I/we know better, so I/we will control you. Look how many people get fired, etc. if they don't ""obey"". Once they run out of real Nazis or  whoever they have a problem with, they will find somebody else they can put their labels on. Maybe it's a question of hating anyone who is happy or free?",2021-05-08T18:24:03Z,1
94,UgziJyUPK2eOCVSRhvt4AaABAg,Sweet Paprika,"@Catherine Johnson There’s nothing wrong in being a part of the minority, that phrase is just funny because she constantly uses as her only defining attributes. She also uses her minority card to get away with racism and sexism",2021-05-20T22:19:32Z,0
95,UgziJyUPK2eOCVSRhvt4AaABAg,Catherine Johnson,I’m saddened that some would see this as funny. 😔,2021-05-20T22:12:15Z,0
96,UgziJyUPK2eOCVSRhvt4AaABAg,Harriet Craig,"@Sweet Paprika soooooo many ways to be persecuted!
Honestly, if I were a job applicant these days, I would WANT to be a bisexual woman of color—ooh—a TRANS of color.   I’d almost be assured of getting the job.",2021-05-17T11:27:23Z,0
97,UgziJyUPK2eOCVSRhvt4AaABAg,Sweet Paprika,@Harriet Craig Ahh dang it she missed a box 😩,2021-05-17T08:02:59Z,0
98,UgziJyUPK2eOCVSRhvt4AaABAg,Harriet Craig,...who probably wishes she was disabled...,2021-05-17T05:35:54Z,1
99,Ugwuq_jW3k2GfFt9Ucp4AaABAg,Gigi Ella Angeli Angie G.,"I really believe that Johnny Depp dumped Amber, because his kids didn't like her, when you are a parent, you have to out your children first, before your own personal life, and Amber didn't seem too happy about that, if she was a real victim, like I have been from a bad relationship, she would have waited a lot longer to tell people, because of the fact that people don't always believe you, even when you tell the truth, the fact that she jumped the gun is the first alarming red flag for a liar, rather than a victim, there are still things that happened to me, that I NEVER told my family, and friends, because I really believe that I did something, to make the abuser think it was okay, for someone like her to jump the gun so fast, it's very unusual, I would sooner believe Alyssa Milano's sorry not sorry podcast",2021-05-08T15:58:44Z,1
100,Ugy0aEZqMzZn0uGo0tl4AaABAg,mikatu,"yes, but when you have Oprah claiming she was victim of racism in Zurich just because the clerk of the store tried to help her picking a cheaper handbag..... even Tina Turner explained that that is not racism, since they do it to everyone. That is how they treat their clients. Oprah simple assumed she was a victim because she is a racist and see everything in black vs white, and don't even consider that an employee being rude to her is just someone being rude, instead is a racist.",2021-10-31T22:11:43Z,2
101,Ugy0aEZqMzZn0uGo0tl4AaABAg,katy larson,"@Balance Is The Only Truth exactly!
Same with your sexual orientation, etc.
I couldn't care less about all that.
It's all about personality, character and behavior. Who you are on the inside.",2021-10-26T22:52:03Z,0
102,Ugy0aEZqMzZn0uGo0tl4AaABAg,Balance Is The Only Truth,"I don't give a f about your skincolor. If you're a good person you are a good person. If you're an @sshole you are that. 
Why does this world feel the need to make everything complicated.",2021-10-26T07:28:01Z,2
103,Ugy0aEZqMzZn0uGo0tl4AaABAg,You Think What,"That's a great point, but I'd go further. It is almost never their skin color. After interviewing several people who were mildly racist, I came to the realization that racism is due to generalizing a group by association with bad experience. AKA if you have 3 bad experiences with people of a certain ethnicity then you will start to apply bad assumptions to new people of that ethnicity. These experiences can include reading about someone in a newspaper or on TV. Kind of like how black people were more likely to be perceived as criminal due to how often the media showed the race of the criminal when he was black. This was a while ago though. One of the conversations was with a man who didn't like the chinese business man who had bought a hotel. He called him a chink, and said that the chinese are all over here. I don't believe that he meant he disliked them because of their skin tone, but because of the difference in culture and bad experiences. This is my explanation of racism, and helps me ""combat"" it. If I know why people are being racist, if I understand them, then I can help them see the truth or at least open them up to new ideas and point out the flaws in being racist (such as the fact that two chinese people have very little in common and no connection. Like how jewish bankers and random citizens who happen to be jewish are two completely different things even thought they are loosely associated).
I was talking to some kids the other day (11 year olds) and they were talking about the Spanish kids. Not brown people, Spanish people. In my town the Spanish Americans have a very strong cultural centre. They hold festivities and play music, they retain a unique culture and that makes them distinct from, say Koreans, who melt into the general American ethnic background at least around here.
Those are just some thoughts I had.",2021-09-04T12:27:07Z,0
104,Ugy0aEZqMzZn0uGo0tl4AaABAg,katy larson,"@Makiyla Reynolds of course. And those people are racists. And there are people who dislike her because of that. 
But those of us who aren't and only judge people on their character, personality, behavior, see what kind of person she is.
She's a manipulative, lying, abusive narcissist. 
And when you've experienced a narcissistic relationship, it's extremely obvious.",2021-09-04T06:01:42Z,0
105,UgzHGACYodEx4Yz67Q14AaABAg,Brandon FJ,"To be fair and only in this instances I don't think any old royal family is free from criticism hell Markle was a ""royal"" before she got with Harry really that whole family and connecting royal families are shady as shit especially with their ""norms""",2021-07-04T20:17:52Z,2
106,UgzHGACYodEx4Yz67Q14AaABAg,Anisa,@Helene at 6:37 i think,2021-06-02T04:59:49Z,1
107,UgzHGACYodEx4Yz67Q14AaABAg,Helene,When is the clip?,2021-05-23T00:07:14Z,0
108,UgzHGACYodEx4Yz67Q14AaABAg,piggyduff,I wish I could like your comment more than once!  I breaks my heart the way POC are being led unthinkingly into a new apartheid.  It's crazy!  (And I noticed that moment with the Queen too!  Absolute Cringe!),2021-05-06T20:43:46Z,3
109,UgyfNY7zLA02Owg_kSd4AaABAg,Niwesh Lekhak,"She went and lied on Oprah. 
She said Archie did not receive a title because of racism when according to the rules only children and grandchildren of the monarch can receive titles. Princesses Anne kids also don't have titles and she is queens daughter. Queen made exception for William's kids cause he will be King one day. 
She said she got no mental health help when Harry has the best psychiatrists on his phone dial, on top of this Queen, Queen's sister, Charles(Future King), Diana(at that time future queen) and Harry all admitted publicly that they are getting mental health treatment. 
The RF tried their best to make the marriage work but she said they were rude to her, RF gave her more expensive wardrobe than Kate(future queen), their own cottage which basically like a palace. They gave her a 32 million wedding.
Moaning about how they don't receive security and money, when you don't work for RF how are supposed receive their privileges. On top of this Charles gave them 2.2 million from his own pocket before they were cut off financially.",2021-05-06T14:48:05Z,0
110,UgzJUEK7bNyVxFFhj7p4AaABAg,Kgaugelo Kevin,Body language*,2021-05-02T20:25:24Z,0
111,Ugz25BAcy4wqboTw0MJ4AaABAg,Brown Girl Tries Skincare,@Maddie Siegmund We as a society have become tone deaf to anyone who even slightly disagrees with us. It is a shame.,2021-05-05T15:25:51Z,0
112,Ugz25BAcy4wqboTw0MJ4AaABAg,Maddie Siegmund,And the wokes endlessly try to destroy him and paint him as the face of philosophical evil,2021-05-05T14:57:39Z,1
113,UgxkNwTdGpA8UeS8gBZ4AaABAg,Mo Reel,U showed him 😂😳 let's gooo!!!,2021-04-28T09:22:52Z,0
114,UgzMfKguY4alovuM3hJ4AaABAg,Eyes of the Cervino,"@Megan Carter 
Or at least pretty darn insecure. I think she really would feel bad when she realized she was hurting me, but it was always in hindsight -- somehow, in the heat of the moment, that was never enough for her to be willing to change.",2021-05-07T22:26:56Z,0
115,UgzMfKguY4alovuM3hJ4AaABAg,Megan Carter,Sounds like a narcissist. I recommend watching HG Tudor on YouTube he is a psychopathic narcissist and his teachings on the subject are so helpful in dealing with these people,2021-05-07T20:00:49Z,0
116,UgxYjp3zSx7ALcLBSzx4AaABAg,Baggage Claim,Thanks for sharing your experience with this ideology!,2021-04-25T17:49:12Z,1
117,Ugw7elW-O82tVcseJs14AaABAg,Tara Walsh-Arpaia,I don't know what you are quoting but it sounds just like my teenage daughter. She hates the 'who cries first wins.',2021-05-11T22:07:15Z,0
118,UgzeCvhVJ5na_Kk4oTJ4AaABAg,M B,@Alvaro Mijares what have you smocked..?,2021-08-20T01:14:21Z,0
119,UgzeCvhVJ5na_Kk4oTJ4AaABAg,Alvaro Mijares,"What you should have edited is your virtue signaling about racism. What you feel is yours an yours alone, and that is fine belive me,  nobody realy cares or needs you to proclaim your feelings about a matter",2021-08-20T01:12:13Z,0
120,UgzeCvhVJ5na_Kk4oTJ4AaABAg,Jayson T,"@M B Thing is, when you edit it to say what you should have edited, the editor could have edited anything else they wanted to edit because the editing still doesn't show what was edited.",2021-08-16T16:32:43Z,0
121,UgzeCvhVJ5na_Kk4oTJ4AaABAg,M B,"@Hannah Friel perhaps because people will wonder what was edited away... But I suppose one could Edit to what one meant, and say what one did below... 😏",2021-06-07T00:00:10Z,3
122,UgzeCvhVJ5na_Kk4oTJ4AaABAg,Hannah Friel,"why not just use the edit feature to edit the mistake and fix it so your comment reads more smoothly? i don't understand this ""editing"" without fixing the problem, just listing at the bottom what you SHOULD have edited.. happens on reddit too. so frustrating. its okay to just.. use the backspace button and fix it.",2021-06-04T02:41:29Z,7
123,UgxuG2soOlNLqoN15Yp4AaABAg,Rosa Mercado,She’s being honest...,2021-04-22T21:46:41Z,0
124,Ugz1vrasNQiKA8cd2r54AaABAg,Egypt Cat,@Word OfYourBody Sounds like a personal problem!,2021-11-08T15:58:45Z,0
125,Ugz1vrasNQiKA8cd2r54AaABAg,Word OfYourBody,@Egypt Cat Christ. This statement is making me super pro-abortion.,2021-11-08T15:04:27Z,0
126,Ugz1vrasNQiKA8cd2r54AaABAg,Egypt Cat,"@Word OfYourBody No not really! ""People"" are making up crap like racist, hater, jealous, etc to fit their own warped narrative! Systemic racism is a myth, much like global warming. It's ok for the useful idiots, but the rest of us will NOT be cowed by the brainwashed few!",2021-11-02T15:20:20Z,0
127,Ugz1vrasNQiKA8cd2r54AaABAg,Word OfYourBody,That is one of the most retarded view points I have ever heard. There is only an illusion of more injustice because people are calling shit out and holding people accountable.,2021-11-02T14:15:51Z,0
128,Ugz1vrasNQiKA8cd2r54AaABAg,Lo Mandy,"@Jayson T Calling people racist while they are making legitimate points simply does more harm than good to people who truly suffer from racism.Is because people like you, the word ""racist"" has less power than it is in the past, resulting in a world with more oppression and injustice",2021-10-20T07:46:51Z,2
129,UgwGIfJ3OErRXuqWkUN4AaABAg,hello queen,@Francisco Morais 🤣🤣🤣🤣🤣🤣🤣🤣🤣🤣🤦‍♀️🤣🤣🤣🤣🤣🤣🤣🤣🤣🤣🤣🤣🤣🤣🤣🤣🤣🤣🤣🤣🤣🤣🤣🤣🤣🤣🤣🤣🤣🤣🤣🤣🤣🤣🤣🤣🤣🤣🤣🤣🤣🤣🤣🤣🤣🤣🤣🤣🤣🤣🤣🤣🤣🤣🤣🤣🤣🤣🤣🤣,2021-05-18T20:42:40Z,0
130,UgwGIfJ3OErRXuqWkUN4AaABAg,Francisco Morais,@hello queen I'm hoping your kids don't catch your insanity lmao best to them,2021-05-18T20:26:14Z,0
131,UgwGIfJ3OErRXuqWkUN4AaABAg,hello queen,@Francisco Morais 🤣🤣🤣🤣🤣🤣🤣🤣🤣🤣🤣🤣🤣🤣🤣🤣🤣🤣🤣🤣🤣🤣🤣🤣🤣🤣🤦‍♀️🤣🤣🤣🤣🤣,2021-05-18T20:13:42Z,0
132,UgwGIfJ3OErRXuqWkUN4AaABAg,Francisco Morais,"home-schooling your kids is the opposite of thinking independently, you're making them think just like you do and are denying them incredible ways for them to develop their own personality and thoughts. but hey, if you want lifeless robots for your entertainment go ahead, they're your kids and your responsibility that they might consider their life miserable and empty.",2021-05-18T20:11:36Z,0
133,UgwREY7YihlcDULXQ894AaABAg,nothereforit,"How she behaved is not so different to how many other men behave when they loose. But how the media chose to ignore Osakas victory has nothing to do with Serena. She paved the way for Osaka, and has battled a lot with how  she has been unfairly represented.  So please don't come for Serena, she has her flaws but she has  not done anything that we know of that warrants any scrutiny that you are looking for. A lot of people are friends with the wrong people, usually because they don't know them really well. Like Johnny Depp and Marilyn Manson.",2021-05-24T18:24:33Z,4
134,UgwREY7YihlcDULXQ894AaABAg,isabella acero,"yes Serena Williams lost the game fair and square and she behaved like a brat on international Tv yeah , there is a reason they are great friends Meghan is an opportunist , i mean the interview on Oprah showed her true character, yes she said her version but she accused the Royal family of racism ,mentioned  that they didnt receive enough financial support when they live in big houses, have food  ... and yeah does she and harry not understand that the Royal protection costs lots of money ...  i Mean that is just being spoiled",2021-05-21T15:39:51Z,10
135,UgwREY7YihlcDULXQ894AaABAg,Momentum Stocks,Man she really is some piece of work. I love how Novak gave her ****!,2021-05-20T09:43:00Z,11
136,UgwREY7YihlcDULXQ894AaABAg,abby pengelly,"she is horrible,no wonder her and megain are besties,I see it now",2021-05-10T11:24:34Z,27
137,Ugw-mTExSAwNA9s-lXh4AaABAg,Pickles,You really nailed this topic. We’ve much to learn about all that is transpiring right now.,2021-09-24T07:38:06Z,2
138,Ugw-mTExSAwNA9s-lXh4AaABAg,Atharv Sakhala,"most importantly, appeals to people with sense of undeserved entitlement, inflated self-importance",2021-05-22T17:19:52Z,5
139,Ugw-mTExSAwNA9s-lXh4AaABAg,Dan D,"absolutely agree, my ex was a pure narcissist and despite her level of intelligence and education, she whole heartedly believes in this woke ideology",2021-05-16T10:49:41Z,7
140,Ugw-mTExSAwNA9s-lXh4AaABAg,Nick BOND,Just seen this and have to absolutely agree with your assessment,2021-05-14T13:34:33Z,6
141,UgzQSOWOKn1FXvaesVR4AaABAg,Pauline,Exactly 👍🏽,2021-10-02T15:41:45Z,0
142,UgzQSOWOKn1FXvaesVR4AaABAg,Linda Haggard,@Jeanne Fischer Because she is a Grandiose Narcissist!  They are NEVER wrong and ALWAYS victims!,2021-07-27T22:27:13Z,6
143,UgzQSOWOKn1FXvaesVR4AaABAg,Hunny Bunny,"YES! These women piggy back ride their charades over actually oppressed people. For someone who has actually been harassed, bullied, had my privacy violated via hacking, my life left on pause because of someone else’s actions - this is especially painful to watch. These women are living their full lives and crying and making millions off lies.",2021-07-27T19:29:55Z,10
144,UgzQSOWOKn1FXvaesVR4AaABAg,Bryce Federwitz,Damn right!,2021-07-25T07:30:08Z,2
145,UgzQSOWOKn1FXvaesVR4AaABAg,Jeanne Fischer,"How can she be a victim living in a million dollar  house, beautiful clothes and still winging",2021-07-11T07:12:34Z,18
146,UgwS2UTEky-zsSi9rgR4AaABAg,Tay,@Vic M I totally agree,2021-04-19T11:49:31Z,0
147,UgwS2UTEky-zsSi9rgR4AaABAg,Vic M,"We in the UK cannot believe the change that has come over him.
If a woman truly loves you, she will not obliterate your family, friends and former lifestyle. I cannot see a happy ending here, unlike in the wife's silly fairy tales.",2021-04-19T06:17:38Z,1
148,Ugwlvfl4bp5TSxBwNkd4AaABAg,E P,I begin to believe the world is a joke,2021-05-12T19:06:28Z,1
149,Ugwlvfl4bp5TSxBwNkd4AaABAg,Niwesh Lekhak,"On top all this Charles till this day, has not said anything about the relationship between him and Diana.",2021-05-06T14:28:44Z,7
150,Ugwlvfl4bp5TSxBwNkd4AaABAg,Honey SweetHeart,"Yess! This is such a terrible mindset to have. Instead of viewing them of real people with flaws, we feel the need to pick side and stand by one of them, even though you don’t need to at all.. You really don’t need to choose side.. What you need is have a set of value, stand by it, and when conflict comes up be fair about it.",2021-04-26T04:49:47Z,14
151,UgyvAqimqqcPmrcXX3J4AaABAg,Ham den langhårede,"I see your comment - and thank you! I've had the same thoughts about this video. This is simply not postmodernism. And I'm fearing that this ""version"" of postmodernism is starting to get a hold in the U.S.",2021-04-19T21:13:40Z,1
152,Ugwe-H-7iyyYkzuu-RV4AaABAg,Alekhya Bhat,@Bluebell 01 no i just don't see why the automatic assumption is to believe that markle is lying about her experiences with racism. black people have a history of exploitation and tokenization in predominantly western cultures. so why are we disregarding her stance when she's a minority at a position of relative influence in a regime that has said/done racist things?,2021-04-18T04:49:27Z,0
153,Ugwe-H-7iyyYkzuu-RV4AaABAg,Alekhya Bhat,"@F S sorry! meant to clarify when I said most of these people I meant the monarchy in particular, not the general populous",2021-04-18T04:47:04Z,0
154,Ugwe-H-7iyyYkzuu-RV4AaABAg,Bluebell 01,By using that analysis isn't the whole world racist? Most countries have at some point exploited different cultures.,2021-04-18T00:23:09Z,0
155,Ugwe-H-7iyyYkzuu-RV4AaABAg,F S,"How do you know ""most"" of us ""shamelessly exploit different cultures""? Have you met all of us? Or are you just grouping us all together based on what British tabloids and powerful people do?",2021-04-17T22:15:14Z,0
156,Ugw078Ozd_RFqzGv-Xh4AaABAg,Claudia Miller,"Very nicely put...will use, if ever appropriate!",2021-05-17T22:26:09Z,3
157,UgyYJNYxTm6c_u8GLlJ4AaABAg,Pauline,"Tolerance? In my experience, if you even slightly disagree with the super-woke, you are subjected to a barrage of hate, personal insults, and intolerance!! Lol 😂",2021-10-02T16:21:22Z,0
158,UgyuSL-AwcmQN7lrvqF4AaABAg,Tty Tty,"@H Man yes, me too after the interview 🤣",2021-04-19T01:51:46Z,1
159,UgyuSL-AwcmQN7lrvqF4AaABAg,H Man,"This might sound bad, but she is fair to the point that I didn't even know she was black until recently.",2021-04-18T22:51:04Z,1
160,UgzdljuG6e_EvVb8NBJ4AaABAg,Bluebell 01,"You talk about evidence, but what evidence did Meghan produce before she described the entire Royal Family as racist? She used a single incident, involving just one other person, information incidentally that she got third hand, and used it to denigrate her husbands family. Did you know what Harry himself has made racists comments? Why didn't Meghan talk about that?",2021-04-18T00:37:02Z,0
161,UgxJkyUmT3oSj2vBSyp4AaABAg,Ham den langhårede,Thank you for this comment! I believe it is important that a comment like this one is being heard. Simply because the claims about postmodernism in this video are wrong.,2021-04-19T21:38:11Z,0
162,UgxlSAjCOX8hX7sNV8p4AaABAg,Amelia gray,I dont know why i laughed out loud to this lmao,2021-04-22T18:36:01Z,3
163,UgxPJIY71SACX3cyqgx4AaABAg,Shane Keena,"@Brandon FJ That's the exact process I was trying to describe. I don't mind it, but I hate the idea of masking it and trying to somehow be pretentious around that whole debate. That's what really gets me under my skin, and that's what's wrong about the current debate, and in my experience, what gets me under my skin is usually something that ought to be eliminated. I won't give any examples because I would have to give it in person.",2021-07-04T20:51:14Z,0
164,UgxPJIY71SACX3cyqgx4AaABAg,Brandon FJ,@Shane Keena what you describe could apply to gentrification. Which has its controversies,2021-07-04T20:08:49Z,0
