,parentId,authorDisplayName,replyComment,publishedAt,likeCount
275,Ugw0UOouChmFeZZwZnp4AaABAg,Zephyer Talking Trees,"Carolyn Genc said ""There is one Truth. The Truth has no owner. It just is""",2021-05-07T00:26:48Z,1
276,UgyhHBpysi0adHMAlVx4AaABAg,Bonnie Howell,"Exactly. This ""woke"" movement convinces people that we must automatically believe a person was victimized without any actual proof or logic.  Anyone who merely questions thems or shares their opposed opinion  are automatically deemed a racist, ""unconsciously biased"" ,or bigoted. Its scary how a movement basically bullies people into silence in fear of being labeled these terms or even being ""cancelled"" if they have a large platform to express their opinions.",2021-04-15T04:10:23Z,5
277,Ugx5dgpmEoxIcpsXuz54AaABAg,montex66,"You know, if they're going to shove it down your throat you could at least be polite enough to pretend to have a gag reflex.",2021-05-06T05:22:18Z,2
278,Ugx5dgpmEoxIcpsXuz54AaABAg,ALOSHY REJI,Intersectionality started as a noble thing..to show judges how the experience of black women differs from thw white counter part...now..well,2021-04-13T23:07:23Z,4
279,UgzJuaJyDdpiHHlE1-t4AaABAg,manbearpig,Yep. It is a nightmare.,2021-03-28T17:53:43Z,2
280,UgwbJ_1ldzp358qJeHV4AaABAg,scoobydoobeedoowhereareyou,Nah..both are equal to each other.,2021-03-27T08:38:37Z,1
281,UgzwQ48CHAixD7A8vsZ4AaABAg,angeleyes0825,CNN did recently,2021-03-27T22:25:31Z,0
282,UgweEWMaLJfjL3Dz23R4AaABAg,Angela Carleton,"The problem is she manipulated and controlled Prince Harry from the beginning and made him believe he wasn't treated right by the family? This was a tactic used by a narcissistic individual to ""conquer and divide"" because I have been in Prince Harry's situation except I know facts from fiction since the narcissist never knew my background or situation so why should I trust this person?  So why should Prince Harry give the Power to Meghan for him to believe everything she says is true because he feels he got no one on his corner which he is wrong. He's got his father, brother, and his grandmother the Queen that loves him.  However, narcissism can be dangerous if that person has a weak mind and believe Meghan instead of those in his family that know the truth of what is going on.  He just can't see beyond his nose.",2021-08-01T15:11:43Z,1
283,UgweEWMaLJfjL3Dz23R4AaABAg,Donna Reed,"@PETE THE REAL RELENTLESS I pray you are right!!!!  He is on the ride of his life.....
Poor Harry!!!!  Doesn’t have a clue, who she is, YET!  But unfortunately, he will....",2021-07-31T18:58:25Z,1
284,UgweEWMaLJfjL3Dz23R4AaABAg,Teresa Hughes,"People don't really concern themselves with ""forever"" in marriage anymore. It's more like while it last marriages.  When problems crop up as they always well...people move on to other partners.",2021-05-16T13:30:42Z,2
285,UgweEWMaLJfjL3Dz23R4AaABAg,Linda,Or stay single 👍,2021-05-14T22:35:29Z,0
286,UgweEWMaLJfjL3Dz23R4AaABAg,ZaraBee28,Bet Prince Harry will be wishing you were in his life for those words in a few years 🤷‍♀️,2021-05-09T08:29:56Z,2
287,UgweC39Z9iHC5yfzTul4AaABAg,Cindy Blount,yep,2021-03-30T01:52:50Z,1
288,Ugx3WaaFegajVj6sri54AaABAg,katy larson,"Martin Luther King said we should judge people based on the content of our character.
That's what I have always done.
Megan is a narcissist. Harry is being manipulated.",2021-05-06T05:03:13Z,1
289,Ugx3WaaFegajVj6sri54AaABAg,Fridaey13txhOktober,"The deliberate, planned destruction of thinking.",2021-04-27T14:23:40Z,3
290,Ugx3WaaFegajVj6sri54AaABAg,victoria Bishko,I.e.bad=good!??!,2021-04-20T04:48:59Z,2
291,Ugx3WaaFegajVj6sri54AaABAg,Oumi's Gluten-Free Kitchen,Well said!,2021-04-17T20:02:43Z,2
292,Ugx3WaaFegajVj6sri54AaABAg,Bonnie Howell,"@Lifesucks! Sodoesgoogle Yep. People are now afraid to state their own opinion in fear of being labeled a racist,unconsciously biased, or ""cancelled"" all together.. Its crazy how the fundamental beliefs this country is based on are now slowly being destroyed by this movement.",2021-04-15T03:06:18Z,24
293,UgyXOTcvgW4lmTMYKDV4AaABAg,Tea to go,I hope Charles doesn't reign. We need Will and Kate to take the positions to keep the family modern.,2021-03-27T10:22:17Z,1
294,UgxGLLy5dnwaMPRPyjN4AaABAg,Kamila S.,"Postmodernism is not a philosophy that paints things black and white. If anything, it shows and analyzes why people nowadays tend to see things in this way. And it's a funny thing, The quote about repeating itself comes from Marx.",2021-04-24T18:45:10Z,1
295,UgxGLLy5dnwaMPRPyjN4AaABAg,Kilgore Trout,"What do you get when you take Hiroshima, the industrial-scale carnage of WW1&2, vietmam, etc, mix with mega-corporate-media-driven consumer culture, a hint of your parents' JFK and serve on a bed of cold-war?   not sure, but maybe reduced faith in the promise of classical Modernism and some anxiety",2021-04-23T04:50:27Z,0
296,UgxGLLy5dnwaMPRPyjN4AaABAg,Kathleen,Marxist Globalists who set it in motion are crossing their fingers.,2021-04-17T23:21:17Z,1
297,UgxGLLy5dnwaMPRPyjN4AaABAg,Ramona Mohan,"@Tea to go True, and what a shame that is. I am from Romania and I moved to UK years ago for studies, and it saddens me to see how some brits treat their own country. That woke shit wouldn't fly where I'm from, and while when I moved to the UK I thought, what an amazing country and nation, I now think it has a few things to learn from Romania about rejecting woke domination and flourishing as a nation.",2021-04-15T09:13:34Z,5
298,UgxGLLy5dnwaMPRPyjN4AaABAg,gina wiggles,"Agree with you 100% Nicole Poliskey. We are heading into the next ""DARK AGES.""",2021-04-14T00:21:35Z,1
299,UgySNUVz-txBfPIsD314AaABAg,S H,"@ChairmanHiro I doubt Tyler could define ""communists,"" either. How anyone labels the couple as such is beyond me.",2021-08-18T23:52:05Z,0
300,UgySNUVz-txBfPIsD314AaABAg,janice polley,yoda l,2021-07-31T10:13:35Z,0
301,UgySNUVz-txBfPIsD314AaABAg,Kaysha,@Dorica Shu pk donc? lol,2021-07-01T11:18:51Z,0
302,UgySNUVz-txBfPIsD314AaABAg,Dorica Shu,Je ne m’attendais pas à te retrouver ici @kaysha,2021-07-01T09:54:04Z,2
303,UgySNUVz-txBfPIsD314AaABAg,Erin Stanger,So is racist/racism.,2021-07-01T05:16:28Z,0
304,UgyoHaBUPnqunYYC7z54AaABAg,Xaspirate,"...and to tie two items together here -- I first heard ""My Truth"" on Oprah about 7 years ago I think. Don't know if that was 'theme' of that show or wtvr but at least 2 woc stood up and made declarations of sorts to wild applause while Oprah offered approval. Then I switched back over to Judge JoeB. Thank God!",2021-04-15T05:20:38Z,0
305,UgyXIk4P207aUXjfocF4AaABAg,yvette vernet,"@Christine Murphy Yes,sadly is does.",2021-04-16T03:38:27Z,1
306,UgyXIk4P207aUXjfocF4AaABAg,Christine Murphy,"I'm sorry to say that it happens every single day, in every single place. :(",2021-04-15T22:15:26Z,4
307,UgxBIjkyyJUAst5P4DB4AaABAg,Anne Lorigan,And ones actions.,2021-05-02T08:47:48Z,0
308,UgxBIjkyyJUAst5P4DB4AaABAg,Jackie,@Kai Outlaw dunno what that is ya fool. You balloon 🎈,2021-04-28T11:40:18Z,0
309,UgxBIjkyyJUAst5P4DB4AaABAg,Kai Outlaw,"@Jackie wow, what a great response. Crowder fan?",2021-04-27T14:31:59Z,0
310,UgxBIjkyyJUAst5P4DB4AaABAg,Benjamin K,Well one thing is clear: postmodernism doesn't make sense to you lmao,2021-04-24T18:48:31Z,0
311,UgxBIjkyyJUAst5P4DB4AaABAg,Kamila S.,@tahsina .c Exactly!,2021-04-24T18:43:14Z,0
312,Ugwm_3LBoYsZ-Y81wWN4AaABAg,Denise mazzotti,Ditto !!,2021-03-27T02:00:48Z,0
313,UgxtYW6ZSHTYRqPmUmB4AaABAg,Baggage Claim,Very well said!!,2021-03-27T02:08:22Z,1
314,UgzvW-5e-97PFH5EwQF4AaABAg,bebop,"Read up on critical race theory, critical theory and intersectionality. Its so insidious in our culture",2021-03-27T10:20:45Z,5
315,UgzvW-5e-97PFH5EwQF4AaABAg,Baggage Claim,Thank you!!,2021-03-27T02:32:39Z,1
316,UgxReqvsj2vq8hUgww94AaABAg,Lo Mandy,A big thumbs up for you,2021-10-20T07:48:23Z,0
317,UgxReqvsj2vq8hUgww94AaABAg,Karyn deWit,That’s as it should be!,2021-09-07T16:02:18Z,0
318,UgxReqvsj2vq8hUgww94AaABAg,GN Ong,@Brenda Lee 9th,2021-08-31T09:34:37Z,1
319,UgxReqvsj2vq8hUgww94AaABAg,Marilyn McCall,"@Carmen Castro Wouldn't that be interesting......oh wait, b4 you save my life, what color is this person?",2021-07-20T19:57:02Z,1
320,UgxReqvsj2vq8hUgww94AaABAg,Marilyn McCall,"Oh, so true.  It's your actions and attitude that make people not like you.  No one cares what color your skin is.  But, throwing the race card is the thing to do now and will continue doing so until the courts override it.",2021-07-20T19:55:42Z,0
321,Ugyv4zSnHp2_ETUKXPN4AaABAg,AB AB,A lot of damage will be done. The elite will HOLD the pendulum this time. There are too many critical external factors this time. We as people have to stand together.,2021-03-27T02:35:58Z,5
322,Ugyv4zSnHp2_ETUKXPN4AaABAg,yvette vernet,"Agree! This is what is happening now,and as you say it will swing back but not before a great deal of damage has been done.",2021-03-27T02:11:54Z,3
323,UgyIF0-vQHV9Q7CSQHh4AaABAg,Светлана Алексеева,"They both have to grow up and take responsibilities not only for themselves but people close to them. They are not little girls any more.
It happens. Girls become women and boys become men.",2021-04-16T12:16:05Z,0
324,UgyIF0-vQHV9Q7CSQHh4AaABAg,osantokensal,"They’re both narcs, playing the same games. One with racism the other one with domestic abuse.",2021-03-28T12:25:20Z,2
325,UgyIF0-vQHV9Q7CSQHh4AaABAg,AD,They’re both abusers. Just in different ways.,2021-03-27T01:46:53Z,9
326,UgyChZXBhPe3z6hXzJ94AaABAg,Vintage Beyoutee,You’ve garnered my respect just by reading this strong Lady 🙌👏👏👏🌹,2021-04-21T13:22:19Z,1
327,UgyChZXBhPe3z6hXzJ94AaABAg,Mary Louise Johnson,"Unless you are a child, no one can make you a victim unless you allow them to hurt you.",2021-04-20T07:42:16Z,1
328,UgyChZXBhPe3z6hXzJ94AaABAg,SirChocula,"You are the definition of resilience, I pray nothing but great things come to you, you deserve it!!! :)",2021-04-11T03:23:45Z,2
329,UgyChZXBhPe3z6hXzJ94AaABAg,Belle the Romantic,👏🏻👏🏻👏🏻👏🏻👏🏻👏🏻👏🏻👏🏻👏🏻👏🏻👏🏻👏🏻👏🏻👏🏻👏🏻👏🏻👏🏻👏🏻👏🏻,2021-04-11T00:30:17Z,0
330,UgyChZXBhPe3z6hXzJ94AaABAg,It's Just Me,@Jill Jensen  I'm proud  of you and your strength !,2021-04-08T02:12:35Z,3
331,UgxncutDEWJdYCBb89t4AaABAg,Okayyyla🍓,The mainstream media have literally been caught on tape (by project veritas)  admitting that they are just selling propaganda and basically being cheerleaders for the far left democrats. No joke. You can find the videos of the producer of CNN admitting it on camera and saying how they used COVID19 as a fear mongering tactic on their show. They don't report anything that doesn't fit their narrative.,2021-05-08T05:21:11Z,1
332,UgxncutDEWJdYCBb89t4AaABAg,M Morrisey,Meghan and Harry have a HUGE budget for PR. So they probably pay these so-called journalists to only post positive news about them.,2021-04-16T00:17:17Z,4
333,UgxncutDEWJdYCBb89t4AaABAg,Aleksandra Zimpel,"@Sàdék __ all of this plus she’s master manipulator, she will get what she wants from people during interviews.",2021-04-10T12:36:11Z,2
334,UgxncutDEWJdYCBb89t4AaABAg,Sàdék __,@Kate Bates dude Oprah is sexist and racist and a pimp for sexual abusers and people just ignore that shit and keep seeing her as the god Angel,2021-04-10T11:54:31Z,6
335,UgxncutDEWJdYCBb89t4AaABAg,Kate Bates,WHere's all the furor over Oprah saying all old white people need to DIE?,2021-03-28T04:01:41Z,9
336,UgwTDujObrG5oTTLu-l4AaABAg,manbearpig,Yes. Being anti-Woke is a lefty socialist thing too.,2021-03-28T17:56:19Z,0
337,UgwTDujObrG5oTTLu-l4AaABAg,bebop,"Why? What has he done at all? And before you say hes transphobic, he was against Bill C-16 which dictates that it is a crime to misgender someone, which is legislation on what you can say which is unethical and the antithesis of a free society. Not transphobic.",2021-03-27T10:24:31Z,0
338,UgzHxYYFbxkAerIrxgd4AaABAg,prime shrimp,It's just a matter of time,2021-05-05T08:39:43Z,0
339,UgzHxYYFbxkAerIrxgd4AaABAg,Taliesin Halliday,thats not how it works. the truth gets buried and then people forget.,2021-05-03T08:37:44Z,1
340,UgzHxYYFbxkAerIrxgd4AaABAg,sa,"Here's a bit of truth for you: a member of the North Western disciplinary committee has come forward describing how Markle was suspended from NWU for gluing shut her two housemates' eyes with Superglue. This was around the late 1990s according to the member which confirms what everyone suspected that Markle is actually 43 and not 39. In addition, she was studying communications at the time of expulsion, not drama and international relations. Anyway, Thomas Markle used his savings to bail her out and get the records sealed. I don't know if she went back and graduated. You'd think there'd be photos all over of her in the purple and gold NWU gown. IF anyone is from Chicago, maybe you can go down to the university and see if her photo is included in the graduating class picture, it would be under Rachel Markle.",2021-05-02T22:29:15Z,0
341,UgzHxYYFbxkAerIrxgd4AaABAg,Marsu Karhu,"Unfortunately it doesn't. And Karma doesn't rise up always either, sometimes it sinks down.",2021-04-26T16:38:50Z,0
342,UgzHxYYFbxkAerIrxgd4AaABAg,THEFRISKIESTDINGO,"@faustina f Very recent example of that not happening: FBI recovered all the security tapes and the black book from Epstein's mansion, and promptly pulled a Clinton and lost them. Maxwell, Epstein's accomplice, testified, and the judge sealed the testimony because it would be too much of a spectacle. You can hope the truth comes out eventually but when important people are implicated in something it doesn't come out.",2021-04-21T22:10:23Z,0
343,UgzIwZvHW1NhI4OfZpd4AaABAg,Ernest Harper,@Baggage Claim 👎👎👎,2021-03-27T01:39:03Z,0
344,UgzIwZvHW1NhI4OfZpd4AaABAg,Baggage Claim,I love all four of them :) So glad you're enjoying!!,2021-03-27T00:45:03Z,3
345,Ugx7WtEX0m-6XcfbYSh4AaABAg,M K,"@pacificblue That statement perpetuates the exact problem this video is trying to create awareness of. You describe ""women"" as one group, and what the individuals do, reflects on the whole group, not just on themselves as individual assholes. Imagine every woman on the planet having to worry about what half of the world´s population are doing so as not to get a ""bad rep"" from their actions. How is that not completely insane and absurd? Not to mention suppressive?",2021-07-04T16:06:22Z,0
346,Ugx7WtEX0m-6XcfbYSh4AaABAg,kessa,Don't be so silly. Since when did 2 women become the representatives of 4 billion people? Smh,2021-06-18T05:22:34Z,0
347,Ugx7WtEX0m-6XcfbYSh4AaABAg,Celisar1,"@Gwendolyn Reds 
Ok, that IS misogynistic! Shame on you!",2021-06-15T23:17:46Z,0
348,Ugx7WtEX0m-6XcfbYSh4AaABAg,Celisar1,That is a tad misogynistic. 2 women can absolutely not give 3.5 billion women a bad name just like two bad men don’t give their entire gender a bad name.,2021-06-15T23:17:03Z,0
349,Ugx7WtEX0m-6XcfbYSh4AaABAg,Kitti whieldon,@Jade Hung My email is kittiwhieldon@yahoo.com. Contact me anytime.,2021-06-12T07:17:39Z,0
350,UgwnlRHT_v3qHLDFEAF4AaABAg,Miss_LW,@jbel7510 Indeed! Why not just say I feel... I think... In my opinion... the way I see things...  No such thing as MY truth.,2021-04-28T09:11:37Z,0
351,UgwnlRHT_v3qHLDFEAF4AaABAg,Marie Pichler,@Big Mama 👍😂,2021-04-22T14:07:46Z,0
352,UgwnlRHT_v3qHLDFEAF4AaABAg,Big Mama,🤣🤣🤣🤣🤣Unseen footage Megan Markle interview!! Truth revealed!! youtu.be/uSWS3fQVx8A😅😮,2021-04-22T13:35:53Z,1
353,UgwnlRHT_v3qHLDFEAF4AaABAg,M Si,"Facts, science, and logic are all aspects of “whiteness”, so it’s racist to look at things objectively somehow. Frustrating, I’ve been battling this since 2013.",2021-04-16T16:55:20Z,2
354,UgwnlRHT_v3qHLDFEAF4AaABAg,Ramona Mohan,"@jbel7510 Very well pointed out. They have noticed that feelings are irrelevant to certain conversations and are now masquerading them as ""their truth"". The reality is, as you mentioned, it's never been that feelings are invalid, it's just that they are not facts. Society is becoming so ""me me me"" that they are trying to replace objectivity with subjectivity and facts with feelings, and that's just not right, it's narcissistic and dare I say unfair. There are certain standards (facts) that should be met, and when feelings are involved, those standards change for everyone. Of course it's at the expense of critically thinking people and in the favour of those who get easily offended, because then the bar becomes super low and everyone gets offended by anything, and a low standard is created. Just an overall mess!",2021-04-15T09:10:25Z,0
355,Ugx_eOpAbjChcBAjSgh4AaABAg,danapnmk,We are the silent majority.,2021-03-28T16:04:31Z,2
356,Ugy_5g2LKtVFNwsmXbp4AaABAg,Comet Vaudin,@18MWM81 I love you for that oml,2021-04-21T20:04:55Z,0
357,Ugy_5g2LKtVFNwsmXbp4AaABAg,victoria Bishko,No shit🤔,2021-04-16T17:29:40Z,0
358,Ugy_5g2LKtVFNwsmXbp4AaABAg,18MWM81,@Bonnie Howell I just hope people got my Drag Race reference,2021-04-15T04:00:36Z,2
359,Ugy_5g2LKtVFNwsmXbp4AaABAg,Bonnie Howell,"@18MWM81 There are actually people who still comment ""I believe her. Show me proof that she lied once in that interview "". 
People give numerous examples based on credible sources.
""YOUR A RACIST! AND BELIEVE WHATVEVER THE TABLOIDS TELL YOU!!!""",2021-04-15T03:11:51Z,4
360,Ugy_5g2LKtVFNwsmXbp4AaABAg,18MWM81,"You’re perfect, you’re beautiful! Everything about you is perfect! Did you make that baby? Oh, you’re having an exclusive interview with Oprah. They eat her up EVERY SINGLE TIME she’s on that damned camera. She could walk out there in a fucking diaper and they’d be like, “Meghan Markle, Your truth is beautiful”",2021-04-14T06:10:42Z,10
361,UgxifozK9deTp-sBHoN4AaABAg,Owen Anthony,@Lunar I studies Foucault last year quite a bit. Underlying narratives and the needs for neoliberal policy making and whatnot.,2021-07-05T12:15:12Z,0
362,UgxifozK9deTp-sBHoN4AaABAg,Lunar,"...definitely agree...so is shallow thinking lol. Like I completely respect and understand post-modernist theories like power dynamics from Foucault...what I don’t understand is viewing everything through a singular theory. Like there’s as much supportive evidence for string theory but as I’m not spending my life wandering around trying not to bump into an infinite number of my alternative selves from an infinite number of universes, why in the world would I wander around assessing for the power dynamics behind every interaction.",2021-06-08T07:34:59Z,2
363,UgxifozK9deTp-sBHoN4AaABAg,Diana *,As a child who lived as a victim due to circumstances I had no control over . As an adult I'm hardcore personal responsibility,2021-05-30T02:41:20Z,2
364,UgxifozK9deTp-sBHoN4AaABAg,Tara Walsh-Arpaia,Nicely stated Geoff Smith.,2021-05-11T21:58:52Z,1
365,UgxifozK9deTp-sBHoN4AaABAg,Alaric Goldkuhl,@Arminius Ave. Well said.,2021-04-23T20:49:07Z,2
366,UgxXKwuHf-ledBRN-rF4AaABAg,Joe Bloggs,"@Bilal Ahmed Plenty wrong with dating them as I’ve found out several times myself. They are always acting, you never know who the real person is or what they are really thinking / feeling. Very disingenuous people. Stay well clear, wokey!",2021-04-09T12:24:04Z,2
367,UgxXKwuHf-ledBRN-rF4AaABAg,Bilal Ahmed,"Nothing wrong with dating or even marrying actors/actresses, it’s the person’s character!",2021-04-07T07:19:53Z,2
368,UgxXKwuHf-ledBRN-rF4AaABAg,apex1993 ax,Thats what Prince Phillip told Harry,2021-03-27T17:33:47Z,4
369,Ugxv_ALR63DVDHEnVQZ4AaABAg,M Morrisey,"Her supporters call everyone who criticizes Meghan as ""racists"".",2021-04-16T00:15:57Z,2
370,Ugxv_ALR63DVDHEnVQZ4AaABAg,S Hendricks,"@Liz Real Girl Beauty ""no, but the WHOLE WORLD WILL, SO I DON'T CARE!!"" says Rachel with glee",2021-04-02T02:32:27Z,0
371,Ugxv_ALR63DVDHEnVQZ4AaABAg,Liz Real Girl Beauty,I just keep reminding them that H&M are never going to see their comment.,2021-04-02T00:56:23Z,0
372,Ugxv_ALR63DVDHEnVQZ4AaABAg,S Hendricks,"It's called 
""weak minded"" 
""follower""
""robotic""
Some ppl will do ANYTHING for money 🎭",2021-04-01T23:41:08Z,5
373,Ugyhqo_TEHXYy1MQyNJ4AaABAg,Murphy Church,Oprah? Proof? Look at how many con artists she has promoted...,2021-10-06T12:22:19Z,0
374,Ugyhqo_TEHXYy1MQyNJ4AaABAg,Joselyn Romero,"Oprah now doesn’t ask for proof, she only wants views.",2021-08-10T03:04:16Z,0
375,Ugyhqo_TEHXYy1MQyNJ4AaABAg,Momentum Stocks,@sa Biden handing over power to Markel......I wouldn't know whether to laugh or cry for the USA,2021-05-20T09:53:37Z,1
376,Ugyhqo_TEHXYy1MQyNJ4AaABAg,Momentum Stocks,"@MsBahbii Yeah...he'll be at the end of her ""wrath"" soon enough. Prepare Harry. We can all see it",2021-05-20T09:49:56Z,2
377,Ugyhqo_TEHXYy1MQyNJ4AaABAg,Momentum Stocks,@i hate bananas Especially when it is made up.,2021-05-20T09:48:39Z,1
378,Ugy9WoQoqLbr6ZH40cp4AaABAg,Baggage Claim,Glad you think so!,2021-03-27T00:46:31Z,2
379,Ugznc73V__hxhAhuCtl4AaABAg,B. C,"Sadly, I feel that in the West, the woke ideology is more and more prevalent while being less and less bothered with hiding its true Marxist nature because too often the failure of Communism is being placed solely on the cultural background of the countries where it was implemented : in other terms, the disasters of Communism in the countries that you mention is being explained and rationalized by the mere fact that it occured in these places that are unfortunately seen by the left-wing elite/media as 'backwarded' and 'underdeveloped' - a point that is superbly illustrated by Jonathan Littell in his novel The Kindly Ones, where a SS officer explains to a captured Soviet commissioner that Socialism would have prevailed in any country but Russia and that it's a shame the Revolution occured there and not, say, in Germany. Now of course we know such theory to be the xenophobic, condescending rubbish, but unfortunately it is pretty much accepted within most left-wing medias as it helps to explain why countries like Poland or Russia have gone conservative ever since the fall of the Berlin Wall. This idea needs to be fought : the evil of Marxism/Post-modernism lie in their very roots, regardless of the ethnical/regional/cultural background where they are implemented.",2021-04-16T15:20:31Z,2
380,Ugznc73V__hxhAhuCtl4AaABAg,Raelven,"There's an old saying ""America sneezes and the rest of the world catches a cold."" If America succumbs to the influence of postmodern thinking, it's going to be a global catastrophe not just a national one. If people want a one world global fascist dictatorship, let the postmodernists win with their ""my feelings are facts""  propaganda.",2021-04-05T18:32:16Z,15
381,Ugznc73V__hxhAhuCtl4AaABAg,Cindy Blount,"Not sure what you mean....people fled those countries.....why did they?
BTW I loathe Markle & though I realize abuse against women is endemic & misogyny rampant: I do not buy Heard for an american sec (& our seconds are shorter than the rest of the world, believe me, lol)",2021-03-30T01:45:20Z,3
382,Ugznc73V__hxhAhuCtl4AaABAg,Wendy Cunningham,"Do tell! I know in general, but not in detail, from a first-hand account !",2021-03-28T20:11:13Z,0
383,Ugznc73V__hxhAhuCtl4AaABAg,Sabrina Mowery,And Chinese cultural revolution from 1966 until 1976.,2021-03-27T19:19:31Z,8
384,UgwEQrAPUovFYUs5H5t4AaABAg,Carpe Diem,@Cindy Blount I think they were trying to make a type of intellectual joke you missed.,2021-03-31T11:05:17Z,2
385,UgwEQrAPUovFYUs5H5t4AaABAg,Cindy Blount,what the hell is post & pre - I make fun of that shit.....live life without an acronym or a post/pre: then you're really truly post & pre & all that jazz... lol whatever,2021-03-30T01:47:50Z,1
386,UgwSV5ZAlld-SSAeQ6l4AaABAg,Gerard Mackay,"@Melissa M. Sutton it would be a pleasure Melissa. After 11 years of very expensive private education Diana emerged without a single qualification to her name, she literally failed at every exam she ever sat. She famously described herself as ‘thick as two short planks’ and few who knew her would disagree. I’m sure she was capable of kindness and empathy but she was also capable of vindictiveness (source material countless staff who worked for her) if she suspected loyalty was to Charles not her. Her lack of judgement centred around the string of extra marital affairs she engaged in ( ruining Will Carling’s marriage and stalking a married boyfriend with 300+ texts when he tried to end the affair) Her final fatal lack of judgement was cavorting with a playboy from a rich but rather sinister family and entrusting her personal safety to a drunken, substance abusing chauffeur instead of the royal security personnel in her previous life who were vetted to within an inch of their lives. Not fastening her seat belt was the final and ultimate act of self neglect which left two young boys motherless and (certainly in Harry’s case) damaged for life. Hope that helps",2021-07-14T07:40:34Z,1
387,UgwSV5ZAlld-SSAeQ6l4AaABAg,Melissa M. Sutton,@Gerard Mackay I'm curious to know about Diana's low intelligence and lack of judgement. Would you care to elaborate? Thank you!,2021-07-13T21:49:40Z,0
388,UgwSV5ZAlld-SSAeQ6l4AaABAg,Gerard Mackay,The victim signalling was all about money. The interview would never have seen the light of day if the UK Government had continued to bankroll his £5m per annum 24/7 security. I think they were genuinely shocked that that particular money tap was switched off and their response was to cry race. Harry inherited good characteristics from his mother but he sadly also inherited her low intelligence and lack of judgement. MM will continue to run rings around him as Harry continues his journey from Royal Family golden boy to its potential nemesis in just 4 short years. Sad for him and sad for the deep dismay of the sibling he was once so close to.,2021-05-02T18:28:21Z,6
389,UgwSV5ZAlld-SSAeQ6l4AaABAg,Zeus Bolt,He used to be so fun and cool. He looks broken,2021-04-19T02:28:54Z,10
