,id,comment,author,likecount,publishedAt
235,UgwfOB0jBPDv4JarVYR4AaABAg,"""It loves walks on the beach..."" Hahaha 😆",cpcoller23,0,2021-06-01T20:38:08Z
236,Ugx1vkyabl0ezY9Ab2Z4AaABAg,TUG and JD FTW,SlyASpiE,0,2021-06-01T20:36:28Z
237,Ugw-9A8klh8ULcinlaR4AaABAg,ALGORITHM FEEDING TIIIMMEEESS!!!!,xxSallyDollxx,0,2021-06-01T20:34:22Z
238,UgztvKkwDS6LixCJuMV4AaABAg,"As the guy from the Big Short said, ""Boom.""",Strike Force Alpha,0,2021-06-01T20:32:16Z
239,Ugz9CEFml6jF1c_3xqh4AaABAg,Tacos for the algorithm xx,Kirstylee Murray,0,2021-06-01T20:30:36Z
240,UgyhRuHnlzdS-M_KmBR4AaABAg,"Even the ""traumatic situation"" is dramatized to so make her sound bigger than she is.",Josh_ Miester_X,0,2021-06-01T20:30:23Z
241,UgxEMox6l-LQPZ-tqDF4AaABAg,This is for the algorithm 🌮,Mary pzr,0,2021-06-01T20:30:09Z
242,UgxJtgkVkiIYmhMjk2Z4AaABAg,"What will it take to get justice to be served?!? I mean, how obvious that she is a narcissistic psychopath? Where are my psychology colleges?? Forensic detectives?!? Nameless person, I am so embarrassed to be a woman based on your behaviors... please stop causing us beautiful, honest and professional women look like gold diggers or incredibly manipulative!!! You are NOT honoring our DIVINE FEMININE!!! Wake up and grow up! You affect the collective! 
Thanks Umbrella Guy! How much longer shall we have to witness this?  😪",Melissa Meskauskas,0,2021-06-01T20:29:54Z
243,UgyrQ1bB2fM0PDVScBl4AaABAg,🍕🌭🥞yummies  for the hungry algorithm..,rose's new beginning,0,2021-06-01T20:26:58Z
244,UgxjUKeIJu5Gv0J2LCl4AaABAg,"You could not make this stuff up ,except thankfully ah does ,🤣to her detriment and TUG's enjoyment ( and ours )",Mr Martin,1,2021-06-01T20:26:32Z
245,UgxmC9v83b53bnYGKWZ4AaABAg,They didn't care to fact check it.,Jennifer Lauben,0,2021-06-01T20:25:33Z
246,UgzerkeZMnSDmpW_O714AaABAg,AH can burn in the fire she lit for Depp.,Lord PAIN,1,2021-06-01T20:23:03Z
247,UgzdhKZW_mE2h1qqHLN4AaABAg,I heard that AH was not even required to attend the Court at all.  She insisted on going there in person and someone on her team called the press to inform them she'd be going there to seek the RO.  It was just one big publicity stunt on her part.,Nel Shrestha,13,2021-06-01T20:20:33Z
248,UgwOZBo70zVTGF3tUv14AaABAg,"Infuriating slime balls and their lying slime leader! I don’t curse but I really really want to! Lol!
She has put the MeToo movement back to the beginning all by herself because of her actions and lies. 
It sounds like this new judge may say and do what all of US want to say and do - basically tell that Nameless Person to go jump in a lake.....

Or into Rocket Man’s arms ......

Whatever works",Lynn P,0,2021-06-01T20:20:26Z
249,UgxFm3F_84zPIairBEF4AaABAg,Of course Amber Turd would use a Chinese company to try and take down your free speech.,Danny Toldyaso,0,2021-06-01T20:19:24Z
250,UgzZn7Z3TUT4rsxprPR4AaABAg,I'll leave this to the professionals ok?,Kissy Missy,0,2021-06-01T20:15:43Z
251,Ugx01mxQ8l0g3-eRjCJ4AaABAg,Get the audio I want to hear here scolded,John Smith,0,2021-06-01T20:14:28Z
252,UgwtE2r2_zbgIpmq6vN4AaABAg,More flopping fishy tales from the Atlantean siren of nautical nonsense.,About Face,0,2021-06-01T20:13:35Z
253,Ugy-23ZJ0BaDgsR093F4AaABAg,My favorite flavor of evidence is 🌮 🌮 🌮 flavored evidence.,Bigfoot Phill,1,2021-06-01T20:11:36Z
254,Ugz6XyUj2sREqv0QJyZ4AaABAg,How would paparazzi even know she was going to lawyers. SHE called them.,laurels heart,31,2021-06-01T20:07:30Z
255,Ugz2WVhDcH7dUokLlRN4AaABAg,Amber is a Turd.. nuff said... Justice for Johnny Depp...,LesPeterGuitarJam,2,2021-06-01T20:06:28Z
256,UgwMsm63GdKScgEacN54AaABAg,TUG figure when?,Radioactive Bear,0,2021-06-01T20:06:26Z
257,UgwQDguBXtS7KT2YYWR4AaABAg,She is apart of a conspiracy for financial and personal gain and the group of people as well as AH should pay restitution and serve time for set up and lies against others. ALL of them!,laurels heart,2,2021-06-01T20:05:08Z
258,UgzWXQJjEB_lHtWVmYZ4AaABAg,Feeding that algorithm for you my dude,Kirstin Rose,0,2021-06-01T20:04:02Z
259,UgyP4uoOz1Vayz7b6zl4AaABAg,"The ultimate Karen, try getting the manager!",Peanut Gallery,4,2021-06-01T20:01:08Z
260,Ugx5koD6PzFROH9MmSd4AaABAg,"""I felt the full force of our culture's wrath when I lied about  being a victim of DV""  Fixed it for her.  :-)
Edit:  She's a Vile,  disgusting  liar.",Elizabeth Clothier,49,2021-06-01T19:58:46Z
261,UgwVAaJdCd_9nceuLWh4AaABAg,"Turd's lawyer back then,(Eric George- who was advising her on op-ed) admitted in his depo he never even asked her if abuse happened. Yep didn't ask, didn't ask for proof, didn't explore that fact she might be lying. Never had a conversation about the  alleged abuse. Yet he helped spread the lies about Johnny. Going to 5 or 6 media outlets to slander JD by calling him an abuser. He lied at depo saying the op-ed wasn't about JD, but when turd said ""two years ago when she had experience abuse""  she was referring to her ""college years""  Chew called him out saying two years before op-ed, she was with JD and asked EG if he's trying to say ""two years ago"" was her ""college years?"" Damn! I might be wrong but didn't turd drop out of HS at 17?",Kat Beck,0,2021-06-01T19:57:32Z
262,UgzkWccn8-fi0T7LTfp4AaABAg,"The teard, lier lier pants on fire, gone girl couldn't tell the truth even if given $7 million, can't pay her for the truth so only other way, video after video of the truth.",Peanut Gallery,0,2021-06-01T19:55:43Z
263,UgzB4CkFfJKlEyDst6B4AaABAg,"Why do you say ""certain nameless person""? Is it for some liability protection, because all person's are named literally in your titles. Or is it just a quirky thing you do",Lowkey Lokii,0,2021-06-01T19:54:59Z
264,Ugy89j1aWH06o7RItgJ4AaABAg,All staged. Bad acting...,Mingo Pace,0,2021-06-01T19:54:04Z
265,UgwEOh0Ht9P2CD5OIeZ4AaABAg,"I'll ""like"" your vid, but I'm not taking the algorithm for a walk on the beach... It's too high-maintenance for me ;-)",Graeme Swallow,0,2021-06-01T19:53:05Z
266,UgwjfCmrY2GMXSYac994AaABAg,I'm sure sometime in the future when JD is finally cleared from all the allegations there will be a film about this. And since Amber Turd is damn clueless and stupid she will want to play herself 🤣,nenna,3,2021-06-01T19:52:44Z
267,UgxKxlQiGBByd2CWcl94AaABAg,That vehicle was parked at the side of the door on purpose.,Admirers of Johnny Depp Count,1,2021-06-01T19:52:24Z
268,UgwSgYRPCqO7i8p-hgt4AaABAg,Justice for Johnny Depp.,Angel,0,2021-06-01T19:52:07Z
269,UgyZy9WjnI2wP_TfX414AaABAg,I'm just going to go out on a limb here as a Johnny Depp supporter and say that whoever narrates these things sounds way too happy about all this like they're getting off on it geez dude just report and do your job Don't act like you're a 6th grade school girl who just got told that Johnny likes her.  Jesus. It's not even your own life you're ranting on about.,E C,0,2021-06-01T19:51:58Z
270,UgxqRpTMrcRnrhbMfjh4AaABAg,Feeding the algorithm,Callie Wright,0,2021-06-01T19:51:36Z
271,Ugx-X2Hx53z2GZG4hD14AaABAg,"Gotta love the fact that the ""hundreds"" of paparazzi don't have reflections.",Wendy Kelley,3,2021-06-01T19:50:50Z
272,Ugwa4etYkAK2MH8I-hR4AaABAg,"I hope this is it cause if this isn't enough evidence, I'm gonna trigger",Blazing Storm,0,2021-06-01T19:49:40Z
273,UgyjMm4jbqbpVVtM4154AaABAg,Like did she literally take notes from gone girl? 😂😂👀,Medusa 2.0,0,2021-06-01T19:47:08Z
274,UgxpqAZnTbQ5KpQ4KSd4AaABAg,Love the video 👍👍👍,Mary Sue McCarty,0,2021-06-01T19:46:58Z
275,Ugyp5sSPlee7bnm_CIF4AaABAg,🙏🔥,Cindy C,0,2021-06-01T19:46:10Z
276,Ugwfx-EMLlHPFVjpyQt4AaABAg,"I refuse to get a Twitter account, 🤦 so I can't go watch 😂",Mindy Carroll,0,2021-06-01T19:46:03Z
277,UgyIzomLp2fUTqZ0qYJ4AaABAg,I just HAVE to ask at least myself what kind of weirdo would dislike this video? Or any such video shes so obviously such a pos....,krbrown948,0,2021-06-01T19:46:01Z
278,UgyFgscruxTFS46X8ax4AaABAg,The court case in London will forever go down as the most embarrassing and humiliating downfall of the (in)justice system.,Greta Bi,38,2021-06-01T19:45:33Z
279,UgwK2s7dMNVqMNNWgBR4AaABAg,"You mean that there weren't swarms of people accusing her of lying when she went to go file a restraining order against the man she's abusing? Shocking.
Her lawyer told her specifically to stay home and that she didn't need to go to the court house at all but she desperately wanted that photo opt",Daniela Galvez,26,2021-06-01T19:44:21Z
280,UgyWvNzYOGKaDRwkGQp4AaABAg,Shared Tug get in lad keep it up :),The Soul Pool 2766marcia,0,2021-06-01T19:44:09Z
281,UgyWHWLvKffMuo3Vu4t4AaABAg,God damit TUG I got sand in my pc.,Aaron Songer,0,2021-06-01T19:40:56Z
282,UgycHBaBDbAH3x6oYOh4AaABAg,"When they walked into the street the reflection of the street was on the glass of the building, and it was empty, the same as in the car at the end the open door reflected no-one behind whoever took the picture. And as you say, they looked like they deliberately walked into the small gaggle of press (she probably had them called anyway, it’s what she does).",Queen Babylonia,6,2021-06-01T19:39:54Z
283,UgyKjEXzKZeMXWAWcdR4AaABAg,"Thank you thank you thank you!!
When I heard this I thought to myself I've seen that video 100 times there was not tons of people out there she was not bombarded none of those terrible things were said to her. Not one person in that very very small teeny-tiny crowd asked her if she was"" making this all up"" they were quite respectful asking her if she was okay and there wasn't a ton of bodyguards are there was a police officer and a bigger African American guy I think her personal assistant and nobody was pushing on her Shadow very clear walk to her van it was just publicity and the reporters and Paparazzi that were there she probably called them ahead of time because that's what narcissist do!!

She is such a disgrace",Margaret Chafe,1,2021-06-01T19:39:53Z
284,UgzsN96kBXJHTVJrzah4AaABAg,I understand it's easier to edit your video and make the copy right trolls happy... but honestly more people need to fight them. It's why they are winning and got every one to self censor themselves on everything.,Justa Guy,1,2021-06-01T19:38:33Z
285,UgyDuObCD_2Ofvsnt614AaABAg,Thank you so much for keeping true reporting out there.  God bless.,Elizabeth Wiley,0,2021-06-01T19:36:25Z
286,UgwGTgVIzoYM-CoGcwp4AaABAg,She didnt have to be there in the first place. her lawyer would have been enough to submit the RO in court and it‘s very unusual that the client attends this. but who we‘re talking about here…of course she has to be there totally unnecessary.,S Z,3,2021-06-01T19:33:54Z
287,UgxtNkvvxIU1S0Bqz-l4AaABAg,"what did try to say?, it´s like you told a story but I felt there was something you wanted say, are you saying she planned having those paparazzi there?",Lyllies,0,2021-06-01T19:30:22Z
288,Ugy2iwynj0mJuiHQ8EJ4AaABAg,This is bs I am subscribed and have bell on why I had to look for the umbrella guy for this. YouTube being bias,sinhen li,0,2021-06-01T19:28:25Z
289,UgyupEn5odwyvtVSYch4AaABAg,"She is moving to calm.... she not avoiding the cameras what is the natural reaction of all ppl when they being ""cornered/pressend"" with paparazzis,  even real victms do all to avoid being filmed or photographed by media, no hand to cover face or anything.... and that mark or her face look very ""fresh"" but no swelling, any doctor,nurse to explain how thats possible? O.o

with a mark that  big and dark and no swelling on her face at all? what kinf witchcraft make-up is that?",Peu Oliver,0,2021-06-01T19:25:57Z
290,UgwmsoP9JWmZxsDE7yd4AaABAg,"Yup, we played this on stream the other day and went through it bit by bit. Not one of them says it to her!!",Come Geek Some,8,2021-06-01T19:24:43Z
291,UgyvyYcUx8ICAX9HiPB4AaABAg,"Such an evil and twisted person she is... She needs help, it's disgusting!!",My self,1,2021-06-01T19:24:31Z
292,UgxxIE2llcO8YiyqzPR4AaABAg,"It’s the same as when she lied about leaving the UK court saying the angry mob threw things at her car... there’s videos, and one woman slaps the car window. One time.",linzi94,5,2021-06-01T19:23:34Z
293,Ugz0vNGbxo2tSjtIr5t4AaABAg,Wonder if this rabbit hole is deep enough to tunnel to China,Christopher Hatch,0,2021-06-01T19:20:39Z
294,Ugzns5F373LmWoDg55N4AaABAg,🍩🌮🌯,Tanya,0,2021-06-01T19:20:07Z
295,UgzHyyl1P4ct4OU_AvB4AaABAg,Burn the bit-witch burn the witch,annoyingPoe15,0,2021-06-01T19:18:43Z
296,Ugwo6tp3FaYoOr4qLm94AaABAg,"I think she's  a soulless wanna-be whose only talent is fading ( her looks, because she SURE can't act",Musey's Modern Dreadfuls; &Tales Of Terror,0,2021-06-01T19:16:05Z
297,UgwOZU7YxwKI6DLCNzp4AaABAg,This whole thing is sickening. I have no respect for these people.Amber dug her own grave. It was about money and publicity - and maybe revenge. Sad that there are such people,Allyana 1971,1,2021-06-01T19:15:56Z
298,Ugwve3F3mV7FlGU0Ahl4AaABAg,"Feeding the algorithm! 🌮🌮🌮
Keep spreading the truth, TUG!

Also, you've gotta know that her excuse will be that she was so emotionally traumatized that she misremembered the event. 🙄",The Literary Spinster,1,2021-06-01T19:12:45Z
299,UgwMMDhV79UIzfItTax4AaABAg,+,L Francis,0,2021-06-01T19:12:28Z
300,Ugw6XmIHfYTuW3gAkhN4AaABAg,We all know that nameless person and nameless team are bound to fail lol,bluecole2,0,2021-06-01T19:11:09Z
301,Ugxx1AJGdK1hbHISF_t4AaABAg,"You know, I've been getting a TON of older videos talking about how Amber Herd is done from 6 months to a year ago with the previous court cases, and the headlines said the same things. It's really making me question if this guy actually cares, or if this is a grift. All Umbrella shows  us is anything he thinks will make us feel Depp is winning, and never explains why he might be losing, even though losing is all Depp can seem to manage. Learn some effing humility and report facts. I'd rather be properly informed than being given a bunch of propaganda.",Toma,0,2021-06-01T19:09:56Z
302,Ugx5Da960CjoUT6yRBR4AaABAg,Just feeding the algorithm I heard it was hungry.... :),Karen O Leary,0,2021-06-01T19:08:43Z
303,UgztEDux1i7qFBBhr5F4AaABAg,"Hey there TUG, yeah I thought she was lying again.....oops yep lying again!",Donna Poskitt,0,2021-06-01T19:07:17Z
304,UgxAmOoPIP_QIE4ujT94AaABAg,"With the way Hollywood and pretty much the entire media ganged up to destroy Johnny, it makes me wonder who Johnny ticked off and why.  Is he spilling what he knows about Hollywood's crimes?  I sure hope so. Glad he’s fighting this.  It is time to acknowledge men can be abused, too, and no one should be lied about.  Thanks @ThatUmbrellaGuy for covering this so thoroughly.",Jennifer Taylor,0,2021-06-01T19:02:57Z
305,UgzHwDRDFSyhhKYB55R4AaABAg,"At this point, i'm wondering when the judge is just going to throw in the towel and say ""Screw this, I'm clearing him (JD) of all charges and awarding him damages for defamation.""",TheGuardianofAzarath,56,2021-06-01T19:01:38Z
306,UgyXmtdaiZEAk-FruYd4AaABAg,"Thanks, great work everytime!!",Laura B,0,2021-06-01T19:00:54Z
307,UgzQJ0zyjTfZ61hNsGt4AaABAg,So glad you're willing to go the extra mile to get the information out to the masses. Keep fighting the good fight.,Peter Allison,4,2021-06-01T19:00:13Z
308,UgwPIF0fLhIWQMWBKrF4AaABAg,They all need to pay JD back the money he out plus for the abuses and make him the ambassador,Cindee Paul,2,2021-06-01T18:58:43Z
309,Ugzq2oTgy00Vv0ab1Rl4AaABAg,Sharing this for the world to see what the truth really looks like.,HippieKathy,2,2021-06-01T18:58:03Z
310,Ugy0g5E6pq2IsvewfEp4AaABAg,i lasted 52 seconds. change the narrator,padraig lyons,1,2021-06-01T18:57:03Z
311,UgwYO4JmwP6Pkq2H5DN4AaABAg,"Sadly even if Depp wins it won’t change anything, the court of public opinion has demanded his career is over, just like what happened with an activision-blizzard voice actor, a court ruled that the claims against him were false and that he was innocent, he was still fired",Doombringer,1,2021-06-01T18:56:19Z
312,Ugw0F-fsN9eJABrgPVZ4AaABAg,Damn TUG mentioned the shiny button... must press it!!,Mr. Biggs,0,2021-06-01T18:56:16Z
313,UgxLlPXcPCONbC6KvL94AaABAg,"Since no one knew AH was going to Court that day for a TEMPORARY R O, *How,* exactly, *did the press know* to be there, what she was there for, and to yell ""Is it true you're making this all up?""  Have Courtrooms in the U.S. started to broadcast restraining order hearings on large screens outside the Courthouse to alert the press who to question as they are leaving? Is there a huge contingency of hundreds of press who wait outside random Courthouses just to see who comes out?  It is far more likely that AH called and informed the press that she was going for a R O, and she was wearing her new, painted-on bruise, that would disappear that night and not be seen on her smiling, laughing face the next day at her lawyers office?  (WHAT is she bragging about...ANYONE can get a temporary R O, you don't require evidence or notification to the respondent...it's a ""just in case"" emergency precaution that is followed by a hearing, within a couple of weeks, where the evidence will be presented and the respondent attends with their OWN evidence!)

AH has no idea about ""our culture's wrath.""  No one cares about a restraining order, but *EVERYONE cares* about false accusations, fabricating evidence, fabricating a crime scene, perjury in depositions, subornation of perjury, obstruction of justice, and witness tampering... not to mention claiming to donate millions to sick children while keeping the money for yourself, accusing the LAPD of willfully lying about seeing evidence of Domestic Violence and ignoring it, and pretending that you are a survivor when you are the abuser.  The only thing worse would be a multi-millionaire who knows the truth, but is so devoid of moral integrity, that he backs you financially, avoids being served to testify, feigns innocence, while trying to cover for you... thus victimizing your victims a second time, *Elon Musk!*",NIBS,0,2021-06-01T18:55:26Z
314,Ugzy_tZaIRDVMDAaeo14AaABAg,Great work TUG!,Amy,0,2021-06-01T18:54:58Z
315,UgyrxOVLuorC5-tyva14AaABAg,"I must not be hearing you right, because I can't find that person on Twitter. I kept trying to go back and hear again, but I can't hear you well.",Brennan Armacost,0,2021-06-01T18:54:07Z
316,UgyB9RYlwcMEvIWjTyJ4AaABAg,Impressive how can one person lie that much 😳,Le Monde,0,2021-06-01T18:51:39Z
317,UgxYm8XvUPVQtbrFtsJ4AaABAg,it is not the fact that she is misremembering things that can happen it happens all the time it is the fact that she has proven beyond a doubt she has lied blatantly and thought she was above the law and could just keep lying to stay ahead of getting in trouble and at one point the world will come back to fact check her but so much of her story is a lie at this point finding what she did not lie about would be a shorter list then what she did lie about,corey spofford,3,2021-06-01T18:51:15Z
318,UgwAIbqPM1pB53TM6Id4AaABAg,Sweet home alabama!,Jamez G.,0,2021-06-01T18:49:14Z
319,Ugzt0RoEpFnNoXL8uX94AaABAg,Yes!!! Thank You!!! Tug!!!,Summeriz19,0,2021-06-01T18:49:03Z
320,UgxcPy8II1i3VR_rObR4AaABAg,I just went to herTwitter page and darned if I can find that video.🤷🏼‍♀️,Mari Victorius,0,2021-06-01T18:48:18Z
321,UgxGnRCRQM2TrA_3pEF4AaABAg,You should make a videos about channels that got blackmailed by companies like that chinese one you mentioned to expose them.,Gino Gauci,0,2021-06-01T18:46:12Z
322,Ugyk1yIYvTVCiRPzQd94AaABAg,Amber is a huge liar 🤥. I really hope that Justice catches up to her in Virginia and is punished for all the terrible things she did to Johnny 🤞🤞. She had no bruise and she totally lied about Johnny abusing her.,Sean B,2,2021-06-01T18:43:28Z
323,UgwDYDMnwwnKnQBcU-V4AaABAg,"This it's sick, what other evidence people and authorities need to put her in jail?",Angie H.,4,2021-06-01T18:42:55Z
324,Ugy67HrgcYMsQOS8tjN4AaABAg,Thank you so much TUG for all the updates! You are awesome!! 😁,Ray Joshoa Dulay,1,2021-06-01T18:42:50Z
325,UgzqOBUC2TSNxvSn6S54AaABAg,Feeding the beast,Nicky Phoenix,0,2021-06-01T18:42:15Z
326,UgxRkX7XzWngbPZTQuV4AaABAg,Wow she just can't tell the truth about anything.,Lorri Holder,0,2021-06-01T18:39:39Z
327,UgzhYp60X4OH6Fze7sd4AaABAg,I pray Justice is finally done,Max Rodz,0,2021-06-01T18:37:29Z
328,Ugx3OWspslJ8I44CKLp4AaABAg,Walks on the beach ⛱,louise,0,2021-06-01T18:37:02Z
329,Ugzxl2A3VEPRqg4XqKt4AaABAg,Here's a comment for ya lol,kijanailis,0,2021-06-01T18:36:18Z
330,UgzIx_-htFX8Cd3VRal4AaABAg,for the algorithm,kazuma kiryu,0,2021-06-01T18:35:48Z
331,UgzCl0sRRanM1lwF5QB4AaABAg,"Thanks  TUG.
Feed the beast 🥕🥑🫒🧅🧄",Jacky VL,0,2021-06-01T18:34:21Z
332,Ugw517PEtvPNl5temvt4AaABAg,"What a TRAP CARD! Hopefully, this will finally destroy AH! This crap against Depp has to stop!!",Gamer Kingdom,0,2021-06-01T18:34:10Z
333,Ugw_4PytMJ85KeSr6YV4AaABAg,Most of that blocking with body happened on Twatter. Everyone was blocked who dared to question AH's story.,Wolfsokaya,63,2021-06-01T18:33:37Z
334,UgzK_e5b1ebXd1JszZB4AaABAg,"Her next movie should be called, A Delusional Mind, because there is no bigger expert on the subject.",James Masters,8,2021-06-01T18:33:08Z
335,UgylKy6TD0yc8G-szNt4AaABAg,"Dude, if she does zero jail time the whole court system will be shown for the farce that it is.",DJ dontstop,6,2021-06-01T18:32:11Z
336,Ugxx0hVyzh_HIGbFZ2F4AaABAg,Algorythm post ^^,Kwich Zwellbreck,0,2021-06-01T18:31:34Z
337,UgxM6o6NZC3RhletLCl4AaABAg,"The Algorithm:""When you saw only one set of footprints,
It was then that I carried you.""",FearofFEMA,5,2021-06-01T18:31:17Z
338,UgxFNYfstFsnplF61rF4AaABAg,Good luck Tug and thank you again great video thousands of paparazzi everywhere yip thousands and a body guard using his arm to hold back the paparazzi brutal strength one man sorry one arm against thousands yip JD needs vindication and liberty,Carmellita Le-Man,0,2021-06-01T18:31:17Z
339,Ugw3od1RZaDGOCjX15J4AaABAg,This is my favorite series on youtube,Ser Art Dayne,0,2021-06-01T18:30:54Z
340,UgxJ95l0O-bY9SUsyLd4AaABAg,I learned to watch this videos as soon as they come out... Otherwise I may not get chance before it's removed...,bagh33ra2,3,2021-06-01T18:30:03Z
341,UgyaqlsCgRjF3OG9ZK94AaABAg,"Narcissists will lie. Then when the lie is exposed as a lie, they will then make up another lie. Narcissists lie without thinking about possible evidence. It boarder lines on delusional. Clearly video cameras were present. Any normal person would not lie, knowing FULL WELL there is video evidence of this. Or, for example, let's say there was a meeting at work, and the Narcissist doesn't show. Their boss goes to them and asks, ""why weren't you at the meeting?"" Narcissist will say, ""What meeting?"" Boss says, ""The meeting I emailed everyone about."" Narcissist says, ""I never got an email."" Boss says, ""Well, yes you did because you replied to that email."" Depending on the type of Narcissist will then determine how they respond. Some will deflect, and claim that it is someone else's fault. Or respond in anger ""how dare you accuse me of lying"". Others will cry and play the victim. Narcissists think they are above and smarter than everyone. If they lie, people will believe them. There are different types of Narcissists. Not an expert. Just saying. This is further evidence that she has some sort of NPD. The constant mental gymnastics and complete disregard of solid evidence, further proves my theory that she's a Narcissist. Again, I can't diagnose anyone. But the similarities or vast. ""I don't care what I have to do to get what I want. I don't care who I have to hurt. I'm going to get what I want."" Thank you for sharing Tug. Appreciate you.",Kahleesee Stark,0,2021-06-01T18:29:30Z
342,UgzCt9HN3WVgN7Z5Ywt4AaABAg,I bet she is squirming in her underpants,David J Biscoe,0,2021-06-01T18:29:17Z
343,UgyX48zLnGLa3PLGmUp4AaABAg,The fact that the aclu is helping her instead of jd is disgusting,Julie Davis,46,2021-06-01T18:29:01Z
344,UgzfhPQGNyyKfegIGEp4AaABAg,Yes!!! More good news! Thanks TUG!!! 😁😁,Batsy,2,2021-06-01T18:28:38Z
345,Ugw-gePR2Qv060usNJ14AaABAg,damn law battles are smart,Dave Stanton,0,2021-06-01T18:28:33Z
346,UgyGLq-zLBAzm7WOGfR4AaABAg,"Damn, how many videos are you gonna make on this, at this point its coming off creepy",Ratpak g,0,2021-06-01T18:28:13Z
347,Ugxo5IqdWjpfSwUp87x4AaABAg,"This ""Woman"" is a disgrace.  Thanks for all the videos TUG, Blessings from Scotland. 🙏🏴󠁧󠁢󠁳󠁣󠁴󠁿🌹",Eve,5,2021-06-01T18:27:45Z
348,Ugwd-ElLhP2yUpP0jyV4AaABAg,"Justice for Johnny! Fingers crossed, women need to be treated equal!!! Get her in jail and take all her money and fuck her dads job up too",johnnyboy2459,0,2021-06-01T18:27:28Z
349,UgzCR7JUiJ-ZV7VSh754AaABAg,here's some snacks for the algorithm,Helena Doyle,1,2021-06-01T18:27:04Z
350,Ugy7Uc86M85LyHoxwvd4AaABAg,"Man , she's such a f'n LIAR - if she said it was Tuesday, I'd have to go check a calendar!!  
NOT a bruise - it's a raging pimple.",Marie,0,2021-06-01T18:26:29Z
351,UgzI5jPmx911QPpHBph4AaABAg,"No offense, but legally speaking this isn’t actually much to go on.  Her defense teams can easily say, “ it was an exaggeration your honor”. And it would work. Yes the bit about no protection is false, but her lawyers can easily claim that the dude shielding her was her lawyer at the time and that the ‘hundreds’ of photographers were all exaggerated for the sake of impact. We’re going to need more than this. 

I studied media law in college, this clip doesn’t do much, unfortunately. Don’t get me wrong, I wanna see her taken down too, but this isn’t what’s going to do it.",Elder Liddle,2,2021-06-01T18:25:16Z
352,UgxdhMP-IE0AianAqHp4AaABAg,"Feeding the algorithm, thank you TUG",Caro,0,2021-06-01T18:25:00Z
353,UgyxblJ1um6gzSziTIZ4AaABAg,Great work!,Mongo Cribdeath,1,2021-06-01T18:23:43Z
