,parentId,authorDisplayName,replyComment,publishedAt,likeCount
0,UgwJxHCJBv-yLgFqLkl4AaABAg,Kayte 0207,I totally agree…,2021-07-23T21:27:51Z,0
1,UgwJxHCJBv-yLgFqLkl4AaABAg,Amirah Kukan,god i know......,2021-05-12T11:14:59Z,2
2,Ugx49tB-taBjZjKTXjl4AaABAg,Rock Candy,"she is diagnose BPD but has other issues as well...pathological liar, narcissistic, sociopathic and she addicted to amphetamines, coke, alcohol and she's vi0lent.  so while i'm not a therapist, i think there's a lot going on in her head at any given time - and not in a good way...",2021-06-22T20:34:34Z,1
3,Ugy5fWga9LkdViGP2dd4AaABAg,Kayte 0207,"The Amber Heard Playlist,     This is NOT fake.  You just don’t like the fact that the tapes were released, because they contradict all of the crap on your damned “Amber Playlists”.   If you really want fake, take a good look at the garbage you put out.",2021-07-22T23:10:59Z,0
4,Ugy5fWga9LkdViGP2dd4AaABAg,lazy chic,How?,2021-05-14T18:47:04Z,0
5,UgzvdgiSP9-jeFnjGyZ4AaABAg,Amirah Kukan,yeah i think i read that he didn't want to rush the day.  his friends were greatly concerned. they didn't like her. they didn't know how to tell him. it was a mess,2021-05-12T11:17:38Z,2
6,UgxdE_QX3FEyRoBSslB4AaABAg,Rock Candy,he called the monster his addictions.  but she was gaslighting him and told him that he turns into a monster when he drinks and he actually started to believe it.,2021-06-22T20:27:54Z,0
7,UgxdE_QX3FEyRoBSslB4AaABAg,bianca devino,The Monster is just him getting angry. SMFH,2021-03-31T03:53:09Z,1
8,UgwRgZX35CnA8lDbytd4AaABAg,Ina Wrede,"Sounded to me, as if somebody is snorting something, yes.. I have a vague idea what it could be..",2021-04-01T23:15:21Z,1
9,UgwqpBoIx_XUEfhQh3d4AaABAg,Carina Snape,He won't. She did too many crazy things to him and he's sueing her in Virginia,2020-12-28T22:00:12Z,2
10,UgyxKkQAbYlq6FYj8Ax4AaABAg,Customer Service,"Excuse me?  The solution would have been for him to stay sober and control himself, but he refused to do that.",2021-01-25T00:40:23Z,0
11,UgyoZmEVp9VE2FV6krx4AaABAg,T_ray,"He's really not being manipulative at all. She is though. So what if he trashed a hotel room when he was younger or if he got hooked on alcohol and drugs. The difference between him and her is that he fully admitted to all his flaws and talked about them openly in court. She couldn't even admit that she was doing cocaine. Again, none of this proves he physically abused her however there is proof she physically abused him.",2021-01-04T09:51:57Z,10
12,UgyoZmEVp9VE2FV6krx4AaABAg,Annette Greaves,Doesn't make him a wife beater,2020-12-12T16:18:22Z,13
13,UgxYtyT4KPegR2kq7uF4AaABAg,Rose Margie,"@Customer Service lol... question have you ever seen any of his other interviews? That's just how he is clearly you didn't do any research lol. Also all evidence points to amber being the abuser.....listen i could sit here writing full essay on why Amber is the abuser......but the best thing for you to do is RESEARCH!!! if you still think johnny is a "" douchebag "" after that then we can talk.",2021-01-25T05:47:35Z,6
14,UgxYtyT4KPegR2kq7uF4AaABAg,Customer Service,He's drugged on Xanax that's why he sounds so calm on these.  He's on a sedative.  The other tapes are completely different & show what he's normally like around her... an aggressive angry douchebag who treats her like garbage.,2021-01-25T00:42:17Z,0
15,UgxWPzc9aMqr0VIYhmx4AaABAg,Rock Candy,that's the sad part...he was so trapped.,2021-06-22T20:25:49Z,0
16,UgyerQdM58DQ5JGhtBd4AaABAg,Rock Candy,he's not a hothead...she's projecting.  She likes him around because she's an avuser and needs someone to avuse. (replace v with b),2021-06-22T20:24:47Z,0
17,Ugw-j43lH0-qBObdiRV4AaABAg,Amirah Kukan,exactly. she gaslighted him with his own words. broke my heart,2021-05-12T11:13:47Z,0
18,Ugxs9jfyfSO3Menst4V4AaABAg,bianca devino,EXACTLY!!!!!!!!!!!!!!!!!!!!!!!!!!!!!!!!!!!!!!,2021-03-31T03:59:27Z,1
19,Ugxs9jfyfSO3Menst4V4AaABAg,F E,"Also, she is provoking him to lash out, in order to bolster her future lawsuit. As Jerry Judge said, ""She knows exactly what she is doing."" Everyone has a line in the sand, and she keeps pushing him towards it. He leaves because he does not want to obliterate her. Removing himself is his only move. AH complains and demeans because JD gets a chance to cool down when away. She doesn't want that.",2020-12-26T00:15:40Z,10
20,Ugwi8feeUhb0rY4WK1N4AaABAg,Carina Snape,"He loved his mother until she died, and she was an abusive person who beat him up as a child. Not a good mother but children always love their parents because they're the first persons they can hold onto...",2020-12-28T22:02:12Z,5
21,Ugwi8feeUhb0rY4WK1N4AaABAg,Denise Metzger,"He said it himself in the July 2016 tape, she was a made up thing in his head.  He fell in love with am illusion, a lie.",2020-11-25T10:26:33Z,7
22,UgzLBTKoBvCsIIDsn754AaABAg,Dennis Karlsson,"@TX Tx Oh, can't help you with that one. I hope someone will translate it for you.",2021-01-25T20:13:16Z,1
23,UgzLBTKoBvCsIIDsn754AaABAg,TX Tx,@Dennis Karlsson Spanish,2021-01-25T20:10:32Z,0
24,UgzLBTKoBvCsIIDsn754AaABAg,Dennis Karlsson,To what language?,2021-01-25T19:51:11Z,1
25,UgyZTD7OYI4OrrP3N5N4AaABAg,TheLittle Atari,"@Rock Candy she was, she wanted his penthouses in the divorce!",2021-06-22T20:22:17Z,2
26,UgyZTD7OYI4OrrP3N5N4AaABAg,Rock Candy,sounds like she's angling for a house...,2021-06-22T20:20:45Z,1
27,UgyZTD7OYI4OrrP3N5N4AaABAg,Amirah Kukan,and he said she could stay for as long as she wanted. she is evil . period,2021-05-12T11:11:47Z,1
28,UgyZTD7OYI4OrrP3N5N4AaABAg,Oscillate Wildly,@Denise Metzger wow!,2021-01-20T08:58:06Z,0
29,UgyZTD7OYI4OrrP3N5N4AaABAg,Carina Snape,@Denise Metzger yeah I think it was more....,2020-12-28T21:56:54Z,0
30,UgxDMvhq7asRpi-4Wj54AaABAg,Julie Barr-Thoms,Thanks I was wondering that too,2021-05-19T21:09:00Z,0
31,UgxDMvhq7asRpi-4Wj54AaABAg,MARY JOU,@H Ibrahim thanks for the information,2020-11-12T21:30:09Z,1
32,UgxDMvhq7asRpi-4Wj54AaABAg,H Ibrahim,"Amber recorded it, but both know they are being recorded. They used the tapes for marriage therapy.",2020-11-12T21:10:25Z,5
33,UgylH_01HhGB-eqxzkJ4AaABAg,Hannah Search,@Rose Harvey how do I report customer service so he can no longer comment on YouTube videos?,2021-09-17T03:17:31Z,1
34,UgylH_01HhGB-eqxzkJ4AaABAg,Hannah Search,@Customer Service 🙄🙄,2021-09-17T03:13:12Z,0
35,UgylH_01HhGB-eqxzkJ4AaABAg,Rose Harvey,@Customer Service that must be why she asked for 2 land rovers along with 55k  pm and 3 penthouses.,2021-05-13T22:37:14Z,1
36,UgylH_01HhGB-eqxzkJ4AaABAg,Customer Service,@Rose Harvey Yes she did. Read it again because you got it wrong the first time. She never said he wouldn’t let her drive. Not even close. There is a huge difference between having access to a car that someone else owns and having your own vehicle in terms of the independence it allows you. He was trying to isolate her being removing those freedoms or complicating her access. He also had his staff watching her which is beyond disturbing. And some of you have the nerve to make claims about her mental state? You’re unbelievable hypocrites. Enjoy watching him lose in Va. I know I will.,2021-05-13T22:20:13Z,0
37,UgylH_01HhGB-eqxzkJ4AaABAg,Rose Harvey,"@Customer Service no that is not what she said. She didn't even mention the refurbishment of her car by the TV programme, she said she he didn't let her drive. She never mentioned the land rovers he put her on the insurance. Everything for her was that he was controlling her and she didn't have her freedom. It was a bit like when she accused MUSK of bugging the Tesla he gave her. Those cars are full of cameras and artificial intelligence. She wants everything to be given to her but then says she is being controlled. In reality she doesn't have to accept gifts from her husband or boyfriend, she can pay her own way and then she would not have to be worried about losing her independence.",2021-05-13T22:14:01Z,2
38,UgwqySy73EGHDcIMHYp4AaABAg,Cassie Campbell,"@#JohnnyDeppIsARapist!! #JohnnyDeppesracista they were just using him for his money, like Amber.",2021-04-11T05:47:31Z,3
39,UgwqySy73EGHDcIMHYp4AaABAg,Cassie Campbell,"@#JohnnyDeppIsARapist!! #JohnnyDeppesracista lmao no they are terrible ppl, they are friends with her, loyal to her, not him.",2021-04-11T05:46:49Z,4
40,UgwqySy73EGHDcIMHYp4AaABAg,#JohnnyDeppIsARapist!! #JohnnyDeppesracista,If they testified for amber and lived there rent free you know they are telling the truth cause they would want to side with him,2021-04-09T01:12:26Z,0
41,UgwqySy73EGHDcIMHYp4AaABAg,g0blin Fractal,whuuuuut???,2021-03-30T21:36:57Z,0
42,UgwqySy73EGHDcIMHYp4AaABAg,Doktor Zhigonzo,"not to mention they brought knives to amber, possibly to harm depp with",2021-01-02T03:26:27Z,5
43,Ugwbdpg5AJcwizmDvFp4AaABAg,Jan Price,"@Rock Candy yep, I do. She's something else!",2021-06-22T20:59:52Z,1
44,Ugwbdpg5AJcwizmDvFp4AaABAg,Rock Candy,@Jan Price interesting...remember how she smiled in the deposition.  maybe those audios are like a type of trophy for her ...where she can relive the avuse.,2021-06-22T20:41:37Z,1
45,Ugwbdpg5AJcwizmDvFp4AaABAg,Jan Price,They both did thinking it would help to listen. In reality tho I think she just liked hearing herself doing all these vile things to Johnny.,2020-11-06T03:31:44Z,4
46,UgxE6B2CzAocgqY7s1V4AaABAg,H Ibrahim,"She is lying abou the abuse though. She was the one who started physical fights, not him. She sees things differently due to her BPD which causes distortion of reality.",2020-11-12T21:12:46Z,9
47,Ugy4x_-H6wnsG_VV6E14AaABAg,Karen Johnson,@Carina Snape crochet is the new rock n roll '...did you not know ?🤣🤣🤣,2020-12-28T22:19:40Z,0
48,Ugy4x_-H6wnsG_VV6E14AaABAg,Carina Snape,😂😂😂 That's actually sad...,2020-12-28T21:59:11Z,0
49,Ugy4x_-H6wnsG_VV6E14AaABAg,Rose Harvey,Very good.,2020-11-10T11:01:13Z,1
50,UgxdLeckaM9H028VfYJ4AaABAg,Kayte 0207,@The Amber Heard Playlist!!   Nope.  I am NOT watching the crap you put out…,2021-07-23T21:01:57Z,0
51,UgxdLeckaM9H028VfYJ4AaABAg,The Amber Heard Playlist!!,Watch my #JusticeforJohnnyDepp video on the Amber Heard Playlist on my channel,2021-04-09T01:13:33Z,1
52,Ugx-6mCk8okdW2h3ncx4AaABAg,Elisa Rivas,"@Bonnie B I love them and show it by treating them kindly, but I don't cope well much, either. I'm a pretty negative person who has trust issues who lives as a hermit and doesn't keep in contact often enough to close friends because of what I've been through. I still have friends and a boyfriend, but very few (5 excluding my boyfriend and my grandmother, who I live with, and one of those friends is my little sister, but I contact these friends a few times a year. I just always have the thought in my head, ""my own mother backstabbed me, how do I know my best friend won't."" I know it's irrational, but the thoughts come every so often.) I lend a helping hand and I'll be a shoulder for them (abusers and those who have hurt me) to cry on, I may even be a slight part of their lives every so often, but I'll close up to them when it's about myself. Thank you. I wish you well and I'm sorry for what you've had to go through as well. Life brings shit that we must grossly dig our way through.",2020-11-17T20:14:15Z,3
53,Ugx-6mCk8okdW2h3ncx4AaABAg,Bonnie B,"@Elisa Rivas I'm sorry to hear you went through all of that & I certainly understand from a position of circumstances, in my case my brain has refused to allow it in, really in. So I have no frame of reference to feel very much. I guess it's a coping mechanism & I have just started work on (as my therapist puts it) ""unburdening what you are carrying around"" I know a lot happened but it's a different person to me. A dissociative experience. A refusal of my brain to even go there. Of course I'm talking to you now about it peripherally but still it's like it's not me I'm speaking of. Very strange how we deal with things. 
I'm inspired by the things I hear and you have been  so strong in going this far with dignity & love. 
I worry I may not I suppose. I certainly haven't in the past by using substances &  really not giving thoughts as to why?  Now, luckily that has been dealt with & I'm moving forward with opening up the gates I've locked. 
Kind regards to you.",2020-11-17T19:35:11Z,2
54,Ugx-6mCk8okdW2h3ncx4AaABAg,Elisa Rivas,"@Bonnie B That is true. Love and forgiveness for an abuser is so difficult. I forgave and love, but if I hadn't been taught from my friends, some peers, teachers and my little sister, I don't think I would've been so nice to my abusers (I've had three; two family members by blood and a man who married my mother; I've been through every kind of abuse except sexual, thank God I never had that scar, but the worst of all was watching them hurt my sister to get to me. Any normal person would hate these people. I had to go through a lot to not hate them and I can say it's not easy to do. I understand why Johnny vented to his friends sometimes. Very difficult)",2020-11-17T19:11:52Z,4
55,Ugx-6mCk8okdW2h3ncx4AaABAg,Bonnie B,"@Elisa Rivas Of course, when I say saint I don't mean it literally, flaws a plenty but not with what he is being so egregiously accused of. 
There are limits to which one can be tested. He put up with horrors from that woman and how he bowed out & even offered love right until the bitter end is saintly. Not many could do the same.",2020-11-17T18:37:18Z,3
56,Ugx-6mCk8okdW2h3ncx4AaABAg,Elisa Rivas,"As a Johnny Depp fan, I'm still not ignorant to his flaws. He's no saint, but he is admirable. I'm so proud that he's standing up for himself and I'm sorry for what he went through. Also being a victim of DV, this was heartbreaking to listen to.",2020-11-17T18:09:47Z,9
57,UgzYy1KITTttftvaB_p4AaABAg,Families Supporting Trauma Recovery,These tapes are a gift to humanity. A lot of people go through this. We know they will crucify her for the Toronto tapes. These lawyers lie more than Depp Times 100. They’re like masterbators In class who don’t know people see them.,2021-02-23T03:18:33Z,0
58,UgzYy1KITTttftvaB_p4AaABAg,Dana Marin,"I agree, from what I've heard in these, she's a master at gaslighting and manipulating.",2020-10-26T15:28:28Z,11
59,UgyIzMEqILEe9isMfN54AaABAg,TwoNoisyLorrikeets,"@Cassie Campbell March 2015 = Australia
September 2015= Toronto
April 2016 = poop (after ah birthday party LA)",2021-04-13T04:33:44Z,0
60,UgyIzMEqILEe9isMfN54AaABAg,Cassie Campbell,was this after the australia incident? and wait I forgot was toronto the time when Amber shit on the bed?,2021-04-11T05:49:19Z,0
