,id,comment,author,likecount,publishedAt
0,Ugyx4-zj5DpaZWce06R4AaABAg,"Just To Clarify, The Words ""Ab*se"", Domest*c V*olence"" & others words close to that are censored because youtube is limiting our videos when we use those words due to their community guidelines. also, putting ""Johnny Depp"" in our videos no matter the subject gets the video limited. is youtube censoring johnny depp???",Viral Vision,1236,2021-02-15T22:39:01Z
1,Ugz4Wzjt5OyOjXtonUx4AaABAg,Better SCRAM from and get another role but  got bad reputation now so maybe bangbros might do a favor for a few bucks...👍🏼 make a great Gold digger Role😂,Rocío Palacios,0,2021-11-01T14:50:26Z
2,UgwlTGsnPdfRk4toWER4AaABAg,Amber is a horrible human being and a violent narcissistic sociopathic abuser. as a male abuse victim myself I hope she gets all the bad karma she's earned . Being blacklisted from most films is honestly far less than she deserves. Even eternity in purgatory is too good for abusers.,Mike Fink,0,2021-10-18T21:16:58Z
3,UgxsY9VBpIsfAz7GkHZ4AaABAg,Good abusers should be blacklisted. I know I won't see aquaman 2 or at least i won't pay a penny to them i may pirate the film lol,Mike Fink,0,2021-10-18T21:13:13Z
4,Ugz204S_OLbt0ob0Kjd4AaABAg,"You brought all of it upon yourself, Amber! Own it. Ugh!😵",Elizabeth Kubli,0,2021-09-27T00:31:48Z
5,UgyS-B3OaGJ9qV7wN0h4AaABAg,We will never watch anything she in becouse it would support her bad behaviour. You don't get to play a hero if your scum it sends a bad message.,Penny Willstrop,0,2021-09-23T13:58:01Z
6,Ugwmgb1M0hsRM66OY_d4AaABAg,If she was a man she would be locked up.,Penny Willstrop,0,2021-09-23T13:53:34Z
7,UgxJXRz2dzIFGTvUbyJ4AaABAg,"If any Hollywood studio wants their movies to bomb at the box office then just hire 💩face 
She ruins every movie she’s in",Lindsey Depp,0,2021-08-26T19:32:48Z
8,UgxiHyT1vxf9BmO1kDN4AaABAg,You bleep so much I can’t even follow what your saying,Brian King,0,2021-08-12T15:43:56Z
9,UgyfHAAUwYTNpsWaN_B4AaABAg,That's the general idea girl🤣🤣🤣 #Justice for Johnny Depp❤❤❤,Underdog Bjorn,0,2021-06-23T09:59:34Z
10,UgwvMqjTNyNLSZrcI7F4AaABAg,"Disney doesn't like Very Strong Negative from the person and even  Amber Heard be having short of a boat.
They just letting her go from all company business is bad to be keeping Amber Heard round ,since everything she does is Very Strong Negative not Postatvie in any shape of form.",Jim Coleman,1,2021-06-22T23:34:29Z
11,UgwYiOaett-HnDTPpvN4AaABAg,"Ambar deserves to go jail.  Very bad person, harmful and cynical.",Lilia Lucciola,1,2021-06-16T15:04:36Z
12,UgyPzirbuUbK9emNg7F4AaABAg,That cow deserve everything she got she practically broke that man when was incredible actress practically destroyed the man,Vic t Campbell,0,2021-06-15T02:54:36Z
13,UgzSuSx2ejcgbX5pVJ54AaABAg,Stop accusing Johnny depp you only want his money. You are a manipulator. Thats so evil and demonic tricks of you lady Heard!,donna marie sarne,1,2021-06-12T12:52:03Z
14,UgxVJgAnsy0tAmf-8GF4AaABAg,I can't believe that people are making petitions to support AH on change.org and keep her on Aquaman 2,The Call of the Jay,1,2021-05-28T09:08:14Z
15,Ugw7AO5UHAsBLfd68gB4AaABAg,She not be offered any work from credible companies or agencies for acting roles. She has failed at her all time block buster roll of really it had probably been in her eyes her best performance yet. She had the leading role yet her co star certainly out shone her. I believe anyone who hires her will no doubt be boycotted in droves that's Merch too. So the best job for her is yacht girl like Smeg Debarcarle and the frog prince,Shelley OMalley,1,2021-05-18T13:43:51Z
16,UgycJIk6ChF6DBhSX-54AaABAg,Each time you stop from saying abouse or hit or punch or cut it's just cringe af bro just do your videos right,Uriel Alba,0,2021-05-13T05:09:12Z
17,UgzcmHCJ-5ZbZlPuFQl4AaABAg,You can't say the word abuse ? You keep stopping,Uriel Alba,0,2021-05-13T05:07:34Z
18,UgyDa7IHqOm23PalK1B4AaABAg,"I don't even think she's that good looking or that great of an actress, aside from being a succubus. Does anyone see the appeal with her?",Moon Summersong,0,2021-05-07T02:28:20Z
19,Ugx_w_20l7wcyjnYOpV4AaABAg,As a Amber Heard fan I am disappointed in her bc I didn't know that she could abuse a good man for no reason and about Aquaman 2 if she gets fired I don't know how to feel bc I am still a fan of her until this day but at the same time I want to give Johnny justice. The role Mera fits her but I can't forget the fact that she abused a man but I hope Johnny will get justice after everything and I hope Amber will change.,Kyllie Alcantara,0,2021-04-25T13:09:15Z
20,UgzbULpqHaTzmhHHna54AaABAg,Ditch the witch DC,Lindane Mnguni,2,2021-04-25T03:30:02Z
21,Ugw_dFi20CC8OuoKVtZ4AaABAg,She's only got herself to blame. Good riddance to the cow. She's not a very good actress anyway.,Helen Henshaw,1,2021-04-23T08:59:39Z
22,UgwcTYqidohNNij3ffh4AaABAg,Peter quill: Did we just win,Jack Adams,0,2021-04-18T16:27:52Z
23,Ugz_s9k1dPB6y8k70Ox4AaABAg,"""Thats Crazy""

I don't understand why she has been charged with the pre-mediated falsifying of her so called evidence and the Purgery she has committed on more than one occasion.  Lock the psyhcotic thing up where she belongs.  She's the one that flew over the cookcoo's nest and never landed, she is one mean manipulative piece of work.  Let her get what she deserves and anyone else associated with her lies.",Jennifer Stewart,1,2021-04-17T10:15:29Z
24,UgyZcTghfyDN2RaojR54AaABAg,No it's hakka ;),Versatile Pro,0,2021-04-03T11:27:20Z
25,UgxwUP5iKKE_IyE_weh4AaABAg,She lies I will not trust her.⚖️🤨,midnightxuser@gmail.com,0,2021-04-01T14:41:14Z
26,UgyXk7MRWCoJukNM1GZ4AaABAg,Salut dernier CADEAU DE MA PART.. J OUVRE EN TANT QUE FILLE FEMME LES YEUX D AMBER HEAD AVEC TOUT MON. RESPECT POUR ELLE ET JOHNNY.. PAS FACILE DE DONNER MON AVIS CAR ICI CETTE AFFAIRE REPRÉSENTE LE COMBAT DE LA FEMME ICI BLONDE CONNUE AUSSI TALENT. ARTISTIQUE BOURREE DE CHARME COMME TOUT CES VRAI. ES ARTISTES D HIER ET LA RELÈVE D AUJOURD HUI...DONC PIÈGE PR MOI DE DONNER MON AVIS EN TANT QUE FEMME VS ME METTEZ COUTEAU À LA GORGE.. 2021 LE COUPLÉ PR MOI C EST 50/50 ABAT VIOLENCE DES 2 CÔTÉS.. LES TEMPS MENTALITÉ ONT CHANGÉ EVOLUÉ.. ÇA VEUT DIRE QUE LE COMBAT DE LA FEMME D AUJOURD HUI DANS CE MONDE QUI SE DIT MODERNE N EST PLUS LE MÊME.. SE DÉFENDRE OUI AMBER. HEAD MAIS 2021..PLUS POUR EN TERRE HUMILIER MASSACRE POMPER FRIXDE VOS EX MARI JUSQU A VOULOIR LES FICHENT À L ASILE PSYCHIATRIQUE ET OU EN PRISON PIRE ENVOYEZ VOS MECS OU EX MARI À LA MORGUE POUR JUSTE GAGNER DU FRIC ET GAGNER UN RO'E.. ICI MAUVAIS COMBAT DE LA FEMME.. CAR CROIT BIEN FAIT AVEC TOUT CET ACHARNEMENT.. CAR COMBAT JUSTICE IMMATURE PUÉRILE.. VOILÀ J ESPÈRE QUE CELA VA TE FAIRE RÉFLÉCHIR EVO'UE ME TALITE HANGE DE TACTIQUE COMBAT PR METTRE FIN À CE COMBAT DIABOLIQUE SANS FIN ET SALE IMAGE DE NOS JOURS DE RELATION COUPLÉ ENTRE LA FEMME ET L HOMME D AUJOURD HUI À CONTRARIO ET LOIN DE L. AMOUR DES ANNEES 80/2000..PLUS NAÏF.. SANS INTERRET.. MERCI À VS TOUS D ACCEPTER MA CRITIQUE CERTES HARD MAIS POSITIVE PR EN FINIR AVEC TOUS ÇA ET VS LIBÉRER ET REORNER CHACUN À LA VIE SANTÉ PAIX LIBERTÉ PROJET AVENIR.. LA VIE EST TROP BELLE PR PERDRE SON TEMPS DANS LA FUTILITÉ RELATION AMOUR ET DIALOGUE PUÉRILE.. BYYYYYE BON COURAGE ARRANGEZ VS. SALE IMAGE. POUR PUBLIC EN PLEIN COVID OU DOIT RÉGNER NORMALEMENT BON CONTACT ENTRAIDE SOLIDARITE,David Chalom,0,2021-04-01T08:53:17Z
27,UgwirD6ATV95zJG8e6Z4AaABAg,go Amber Depp sucks!!!!!,Joseph byg,0,2021-03-30T01:42:50Z
28,UgxnxwALmSMiVKEizA54AaABAg,Justice for Johnny!!!!!,Liberty,0,2021-03-28T08:32:11Z
29,Ugw5zbhTMD30nDQZH0F4AaABAg,Guess she can go on welfare.,Glenn Webster,0,2021-03-17T06:05:14Z
30,UgwX9otv03TX9J2MlLd4AaABAg,"She really isn't that good an actor. Her best work is all CGI enhanced. So, her bridges aren't too very stable and I believe they are already too weak to continue to stand. Personally, I know I will never see her on the silver screen again. She doesn't deserve my attention and a bulk of the people I know, agree!

Related: A hypnotist used to entertain us in the Marine Corps as a morale booster and to dissemminate internal propaganda. He would say, ""As quick as the water in a bucket fills the space your hand occupied in it, is as fast as you can be replaced in the Marine Corps."" It is true!!! The Amber Heards of the world should take heed. Yes, it applies to the civilian world too. You are all replaceable. Please don't die to prove it. People hate liars, greedy, evil, thieving, abusive liars least of all. Karma hates them even more. Ms. Heard, not even sorry to say, you're fired!

What should the punishment be for torturing a person and destroying their life and career for 6 years?",Warhol's Circus,1,2021-03-15T13:52:14Z
31,Ugzsg4S2ljNhuNJxsUZ4AaABAg,If she is in Aquaman 2 nobody is going to see it. Really want to risk that?,Ennovative,0,2021-03-15T13:31:36Z
32,Ugw_W6scraDR9hQZP2t4AaABAg,She won't be able to get a job at BRAZZERS after this.,Ennovative,2,2021-03-15T13:29:20Z
33,UgzFLXB33fyJ7BBL4RV4AaABAg,This is what she deserves,Chronicler productions,0,2021-03-15T02:45:06Z
34,UgzU_PLZXxYUc6lazPx4AaABAg,Are we supposed to care AH🤨nobody will cast me....................chile anyways,Bookie Law,0,2021-03-14T23:31:47Z
35,UgxV-mRmWte83hfy0_p4AaABAg,"Sorry Amber, no one's going to watch any of your movies anymore (i actually never did...). You won't be missed. Bye!",stinabo,1,2021-03-14T17:38:19Z
36,UgybWYzhMOgHH70AHaJ4AaABAg,She needs to be removed... to JAIL,Motherfunxx,1,2021-03-14T02:45:22Z
37,UgxDK4YN5zqxA8vIJc14AaABAg,Serves you right for doing all you did to JohnnyDepp 😠😠😠,Sharn Delane,0,2021-03-13T18:50:09Z
38,Ugz9m1Za3FAImaadlR14AaABAg,"I will not watch any movies of AH.

If johnny is removed, im not watching any. #teamjohnny",Erin Liew,0,2021-03-13T10:40:07Z
39,UgzIjA0746jFOT9lyRt4AaABAg,It’s not because of the petitions...,ElloNasty,0,2021-03-12T10:14:03Z
40,UgyOD-bFAS6pI0rQQ0p4AaABAg,Oh no!.... anyway....... 🙄,Elise Parr,0,2021-03-11T09:46:07Z
41,UgzGul0fgdnwd7VlIut4AaABAg,"she should not be allowed to be on star wars, absolutely not.",BeyDiario,1,2021-03-11T00:33:21Z
42,UgxSLC9RZ6TPhFNQP6B4AaABAg,Hopefully Johnny gets justice soon,Claudia Vogel,2,2021-03-10T16:19:14Z
43,Ugxj_0R7P_lqsuWJ7_94AaABAg,"I hate that censorship has become so absurd that the word ""abuse"" and ""abuser"" cannot be said on video's. 
I just hate this world.",funkyfiss,15,2021-03-10T14:19:15Z
44,UgwkphLmk5Tj8eZGMph4AaABAg,Feel the pain.,Øppa1 Gød,0,2021-03-09T23:36:35Z
45,UgyXB5rOzR6ZavBzdmd4AaABAg,Disney shouldn't take her in,Prakash Mohapatra,0,2021-03-09T23:33:13Z
46,Ugwtj1xCMijW_deKqHN4AaABAg,Team Johnny all the way! Also happy to be one of the many to sign petitions against Amber Turd!,KittyKAT666Meow,1,2021-03-09T23:30:57Z
47,Ugzju1CRU8PNXfmYqFZ4AaABAg,"She did that to herself  
She got to agree that",IDK,0,2021-03-09T18:31:12Z
48,UgxyV4qnjAS4Jd4U31N4AaABAg,Bij get rekt 😆 Justice for Johnny Boy ✊✊✊,Rin Ryu,0,2021-03-09T17:59:41Z
49,Ugyp3ODaEkXhTXtLbGl4AaABAg,She made 0 success. Omg how can u say this. The reason why it was a good movie becuz all of their movies were bad. They just finally made a nice content. Stop simping,ICEMAN DEV,0,2021-03-09T00:24:06Z
50,UgzGW5I9YGp6qdSnf094AaABAg,I hate her she killed pirates of the Carribbean,Another Unicorn,0,2021-03-08T23:25:51Z
51,UgwUl5kRAejSqoIhRBR4AaABAg,"I will F-ing stop Watching SW if AH is ever in one, Duck her",A Piplup,1,2021-03-08T23:07:39Z
52,Ugxnrd6qU2NmXBwHdip4AaABAg,😂😂😂 She has high hopes,かぼちゃ,0,2021-03-08T14:09:05Z
53,UgwSfxx2NGV6Ie5A6yN4AaABAg,TEAM #JFJD WHERE YA‘LL,Lena Vgt,0,2021-03-08T12:55:30Z
54,UgysZgxecorNPZIMxeh4AaABAg,Yea & nobody will hire Johnny Depp because you lie.,Devan Vieira,0,2021-03-07T04:13:56Z
55,UgwyBQCKuhfMWDVJDwZ4AaABAg,I'm glad AH is having a hard time. She needs to answer for her lies!,Dreama Collins,0,2021-03-07T02:02:45Z
56,Ugwh8p3Moe-sMmw0Xwp4AaABAg,"if she continues to get work in hollywood, that just shows SUCH A DISGUSTING DOUBLE STANDARD. she should do time not only for the abuse but how she obviously targeted johnny and MOST LIKELY had these plans to lie and ruin him from the beginning. her not being punished tells others that false accusations aren't a big deal and you won't get in trouble. WRONG! 
FUCK her.",itisiyoungmonny,0,2021-03-07T00:38:27Z
57,UgxoBqfkAtZB1YG6BE14AaABAg,Leave her jobless. Hopefully then shes hits rock bottom and learn not to f... With folks,Diana🔥Brito🦋,0,2021-03-06T22:29:46Z
58,UgyvpgRzdjucwlrwVM54AaABAg,Unless Amber Heard is a Stormtrooper in Starwars...and you never see her...I will NOT watch a Starwars movie that stars her..never ever. It is so disgusting how quick they were to fire Depp but they won't fire her for falsely accusing him...disgusting,Goose 1302,0,2021-03-06T21:53:50Z
59,Ugx-yz1qmGWovTuJF5p4AaABAg,HAA HAA!! Take her WHOLE career away and throw her in jail.,The Sage,0,2021-03-06T20:19:06Z
60,UgwZSqyPoleHPEv5Ok94AaABAg,"EC is the lead queen JM deserves! Get RID of AH, throw the whole person away!",Karli Stull,1,2021-03-06T14:05:57Z
61,UgwnWfOPZbW9iL-JcL54AaABAg,YouTube STOP CENSORING  what doesn’t fit your narrative !!! Amber was the abuser !,Michael Cipriano,1,2021-03-06T13:32:42Z
62,UgzcXmY9LLvloS6i1T54AaABAg,Never watch any movie with Amber ever !,Michael Cipriano,1,2021-03-06T13:28:17Z
63,UgxDaPKzvZ9iobHwE8p4AaABAg,"Not true, nobody will hire her for movie roles because she's an evil, loathsome, obnoxious twat.",Kerr Avon,1,2021-03-06T11:51:56Z
64,UgzMTi173G75hxj_ZDh4AaABAg,Elton can use her in his space x adverts,JASON KNIGHT,0,2021-03-06T11:24:18Z
65,Ugw2z07spoIqP7SoQNR4AaABAg,where do i sign this petition?,Lance Mkhokheli Dube,0,2021-03-06T08:09:55Z
66,UgyS01fekJb0AXmN8-t4AaABAg,why is this guy censoring words that don't need to be or is it just my laptop fucking with me.,Tomasi Nasau,0,2021-03-06T07:32:13Z
67,UgwCwmCnwYzt47_U3Dt4AaABAg,im boycotting all disney movies...its ridicules they keep her...the real abuser..and fire johnny...js,soni stowe,0,2021-03-06T01:36:12Z
68,UgwEzkpYkk2b6DNnb794AaABAg,Ha!! A'int Karma a Bitch?,Linda Bright,0,2021-03-05T21:31:54Z
69,UgyCnyitgd7BGtf6FTp4AaABAg,"Imagine having to post this well edited amazing content like this but having to censor it every time as harshly as they have to. FFS youtube.

Great video nonetheless, if anything more impressive for the extra ""editing"" u are forced to do lol",XELPLAYSGAMES,0,2021-03-05T20:55:32Z
70,Ugy-ceCK5aHP4WPb4GJ4AaABAg,She should be in JAIL!,Ruth Anderson,0,2021-03-05T19:03:27Z
71,UgwJaVK70xZM5yv4nR94AaABAg,Maybe if she just left him alone...... she would be fine.,SSKBenhamz,0,2021-03-05T17:44:18Z
72,Ugx1L_kGflWt7RIeFtp4AaABAg,I see this as a win.,Julia Burger,0,2021-03-05T12:39:55Z
73,UgydvMx5qrhncN4_Z5h4AaABAg,She deserves all the hate she is getting.,Vasil Slavov,0,2021-03-05T11:53:55Z
74,UgxJytGWdl_zUfhvbf94AaABAg,Reduced to Only Fans work only? Well deserved.,Crow,0,2021-03-05T10:30:15Z
75,UgzMqIHCk6nyu8Lho1N4AaABAg,Cry me a river .....consequences..,jenni deans,0,2021-03-05T07:26:24Z
76,UgwhjpMtSXL_ubmf2Sp4AaABAg,"I'm glad she's gone .Like  how dare she stilling her own sister surviving story . yet she has multiple cases against her abusing her exes.",Christian Riley,0,2021-03-05T03:00:36Z
77,Ugz7f-QH-z2XpOFWPRx4AaABAg,AH should be in jail .,Savannah Saunders,0,2021-03-04T20:49:54Z
78,Ugx2UTg1A2aNY8nZv2Z4AaABAg,Hahahahahahaha,Savannah Saunders,0,2021-03-04T20:43:07Z
79,UgwDVFCWv0UE9TCnR454AaABAg,emilia clarke is the new actress for that aquaman role,Carrie Chan,0,2021-03-04T19:39:56Z
80,UgxcQyA4zvJbdAYypHB4AaABAg,cool,Grzegorz Biskowski,0,2021-03-04T17:08:01Z
81,UgyxFkhKwwBceiFhHV94AaABAg,I hope she never finds work in the public eye again.,Asmodeus,0,2021-03-04T16:53:37Z
82,UgxvE5WU7DXS7x-eqKF4AaABAg,"Yeah that was the whole point of us signing these petitions. So, maybe think before you take the piss out of people's intelligence. Karma a bitch.",Anna Lane,0,2021-03-04T15:10:49Z
83,UgxbEmi29ofQTAIawvV4AaABAg,"""You get what you f*cking deserve""",_watersnake_,0,2021-03-04T11:42:24Z
84,UgxA5SOsxFErz7UYmed4AaABAg,In a fair world she would be in jail by now.,Mystery Man,0,2021-03-04T09:04:38Z
85,UgwZ9quzTAZTLeSVhvR4AaABAg,I will never pay a cent to or for anything amber heard is a part of.,Janna Barkley,0,2021-03-03T19:43:35Z
86,Ugw60QKO3N02Sq6gnrN4AaABAg,Heard is so cute and hot but... Damn,Metalpazallteway,0,2021-03-03T13:41:34Z
87,UgxwcoSx0BvsB9Sq4_R4AaABAg,She had it all and fucked it up. She looks out there somewhere!!!!!,bradpaca,0,2021-03-03T11:41:43Z
88,UgyWfehIoH4lyBMuwhl4AaABAg,Well deserved Amber Heard,Leo Sundsfjord,0,2021-03-03T10:14:15Z
89,UgzB4sLi0tatFOIGx8N4AaABAg,They want her to play a live action Disney princess and Johnny can't get a job,Yeema Wheaver,0,2021-03-03T07:56:13Z
90,UgyRwaw-0ivahtmYCAt4AaABAg,Good,nicholas vollmer,0,2021-03-03T03:14:28Z
91,Ugy75bwMvnea_qPfhV94AaABAg,All false accusers should have this done to them. Hope this starts a trend.,Christopher Taylor,0,2021-03-03T02:57:16Z
92,UgwmWEpkC_oBUFpJmPh4AaABAg,This woman should go to jail lmao,Rachel Fleur Knox Smith,0,2021-03-02T22:08:39Z
93,Ugxn-k3PdHd5wxiwWWB4AaABAg,Exactly where and when she said that?,dacsus,0,2021-03-02T21:33:29Z
94,Ugxzgn_iDVEo_73CGMx4AaABAg,Amber Turd is a shitty spoiled person. She deserves all the negative Karma she put out and then some.,Jose Sandoval,0,2021-03-02T20:02:36Z
95,UgxJpYeIV5Me1NBSC3h4AaABAg,that’s karma,Stan,0,2021-03-02T13:29:49Z
96,Ugz-R6c3Z00dKc85rzx4AaABAg,100mil bitch u crazy!,Olivia,0,2021-03-02T13:08:38Z
97,UgyE7FfntEe2v2pNlWF4AaABAg,There wouldnt be petitions if you didnt try to destroy Depps life. This is what you get,Flashh_Gordonn,0,2021-03-02T12:12:50Z
98,UgxVuCHTihd2gzgzRVF4AaABAg,I doubt Disney will hire amber as they are now taking depps side and she also filed a subpoena against Disney and was looking for sanctions from them which they weren’t happy about 😂,Rebecca Walsh,0,2021-03-02T12:08:23Z
99,UgygR87H991uUJ-gmkV4AaABAg,Why are they editing out abuser and words such as it?,Victoria Caneal,0,2021-03-02T11:05:15Z
100,Ugz6H3CnrLoYmL8rBit4AaABAg,"There are far more women abusers than people would imagine, far too many men scared to death because society won't believe them. Been through it myself so i speak from experience.",Killa Mr B XB1,0,2021-03-01T23:09:59Z
101,Ugy7W4r_BCw6AugwEat4AaABAg,AH’s actions need to be heard throughout the damn galaxy. Will be Boycotting her movies. It’s your fault if you cast her for a role.,N L,0,2021-03-01T22:32:16Z
102,Ugwc4UVCYhIfVRyr5Rh4AaABAg,Did you really think the devil would not be beautiful? :),Marc Hone,0,2021-03-01T19:36:32Z
103,UgyvwLfrX6rPbO2bW_h4AaABAg,#fireamberheard,Vitória Nunes,0,2021-03-01T19:13:33Z
104,UgzzKH7HYVMt0OsDy2R4AaABAg,Cancel amber heard,Laurie Frohlich,0,2021-03-01T15:58:29Z
105,UgyI5U9TKrp2-UyOReB4AaABAg,Amber Turd,Maricar Lo,0,2021-03-01T12:10:03Z
106,UgyVrNy46oQSMCOaoSF4AaABAg,She should lose all her jobs and future prospects...2nd chances are reserved for people who repent their actions..she went on to sue her victim and slander and tarnish his image...I hope she loses everything,Vishnu Sugathan,0,2021-03-01T11:09:03Z
107,Ugwp8xrM8_SCZQ62v1R4AaABAg,Oh no! Anyway..,WayStedYou,0,2021-03-01T10:25:27Z
108,UgzI664E5l_D5EjAPWF4AaABAg,Did she leave Johnny alone... No ..,Katt Jones,0,2021-03-01T09:26:43Z
109,UgxBKkcV6Nc5tnk3t7V4AaABAg,We did it people,FattyGod,1,2021-03-01T09:02:27Z
110,Ugw3dgSucPkez_WbPeh4AaABAg,All I have to say is....GOOD!,CatsOnNip,0,2021-03-01T08:17:55Z
111,UgyKPU8SjaQrlledOAV4AaABAg,She has undermined victims across the world.,Sheridan,1,2021-03-01T05:52:19Z
112,Ugz7NBc9XYtLokUBhmF4AaABAg,"this is a strong evidence that there is abuse on men. And it is clearly showing us that's not only a women bein abused. There are many male in my circle of friends around the globe that has been to tortured, taunted, haunted and physically abused and even hunted just becoz they are trying hard not to harm their wife or girlfriend. They'd felt confused, helpless and ""cowardly"" hiding not to be traced. I wish JD's case will win for other male who went abused and that even male can file a case of domestic abuse against women. Divorce gets real nasty and tormenting when you entangled with narcissist.  May JD gets his much needed peace very soon. 
Amber is indeed a very good ""actress"". She ""performed"" very well in her ""own story"". I never knew her until late 2018. I heard her name but not popularly known by many and she will remain ""unknown"" to me (I did not watch any unknown stars to me in a movie) as long as she's around.",Maria Simone,0,2021-03-01T03:30:54Z
113,UgzP2eRkw1r8usOmDC54AaABAg,😆🤣😄😂😁😆,Beth Obreiter,0,2021-03-01T01:30:34Z
114,UgyEUgLAZ7YsL2m1aJ54AaABAg,Poor baby,Tami Wyatt,0,2021-02-28T23:03:18Z
115,UgxirPIdqJHzKNrl1Vt4AaABAg,And oh I'm sorry I think they like Johnny and are on his side.,Carolyn Truluck,0,2021-02-28T21:40:58Z
116,Ugzz5becQHsbo6kSJPd4AaABAg,Bleeping out normal words. Its like we have to make your sentences work. Why even say a sentence if you are going to bleep out 75% of the words it makes no sense . Youtube has gone to shit.,Assu,0,2021-02-28T19:50:00Z
117,UgwsmpHkr1HmOGlCq4B4AaABAg,"Holy s..t . Amber has a BORDERLINE PERSONALITY DISORDER. I was married to a super beautiful woman just like Amber just Brown Colombian,  for 8 years and it was 8 years of hell. (we have 2 kids together so I had to put in the time) My ex-wife got looked up in the looney bin for 2 weeks where the psychiatrist told me she offers from Borderline Personality Disorder. And what Jonny is saying he went through. It's clear as crystal that Amber has BPD. 
My wife was very fiscally and verbally abusive against me and everything wrong in the world was my fault all the time.  She was either super happy and smiling making the world fall in love with her and did switch to the worst Bitch ever for the smallest thing. IT WAS HELL!",Condor Gebecke,0,2021-02-28T19:11:33Z
118,UgztczLcuOh_tEHI-ph4AaABAg,I will never watch another disney movie IF she is involved with them,Belinda Maund,0,2021-02-28T17:06:09Z
119,UgzqkKK1Bi2TEin1z3l4AaABAg,Manwin or Mindgeek would be very happy to hire Amber Heard and i will petition they do so,chester ingosan,0,2021-02-28T15:45:03Z
120,Ugx1e2yY3BQC_RMZQj14AaABAg,Nasty piece of work....let's hope karma deals her a bıg hand....;),Jerry Tremaine Photography,0,2021-02-28T14:23:08Z
121,UgyS7MRMZgD-7rh4C_J4AaABAg,"Of course it's ''petitions'' that are causing the problem, not all the shit she has caused.",Paul Murgatroyd,0,2021-02-28T13:32:41Z
122,UgxdvmHCFWG3INbW2NN4AaABAg,She has been fired from aquaman 2 yessss !!,F1slove,0,2021-02-28T10:37:19Z
123,UgyuZwXmmv9hP-qJIJ94AaABAg,Man i hope they do her dirty in his film i mean make wonder woman kill her in the movie 😂😂 just like in the animated film justice league the flashpoint paradox  man i wish i see that scene in real live action movie  who else agrees?,Rohan patel,0,2021-02-28T06:48:10Z
124,UgyGbJ47Dz3PkxRi-W94AaABAg,:) I love this,Eco Whisper,0,2021-02-28T03:42:12Z
125,UgykDdNtaNrb3jarnud4AaABAg,"why is the word ""abuse"" being muted?",dashmasterful,0,2021-02-28T03:17:23Z
126,Ugy8-HRRhUxCM2mv8Jp4AaABAg,The first reason is more likely just acting ability... then maybe the petitions lol,phoenix edits,0,2021-02-27T20:11:45Z
127,UgwCEgP4CKmBJvVesvF4AaABAg,Duck Amber Heard she’s an evil bitch,Shadow A.K.A Shad Viciouz formally of East CoCo,0,2021-02-27T19:57:13Z
128,Ugx9E9nYyFNdunr-ul14AaABAg,"johny is kind man,he even dont wanna her to be arrested after she cut his finger",freedom voice,8,2021-02-27T14:29:25Z
129,UgwFGKFKBg3JqoBNxnN4AaABAg,"Amber Heard charges $33k to give talks on domestic violence---  new line of """"how to ....for Dummies"" instructional talks. 
Ruin the lives of people that were doing well until they met you---and then use the media as tools of coercive control (special emphasis on ""tools"")

Why do femin!sts with impossible wish lists insist on playing hard to get, when they are now so hard to want. They want to ruin other's success and then be complimented by the world----as if that is the best a woman can do",Silverlight Illuminant,0,2021-02-27T12:16:22Z
130,UgwRTdNKpHjblfdF_214AaABAg,There are many vacancy as hooters,YoSr,0,2021-02-27T11:36:52Z
131,UgwT9H-wuLEOF2ZLBvR4AaABAg,Is there a way u can make ur video in a way it doesnt get cut in bits when ur talking. Its bloody annoying,A.y. Wee Ching,0,2021-02-27T11:04:22Z
132,UgxqfRmAz9wP10NopNZ4AaABAg,"Shes a narc. A very cunning one too. Most dangerous especially because shes a female in a position. If JD was not famous, nobody would bat an eye. I use to be with one. And i know that after a few bruises and abuse you tend to fight back even just a little. And they will use that against u. You will end up looking like the abuser and even lose urself in the process",Andy Syark,0,2021-02-27T08:30:46Z
133,UgwQbajj5wh6QgkvU1R4AaABAg,Amber Heard! Dont be a piece of shit and you wont be treated like one!!! Your lieing ass Justice for Johnny! The real victim!!!!,Chadwick Harris,0,2021-02-27T08:26:33Z
134,Ugytb6EB0qupsdTgDuR4AaABAg,"Johnny Depp is a legend! Amber is newbie trash. She will be soon forgotten. As far as her vengeance trip against Johnny, fans will always have the final say. Standing with Johnny. She doesn’t hold a candle to him.",April Bird,5,2021-02-27T05:46:26Z
135,Ugxeh3A6xnm5wagLHTV4AaABAg,It's called justice and/or karma,1968lr,0,2021-02-27T04:31:33Z
136,Ugz7XOeTx2N1QZj3ca94AaABAg,I will never support anything she's in... how dare Hollywood not take domestic violence seriously,Jayne Sally,0,2021-02-27T04:03:48Z
