,id,comment,author,likecount,publishedAt
281,Ugyw86X3rBQLx2VPWOB4AaABAg,"It's called Karma !!  You get what you give !!  You lied about Johnny for you it was all about money !!  You were suppose to love this man and you did this to him !!!  Your an Evil person 😈 I hope you can't get any work like what you did to Johnny almost destroyed his career.  I never liked you from the beginning I saw right through you !!  I don't feel sorry for you at all but I do feel sorry for any man who gets involved with you !!  You are shallow and all about greed !!  Not love !!  I just hope Johnny and his kids can get back on track with his life after you tryed to destroy it !!!  You never loved him did you ??? 
Huge fan of Johnny Depp
Always & Forever 💋 ❤ 🎸
Go Johnny 
Amber is 💩",Deb Lynn,1,2021-02-21T06:25:03Z
282,Ugxc92cWbLolUGJPWEJ4AaABAg,The way he said ahsoka kinda triggered me ngl,Checkb0y,0,2021-02-21T06:04:11Z
283,Ugwx1iocyRKDoZHQsc94AaABAg,"Include her character then kill her in the film ,then replace the lead lady by a new character just like that spiderman",Yos Soy,0,2021-02-21T05:54:10Z
284,UgxZ8IfvNvBxOZa-2vd4AaABAg,"Imagine the extent of censorship when profane language can be said openly but people can’t mention words like abuse, violence etc... shut crap",Maggie Naidoo,0,2021-02-21T05:19:25Z
285,UgzQus0KpFazl62AFqN4AaABAg,No one should ever glamorize an abusive psycho like Amber Heard. I’m GLAD she’s not being put in movies right now.,Honey Bee,0,2021-02-21T05:17:05Z
286,Ugw_9tpXUaIAK_2GHv94AaABAg,Johnny Depp is the real monster and not someone as beautiful as her,Shine tsu hiko,0,2021-02-21T05:11:43Z
287,UgwyqE9AEzZ7o5Bofrt4AaABAg,she have to go,m mooney,0,2021-02-21T04:58:39Z
288,UgxCguSFfP5v3i0id194AaABAg,"I suspect a lot of movie and TV directors would likely NOT work with this woman as currently she no 2 of the most disliked women in Hollywood by fans, no 1 is the head of Lucasfilm while no 3 is a woman who wasn't really required for End Game thus had her role shrunk down to very little!!",superomegaprimemk2,0,2021-02-21T03:07:06Z
289,UgxMIN3qturemJxMw4J4AaABAg,"She looks downright evil. I am a victim of abuse myself and the idea of curating stories to destroy someone innocent is just beyond me. If a person was truly abused, they are broken and you’ll see it in their eyes. She just looks like a cunning gold digger to me! I hope she never gets any movie roles ever.",Anna Medina,0,2021-02-21T03:04:05Z
290,UgwQ7V_MUi_QX-XlsRJ4AaABAg,Team Johnny Depp all the way,Domingo Esquivel,0,2021-02-21T02:57:53Z
291,UgwJUTJxe-IrSQvXBRJ4AaABAg,I won't support any movie she's involved in!!! I dont reward monsters or assist them,Suade Legend,0,2021-02-21T02:57:06Z
292,UgxQgDMYnfZoRxY932t4AaABAg,"Amber needs to be permanently removed and retired from Hollywood!!! As a woman, I am disgusted with Amber and her bullshit. As a survivor of domestic violence I think Amber should spend 1-5 years behind bars!!!!!! #mencanbeabusevictimstoo",Karen Dagsen,0,2021-02-21T00:53:34Z
293,UgxI0v1YF8SHj0yJmed4AaABAg,I hate YouTube censorship I can't understand  shit you are saying.#Fuck censorship,Haseo Cercil,0,2021-02-20T23:22:06Z
294,UgzJ9FNpjOoHKUJPxnJ4AaABAg,Finally some good f*cking news,Atomic Lazercat,0,2021-02-20T22:19:00Z
295,UgxIqkCH7LjuEC9BbmV4AaABAg,Frustrated by petitions? Cry us a river amber,Sai,0,2021-02-20T20:56:15Z
296,UgwChueFqF0u10BxNlF4AaABAg,Did this guy say Ashoka,Gavin Humphrey,0,2021-02-20T20:34:02Z
297,UgykkG25j8VtNYXgEpZ4AaABAg,I hope Jason or LeBron( someone in a big role) say they won’t do it if she’s in the same company. Boom probably solved.,RedWing,0,2021-02-20T19:28:29Z
298,Ugz5N9N3dm0ZIELNzpV4AaABAg,Emilia Clarke for mera,Shawn Kow,0,2021-02-20T19:25:25Z
299,Ugyk2yd9faqyW27QOs94AaABAg,I hope Emilia Clark gets the job man!,Random Guy,0,2021-02-20T19:21:47Z
300,UgyVs4IqmMWzFBsYK8h4AaABAg,Lmao she ruined her own career by trying to ruin & frame jonny 💀 😂,corryn couture,0,2021-02-20T18:22:32Z
301,UgzFMNwEs3vQDtnGYKN4AaABAg,Yes! Karma is working!!!!,Fahlovi Noman,0,2021-02-20T18:19:22Z
302,UgwWE6zgcbP83nipFHF4AaABAg,Sucks that you have to censor the word “abuse”,Spaghetti Shredder • 50 years ago,0,2021-02-20T18:04:26Z
303,UgzAPij-FjSeccShpEh4AaABAg,She reminds me of Lori Vallow for some reason. I dislike them both.,your friendly neighborhood alien,0,2021-02-20T17:30:27Z
304,UgypqAjwdq1s-mNNyNp4AaABAg,Johnny Depp ❤️🔥,Sufyan Khan Fitness,0,2021-02-20T17:25:44Z
305,Ugw5URNumMyqrnLMCiB4AaABAg,I hope I never see her face again,THr1ve 1N CHAOS,0,2021-02-20T15:43:35Z
306,UgwzWskgqSQ5fTFZrJt4AaABAg,Yeah AMBER it’s a thing called karma you wicked bitch,THr1ve 1N CHAOS,0,2021-02-20T15:43:17Z
307,UgytyvrmGkvpai0v5gV4AaABAg,"Good, she is violent",Pauline Downs,0,2021-02-20T15:22:43Z
308,UgxB3f-1R-eHbQTq8-F4AaABAg,Such a piece of shat.... abuse is abuse male or female. I hope she never gets a role again and has to go flip burgers 😒,Pink Smoke,0,2021-02-20T14:18:44Z
309,UgwCZ8I8LNy_Ja7Rrpp4AaABAg,If she is in the next aquaman i call for a boycott on the movie,Brad Jefferies,0,2021-02-20T13:42:40Z
310,UgyEo2rU8RYJmebm1xR4AaABAg,"If she is in any movies, we must not give them a dime.",Spencer G,0,2021-02-20T13:37:11Z
311,UgysKhbU-NhVUyjBmy14AaABAg,"People are defending JD even if they haven't even have a movie together. Meanwhile no one defends AH, even her co stars. Meaning she must have really had a twisted personality.",Exo-ᄂᄋᄉᄐlf CaraTomoon,0,2021-02-20T13:28:17Z
312,UgxPQZ-1lRgv20CM-rd4AaABAg,If she isn't removed from that role the best thing to do is boycott the movie. When they don't make any money then they'll change their minds real quick.,Caption This,0,2021-02-20T13:21:39Z
313,UgwgPmgrUcu8rQB96zF4AaABAg,"Then - JD
Now - MM (Jd's best friend )",Karma09 official,0,2021-02-20T10:57:19Z
314,UgwDAD8U0W1NgA58hoR4AaABAg,Disney's Star Wars is the trash compactor of Hollywood.,Erwin Simpauco,0,2021-02-20T10:47:33Z
315,UgyThEBW84qJXjnbkah4AaABAg,"Amelia Clark would be perfect for the role 
I hope she gets it",6Xitlaly 11Gaia,0,2021-02-20T10:30:28Z
316,UgxHNSy5lF3WLyUv8it4AaABAg,Bruh she really thought she could take down one of the most powerful wizarda and the Black Pearl's captain? She needs to get her brain checked out if she thought she would suceed,Axr,0,2021-02-20T08:53:59Z
317,Ugy4Cur3dTKX4vE2b4N4AaABAg,Career OVER Amber TURD,toyah wright,0,2021-02-20T08:00:53Z
318,Ugyol7cD4A72Ue80yMt4AaABAg,The Only thing that Amber Heard would be a good addition to is a woman's prison for her crimes. Long may she got.,Daniel Patterson,0,2021-02-20T07:49:55Z
319,UgxLJYgewNto_Gv4sel4AaABAg,Wtf so many censored audio si fucking confusing,JC Gaming,0,2021-02-20T07:14:25Z
320,UgyDLLK67T7BPTiFmC54AaABAg,Cast her as a stormtrooper,oo saudade,0,2021-02-20T06:46:17Z
321,UgzxsQATD8oqU-Yz6BN4AaABAg,"If she said she can't afford herself to pay bills and anything, let me remind you.



Mcdonald's exist. She can work there. Say to her don't get too comfortable having comfy life",Bazziness' Mashups,0,2021-02-20T05:10:17Z
322,UgyVKbW6y8nwnJhyLop4AaABAg,Karma is now finally being served. She will receive the full price,Denise Kieffer,0,2021-02-20T04:59:14Z
323,UgwZBUsC36s86gCl2bN4AaABAg,You mean she’s whining about consequences for her abuse of Johnny Depp?  Oopsie!,Patti Reinheimer,0,2021-02-20T04:56:54Z
324,Ugzdw67pF6S3u__SiNN4AaABAg,Why in the world did she do this?,PinkyChiChi,0,2021-02-20T04:46:53Z
325,UgwAcvPdB3UsbaBT2994AaABAg,If you came for what happen of Amber for her role its around 7:00,Let Me Dream,0,2021-02-20T04:39:29Z
326,Ugy19nPx_09xdZBysNp4AaABAg,Why are ur words cutting off?,Verushka Cortes,0,2021-02-20T04:32:41Z
327,UgzVc-rh5VCdnQz0U0N4AaABAg,You know what to do folks. Pedal to the metal.,Beezer,0,2021-02-20T04:29:58Z
328,UgxyjqcA3HgPPoD4F3N4AaABAg,Karmas a bitch!!!!! 👏👏👏👏👏👏,Verushka Cortes,0,2021-02-20T04:29:29Z
329,UgwwbQch-EncMS01ufV4AaABAg,Amber Turd,Generation X,0,2021-02-20T04:29:07Z
330,Ugzy68uMyV9qMg3Hb0x4AaABAg,All these censored words makes my brain feel a bit laggy,Jesus Davila,0,2021-02-20T04:10:22Z
331,Ugw84n67tqPKlTA_IFp4AaABAg,"All his fans honey, u will never be left alone. Which I thought he was the abuser. Listening to all the facts! YOU ARE Ms Turd 💩. I have never heard of his other ex’s saying another about him abusing them",Wirangu Girl,0,2021-02-20T04:08:13Z
332,Ugxb8Ft0oJoLDVe8t354AaABAg,Cry about it. Boo you w***e,Kayla Holley,0,2021-02-20T03:52:45Z
333,UgxUfGYhQ8r0x3c6OUt4AaABAg,I Heard amber heard lied 🤣🤣🤣 #KARMA,Jonny Amber Aaliyah,0,2021-02-20T03:50:50Z
334,Ugx7BwcU5v_a4aNssR94AaABAg,She’s a sick narcissist. Johnny Depp is lovely!,RED DRAGON GEMS BEADING TUTORIALS,0,2021-02-20T03:29:11Z
335,UgyhqesWGzm7aYKd3aF4AaABAg,"This is not even captioned. If you're going to sensor to the point that you sound like you're skipping, then caption.",nutmeg418,0,2021-02-20T03:28:54Z
336,UgzdyonVYS2uIKaDk6V4AaABAg,"Gurrrllll, its you or JD. And sadly a lot loves JD MORE than you. Never going to watch any movie with you in it. AHnawp",Anime Manga,0,2021-02-20T03:23:55Z
337,UgwXmJqNQkczDvaCykx4AaABAg,"As the joker would say, you get what you fucken deserve!",Darcie Dawson,0,2021-02-20T02:57:52Z
338,UgzO86M6tQFA6wi48H54AaABAg,She should not be in any movie and she should be sentenced to life how come they do this to men that’s not fucking fair yet girls still wanna do that and think it’s ok,Andres Morales,0,2021-02-20T02:54:53Z
339,Ugwv3H_43z2WFMtaxIp4AaABAg,I will not watch anything she in,Tamara Ossa-Wangnet,0,2021-02-20T02:39:59Z
340,UgzlOdzkog_ESC1crop4AaABAg,Not that its hard evidence but just watch them. She has so much hate in her.,Krandal Collier,0,2021-02-20T02:31:33Z
341,Ugxced04vSuCu73KaOZ4AaABAg,Honestly i think we should let it go after she does her time and let her live her life,Jasonzerowars Playes,1,2021-02-20T02:23:55Z
342,UgyU5-4xZ5bzprGwdRN4AaABAg,Team Captain Jack,Chase Cogsdell,0,2021-02-20T02:21:52Z
343,UgxSZovpyYg2T1rb3594AaABAg,Bruh too much shit is censored on this shit. Abuse shouldn't be a censored word. Neither should shatter. They are words. What the fuck is wrong with that,Breakdown,0,2021-02-20T02:11:32Z
344,Ugxina2hZKFQGDgMUyh4AaABAg,"This word censorship over monetization is too much. I'm surprised I made it to 4 minutes. Stop bleeping out abuse, abuser, abusive, and other trigger words. This is nuts!",Bodhi Sattva,0,2021-02-20T01:56:43Z
345,UgzWhsh6UX3BBtXa5x54AaABAg,"This is unwatchable...
And shame on you for censoring yourselves, if we want to see these videos we can find them.",Rod Turner,0,2021-02-20T01:38:15Z
346,Ugz_WlPyOtLtmKISuZl4AaABAg,"Perhaps she could try to make movie by herself...
There's some free space on only fans server",Geek Daddy,0,2021-02-20T01:01:22Z
347,Ugx7qrqWB875wK5NGLx4AaABAg,They have a word for it.. 'justice' 🤷,Joris Wegner,0,2021-02-20T00:56:59Z
348,UgwEfD7No-Oji3d_hw54AaABAg,Iam so very happy for Johnny depp glad that Disney rehired him and now its time for another pirate's of the Caribbean movie,CJ Robinson Jr The show,0,2021-02-20T00:25:02Z
349,UgzA4P0G4tYWSB-Azpx4AaABAg,"Disney just canned Gina Carano for controversial statements, you think they are going to hire Heard if there is even a possibility of controversy?  I don't think so.",apoclypse,0,2021-02-20T00:16:28Z
350,Ugx26HdmR_fY1nP1pVB4AaABAg,Don’t feel sorry for AH in the least JD  begged her not to pursue this at the start of this mess but she thought she could lie her way through. Big mistake. RIP amber heards career,Kim deady,0,2021-02-19T23:53:32Z
351,UgyZmDVf5e0aPIdIOlh4AaABAg,"Both damaged people , but!!! She's a skank.. All the videos and publicity in vicktimhood. She is just another woman who is looking for £££",Phil Morton,0,2021-02-19T22:49:24Z
352,Ugzh1_GY5KceRsNGLpB4AaABAg,No ones gonna watch Aquaman 2 if she’s in the movie which means that they won’t make as much money as they want coz no one will go the cinema to watch it while she’s in it clearly not me I can’t support an abuser and I won’t,Dean Winchester,0,2021-02-19T22:45:11Z
353,UgynOIgqt2G6sI9GSRN4AaABAg,"Man, I feel guilty for believing her at first. I'm so glad Depp came forward. Men can be abused, too. If he actually came forward from the get-go, people would have treated him so badly, too. I'm just glad he inadvertently is bringing light to victimization of men. I've lost friends to abuse because ""they weren't men anymore and nobody would believe them anyway"". Amber Heard needs actual jail time and clinical therapy.",shooglechic,1,2021-02-19T22:07:33Z
354,UgyxmX1WLbMz7MVT55V4AaABAg,"Who cares if she gets work again iin the movie industry, no one can look at her the same.",Jeanette Davies,0,2021-02-19T22:05:41Z
355,UgyAVjr5hjIMppCajA14AaABAg,Finally. What a serpent. She is pure evil and getting exactly what she deserves.,DD Bingham,0,2021-02-19T21:07:14Z
356,UgxiOS1tRbsa1zBxbZd4AaABAg,Just like guys should get there asses kicked for beating women the same should happen to her! There's plenty of girls who would love to handle her ... She has no remorse and is a sociopath,Rebecca Marrujo,0,2021-02-19T20:44:22Z
357,Ugwd6_yoy5XrZN9_0al4AaABAg,Why are you fu king words censored or toned down!??? Are you a pussie!??,De G,0,2021-02-19T20:39:31Z
358,UgwDyx72q2NhENbnXPR4AaABAg,She should be in jail.,Elian Van de Loo,0,2021-02-19T20:31:06Z
359,Ugx8hG6ThaYcf-b_wlB4AaABAg,"I love Star Wars, but I ain't watching anything with that manipulative delusional woman in it.",FruityPatchouli ASMR,0,2021-02-19T20:14:17Z
360,UgxeVt8WmgUxTbhvA-V4AaABAg,Female to Male Spousal abuse is real. It happened to me. Hope she ends up on the streets,Dean White,0,2021-02-19T20:13:38Z
361,Ugy57hZ8BWAMzsUroJh4AaABAg,TEAM JOHNNY....,Erin Raelle,0,2021-02-19T20:02:22Z
362,UgwUPvuw5PQOPNmGIFZ4AaABAg,She and kiera  knightly  favor i wonder if they're  related,Leah Anderson,0,2021-02-19T20:01:17Z
363,Ugxxwr8Sj9pvXNCc7u54AaABAg,GOOD,Lejuan Smith,0,2021-02-19T19:51:46Z
364,Ugz71ZkbsK6yOhGwldd4AaABAg,"Wow, that sounds like the wall you put Johnny against for the woke firing squad. Well I guess actions have consequences, lies too.",andy simpson,0,2021-02-19T19:49:34Z
365,UgwbftZjhwgPiJSurOF4AaABAg,"She deserves everything thats about to happen to her along with being black listed from Hollywood for life. She honestly did this to herself. And JD tried to warn her not to go this path from the beginning he WARNED HER ""You will not be able to come back from this"".... You cant take down a legend who has tons of friends and family supporting them plus world wide fans as well, she is already paying for her mistakes and yet is still more to come. she deserves ALL that is about to her happen to her, I do hope she becomes black listed for life.",Bleumoon,0,2021-02-19T19:31:18Z
366,UgxzAFgpX_LD-wwtmsl4AaABAg,Amber heard need to be forgotten in holly wood.,LadyofTruth,0,2021-02-19T19:26:00Z
367,UgzWUN9vM9D6q04BwpV4AaABAg,"Aquaman movie will be fine without her!!! I love Jason Momoa, but if they cast her in  the next Aquaman Film... Nevermind! She's crazy!",MCD's Creations,0,2021-02-19T19:25:05Z
368,Ugwmjlk5eowVUzNLIfB4AaABAg,https://youtu.be/yRYFKcMa_EkP,Arrrelevant 2Ű,0,2021-02-19T19:04:57Z
369,UgxGi14IGN5o97CklcZ4AaABAg,The hell's up with the audio? Sounds like it's cutting in and out at times,Wolfbjorn,0,2021-02-19T18:42:00Z
370,UgzFsb58yJm1uI_5jxV4AaABAg,Did anyone else notice how he said ashoka,Darth_link3055,0,2021-02-19T18:39:54Z
371,UgzKWGsNDAwyX_ywpER4AaABAg,Oh noooo lol karma is a bitch ain’t it,Priscilla Guzman,0,2021-02-19T17:48:12Z
372,UgzRdAAaXfMgqkYYcSB4AaABAg,She's trash,sagchipkwe31,0,2021-02-19T17:33:22Z
373,UgzkdG_mbml64zYktGF4AaABAg,Good #justiceforJohnnyDepp,Casey Storan,0,2021-02-19T17:31:25Z
374,Ugyw3BCSuWSHHh3V9EJ4AaABAg,Is abuse a swear word now?,FaceForRadio,0,2021-02-19T17:22:53Z
375,Ugwm0wQI6Wsiz5DGIf94AaABAg,She is making a movie with Jared Leto presently. I’m a Johnny drop fan,Susan Smith,0,2021-02-19T17:05:07Z
376,UgyWh9plLiAAwoIIMid4AaABAg,A taste of your own medicine. She get's what she deserves.,Ghost,0,2021-02-19T16:58:21Z
377,UgyOtVPrQUQ6pZrkyUV4AaABAg,"Oddly, even though she did really bad things which I rilly frown at, I think she needs treatment but I also want 2 see her in aqauman again...at least let that be left with her",Gly Uzor,0,2021-02-19T16:55:55Z
378,UgxRNk4TDKvYqWthXDN4AaABAg,she should spend some time in jail for false accusations. She tried to ruin a guy. Straight up slander.,Christopher Wallace,0,2021-02-19T16:37:01Z
379,UgwLkTPYKGqzTu9KL9t4AaABAg,"she should never work in Hollywood again.

#cancelled
#CancelHerToo",Christopher Wallace,0,2021-02-19T16:34:28Z
380,UgzB8IzHLWntyiBbIdV4AaABAg,She's bad PR right now. Clarke and Mamoa have better chemistry,KD BEE,0,2021-02-19T16:31:06Z
381,UgwsXfMILyKQqAgKqCV4AaABAg,I couldn't finish the video because your audio kept cutting out,Arthur Morgan,0,2021-02-19T16:28:33Z
382,UgxImqGMJL7xVrPLxyd4AaABAg,"Johnny Deep got fired over mere accusations, yet Amber Heard has proof against her and confessed HERSELF that she was abusive yet still has her roles. This is not women empowerment. This is not equality.",Jiménez,0,2021-02-19T16:24:53Z
383,UgyKOJEuXw2pOFrF36R4AaABAg,She didnt go to prison? Can you still acting when you in prison.,Muhammad Nazerin Saripin,0,2021-02-19T16:24:14Z
384,UgwqfjSHmBDuxMsYTfV4AaABAg,She is toxic,Senvia,0,2021-02-19T16:06:28Z
385,Ugy0JHQ0vuNHTHwMaGt4AaABAg,Amber is perfect for Mera Aquaman she Will be mist,Lori Cavanaugh,0,2021-02-19T16:02:18Z
386,UgwAXg6IEjp_5xS4Krl4AaABAg,Amber is perfect for Mera Aquaman she Will be mist,Lori Cavanaugh,0,2021-02-19T16:02:03Z
387,UgyByY9CV5f3PHLCz7V4AaABAg,I dont even feel a slight bit of pity for that thing,Now get ready children we're going to war,0,2021-02-19T15:27:38Z
388,Ugyq_t0vQdwYX2tk6OV4AaABAg,Split??? Who is still on her side?,Happi Burrito,0,2021-02-19T15:22:51Z
389,Ugz2UNDeqEJf0G4QBdF4AaABAg,Bye Amber. ✋✋✋✋,Kathryn McKeown,0,2021-02-19T14:07:04Z
390,Ugwd3x_QvhFRd-MILr94AaABAg,She's nuts,The Woobly Dude,0,2021-02-19T13:57:28Z
391,UgwSA4609pqB8gyenX54AaABAg,that's how Johnny felt when you told stupid ass lies god i hate AH,GoblinSlayer 9996,0,2021-02-19T13:51:13Z
392,UgzqPaT3U1n3EiBACft4AaABAg,"I wouldn't want to deal with her either. Someone with strong antisocial personality disorder traits, isn't a good time.",Kendra Johnson,0,2021-02-19T13:09:51Z
393,UgxF2mYWiNlOPD7lzYB4AaABAg,F dat we true starwars fans Don't want her maybe kk writing team. Stand with Gina,Dustin Walker,0,2021-02-19T13:05:08Z
394,UgymQjq0wutnrWlHZ4Z4AaABAg,"Good. She’s been getting away with abuse for long enough, about time she faced consequences.",Daenerys Targaryen,0,2021-02-19T12:58:07Z
395,UgxaXhbjYzSqwlbjdPl4AaABAg,Why bleep all the words of abuse... abuse is a word that should be used . Amber is a domestic abuser ... please don’t ignore the word!,Stephanie Tugwood,0,2021-02-19T12:24:37Z
396,UgweU4fSGZNcsfeI0FV4AaABAg,"She's trying to break out the tiny violins but we don't want to hear it...

Why would they keep her.. I didn't think her acting was  great in Aquaman and I didn't even know who she was before this drama.. So if they replaced her it would be fine..Johnny is a much bigger star and he got dropped fast without question... I don't see why they are holding on to her.",Mrs. RockKitty (VixxVoodooKitty),0,2021-02-19T12:24:15Z
397,Ugy0iLXWbWVWOgNFUIp4AaABAg,Youtube: Funny Actors,Venita Milliner,0,2021-02-19T12:03:47Z
398,UgxnqlYx2wHjEmvk28J4AaABAg,"She needs to drop to the level of her fans. Fall from the high life,and just be another face in the crowd. Fame OVER.",Jinjer Radiske,0,2021-02-19T11:39:12Z
399,UgwYSvmb6E2dg_srEzl4AaABAg,This time she played with the wrong person thank god Johnny is Back in pirates of the Caribbean,ALPHA,0,2021-02-19T11:28:45Z
400,UgzDAAAqBHVRwq4KNSt4AaABAg,Lock Her Up!!! I want to see her behind bars she'll make a good prison gal in an orange jumpsuit..,Hank Rich,0,2021-02-19T09:58:56Z
401,UgwyD7SQiW3tvY42CS54AaABAg,I saw the turd she shit on his bed 🤢🤢 😂😂,vdcg2010,0,2021-02-19T09:16:13Z
402,Ugw9KIV6_iwr_jPkjXN4AaABAg,"As a domestic violence survivor I feel Amber Heard is a disgrace to all domestic violence victims.  She is a horrible, conniving, manipulative woman intent on destroying JD for no other reason than she wants to. You can't have bruises one day and none the next. She should never be hired for anything and be fired from everything she already takes part in",Rhonda Brown,0,2021-02-19T08:57:05Z
403,UgzylrHqYuyytCxvWrl4AaABAg,Can he not say the word abuser or something cause I keep hearing it cut out,Skyler Stutte,0,2021-02-19T08:28:41Z
404,UgxFJM_vOZCEC-Un0pd4AaABAg,I bet Bang Bros would hire her....,K3wlD3wd,0,2021-02-19T07:09:46Z
405,Ugxk17JsrD8AGju1nLh4AaABAg,I really hope she doesn't ruin Star Wars! Someone like her doesn't deserve to be in something as awesome as that...she's so toxic,Sofia Briones,0,2021-02-19T06:47:42Z
406,UgyqabXEd-TsTKwAxsZ4AaABAg,AH tried to ruin Johnny's career...she's the reason for her failing career.,Tee Jack,0,2021-02-19T06:30:06Z
407,Ugz81VTMXY1fhVpTUc14AaABAg,"Glad for him that the truth came out, speaking out of experience, the frustration kills you slowly from the inside when they succeed in reversing the roles.",OneofInfinity,0,2021-02-19T05:58:02Z
408,UgyFeVzSev-yDudn5Nl4AaABAg,Good,Flawless Whoreless,0,2021-02-19T05:53:50Z
409,Ugzb72ZslBEsYIUXuH94AaABAg,He divor8his wife of 25 years. He got what he desearved from that trash.,Audie,0,2021-02-19T05:24:04Z
410,UgwbQkZZ4oTXA17oApR4AaABAg,Can’t wait for the onlyfans,SC 20,0,2021-02-19T05:17:52Z
411,UgzgnRD9cOsMn-CdELt4AaABAg,I mean i can see why Warner bros not throwing her out of her role. Don't they have a contract and In case something happens and Amber wins the cases she can sue the whole production company for unlawful firing her even when her contract stands...?,Devika Pradeep,0,2021-02-19T04:58:04Z
412,UgxIxjWOBtmX7vGkCkB4AaABAg,Let’s all watch the new aqua man without amber so the directors know they made the right decision and as a F You to amber,It’s rowan,0,2021-02-19T04:55:27Z
413,UgwogFNx1xXwOD1fjiF4AaABAg,Heard needs to go to jail and her sister,Georgia Peach,0,2021-02-19T04:42:12Z
414,UgwVUt35GV5AVANWi0x4AaABAg,She should not have lied,Alice Bennett,0,2021-02-19T04:17:30Z
415,Ugzhc1z_ydUsfhWRdfl4AaABAg,"Guess she should've thought about that before trying to take a big star down when he didn't deserve it. If she can't play the game of hollywood right, she needs to leave and not bother. She should just go home and rethink her nasty ass life choices.",MaibiItsAlice,0,2021-02-19T04:08:38Z
416,UgxQv3sJfR7OVLiEMOd4AaABAg,Johnny always,Lilah Gipson,0,2021-02-19T04:07:11Z
417,UgyCMgG1tpUll_NQ-YJ4AaABAg,IF DISNEY OR NETFLIX CASTS HER  IN ANY MOVIE IM CANCELING MY SUBSCRIPTIONS!!!,Jimin Mochi,1,2021-02-19T03:32:19Z
418,Ugx9qMSY-TnnIZfdkYt4AaABAg,No way disney will hire her because they rehired johnny 😁,Jeff Laflamme,0,2021-02-19T03:24:34Z
419,UgzfKRL5YJhbaPS3U-Z4AaABAg,You wanted the attention so now deal with it 😁,Jeff Laflamme,0,2021-02-19T03:15:58Z
420,UgyQrtzKQeHAIq1SpzF4AaABAg,"Her next target is the aquaman actor, see how they cozy up on talk shows.",Wooley689,0,2021-02-19T03:10:27Z
421,Ugxj2Le6zs0nCDo6_-x4AaABAg,Seems like she's one of those that will find any reason in the world to convince herself nothing is her fault we all know people like that ya she's trash but she looked goooood in aquaman fuck her,leo martino,0,2021-02-19T03:10:08Z
422,Ugxi3-5OBNIKXh8n53Z4AaABAg,Good for her ass.,Michael Denisco,0,2021-02-19T02:46:49Z
423,UgzO74hXlev029mM9il4AaABAg,She needs to be in jail for a long time. For DV. For basically robbing JD since she was the one who did it. And in jail for all the money he is out because of her lies. If I were Jason Id flat out publicly refuse to work with her.,blaise black,0,2021-02-19T02:33:20Z
424,UgxOYYXWHtK_QWB1S4Z4AaABAg,Yeah I signed it I don't ever want to see her bitch face again!,Mel 777,1,2021-02-19T02:22:54Z
425,UgxAXZiPXPNXR-qTOM94AaABAg,.... why is Ab*sive bleeped out... is that some kind of bad word now?,YiYaEmperor,1,2021-02-19T01:54:30Z
426,Ugzknk5yTBQbJhb0FvZ4AaABAg,Who here believed Johnny from the beginning?,Brook,1,2021-02-19T01:47:13Z
427,UgxpBTkZVQ7OajxWlKl4AaABAg,"Aquaman is famous because of Aquaman, or Jason Momoa... Not Umber Turd!!! Sorry, Jason, get RID of Turd and I'll watch your films!! Plus, bring back Captain Jack Sparrow, too!!!!",PrettyBrown Eyez,0,2021-02-19T01:47:06Z
428,UgxBT0BzrLtRqfGcQPd4AaABAg,"Why won't people admit that Both were Toxic in that relationship. Johnny maybe nice in the public eye that doesn't mean he's that way behind close doors. Amber doesn't seem so innocent either. Johnny isn't attractive as he once was. I'm sure as he ages his insecurity is starting to kick in. Amber working with alot of attractive men I'm sure is not easy to watch. People need to stop taking sides just because you love Johnny in movie roles.
I think they are both Guilty of mistreating each other.",Lil Lou,0,2021-02-19T01:41:39Z
429,UgwmIJ_xLbVUH7YHKoN4AaABAg,I mean thx to YouTube or google or should I say Big Techs in overall?!,John Doe,0,2021-02-19T01:31:18Z
