,id,comment,author,likecount,publishedAt
712,Ugxb002RyitkjglPe454AaABAg,Boycott her movies! Don't go to her movies and and write everywhere and to every studio that you don't want to see her..,ei-da?,1,2021-02-17T14:13:08Z
713,UgxsGx5IH9MhAabhVyd4AaABAg,"Oh, we will babe😉",ei-da?,1,2021-02-17T14:10:56Z
714,UgyqiTE7-kV0OUCH-QN4AaABAg,Let’s cancel this bixch for good 😂👌🏻,lexis garrison,0,2021-02-17T14:02:45Z
715,UgxO1eR4vx1MWpGruGJ4AaABAg,🤦‍♀️,The Killing Joke,0,2021-02-17T14:01:31Z
716,UgwDtq2uAGADgZePdT14AaABAg,WE GOT EM,HipHop Head,0,2021-02-17T14:01:19Z
717,Ugw5xUGU3EP7XYTfEEZ4AaABAg,Good!! You guys can hire me instead then.,October Ward,0,2021-02-17T13:51:39Z
718,UgytzI-kPcqQ1aKQme54AaABAg,"This is exactly what she wanted to do to Jonny Dep, it's called Karma",Farzaneh Gh,0,2021-02-17T13:45:34Z
719,Ugx6f5ER0DSf8EpP9NJ4AaABAg,Woah what,Kim Atha,0,2021-02-17T13:41:36Z
720,Ugx0cObHv5fTF1CpeaV4AaABAg,Karma is doing her job you deserve this i wouldn't watch another movie if it had you in it,Anthony Tate,0,2021-02-17T13:32:43Z
721,UgzpQ1Kh1x-axCvcuXp4AaABAg,Shouldn't have ruined Johnny's career first then.,Tuan Tran,0,2021-02-17T13:14:04Z
722,UgxZclziXeljDjOlGI54AaABAg,That's what she deserves at least after all...,Honey Hani,0,2021-02-17T12:58:23Z
723,UgzhBrI2xJahn1W6vtB4AaABAg,She needs to be fired. Keeping her in the movie is condoning domestic violence.,Teresa Walden,0,2021-02-17T12:50:17Z
724,UgxdV32_FojzBF_-ACJ4AaABAg,NOBODY WILL HIRE HER?!? what a shame😒😒,Sara Preda,0,2021-02-17T12:33:52Z
725,UgxNrWVgJttjd7Mlc114AaABAg,"Praying for Johnny 🙏 hoping he would overcome every obstacle he's facing. He has a lot of people waiting for his return to the screen... And as for her... Well, what goes around comes around...",Eunie Q,0,2021-02-17T12:27:55Z
726,UgwhnV0LkR1ti9fOOVd4AaABAg,"Your not getting rejected because of petitions, ur getting rejected cause your an arse",Sheikh U,0,2021-02-17T12:09:08Z
727,UgxVcAybLgU3qHBqA9x4AaABAg,She should be in jail.,Beren theBear,0,2021-02-17T11:53:38Z
728,Ugz-8q2_7hh04AF1d554AaABAg,Asides from her attempting to destroy Johnny Depp...I don’t think she’s a very good actress anyways...just my opinion,Cynthia Sealy,0,2021-02-17T11:43:26Z
729,Ugyh2QVtA1SyO4fyk-14AaABAg,Guess she can go back to stripping,James Agradi,0,2021-02-17T11:33:49Z
730,Ugyyl0MHyT4NE38bdlN4AaABAg,It is her own falt. She wanted to kill somones carrier just to bust up Hers... And now ie backfire,Azurael1,0,2021-02-17T11:32:26Z
731,UgxujgSQBHZP096pdxN4AaABAg,"I don't care how good the film is, if it has AH in it I will not buy or watch it.
I wonder how many others feel the same?",Nigelnightmare,0,2021-02-17T11:25:51Z
732,UgyEu0fBOhj1T9GwXMt4AaABAg,"Oh BOO HOO!
You tried.
You failed.
Now you must live with the fallout.",Nigelnightmare,0,2021-02-17T11:17:54Z
733,UgyqpByK7An_FgR7mQx4AaABAg,We're such pansies nowadays that you really have to bleep out the word abuse and beat. What the f*** has happened to us,adamwest,0,2021-02-17T11:13:30Z
734,Ugwb7uM61a0_DJUe-dx4AaABAg,"Are you not allowed to say the word ""abuse"" on youtube or something? What a joke this site has become...",Stan Lee's Ghost,0,2021-02-17T10:59:54Z
735,Ugz2z8llnNJyXZ-X_qJ4AaABAg,Nobody want's to see her...,headbangersworld,0,2021-02-17T10:20:06Z
736,UgxVLz_y_UZQWxtQZ2V4AaABAg,"Well, if she don't get replaced, I'm not gonna watch the movie 🤭",King Sakuya,0,2021-02-17T09:49:27Z
737,UgzpTa7eDh7DaD1HB1l4AaABAg,YOU GET WHAT YOU FUCKING DESERVE.,talha siddiqui,0,2021-02-17T09:37:06Z
738,Ugyx4b8dbiRFdFvJRw14AaABAg,If she gets the role....everyone should boycott the film. Get ‘em where it “heards!!”,Plants Over Pills,5,2021-02-17T09:34:50Z
739,UgwTP02qEw9oTAA28sp4AaABAg,IDK Scamber. Perhaps “I can’t get work BC of......” says ALOT! The witch doesn’t get it.,Debbie California,0,2021-02-17T09:22:40Z
740,UgxOrRuLjLgebsePq054AaABAg,Do you realise how disconcerting it is to listen to you telling a story when every vital or action word is cut out? It's like watching a porn movie without any porn.,Birdy Num Num,0,2021-02-17T09:19:38Z
741,Ugw1Ir9r22EinyUeRd94AaABAg,"Disney: we are sorry depp
Also Disney: wanna job amber? lol
JK",Ian Cain,0,2021-02-17T09:08:30Z
742,UgxdKdIvg87mndQMqBp4AaABAg,It should be noted that depp has been rehired by both WB and Disney and has both roles of sparrow and grinderwald back,Onyx Springtail,0,2021-02-17T08:46:09Z
743,Ugx1oSS3tDFopr_WcA14AaABAg,"It's good to see that facts prevailed over emotion.
 People you should read Machiavelli.",theodhor shkembi,0,2021-02-17T08:38:13Z
744,Ugzfk6R8OZj7ySwIPYB4AaABAg,A narcissistic predator will ALWAYS play VICTIM! Amber needs to be shunned! I’ve known many a crazy btch that got men arrested AND criminal record!! Based on lies and need for attention! I’m also an abuse survivor! Operative word... SURVIVOR! Lucky to be alive! I fkn hate her and won’t watch anything she’s in! I’m surprised I clicked on this! ✌🏼🇨🇦,Yvette Brand,0,2021-02-17T07:31:07Z
745,UgzXoMBb-ASCf1GCDg14AaABAg,I hope she doesn't get any roles in anything ever again. Career finished.,Cameron Goldthorpe,0,2021-02-17T07:20:53Z
746,UgwDVZoOIr4UEkzQ6zF4AaABAg,@3:30 i definitely see a couple small bruises.,Juniper Huner,0,2021-02-17T07:19:36Z
747,UgwUFKll7GVQtG2Q1NV4AaABAg,THAT B*tch BETTER NOT PLAY IN STAR WARS EITHER . Darth Vader might have changed but that Abuser isn’t going to have that chance at all . The only role she can be playing is a prison mate .,Kristie Yang,0,2021-02-17T07:11:52Z
748,UgwCG4r5v2Yem_ZU0Ct4AaABAg,"Amber Heard deserves to be kicked out of the entertainment industry for making false accusations against her ex-husband Johnny Depp. AH should be held accountable for what she’s done and is continuing to do. There is so many great actresses that can easily step into Aquaman’s 2/3/4 Mera’s role and would have incredible chemistry with Jason Momoa. I watched Aquaman a few times but not because of Amber Heard but for the many great actors they have in that movie. That woman doesn’t deserve to continue to work in the entertainment industry after what she’s done and is continuing to do to Johnny Depp. AH should be held accountable for being an domestic violence abuser that she clearly is. As long as she’s given the platform to play the victim that’s not going to happen. However, I do strongly believe in KARMA and AH is definitely going to get what she rightfully deserves and hopefully that happens a lot sooner than later",Keitha Kennedy,0,2021-02-17T07:09:58Z
749,Ugz52oEFm0hNoh_Ifkl4AaABAg,Abusive Amber would make a lovely addition to a box. I'd say unless she learns and grows but we all know she won't choose that option,Char-Lee Wiebe,0,2021-02-17T06:36:38Z
750,Ugw5tZaRM8dc_FDc-fN4AaABAg,Hahahahahahahahaha,jack frost,1,2021-02-17T06:23:15Z
751,UgyLu1W15UlabjnX5Yh4AaABAg,Sign petition to destroy her career 🙌🏻,Nikhil Rao,0,2021-02-17T06:00:48Z
752,UgzDFfz0CXFVpJAp8fl4AaABAg,Finally some great news,Norman Olson Western,0,2021-02-17T05:58:16Z
753,Ugxx4MmNqpFxtDyPHnd4AaABAg,I never liked this woman🙄,SugarGlaze,0,2021-02-17T05:57:42Z
754,Ugyw22WQMN359MydCBV4AaABAg,I hate cancel culture but in this case its well deserved. She really should get some jail time but I doubt that will happen,Alysia Petak,0,2021-02-17T05:54:59Z
755,UgwPKD3cb0MkDwWhY614AaABAg,Amazing!,Chico Blessed,0,2021-02-17T05:37:36Z
756,Ugwu1TjzrJSUoSWYwrR4AaABAg,I would think they won’t hire her because she can’t act,Desi Herring,0,2021-02-17T05:25:45Z
757,UgwndGHwmPeh_N1gK6F4AaABAg,She better not get into anything star wars related. Petition to keep her away from it?,LillyTheNeko 17,0,2021-02-17T05:23:04Z
758,UgxNhe13aU4lMVp6-D54AaABAg,If she was a good person. There wouldnt be thousands of people signing petitions,HaviboX,0,2021-02-17T05:08:59Z
759,UgzDdRXzo_M5MmxljsB4AaABAg,"YouTube censorship on this vid and any vid alike is absurd. Amber Heard is an ABUSER, she commits DOMESTIC VIOLENCE! SHE IS NOT THE VICTIM JUST BECAUSE SHE'S A WOMAN!

#justiceforjohnny",none enon,0,2021-02-17T04:48:54Z
760,UgwPwQpIQwf4YabTrIR4AaABAg,Oh well,katy larson,0,2021-02-17T04:26:35Z
761,Ugz2rLCcknvOdKA8jhZ4AaABAg,AMBER SHOULD BE CANCELLED.,CSA,0,2021-02-17T04:23:54Z
762,Ugx4Ka4zm8XlvvfQiCd4AaABAg,Fuck her man I wish dept got his Roles back :(,NemoJi Meister,0,2021-02-17T04:09:56Z
763,Ugx2deaiFEz0wVAHJcl4AaABAg,5:37 that doesn't really help with the content of the movie if they want to keep the fans happy and still make good content then they have to compromise with the audiences demands,Kevin Pham,0,2021-02-17T03:57:14Z
764,Ugx06IP69TSvDuP2YbV4AaABAg,"never heard of this Amber before but so for the situation good on Johnny, hope to see the Pirates Caribbean",Kevin Pham,0,2021-02-17T03:54:47Z
765,UgxDOE-m6_DjGnbEmJh4AaABAg,"No she doesn’t deserve it (any role), and should be punished for what she’s done.  Both sexes get abused, it’s just sad in many ways that it is not showing that much with men that have been taken advantage of. Not that it will happen, but if in the future after she serve some jail time; and still wants to do something  I think a formal apology along with many other things she should find a new job.  I personally think that her acting roles or Hollywood life is over, if you still getting paid for some of the rules that she was in or has been in; maybe what you should do is just save it  knowing that you probably make a lot that could possibly if you wanted to get a house and retire early.",u140550,0,2021-02-17T03:45:19Z
766,UgxXrC_VJ9mY_4Cb6aB4AaABAg,HAHA!,Armando Willem,0,2021-02-17T02:49:28Z
767,Ugy0anr7kV2I4tKJlwR4AaABAg,Yep. That kind of goes without saying she’ll be disbarred from Hollywood. Her own doing.,Gwen Dolyn,0,2021-02-17T02:35:19Z
768,Ugy0nInedOKWGb0EWd14AaABAg,SIMPLE,DRUGZY 1201,0,2021-02-17T01:46:27Z
769,Ugx6KW8-1A1R1YhYSYx4AaABAg,Don’t know the keyword but u are the best YouTube,Hunter Mikels,0,2021-02-17T01:42:58Z
770,UgxxDxp6P-DccBrgpCd4AaABAg,She's a bad bad actress.  I never liked her,TheIronnia,0,2021-02-17T01:33:13Z
771,UgxXlXCbL0PSmuU2ROp4AaABAg,"Action must be taken, if she is proven guilty in the court of law. If not, just don’t go see her movies.",peoplenoodlesoup,0,2021-02-17T01:28:52Z
772,Ugw9pNu4pWc1y8cR9_14AaABAg,"I’m just not sure what to think not knowing everything. Having been in an abusive relationship, if you recorded me sometimes, I would seem like the abuser, not knowing all details, because if you are abused, it can make you just snap sometimes because you emotionally can’t take it anymore.",peoplenoodlesoup,0,2021-02-17T01:27:06Z
773,Ugz1BQjO3Q4A9a2xEGN4AaABAg,I mean if she was the victim... She wouldn't be going out there like she is...you know what I mean? I mean... She would be traumatized or something but she's out there taking pictures smiling and all.. like if she wants to win something... That's all I'm saying... If she was the victim or the other guy who knows,Diana Gutierrez,0,2021-02-17T01:24:29Z
774,UgwfqE6rUZPxG9XYjo54AaABAg,Good,Evelyn Clay,0,2021-02-17T01:19:30Z
775,UgzHJhALBS-zNsG-bZx4AaABAg,"Interesting ... she now has reservations about public perception.

Yet when it came to Johnny Depp she was all too willing to use the same public perception to attempt to not only ruin his career, but also to forward her own victim story.

Looks like she's finding out that karma sucks.",Mike Wilton,0,2021-02-17T01:08:27Z
776,UgwI_axpwBnfHd0cMCR4AaABAg,"Good, serves her right. Karma will do justice to her for what she's put that man through.",Alex Judkins,0,2021-02-17T00:57:24Z
777,UgxSjhSpTnLZ3_7fRvR4AaABAg,Of course when she lied about being a victim of abuse and she was the abuser. She's narcissistic and she deserves that karma.,Karl Su'apaia,0,2021-02-17T00:47:58Z
778,UgwPqpdOECCob7hWA4R4AaABAg,"""LEAVE ME ALONE!""

Um, you did this to yourself sis. Consequences, Karma. You did this.",𝚖𝚘𝚘𝚗,52,2021-02-17T00:47:41Z
779,UgxZ3rvLB5AqWnAjnQd4AaABAg,Why are words like abuse being censored?. Very hard to follow the thread when it skips over words. If ya can’t put everything in then why put chopped off pieces. Ridiculous,Ivonne Irias,0,2021-02-17T00:44:25Z
780,UgxAehrOyghyt8iXCEd4AaABAg,"Its funny to say but it's true, we (us public) are the bosses of actors. If people don't go see the movies and boycott them, like in 
 this case Amber's movies, she will become a ""has been"". Basically, we have the power 😇",Annita Maris,0,2021-02-17T00:34:33Z
781,Ugy3KiC7PiJimYt8P5l4AaABAg,Amber...stop. It's over.,Maya Alieva,0,2021-02-17T00:23:18Z
782,UgzWeXeEw3kBstKDHhR4AaABAg,"Dw l would hire her, as an escort 👀",Tom Williams,1,2021-02-17T00:21:37Z
783,UgwT_J7bzNGbs6ICwy14AaABAg,Johnny Depp has such a long and respectable track record to try and paint him as an abuser was never going to work. If he was that kind of person we would have heard from other women about it long before Amber Heard.,mmish,1,2021-02-17T00:14:10Z
784,Ugy2yQo6rk_Bcs5RbVd4AaABAg,"After what she tried to do to Johnny it serves her right. She doesn't a role in any movie.  Besides she can't act anyway. See what Evil gets you, SHE DEVIL.",Joni Kaltenbach,0,2021-02-17T00:12:35Z
785,UgwpxDfuNGeFXdY_kF14AaABAg,"She is a horrific ""actor"" anyway! I'm literally stunned that she managed to get this far in Hollywood. She CAN NOT ACT. Stiff as a board. She must be GREAT at ""other things"".

#justiceforJohnnyDepp #amberheardisanabusivepsychopath #notabot #wejustdontlikeyouamber

P.S. sign the petition, if you haven't already. https://www.change.org/p/dc-entertainment-remove-amber-heard-from-aquaman-2/sign",TrueBliu Nineleven,0,2021-02-17T00:10:13Z
786,UgyXBXaT8dwHSp2iBe54AaABAg,a secret hidden message,Dziban Art,0,2021-02-17T00:07:49Z
787,UgzFKUfhohBnK6TqLwJ4AaABAg,jason made aquaman a hit not her,Sherry Armstrong,0,2021-02-17T00:07:37Z
788,Ugxm9Yzp3Ig1F0y4hTZ4AaABAg,JUSTICE FOR JOHNNY!!!!! get Amber in PRISON NOW!!!,Dr Hapi,1,2021-02-16T23:33:16Z
789,UgxF7q7Tj6O5bpXoupx4AaABAg,Good!,Anne TheAngel,0,2021-02-16T23:32:16Z
790,UgxIyABf9tUaZ-WMfHV4AaABAg,What can you do? He’s Captain Jack Sparrow,Jr Tapz,0,2021-02-16T23:24:27Z
791,Ugz8ZUIFE7jltXbqtDh4AaABAg,I hope she loses all her money and fame,GeNeRaL FrIsK0191,0,2021-02-16T23:13:35Z
792,UgxBH05Q_-Nf3ds34U14AaABAg,She is an absolute creep for what she did to him. I hope Hollywood shuns her forever and she never works in entertainment again.,Bridget,0,2021-02-16T23:13:10Z
793,UgwZ218iDw78MCOpkPl4AaABAg,"Let’s face it,  we’ve all seen and heard more than enough of her and the noxious creature that she is. We don’t need people like her",Sharon Bodimeade,0,2021-02-16T23:10:21Z
794,Ugwj_k9BGfLV6H1ZCdt4AaABAg,This is Narcissistic abuse by a female.,Salomons Daughter,0,2021-02-16T22:59:58Z
795,UgzdkR00if6T8TjaF2N4AaABAg,"Karma K has came to collect 
Make your own goddamn money 
🥴",Salomons Daughter,0,2021-02-16T22:56:13Z
796,UgySSTbwS6oOiu7NYsB4AaABAg,"I cant believe that youtube is censoring these words...this is absolutely insane! This bullshit mentality is whats wrong with our culture and our political landscape.
There is literally no reason to bleep out these words. The fact that they censor Johnny Depps name and not Amber Heard even though she is clearly the criminal in this situation is blatant sexism. This needs to stop. Otherwise they risk losing their support.",b3at5talk3r,0,2021-02-16T22:47:34Z
797,Ugwi-JTx1jkUvl6lA8t4AaABAg,👇Justice for JOHHNY DEEP !!!,Leon Mori,1,2021-02-16T22:42:51Z
798,UgyqAvkXUFsXr6SWSwB4AaABAg,At 1:56 your audio was cut and couldn’t hear until 1:58 but the video was great,Leon Mori,0,2021-02-16T22:40:57Z
799,UgzXxIcQcbF9RKyQBLx4AaABAg,"Women should be believed, but not blindly. Her ego told her she could eff with Johnny Depp and everyone would believe her. She effed with the wrong guy. Fans absolutely adore Johnny. It must kill her, but I'm delighted.",Christine Musselman,0,2021-02-16T22:40:28Z
800,UgxrDxxBXoWZcjCMHgN4AaABAg,My family and I will not watch anything that AH is in!!! What she did was SO wrong!!,Mamma Bear,0,2021-02-16T22:36:42Z
801,UgxWV73QK-5umJguEc14AaABAg,"Team Johnny
The words I wanted to hear (3:46)",Franny worldxo,1,2021-02-16T22:30:34Z
802,UgyBzJzLzP4Nywe7UCx4AaABAg,"""That's a lot of openings for someone like Amber Heard to go into""",Darla Day,0,2021-02-16T22:25:34Z
803,Ugxod8zyVr2TuA8IY_B4AaABAg,"oh hell nah, keep her away from star wars",FangRiper Games,0,2021-02-16T22:20:17Z
804,Ugw6kwHJa3X5XBtHSQZ4AaABAg,I hope she never works in Hollywood again!,breann,0,2021-02-16T22:17:49Z
805,Ugyrj8wFLj5Pk_IxF-N4AaABAg,What's with the censorship !?,Gerald Da Coruña,0,2021-02-16T22:16:13Z
806,UgzdBuS5pnq3eYprpVF4AaABAg,I don't blame them,owowlsolseoosksksosoeosoeleekekkekeks,0,2021-02-16T22:13:22Z
807,UgxJRNdwvMP61fCeI5N4AaABAg,I’d much rather see JD get a role in future Star Wars movies.,colby rodgers,1,2021-02-16T22:08:54Z
808,UgwHnNwFHTDK7z8d4AJ4AaABAg,"I guess she's finally getting it. 
Lovely isn't the same as loveable. She effed with the wrong guy. Johnny Depp is well loved by his fans. Jettison Heard and replace her with Emilia Clarke. She and Jason have terrific on-screen chemistry.",Christine Musselman,0,2021-02-16T22:07:17Z
809,UgwM1oZAcncYUD824Rl4AaABAg,"Also disney isnt going to give her any work.. tjey are behind depp snd have reordered him his role as ""jack sparrow"" and she has tried to drag them into her issues basically burning that bridge",Richard Grace,0,2021-02-16T22:03:26Z
810,Ugy2qOE8av_CN4FlrqB4AaABAg,But amber herd didn't make them money...Jason mamoa did... you could completely remove her character from the film without even replacing her and nobody would give a flying fuk lmfao,Richard Grace,0,2021-02-16T22:01:28Z
811,UgydpPA_hDm5Cnq96454AaABAg,Boo hoo you deserve everything that is coming to you. You abusive cow,Jaime Larrabee,0,2021-02-16T22:00:15Z
812,UgwInydEDkcVxQ2JkEV4AaABAg,"Now, where's my tiny violin!? 😆",Robert Slye Jr,1,2021-02-16T21:59:26Z
813,Ugz8UQKoW6_r9nB80Hx4AaABAg,Haha 😃😆😆😃😆,Jessica Zamarripa,0,2021-02-16T21:56:59Z
814,UgxrUwSOjPnP-rP52Ol4AaABAg,"Suggestion

The recap is way too long.",Muhammad Haniff Sazali,0,2021-02-16T21:56:17Z
815,Ugy14irXfd5kWMot4aF4AaABAg,Amber in starwars? That would be hard to believe after she subpoenaed Disney.,emily cheetham,1,2021-02-16T21:52:12Z
816,Ugwkz7nZVQ5Ly_-mP414AaABAg,"What goes around comes around. She brought this on herself. Call it carma/fate/something else- but all I know is she deserves to not be hired. She lied, manipulates, forged, abused & outright took advantage of people. Why the F would anyone want to hire her anyways? She isn’t even a very good actress. I’ll be glad if this ruins her career. The whole point of the petitions WAS to stop you being in aquaman so if you loose you role then the fans will cheer because we don’t want her. Also we don’t want to watch anything she may be in after the way she has treated Johnny and other DA victims. Overall I say to the Turd “ you dug your way into this mess. Only you can dig your way out. No fans will support you till you change your ways and become a respectable, civilised member of society & publicly apologise not just to Johnny but also to the fans for your behaviour.”",emily cheetham,0,2021-02-16T21:49:38Z
817,Ugyi4dheGdiBwJuM67J4AaABAg,I think Disney needs to think it over again about heard and all the films they put her in people will be against it for now you all need to rethink it all and roles for Johnny Depp again it’s wrong to get him outer roles and let her in think about this it’s like laughing at Johnny Depp she is because she has a role in films the bitch that took him down and keeps doing it how does it feel to you Disney and aquaman makers what do you think,Carole Lindsley,0,2021-02-16T21:42:48Z
818,Ugzk71Wd9LNt4MV2ZXd4AaABAg,I'm sorry but abuse claims are serious and people who create stories about being abused should be charged. Intentionally trying to ruin someone's life should have serious consequences.,jeneenr33,1,2021-02-16T21:41:23Z
819,Ugz4dnLfJ3yi1Ujc2Ll4AaABAg,I hope not Star Wars has enough problems,Angel Marcano,0,2021-02-16T21:41:02Z
820,Ugwp9x21QVpFLww7KRl4AaABAg,"They are nobheads if they keep her as mira

And if they do then everyone should boycott the movie and not go watch it",Andrew Gibbons,0,2021-02-16T21:37:53Z
821,UgzitFuvYLwvIqaLSnt4AaABAg,Now she knows how JD felt when he was falsely accused and she reaped the benefits of playing the victim. The fact that she said she would donate her proceeds to charities and didn’t follow through is just as wrong.,WenWen,0,2021-02-16T21:35:59Z
822,Ugznxg7yGfQlBM3HB554AaABAg,She looks like carol baskins.. can't be trusted,Mischievous Fish,0,2021-02-16T21:35:57Z
823,Ugwby9QfK1EwC77ywAl4AaABAg,The information that he lets us know is enough to picture the whole story from the beginning to end plus I want to win a iPhone 11 ☺️,Tee Kaye,0,2021-02-16T21:35:09Z
824,Ugx64HYn42jvrPcGCEV4AaABAg,including an incident when amber BLEEP BLEEP and then BLEEP johnny BLEEP BLEEP claiming he is BLEEP and fans thinks amber is the actual BLEEP,alan pelc,0,2021-02-16T21:28:56Z
825,UgwQ4MQiqaFn20j89ZZ4AaABAg,why has abuse been censored,Sam YKV,0,2021-02-16T21:20:17Z
826,UgyTgbjWzCGS-wCVKAh4AaABAg,"""When was the last time an actor assassinated a president"" -JD. I hope the best for JD, but disappointed with this statement, I bet if someone said that about our president now, action will be taken. Wish you luck JD, I really do.",501st Pirix,0,2021-02-16T21:20:00Z
827,Ugz0gfPryajG9vby-4N4AaABAg,"She's literally a wrecking ball for any franchise that hires her. At this point, if the movie has her in it, it will flop and end up punishing her coworkers.",sweetest days,16,2021-02-16T21:14:39Z
828,Ugxo_Tp2ASNJJHLWrad4AaABAg,She's a evil bitch,OFFICIALSYK !,1,2021-02-16T21:06:53Z
829,Ugy4pL3O0is4LS4omjd4AaABAg,Johnny should get half of her pay :),RAVEN_SPRING_9000,0,2021-02-16T20:59:23Z
830,Ugwe8z_WHp3btJvdL114AaABAg,Xd lmaoo,snowdasavage epic,0,2021-02-16T20:54:33Z
831,UgzYmUbzSabUZG2hW1Z4AaABAg,#justiceforjohnnydepp,Beanzy,0,2021-02-16T20:41:00Z
832,UgyfMrHdf6BJtU9hPaB4AaABAg,Oh so sad. She got Johnny out of jobs with her lies  but now she's whining because she might not be hired. Poor dumb Amber.  I don't care. Justice for Johnny Depp!!,🌟Maud🌟,0,2021-02-16T20:39:19Z
833,UgxWZZPR9T8t5piMMQN4AaABAg,"People won't hire her, because of the hard evidence against her",Dr P. C.,0,2021-02-16T20:36:12Z
834,UgxaI7enJHQM8rJiR6B4AaABAg,Just imagine the world where Amber Heard is dating Marylin Manson.,Max Georgievsky,0,2021-02-16T20:34:57Z
835,UgzsK0hr9b1rR0vqWqh4AaABAg,She is done I think,Veronica Cann,0,2021-02-16T20:34:27Z
836,UgwL16PpPJ1YFUuv-5Z4AaABAg,"Idk why she’s complaining, if she didn’t lie about the whole thing no one would be making these petitions. She needs to just own up to what she’s done and be an adult for once.",Rosalie Doane,0,2021-02-16T20:32:05Z
837,UgxKOaipJZKuzczZOMh4AaABAg,#TeamJohnnyDepp,Sybil_anna82 FibroWarrior,0,2021-02-16T20:16:43Z
838,UgyTxojatgAaQqlBHzp4AaABAg,So she's complaining that her life is ruined because she tried to ruin someone else's life,Star Emerson,0,2021-02-16T20:15:38Z
839,UgwsGHImvQnUSCp_Lql4AaABAg,Ah finally some good news,Star Emerson,0,2021-02-16T20:14:35Z
840,Ugz6Xzw-zFWsGrte_z94AaABAg,"She has abused him multiple times, and even tried to destroy his career and take his money. How do people defend this woman?!?!?!",Gabi Garzon,0,2021-02-16T20:09:16Z
841,UgxGcn6SjE2dvJwUPMp4AaABAg,"Oh this feels so good.
This is what you get for being a snake.",Skull Milo,0,2021-02-16T20:08:00Z
842,UgyLYOfs1KUWFPrqiJF4AaABAg,"""No one will hire me cause I'm a horrible person!!!""

Boo fucking hoo. They say karma's a bitch so don't know why she is so surprised. You get what you deserve.",LadyLugia87,0,2021-02-16T20:07:40Z
843,UgwTzTUejOh-ziNg2Ll4AaABAg,Maybe some of the reason can be seen in the Aquaman movie. She's not a very good actor. Whoever put her in scenes with Nicole Kidman must have disliked Ms Heard because she looks like a cardboard cut-out in comparison.,Sandy Kazuko,1,2021-02-16T20:07:34Z
844,Ugz2-CjF9etj7ZD7fIF4AaABAg,"If they keep her in the film it will be terribly unfair to the rest of the cast, and to the fans. 1) The movie could tank just because they leave her in it, which would really be sad for the rest of the cast. 2) If they leave her in it puts fans in a terrible spot that we must support this person if we want to see the movie, or if we want to support the rest of the cast. We will be left with the decision of boycotting the whole cast with her which would be bad, or enabling her and making her feel even more invincible to do these horrible things and have her career thrive. I think they are in real danger here financially if they do NOT replace her. And putting her in a lesser role would not make me happy, even if they paid her less. She needs to be OUT.",LL 00,0,2021-02-16T20:02:38Z
845,Ugw3-mfNRDOmk9w_H5B4AaABAg,From what i have heard Johnny Depp has had an apology  off Disney and is being rehired as Jack Sparrow.,Rebecca Rose Mannion,0,2021-02-16T19:59:17Z
846,Ugy-QweLPuw_AuMQkOB4AaABAg,Can’t watch this shit as it’s bleeped out!,Mark Caswell,0,2021-02-16T19:51:26Z
847,UgxXR_x_vbi5yh32sK54AaABAg,Just stop saying abuse and avoid the annoying cut,Expe x,0,2021-02-16T19:48:41Z
848,Ugx7rqpvELTt2s5vI-B4AaABAg,Honestly dude. FUCK YOU. I'm with Jonny but what your doing here isnt for Jonny. Your here to get views off of him. You say the same stupid ass script in EVERY video. Same words just different video edits. Your a punk ass by doing this. Fucking lazy ass,John Wick's Doggo,0,2021-02-16T19:48:35Z
