,id,comment,author,likecount,publishedAt
1127,Ugz7plD_hnDNgj5TxpV4AaABAg,Good! maybe it's time to start saving her money for an early retirement in jail,Little Squishie,0,2021-02-16T07:03:27Z
1128,UgwB0vp4gwoKdJus7M14AaABAg,"I am perfectly DELIGHTED to hear the petition I signed is working!     When there is audio of you admitting you've done a particular thing, it should be kinda obvious, wouldn't you think?     I will boycott anything with her in it, that much you can count on, and give bad reviews to any project ridiculous enough to use her.     Good Riddance!",Dipper Bear,11,2021-02-16T07:02:57Z
1129,UgwB1cALGtJAqtSvXbB4AaABAg,Woah what,Angel TNT,0,2021-02-16T07:00:31Z
1130,UgzFR9FT88EdyFXfWtJ4AaABAg,"It would be so, SATISFYING, if she never got another movie role, ever again; I’d live the rest of my life, with the only smile on my face.",jday beats,4,2021-02-16T07:00:06Z
1131,UgxbEq2fMUU7i5itrJ14AaABAg,Lol we didn’t watch the movie because of Amber .... your good you can recast her her role to someone els . Jasons water emerging scene sold that movie not her .,Chelsea Panda,0,2021-02-16T06:59:52Z
1132,UgwpYmB6z_tVPOgsoSF4AaABAg,You do not need to do all this sensor bullshit doughnut operator literally breaks down police shootings where people are getting killed he has over 1 million subs and doesn’t bleep his shit bro chill,Dusty Swope,0,2021-02-16T06:53:04Z
1133,UgyfuRgFSNLEjPmo9294AaABAg,I love how things are finally starting to change for men. There are way too many amber herds out there,solitario 77,1,2021-02-16T06:49:28Z
1134,UgyleXUySn1DinZvvh54AaABAg,You kept on saying the same shit bro..,Angelus MorningStar,0,2021-02-16T06:44:26Z
1135,UgxiW2_ndpXiIP2fruV4AaABAg,"Justice for Jonny now!
#jonnydepp
#loveforjohnny
#justiceforjonnynow
#johnnydepp",Breezy bx's mom,0,2021-02-16T06:36:21Z
1136,UgysuncJG_eSJXbdRJx4AaABAg,fix ur mic.,MR EVIL GAMER,0,2021-02-16T06:35:41Z
1137,UgxRRqL5EpPMWV2kVVt4AaABAg,Joker: You get what you f**king deserve.,Daniel Toledo,48,2021-02-16T06:34:35Z
1138,UgwKzdko6PtaKRMJPzR4AaABAg,No if she ends up in a star wars series I'm dropping Star Wars all together.,Wafeeqah Barnes,0,2021-02-16T06:34:25Z
1139,Ugw4IcCeaw6Bk6C83vp4AaABAg,"If they do hire her for Star Wars, whatever it is she’s in WILL fail",jacob x,1,2021-02-16T06:33:00Z
1140,UgxInyMR7NHxS90BK5V4AaABAg,Justice for Johnny!!!!,FoulTastingFairies,0,2021-02-16T06:30:33Z
1141,UgwE6UJ3eU7AKz0-_Cl4AaABAg,"Disney: We wont bring back Johnny Depp

Then say goodbye to one of many big franchises you have",임으뜸,75,2021-02-16T06:26:25Z
1142,Ugyu8KEw8TBRHcCt6-R4AaABAg,"They better not put her on Star Wars, the pop culture fans will not stand for a snake like her.",Penelope Ramirez,0,2021-02-16T06:23:49Z
1143,Ugx_Uoz-rA9fBcfheBp4AaABAg,FUCK YESSSSS JUSTICE FOR JOHNNY,Chicano Chingon,0,2021-02-16T06:20:13Z
1144,Ugw4bzEZKcV2YzjTk8J4AaABAg,Disney will NEVER hire her. EVER.,Joann Hesse,0,2021-02-16T06:19:15Z
1145,UgyG1YoZaD5ra8lnhcB4AaABAg,She should have Elon send her to Mars and she can start again. I think its game over for her here..,Toni Marie,0,2021-02-16T06:18:49Z
1146,Ugzum2fjuy2EVD6VQ-l4AaABAg,I mean common... She tryed to ruin guilbert grape and come between him and arnie... Even had simp elon musk trying to provide protection,Lee Vega,0,2021-02-16T06:09:06Z
1147,UgxzU2MIIkrjnI1PfF14AaABAg,TEAM JOHHNYYYYYY,yarrie giddings,0,2021-02-16T06:06:22Z
1148,UgzhKgpiYkz3RqLIi_B4AaABAg,"Damn, why this witch gotta be so beautiful though 😔😔
You know how easy it was for me when Ellen got exposed, she looks like a dried potato",MaxW,1,2021-02-16T06:04:19Z
1149,UgylV0ULDRPGBIwGnP94AaABAg,The black soul of AH can be seen in that smirk every direction she looks and tries extremely hard to hide it. She is not pretty because of the darkness inside ...helps for the beauty inside to boost it on the outside. Narcissists are the most ugly sick people who stalk and prey on their victims...I will not watch anything with her in it. They take any longer to decide I won't watch Aquaman 2 because they cant make up their minds to support an abuser.,L G,1,2021-02-16T06:04:16Z
1150,Ugy7THIh-q5Eg70wPGN4AaABAg,To you think all she had to do is not lie about being abused and nothing would ever happened... she literally brought this upon herself,greghah,0,2021-02-16T06:01:46Z
1151,UgzFzPEgANup-aoO2Od4AaABAg,"The people who pay to see their movies hold the REAL POWER not them. Without us they are nothing, they should well remember this!",Animation Alliance,5,2021-02-16T06:00:15Z
1152,UgwAT5HYhIsGSZlFOe14AaABAg,We love to see it,Olivia Martin,0,2021-02-16T05:58:36Z
1153,UgxaWxXnWd7Cd5LBbjN4AaABAg,"And the penny finally drops haha, team depp all day every day 🙌 👏 😅",Jayne Conlon,1,2021-02-16T05:58:25Z
1154,Ugwlqa57-q0oNOPtiGt4AaABAg,Want to know what time something else that ended her career her trying to sue Disney for some public documents on the people who work on the Pirates of Caribbean movies to get dirt on Johnny. And all lawyers know you don't mess was freaking Disney and courtroom cause you don't win.,Manuel Garcia,0,2021-02-16T05:55:37Z
1155,UgzOPDfT6nmG7ZwwMPt4AaABAg,Team Johnny,Luz Rodriguez,0,2021-02-16T05:54:55Z
1156,UgzK60OOT1fNIC-BMXF4AaABAg,I hope she becomes a Walmart greeter,Schneider Bertrand,0,2021-02-16T05:52:40Z
1157,UgxpnVlkfouLYC5Bc2d4AaABAg,Sign the petition! On change.org,J T,0,2021-02-16T05:51:32Z
1158,Ugwij4V3TrROoU1Ca8t4AaABAg,Johnny Depp is a good person💖💖💖,Jessa Mae Gamlanga,1,2021-02-16T05:46:35Z
1159,Ugw-rNxtqsHBEp1oCfN4AaABAg,"LMAO 😂😂😂😂😂😂
That's what she DESERVES.",Chérie,0,2021-02-16T05:46:07Z
1160,Ugw21dSpgz4SfeJIrWR4AaABAg,"Amber lost the parley, now her ship is sinking due to the attack from Jack's crew




Gibb : FIREEEEE!!!!!",Amirul Akmal,0,2021-02-16T05:46:00Z
1161,UgxnLQPlcwO3u3oXhA14AaABAg,"She's already been officially replaced.  YOU MESS WITH THE BULL YOU WILL MOST DEFINITELY GET THE HORNS..the bull is obviously Johnny Depp, and the horns are his fans. In closing I would like to say to Amber...The petitions alone aren't the only thing that hurt your career....but SHITTING IN YOURS AND JOHNNY'S BED, in my opinion, was the proverbial straw that broke the proverbial camel's back.",Pumpkin Puna,0,2021-02-16T05:43:28Z
1162,UgzCjyZkY1ctwyeZ8mx4AaABAg,I'd love to see her cast as Ungoliant if they ever film The Silmarillion,Quycksylver,0,2021-02-16T05:37:17Z
1163,Ugxit9vd7s4Etgf1w2J4AaABAg,"Serves her right. I hope this ruins her career, and leaves her stuck acting in commercials such as The General Insurance & JG
Wentworth ""877cashnow""",Trey Wright,3,2021-02-16T05:34:08Z
1164,UgxQ-n4QaRrisdw90od4AaABAg,Can you have citations and maybe include a direct quote from Amber Heard herself next time?,The Geek Writer,0,2021-02-16T05:33:41Z
1165,UgxMws2-g47fiD9am3d4AaABAg,"If they keep Amber heard, she's going to cost Warner Brothers money, because fans won't support a movie she's in. Especially people who lie about domestic violence claims. it's also the mere principals at if they keep Amber Heard, they're glorifying domestic violence, and make it acceptable for women to commit domestic violence, without punishment. I believe, committing domestic violence violates the honor clause put in an actors contract, which means termination, loss of pay, without any legal recourse to sue.",domo mitsune,1,2021-02-16T05:33:27Z
1166,Ugx9RUTIyommu5wzoph4AaABAg,Thats a No from Star Wars like hell they're gonna use her for a Star Wars role.,Zen Nathaniel Yuzon,3,2021-02-16T05:31:00Z
1167,Ugw8LB2M720LAoHqCch4AaABAg,She just got replaced,Becc F.S.,0,2021-02-16T05:29:30Z
1168,UgzeDN0QrkOhNpuMP_N4AaABAg,Good! I hope it stays that way,Abdrea ___,0,2021-02-16T05:26:48Z
1169,UgxDrDVZY451gznHptJ4AaABAg,"I have a feeling that she is going to be in any type of movie at all, it's probably going to be amateur porn.",Michel Hammack,0,2021-02-16T05:21:00Z
1170,UgxVANdoj64D82kpDy14AaABAg,I already no longer watch Aquaman whenever they repeat it on TV lol,Ellora Sg,1,2021-02-16T05:20:57Z
1171,Ugx49V36b6dADhD_xg54AaABAg,Tf is it split my guy? Haven't seen anyone supporting amber has been,Hunter Hoffman,0,2021-02-16T05:18:17Z
1172,Ugx5D2ULYhWfUXclcVB4AaABAg,Aww my heart bleeds for her. NOT!,Steven Graham,1,2021-02-16T05:12:43Z
1173,UgxUSFnsM1SowqLjkYd4AaABAg,"Guys, please stop insulting amber heard. I'm tired of liking your comments.",Ravindu Pabasara,2,2021-02-16T05:08:54Z
1174,UgyuB6b4sZ0j9207ac94AaABAg,"Sorry, not sorry- listened to the recordings of her and J. Depp's arguements/conversations. She's a totally horrid person, plus she lied about who was abusing who! She's toxic- I would never want to work with her, nor, as an employer, would I ever want to subject others to her possible lies and accusations- she cannot be trusted, as she's proven herself untrustworthy. 
Don't know anyone who watched ""Aquaman"" for AH, but pretty much everyone watched it for JM's portrayal of Aquaman. AH is easily replaceable, and deserves to be!",Linda Bealer,1,2021-02-16T05:03:54Z
1175,Ugz4HgO5bAZGhhDjEXB4AaABAg,And if the finger caught close enough across the tip it means he will always have constant pain in it because we all have nerves in our finger tips.,Virginia House,0,2021-02-16T05:01:44Z
1176,UgxOg1G5pe3FAeFAWKp4AaABAg,"It's not because of petitions, it's because of all the people that can see through her fakery.",Acidobay,0,2021-02-16T04:57:11Z
1177,UgzXtAkY6Q0eDbv2AWh4AaABAg,"WRONG, YOU CAN'T GET HIRED BECAUSE YOU FRAMED A GUY THAT WAS GOOD TO YOU, YET YOU INTENDED TO STEAL HIS FORTUNE, REPUTATION AND Possibly  HIS LIFE!!! ALL because you thought he was an easy Mark. Johnny was used, framed and seriously lied about. She deserves this fallout and more. She brought this all to Herself. 
BTW HEARD, we're real people, NOT BOTS. 😆😆😆
AND, YOU'RE EVIL...!!!",marmaladesunrise,0,2021-02-16T04:55:04Z
1178,Ugwi4UlBUkL9sZjNjsh4AaABAg,Poor poor pitiful pearl.,Tabitha Adams,0,2021-02-16T04:47:59Z
1179,Ugwu__2wUxBSemh8SNF4AaABAg,She fked with probs the worst actor you can fk with lol . Super popular in Hollywood.  Makes alot of money for movies.. has an enormous fan base. Super likeable . Dont hear anything bad from Johnny Depp.  The fact that warner bros is trying so hard to keep her is a little weird...,Valenwood,1,2021-02-16T04:46:25Z
1180,Ugy_nNAx_X-i_k3fhO54AaABAg,Waaaaaaaahhhh,Maestro,0,2021-02-16T04:46:12Z
1181,UgxqL7L-9rkWrNQQzg94AaABAg,What did you think? You asked for it!,Chantel Strydom,0,2021-02-16T04:42:28Z
1182,Ugxko1MpGnvd6wR9gOB4AaABAg,"Good! She brought this on herself. 
#justiceforjohnnydepp
""Woah What""",Catherine Jo-Ann,1,2021-02-16T04:40:12Z
1183,UgwmynnAnL7WBoC47bl4AaABAg,She is a disgrace to women that actually experience domestic abuse.,Jazoli Sauce,184,2021-02-16T04:36:06Z
1184,UgxEMdA-BpiSELzS8kF4AaABAg,"No one gives a shit 
Team JOHNNY DEPP",Anime Clips,0,2021-02-16T04:33:12Z
1185,UgyczkZMO6p8v4qWPgx4AaABAg,We don't want to see or hear about Amber Heard again. Justice for Johnny Depp.,ep300373,0,2021-02-16T04:30:50Z
1186,Ugz4hkFcLkpTq-kn7mB4AaABAg,JDs Justice🙏🙏🙏🙏,k. _nf,0,2021-02-16T04:29:20Z
1187,UgzS1H9ketYI2xmFeeN4AaABAg,She should be  removed Jd got fired for nothing and for one wont watch or buy the movie  if she is in it,marilyn fouse,0,2021-02-16T04:22:45Z
1188,Ugyiv5tRmoR-h4lsAC94AaABAg,"God, this is like buying a rap album from walmart. I can't with the censoring.",[ Just Mini ],1,2021-02-16T04:20:52Z
1189,UgyL8CMFg_7MoJla89l4AaABAg,"the censorship is bizarre, i do not know if it is beceuse this is intended for children.",Gonzalo Gomez Martinez,0,2021-02-16T04:19:08Z
1190,UgwQG0740v7pXVBkkpp4AaABAg,"I would think that if AH is allowed to stay in the  Aquaman 2 movie, then the fans could retaliate by boycotting the entire movie once it’s released.",Deborah Foster,1,2021-02-16T04:17:39Z
1191,UgwyRT06_jwI1a-QdxZ4AaABAg,Shes done.  She will be the next Brigett Nelson.,ANGRY SQUIRREL PRODUCTIONS,0,2021-02-16T04:15:41Z
1192,UgxPUwygsNbrCaqlw394AaABAg,2009 arrested for domestic abuse hmmmmmmmm everything I have seen screams A.H is a serial abuser.  Who lies about donating to a charity? Pathetic,Josh,0,2021-02-16T04:14:28Z
1193,Ugyl6RduX1_cVGvTgjB4AaABAg,Did youtube really make you bleep all those words?,Michael Mullins,0,2021-02-16T04:14:22Z
1194,Ugx71QxCqadgrCyjex14AaABAg,"She deserves to go through all this crap. After all, she did put Johnny Depp through so much shit.",Muhammad Fatihin Jeffril,0,2021-02-16T04:10:25Z
1195,UgxElUCFTJhn02entCZ4AaABAg,no one will hire her? GUTEN GUTEN,cheung chui hin,0,2021-02-16T04:06:46Z
1196,UgyIKKUnDw4ncQi3GAJ4AaABAg,JUSTICE FOR JOHNNY,Maisie Utube,0,2021-02-16T04:06:00Z
1197,UgxRi9JT7zi2zT58dLV4AaABAg,Amber must realize that not all treasure are silver and gold,pure anarchy,0,2021-02-16T04:02:11Z
1198,UgwKoSiPTGKFmcUR9pN4AaABAg,It's the time where movies from comics or in demand cast play some part but it's just what's in fashion rn,Surface Art Studio,0,2021-02-16T04:01:37Z
1199,Ugz7o9P4cFtVRIMcA6t4AaABAg,"I may be in the minority, but I didn't see any 'chemistry' between Heard and Momoa in Aquaman 1. Her character portrayal was stiff and unlikeable.",P.J. Burrelli,3,2021-02-16T04:01:10Z
1200,UgxHRkSQC8uT7GY0hN14AaABAg,She's always had an evil side - no doubt - this scheme was her big payout though and it backfired - thank God for justice or Johnny Depp would be done!,Kimberley Zona,0,2021-02-16T03:59:22Z
1201,UgxFUVO5WXIGjNohXX54AaABAg,Obviously amber....that’s how karma works.,Endeavor Rose,0,2021-02-16T03:59:21Z
1202,UgxZWg-UeYGzomMJg114AaABAg,Not gonna watch anything she's in. Period.,Ken Cheung,0,2021-02-16T03:58:31Z
1203,UgzxUC4cEwlEHkL5l3d4AaABAg,"For a narcissist like Amber Heard, bad attention is better then no attention at this point.",Gina Dean,0,2021-02-16T03:51:50Z
1204,UgxnvvIjCzoiThy0CLx4AaABAg,Ah beautiful isn’t it,keiffer smith,0,2021-02-16T03:42:52Z
1205,UgypC-5XpKIMyxtU-qN4AaABAg,She deserves it,Kim Peery,0,2021-02-16T03:41:53Z
1206,UgzkPBTkgpIjUlUdri54AaABAg,Sounds like someone has the hiccups lol,Dustin Cleveland,0,2021-02-16T03:40:56Z
1207,UgyRBfqWS2uOMHHezQV4AaABAg,Thats the idea hahaha,Jahim Jauh-hey,0,2021-02-16T03:37:30Z
1208,UgxjAL4IEbAVqZYr0Nl4AaABAg,"I will not pay to see any movie she is in ..... that's my right ...... after the J Depp thing . Any movie she's in , if her new partner makes a hit movie , I will not pay to see it . She is totally black band , in my heart ..... And my heart is good friends with my wallet .......",David King,1,2021-02-16T03:35:29Z
1209,Ugx1WwpqZZFc-J83dZx4AaABAg,"She single Handley tried to destroy her ex husbands career, all because she was crazy and was petty asf about it. But the moment she got caught with her bullshit she crying because she ended up getting ruined because of it.",Ethan Solorzano,0,2021-02-16T03:33:26Z
1210,Ugz4UdjP09PdNoz-0Yx4AaABAg,"she dug her own grave. Even in the conversation she here in the recording, Johnny Jeff warned her not to do what she did. She did it anyway. Johnny Depp was perfectly fine keeping quiet and moving on. But when she defend him in public, even with the evidence showing she is at fault, granted she didn’t know it existed though, She should’ve stopped at a certain point. She did not she double down, and the evidence tripled up",Kevin McColl,0,2021-02-16T03:29:59Z
1211,Ugyxpq_bMow__ng2Wmx4AaABAg,"I would be sorry for her, but with respect by evidence she brought this on herself.",Rameses Villanueva,0,2021-02-16T03:27:49Z
1212,Ugy8QwWeTB-yWnmX4994AaABAg,Too many men have been suffering in silence for far too long  she must be punished . Equality,Fuzzy Lumpkin,0,2021-02-16T03:27:42Z
1213,UgwqZeCCJQJpd2wM1It4AaABAg,Miss Turd,Betsy Hunter,0,2021-02-16T03:24:31Z
1214,UgwNAOvEEK86OrLcnr94AaABAg,She didn’t seem to care when she was doing the same to Johnny,orange._pie,1,2021-02-16T03:18:11Z
1215,Ugy2Wejc5EbEGwHiJZx4AaABAg,Good she deserved to not be able to get hired for anything and lose her spot in auqaman,Blacktail,0,2021-02-16T03:17:07Z
1216,UgwvhVApAh7R6ZImEi54AaABAg,Can u just say abuse the fucking edit is horrible,Stabin MeGroin,0,2021-02-16T03:15:47Z
1217,UgwyTuKs6bSrN7Weizl4AaABAg,Good. That's what she deserves for trying to ruin someone else's life just bc she was greedy,Mini Mew,1,2021-02-16T03:12:51Z
1218,UgxOVuxYF_unZdWVu0B4AaABAg,THAT’S THE POINT,1800 - HaitianSavage,0,2021-02-16T03:10:34Z
1219,Ugwh9knCUPyhIojuNLN4AaABAg,"Bro as much as I do appreciate you covering this story I feel like you just add a sentence to your script for each video, i could hit play on all your vids at once and they would sync up. No hate, just feel I should wait a few months then just watch the first 3 minutes of new info instead of 10 videos of almost the same thing",Mitsu,0,2021-02-16T03:05:47Z
1220,UgwIemCgu54ZVUY1-A54AaABAg,"So nobody will hire her for any movie rolls now so therefore she's 😢 sad but when she lied on Jhonny and he was drop from all his rolls it was funny to her and to add salt on the wounds she blackmail him,,, assaulted him,,,,poop in his bed basically made his life HELL but now the tables have turned and we suppose to care for her🧐 yeah I DON'T THINK SO AMBER",killemzay zay,1,2021-02-16T03:04:13Z
1221,UgzUZt2uGFNRMwPS_ld4AaABAg,Wb can’t be stupid enough to cast a real life supervillain as a heroine,S.S,0,2021-02-16T03:01:48Z
1222,UgwE4iRPE6KnQTj6OpF4AaABAg,"Amber heard has this ‘mean girl’ aura all around her. If you’ve seen her snapping at someone for getting in and out of the room like a real biatch during her interview, it shows her true colour.",Rose Hepworth,0,2021-02-16T03:00:00Z
1223,Ugx2heI6WlQ828RRGFh4AaABAg,Abused,Brandon Veach,0,2021-02-16T02:59:41Z
1224,UgweHlCTw-iafHPfwil4AaABAg,A. Turd is NOT a Victim #JusticeForJD,M jan,1,2021-02-16T02:56:18Z
1225,Ugx9l5U97EdjehOJmZZ4AaABAg,"Mera was as stale as a bread left in kitchen for 3 weeks. She did not impress anyone with that performance. If they were impressed, they were probably looking at the costume, not the performance.",Tito Cristobal,0,2021-02-16T02:55:02Z
1226,Ugy2J2IsuHLYSEABvrl4AaABAg,well .....hope she is rightto worry A. Turd is NOT a Victim #JusticeForJhonnyDepp,M jan,0,2021-02-16T02:54:47Z
1227,UgzQc8z-_ea46E8-85t4AaABAg,Youtube: Funny Actors . Poor Johnny.,Marga Subrado,0,2021-02-16T02:53:41Z
1228,UgwWqXt3W9Bd0tTg4LR4AaABAg,Her career 📉📉📉📉📉📉📉📉📉📉📉📉📉,Callmehjul,0,2021-02-16T02:53:19Z
1229,UgxVNn_1UcN5MBGdkwx4AaABAg,"I saw Aquaman , own it on Blue-ray. Mera has LITTLE to do with it's success.",WhiteBeard SkyDaddy,0,2021-02-16T02:52:40Z
1230,Ugww5hcPw_h6zzvUsJJ4AaABAg,Where can I sign the petition at??,Caden Campos,0,2021-02-16T02:50:06Z
1231,UgzgzCOiyRhljrLn0Ut4AaABAg,Johnny Depp won 😢😊😄,Hansin Thakur,0,2021-02-16T02:49:09Z
1232,UgzVS_5f1zlGiwBksWF4AaABAg,"She brought all this to the public, now it’s causing her life to be questioned like Johnny’s was.",Deborah Crawford,10,2021-02-16T02:49:02Z
1233,UgwCd0-xpu_BNVS5KS54AaABAg,"I'm so disgusting with the blatant injustice this whole situation. 

I would get hope if she gets kicks off of Aquaman but their lack of actions on AH part is really making me cynical go this.

I blv Johnny and I'll always stand on his side of all this because the evidence dont lie",Alexia Liburd,0,2021-02-16T02:47:54Z
1234,UgwUq9-gVnmToaRbuJh4AaABAg,"No, no, no, no, no, no, no!  Studio's don't want to hire Amber Heard because she is a terrible actor, a terrible human being, and a HUGE unsustainable liability, because her crimes are revealed, and a reckoning is due.  Time to atone for your sins... pay some HEAFTY fines, and do some jail time.   *THIS.   IS.   ALL.   YOUR.   OWN.   FAULT.*  You could have handled your divorce like a normal human being.  Mr. Depp, ever the generous man, would have given you a good settlement, and remained your friend, using his influence to get suitable roles for you (and some acting lessons) -- but NO.  You had to be the ""poor, frail, fragile, female victim"" ever wronged by those BIG BAD MEN.  You should have known that the truth would come out, and we are Oh, so glad that it did.",NIBS,0,2021-02-16T02:46:31Z
1235,UgxI1195j5XVo9ZnsqN4AaABAg,"Nah nah nah get that abuser away from Star Wars, only REAL woman should be a part of such a fantastic franchise NOT monsters who ruin the lives of others for kicks. Amber is no Daisy Ridley, or Natalie Portman, and she sure as hell ain’t no Carrie Fisher. Amber gives woman a bad name and she’ll do the same to my childhood series so for AH to be in Star Wars I say: FUCK OFF",Alfredo 101,0,2021-02-16T02:42:05Z
1236,Ugwfx0EupVsBJdpcqMF4AaABAg,"I believe Johnny ,just Want couet case to be over so legally it is proven he is innocent  and he can move on...",victoria Bishko,0,2021-02-16T02:40:49Z
1237,UgxiSg0dIlyOqV-DNCB4AaABAg,amber turd,Haley Woodbury,0,2021-02-16T02:40:35Z
1238,UgzsOqemK3VX3RHADit4AaABAg,"Disney is already taking a hit after firing Cara Dune. IF they hire Amber Heard in any capacity, they’ll nosedive even more.",Sherry Pie,2,2021-02-16T02:40:35Z
1239,UgyUVMt-AkVni2t3V8B4AaABAg,Not watching if she's in it,Susan Crowley,0,2021-02-16T02:38:49Z
1240,Ugzytb3l-yFNiSzgq254AaABAg,he'll drain her out he has way more money,Chef Breadsofa,0,2021-02-16T02:37:26Z
1241,Ugys79YU0f6C6y-TDOx4AaABAg,"No one feels sorry for her after her ""performance"" during her divorce.  It was a good thing Depp taped her being her true self or he might have been professionally ruined by Amber's actions.  She should be replaced or fired as fast as the industry did when jumping to conclusions about Depp's guilt in the matter.  She tried to destroy a man's career and his reputation for money.  Pirates of the Caribbean will no longer cast Johnny so why is the industry tolerating Amber?  Her career in the biz should be over forever. Period.",Carol Feher,1,2021-02-16T02:36:48Z
1242,UgwzZC6YCqEhXkgYEtx4AaABAg,I never sided with that witch. It was so obvious she faking her injuries!,Y LatMD,0,2021-02-16T02:35:59Z
1243,Ugx4QViy5J15Nn5Indt4AaABAg,Poor Johnny. She destroyed him.,Mary Ferre,0,2021-02-16T02:35:46Z
1244,UgyTYuRtIa3W7bCl9C54AaABAg,She deserves it. I hope she doesn't have any career in acting or any entertainment industries.,Z4NE安,3,2021-02-16T02:31:56Z
1245,UgzPKoq9rhYkL6H5hyF4AaABAg,"Just let her retire man, she can’t act for 💩 and she’s a true terrible person wtf would you hire someone who can’t be honest and has such a violent way",Catline Lewis,0,2021-02-16T02:31:08Z
1246,UgxilHVsJB34rq4RcR94AaABAg,This won't end well. I think the publicity surrounding this case should be made private now. She will end up committing suicide. I'm team Johnny too BTW.,Lynn O'MARA,0,2021-02-16T02:28:50Z
1247,UgxO11fZCkzdX1fgWKB4AaABAg,"ANY movie with that abuser.
I will NOT be watching",Alrica Neshama,1,2021-02-16T02:27:59Z
1248,Ugyb6ycrRKTQVUaraEp4AaABAg,Justice is coming for johnny depp,Willem Flattery,0,2021-02-16T02:23:10Z
1249,UgyX9iE08NhrSbk9bSt4AaABAg,Sorry 0 sympathy for this Harpy.pore baby this is what happens when you chop someone's finger off and shit in there bed and is just genuinely a crap person.,Hannadi Habbal,0,2021-02-16T02:18:45Z
1250,UgwbKyl6immBrG1_jmh4AaABAg,Amber sucked and everyone except her small fanbase feels she sucks as an actress. The reason Aquaman did so well was because of Jason Momoa. Amber did NOTHING to help it and she only for the role is because Johnny got her the part.,SweetChastity,0,2021-02-16T02:17:02Z
1251,UgynJLMBbG4Hixuz76F4AaABAg,she is reaping what she sowed...,Adriana,0,2021-02-16T02:15:11Z
1252,Ugw0tSiI30xocgfDTh14AaABAg,She not getting into starwars fans won't allow it the backlash would be tremendous,Lazy ninja 4000,27,2021-02-16T02:14:03Z
1253,Ugyb3dVW1EAT-R5BgpN4AaABAg,Finally some good news. She is a terrible actor along with being a terrible person.  Clearly she uses people to get ahead.,Carolyn Dee,37,2021-02-16T02:13:16Z
1254,UgwVGva_GmL2iQCd_Vh4AaABAg,I have no confidence that AH will suffer consequences as Disney and Warner are sexist pigs.,George Orwell,0,2021-02-16T02:09:58Z
1255,UgzylCOupK0zI1Px-rt4AaABAg,Lol! She cancelled herself! No one to blame but herself!,Jadedragon Loves Disney,0,2021-02-16T02:08:22Z
1256,UgwxXhraF5n1ydmnROp4AaABAg,"Well that’s what happens when you lie, cry wolf and try to defame someone’s character. I’m still and that Warner Bros isn’t trying to get JD back for Fantastic Beasts! AH made her bed and needs to sleep in it!",Jadedragon Loves Disney,0,2021-02-16T02:07:12Z
1257,Ugzkc-AqCZjuSeMLwCF4AaABAg,#JusticeForJohnnyDepp. It only made money because of Jason.  No one even knew her until the court case. She cant act Either!  PURGERY. The stand sucks. I dont think Disney would hire her after the trouble she's caused.,Lorri Holder,0,2021-02-16T02:07:11Z
1258,UgwhTqt4lVEewKMMO_94AaABAg,I din,Sylvia Johnson,0,2021-02-16T02:07:04Z
1259,UgzNiRQCy9m_pEpkGlV4AaABAg,Amber heard belongs to the shadow realm,Ace Of Aces,0,2021-02-16T02:05:16Z
1260,UgxwnVyEs1EC8bnhYp14AaABAg,FUCK AMBER HEARDDD,James Morland,0,2021-02-16T02:02:17Z
1261,UgyXE6E83bL5mwGDtRB4AaABAg,Whatever show she’s on will fail she just not worth it no matter she sleeps with,Kim Gann,0,2021-02-16T02:00:10Z
1262,UgyTMKQzr8tZ3cox5Nl4AaABAg,Good! You can't act anyways :p,Cren Cottrell,0,2021-02-16T01:53:04Z
1263,UgzkAoIlE81feF9v1iF4AaABAg,Awww poor narcissist Amber. I'm sorry Johnny Depp was not what she said. Nasty nasty woman!,Celena Fenner,1,2021-02-16T01:52:32Z
1264,UgyafrpSGK1VUCM_DKB4AaABAg,Omg anything with Amber Heard is cursed now and would be suicide for any film or tv franchise. every time i see an image of her i see a turd on bedsheets.,carlbrecon,0,2021-02-16T01:44:37Z
