,parentId,authorDisplayName,replyComment,publishedAt,likeCount
377,UgxaXi1jMykFjy1xeWR4AaABAg,Silky Shish,"​@Mark Walker  - Thank you for your point of view, but with all due respect I am going to have to correct you here.

I agree that when someone goes down the road of addiction, it does change a person and that person will do things they normally would not do when not under the influence.  For example, when it comes to violent behaviour they may get into a physical altercation with a stranger or rob someone for money to get money to fund their drug fix.

But, we are talking specifically about domestic abuse not just any other kind of violent acts.  For someone to actually have the ability and no filter to violently abuse someone they love and who is their partner takes a certain inherent propensity towards that.  So, simply just becoming an addict or alcoholic does not cause this if someone inherently is not a domestic abusive person to begin with.  It doesn't matter how addicted they are to substances.  

I worked with mental health and addiction patients and also, I actually worked in domestic violence for a government organization and also myself was a victim of abuse.  So, I have not only personal, but professional experience with this.  And for you or anyone to make s blanket statement that someone who does drugs and is addicted will become a domestic abuser is actually far from the fact.  

Also to add to this, a person does not suddenly become a domestic abuser when there has been no history of violence or abuse.  That is not a fact at all.  A domestic abuser usually has a history of some kind abuse towards others (animals or other people) either mentally, verbally or physically) and it is inherent in their chemical make-up and they possess psychological markers for this.  What does change is the frequency and intensity of this behaviour can increase over time.  But no, someone doesn't just suddenly out of nowhere become an abuser when they have no history of it especially, at such a late age.  Johnny was over 50 and then he suddenly becomes this crazy, raging, violent abusive man?  Nope..does not happen.",2020-04-17T00:33:46Z,5
378,UgxaXi1jMykFjy1xeWR4AaABAg,Silky Shish,"@The Cowboy - Have you heard the audio tapes?  It is proof she was the abuser and she has no witnesses to show he hit her.  He however, has alot of witnesses showing she was an abusive person in general not just to him,, but to everyone she interacted with.",2020-04-16T23:47:32Z,15
379,Ugw3fj-kA7hR9NZrXUx4AaABAg,Tommy Baxter,I'd rather he gets his reputation and career back on track. No Oscar needed just some slander law suits and public apology needed.,2020-04-17T19:18:49Z,0
380,Ugw3fj-kA7hR9NZrXUx4AaABAg,Sam’s opinion,Vivek Shekhar   That’s the truth mate.,2020-04-17T17:54:25Z,1
381,Ugw3fj-kA7hR9NZrXUx4AaABAg,Vivek Shekhar,No. Give Amber one for pulling off one of the most believable performances against a TRUE LEGEND! Where were the investigative journalists when you need them?! Oh...Im sorry... they dont exist in 21st century....,2020-04-17T03:14:39Z,0
382,Ugw3fj-kA7hR9NZrXUx4AaABAg,Samantha Armin,@Nope Nope Your right man. 🙄,2020-04-16T23:51:43Z,0
383,UgwDiZLiI1rsDlv99a94AaABAg,Antonia Baker,@V J thank you for the info. I'd never heard that. Says alot about him.,2020-04-17T00:01:26Z,5
384,UgwDiZLiI1rsDlv99a94AaABAg,V J,"Antonia Baker he talked about the physical abuse he endured from his mother when he was a child in a Rolling Stone article back in I think, 2018?  He talked about the “Irrational beatings” he received from her, and that she was “still his mom” even though she hurled things. “Maybe it’s an ashtray coming your way. Maybe you’re gonna get clunked with the phone,” Depp said. “It was a ghost house — no one talked. I don’t think there ever was a way I thought about people, especially women, other than ‘I can fix them.'” Depp also said he worshiped Betty Sue, but “she could be a real bitch on wheels.” At her 2016 funeral, he said: “My mom was maybe the meanest human being I have ever met in my life.”",2020-04-16T23:06:16Z,14
385,UgwDiZLiI1rsDlv99a94AaABAg,Antonia Baker,I haven't heard anything about his mother?,2020-04-16T22:56:00Z,1
386,UgyZKT8BvQBi1UnM79N4AaABAg,Kanika Garal,@Twinkle Toes I hope u found peace and happiness after such trauma. Stay strong my dear. And hope she serves her time for her crime.,2020-04-19T20:11:40Z,0
387,UgyZKT8BvQBi1UnM79N4AaABAg,Twinkle Toes,"Kanika Garal I would have been right there beside you, because I didn’t believe the accusations against him, I defended him & I was incredibly suspicious about her!! I am actually a survivor of domestic abuse myself, when I heard her stories in her claims, there were so many holes in them, so many things that didn’t add up or make sense and didn’t seem right to me. Sadly, I’ve been bruised and battered enough in the past, that I know what those things look like! When she claimed he threw an iPhone at her and then showed a supposed picture of what her face looked like, the markings didn’t add up to how the phone would have actually marked up her face. Then, when she showed up at court for the restraining order, she had way less bruising on her face than she should have if the marks she claimed to have gotten in the first photo were real! Also, the bruising she did have was in a completely different spot on her face, a part that didn’t have any markings in her other photo, and was very small for what she claimed to have happened to her! The” bruise” was also not in the stage of bruising it should have been! The “bruise” she had, was what a much older bruise would have looked like (if it were real), much lighter - not that of a bruise that was brand new and developed just the other day!! It’s sad that I would actually know these things from firsthand experience, but it was crystal clear to me then that she didn’t and was lying!! The bruise also wasn’t there, completely gone, in photos taken in the following days, which is impossible!!! 🤷🏼‍♀️ I also knew that with the claims of abuse she was making, how often and how severe - on a regular basis, we would have seen evidence of that in all the photos and videos of them out and about at various functions and whatnot, but we didn’t - not a single speck, scratch, bruise, black eye, broken nose, busted lips, or marks anywhere on her body or injuries of any type! However, there is evidence of Johnny being abused in photos and videos!! 🤷🏼‍♀️ Shes a complete bitch, and as a DV survivor, I don’t take kindly to someone lying about being abused, tarnishing an actually good mans name and reputation, causing him to lose jobs and have his career damaged, for her own messed up reasons! It’s like she’s belittling & demeaning what I and so many others have gone through, or are still going through, making a complete mockery of our suffering, and Johnny’s, with her disgusting hoax! I hope the bitch fries and loses everything - never to work in Hollywood again!! 🤷🏼‍♀️",2020-04-19T10:56:39Z,1
388,UgyZKT8BvQBi1UnM79N4AaABAg,Sam’s opinion,penny reynolds   Yes she is rotten to the core mate.,2020-04-17T17:47:21Z,2
389,UgyZKT8BvQBi1UnM79N4AaABAg,BuckPack,and mentally,2020-04-17T11:35:00Z,3
390,UgyZKT8BvQBi1UnM79N4AaABAg,Kanika Garal,I know. Never liked her before all this coz I kept saying she is not cool. But nobody believed me and threw so much hate at me. But after the truth came out people still defend her and I am like how brain dead u have to be,2020-04-17T04:03:17Z,9
391,UgwXoVpBo2UyH7-8Vy54AaABAg,Tommy Baxter,Daddywise Clussy   It's coming soon mate,2020-04-17T19:21:24Z,0
392,Ugz8ORMWdyOkS1yEGCh4AaABAg,Sam’s opinion,Sad thing is he is a decent guy but even if he wasn’t! He definitely isn’t a wife beater!,2020-04-17T17:57:02Z,1
393,Ugz8ORMWdyOkS1yEGCh4AaABAg,Alexandra Jack,I've been cheering for Johnny all this time. 🙏,2020-04-16T23:29:51Z,3
394,Ugz8ORMWdyOkS1yEGCh4AaABAg,penny reynolds,So true,2020-04-16T22:19:07Z,3
395,Ugz8ORMWdyOkS1yEGCh4AaABAg,Days with tt,Song Henry exactly Johnny is like the kindest person,2020-04-16T22:14:05Z,5
396,UgxHkTf6B14P0GqaUOF4AaABAg,⋆༄⋆༺ＢẹĿĿạṭṛịẍ༻⋆࿐⋆,And wanted his money too.,2020-04-20T17:52:36Z,0
397,UgxHkTf6B14P0GqaUOF4AaABAg,Geeyeen,"Wait what? You can now talk? lmao you should be mastering your abilities right now and showbiz is not good for you Baby Yoda, may the force be with you.",2020-04-18T05:49:48Z,0
398,UgxHkTf6B14P0GqaUOF4AaABAg,Bridgygirl,Chicky nuggies,2020-04-18T01:14:19Z,0
399,UgxHkTf6B14P0GqaUOF4AaABAg,Tommy Baxter,Baby Yoda   That's So true ☝🏼️. She is vile!,2020-04-17T19:13:43Z,2
400,UgynjPLDzSRjNLxiSCZ4AaABAg,Days with tt,I was second,2020-04-16T22:15:31Z,0
401,Ugx_it6nYfM_pcIBQpN4AaABAg,bright blue,She eats snack disrespectfully while on trial. Anyone else wanna throw food at her after seeing that,2020-04-17T11:40:55Z,0
402,Ugx_it6nYfM_pcIBQpN4AaABAg,Lucie Taylor,jimmy one  - their right or our right?,2020-04-17T03:03:57Z,0
403,Ugx_it6nYfM_pcIBQpN4AaABAg,hardlybreathe,@Amelia Jones lie detector is a placebo,2020-04-17T02:55:47Z,0
404,Ugx_it6nYfM_pcIBQpN4AaABAg,Hey Yahhh,Days with tt yeah something about a tell when people are lying,2020-04-16T22:49:21Z,0
405,Ugx_it6nYfM_pcIBQpN4AaABAg,Amelia Jones,There is also the fluttering of the ice. It could be a sign that he’s lying as well. But there are more ways to prove that she’s lying and I think it’s up to the light detector test to prove it! Tie her to the polygraph!,2020-04-16T22:49:14Z,2
406,UgykNW1PshE9inQuYTF4AaABAg,Alison Manson,Kinda think she's done it to herself tbh 😏 ( with a little help from Karma - the bitch!),2020-04-17T00:27:19Z,1
407,UgykNW1PshE9inQuYTF4AaABAg,Marshmallowmonster 77,I wouldn't mind to be honest :),2020-04-16T22:13:52Z,0
408,UgznaHKizLvvLFKu5754AaABAg,Days with tt,Exactly like Johnny wouldn’t do something like that,2020-04-16T22:13:39Z,3
409,UgznaHKizLvvLFKu5754AaABAg,Susan Hughan,RC castle I couldn’t agree more with you! She’s a piece of work 🤦🏼‍♀️,2020-04-16T22:11:41Z,6
410,UgyQwSMr6-NVZgDArYF4AaABAg,Susan Hughan,"DANA FANBOY Unfortunately, she makes a lot of women look this way 🤦🏼‍♀️ I promise there are some of us that are not even close to being like Amber",2020-04-16T22:14:35Z,2
411,UgzKS6ic-YBQ_A92y794AaABAg,Days with tt,Leighan Swanya I’m second,2020-04-16T22:05:10Z,0
