,id,comment,author,likecount,publishedAt
0,UgzpvqeaEzWJfPVb2eV4AaABAg,2:12,Martín Pérez Disalvo,1,2021-11-18T17:45:53Z
1,UgxxZbxzdAaCgzGY9Xd4AaABAg,Mera said her parents died in the wars but her father was clearly alive in Aquaman?,vLad,0,2021-10-30T02:47:53Z
2,UgyGwLPld3zuLwCxgTh4AaABAg,I love how steppenwolf is all big and bad throughout the whole movie till Superman’s comes in 🤣🤣turns steppenwolf to steppenpup🤣🤣🤣,Bubba300,0,2021-10-29T05:08:41Z
3,UgzOf0YWg9RLmkx5qyx4AaABAg,"""FOR DARKS.. I mean... FOR JOHNNY DEPP""",Man Delorean,0,2021-10-19T03:28:06Z
4,UgxDRsWwHt6Vt1YL-uZ4AaABAg,"Randomly, I rewatched the 2017 version of this scene and while a lot of the dialogue is the same, what I find is that this version has more breathing room between dialogue. Whereas with JL 2017, everything is just moving so fast.",Omari Daniels,5,2021-09-29T12:12:21Z
5,UgxUflQKy-PR2In0jb54AaABAg,You dare call Queen Atlanna a Saint.,bringingback themohawk,0,2021-09-28T16:31:32Z
6,UgzW0KlCh6almH_x5Ch4AaABAg,Is her British accent meant to be accurate or what?,kai smith,0,2021-09-24T18:08:41Z
7,UgyTQ5GKCLcdmCL7YPV4AaABAg,"Anyone else noticed the ""symbolism"" or ""similarities"" between this fight and return of Superman. Look at this way:


-Steppenwolf is about to kill someone with his axe (Mera/Cyborg)
-Somebody stops the axe (Aquaman/Superman)
-The character attacks Steppenwolf, sending him away from them (Aquaman punches him and Superman kick him)
-Then, the character goes straightfoward Steppenwolf, and he attacks him but Aquaman avoid the axe and Superman avoid his hand. 


Definetly, Snyder is such a genius

(Sorry, english it's not muy first language)",Fernando Torres,5,2021-09-23T19:32:56Z
8,UgxUgMiaE3xstprNVDF4AaABAg,This version is lot better,P S,1,2021-09-18T04:26:27Z
9,UgyVYtrBPeUaHft9Pvh4AaABAg,#EventMovies of #MovieSeason2021 with #WarnerBros and #HBO distributing respectively.,Albert F. Warner,2,2021-09-15T09:59:05Z
10,UgyDOLOxtXbsmDz18xF4AaABAg,"I'm very disappointed in the lack of ""That's what she said"" jokes when it comes to the Mother Box",WACOMON,4,2021-09-11T16:52:56Z
11,UgwBtfaB8eHWFjN8gQ94AaABAg,whatever she did... But amber head.... Looks damn cute.... In this,Prashant Chauhan,8,2021-09-04T03:55:59Z
12,Ugy8RTygpBR8plKJSmN4AaABAg,I did not recognize the title of this video and I was so confused thinking I didn’t watch the actual movie at all 😂😂😂😂 took me way too long to realize this was Snyder’s version,LaToya Marcinko,1,2021-09-01T14:49:54Z
13,UgxaBu3Le1m9AbMZgdx4AaABAg,Change the title,𝔁𝓮𝓫𝓮𝓵𝔀𝓸𝓵𝓯𝓲𝓮,0,2021-08-29T19:22:32Z
14,UgwUVfBG-RyUxm7cXdd4AaABAg,#RestoreTheSnyderverse,Wheeler67,3,2021-08-20T20:20:02Z
15,UgyXqM4Z3vSKeQyfYYB4AaABAg,I always thought Mets was Aquaman’s sister,Kyle Andrade,6,2021-08-02T16:33:15Z
16,Ugz0JK2QfmXa41Dwbd14AaABAg,when step shakes his head after the blood bend is such a good addition. shows how close she was to killing,Cen d,51,2021-07-31T17:05:48Z
17,Ugysx-5x5OLnbelS32x4AaABAg,"If you think Loki & Sylvie’s relationship was weird. Just remember, Arthur & Mera are basically foster siblings.",The Awesome Bat,19,2021-07-23T04:05:16Z
18,UgyiRKjJCEU7qHs5UIx4AaABAg,1:04 When I realized Snyder meant business.,Michael Plurad,18,2021-07-17T22:23:34Z
19,UgwsVedPBMTgh4wO_4N4AaABAg,I hope Mera keeps her British accent from now on,Alex,15,2021-07-15T12:27:27Z
20,UgyiaOgbyHrfxZidPD94AaABAg,"God, I can't stand this woman, I wanted to watch this scene but couldn't finnish it...She's horrible. 😒",Emilce Diaz,2,2021-07-12T09:05:36Z
21,UgxX1daV-QjDUY4FVoN4AaABAg,The sheer downgrade from this majestic costume design to a shiny green body suit,ItzMrinyYø,8,2021-07-08T00:28:58Z
22,UgzDLVtwt7mNtsc34Yl4AaABAg,Why does everyone say badass when describing something related to aquaman,•Nebuliqque•,7,2021-06-22T18:20:39Z
23,UgypB0OYDNX6sunI0RB4AaABAg,Funny how the story line of this movie and the actual aqua man movie are so different,Domenique Echols,24,2021-06-16T10:33:16Z
24,Ugxf5n8H8qFJB_nUaIx4AaABAg,"You guys do understand right? Snyder had his film with the story and Mera's accent. Then it went to shit and Whedon changed a lot. Then Wan had to try to make his film match it instead of the Snyder cut. Whedon changed died in the war to fought in the war. Whedon had Heard redo all her lines w/o the accent. 
Then the Snyder cut comes out. Things are different.
If Dolph Lundgren adopted Mera after Atlanna was banished then problem solved.",dave miller,22,2021-06-11T01:02:12Z
25,UgwpNLPBQsovUb49vgd4AaABAg,Amber may be a shit of person but we can’t deny that she looks cute in this film,Varelux,129,2021-05-28T17:32:03Z
26,UgwsStFsve6wtUMirJN4AaABAg,As a Avatar the Last Air Bender fan it was cool to see Mera blood bend.,adan_estoesta,148,2021-05-22T23:09:55Z
27,Ugyr55gIpjBTPOXUCPt4AaABAg,Why isn't her hair red here and why does she say her patents die but in the aqua man movie she has a father?,Domenique Echols,6,2021-05-05T20:51:52Z
28,Ugx8i1Vp7Yq9GPid4jN4AaABAg,Hollywood loves to preach about woke nonsense yet here they are hiring a domestic abuser.... she's not even a good actress. I won't be watching this trash.,Fred,0,2021-05-04T12:11:20Z
29,Ugx6Qpt9IWaXD4f3nPl4AaABAg,"So Mera says in this scene her parents died in a war, and Queen Atlanna, Aquaman's mom, took her in? But in Aquaman, which takes place after this, James Wan cast Dolph Lundgren as her father. And he's a major secondary character. Is this just a big continuity error that everyone overlooked?",Christopher Lai,54,2021-04-30T05:57:49Z
30,Ugy95RXcl6ZYGctJ5JB4AaABAg,This is why this movie is R clasificated,AmG Andresganzo,14,2021-04-30T00:42:31Z
31,Ugw18jo7NWKdMty4R1t4AaABAg,wtf did she bloodbend?,coutvre,8,2021-04-28T05:30:33Z
32,UgxkxWoucDNjw9VzpjZ4AaABAg,Well that just blows if what is Canon because her parents well yet her mom could’ve died but not her father for Pete’s sake,Maximus The Wolf Reborn,11,2021-04-26T19:07:09Z
33,UgxXtnupbEZ1tyAXwq14AaABAg,"I love Amber Heard! It's unbelievable that Johnny the lothario and addict could think he was deserving of her attention! Loser that he is,his daughter is a better actress than he is an actor!",gamr,6,2021-04-18T20:58:45Z
34,UgxNysMnWZbZjyG0gMt4AaABAg,Steppenwolf was the best actor in this scene. Poor Aquaman  doesn't have much to play off with Mera.,Nita Shepard,37,2021-04-15T04:14:14Z
35,Ugwlg6HZJwtt0dhuIvZ4AaABAg,I find the dry for wet effects look more convincing here than in the  Aquaman solo movie.,bestmoviesever1,75,2021-04-10T05:40:02Z
36,UgxCtyzRGu1CCeid7794AaABAg,Maybe this Mera is from Earth-GB?,David Lim,10,2021-04-08T01:10:02Z
37,Ugwcd3_bhxLlsUfPJ314AaABAg,Mera can do bloodbending?,RAFENROLLA,33,2021-04-08T00:20:26Z
38,Ugxw8pGfulifkwj_L5J4AaABAg,Why does she have a British accent,Cody Minor,17,2021-04-05T19:36:30Z
39,UgwjaSU74d7nVa-TvEd4AaABAg,"2:20 man I can't get over with how cute, adorable and awwww Mera is here. And the look Aquaman give her. Her cuteness dokidoki face here is killing me the most uwu",Quiss,19,2021-04-05T13:18:46Z
40,UgykjlOC0WImm4uIDlF4AaABAg,"*Some actors play a villain, some villains play an actor.* 
 Amber Heard doesn't deserve superhero title - she is a real-life villain who created false accusations against an innocent man. Justice for Depp

ADDED: I'll include these blog qotes from 2011 when Amber was on the set of Drive Angry before she was dating Johnny. It's by Todd Farmer a writer/actor - it seems legit and he even provides a picture. After reading the blog my take-away is she beat the crap out of pretty much everybody - her role of Piper allowed her to get away with beating others.
*BLOG QUOTE* - Most of this is likely due to the fact that *she beat the crap out of me. She pulled her punches with Christa, but she did not cut the boys any slack.* I snapped a picture at the end of the day. I should have taken a picture the next morning when *the bruise had blossomed the size of grapefruit.* (he provides selfie of red marks on chest)
*BLOG QUOTE* - I remember *Billy Burke* joking that he thought shooting a fight scene with the lovely Amber Heard would be more fun and less *painful. She beat the crap out of all of us.*
*BLOG QUOTE* - *And she beat the crap out of me.* By the way. There are men and more than a few ladies who would pay top dollar *to be beat up by Amber Heard. Oh. And she spit on me. Over and over and over.* And you KNOW there are folks who’d pay for that.
*BLOG QUOTE* - *We have Amber Heard punching, spitting, bitting and jumping.*",Rock Candy,55,2021-04-05T09:52:42Z
41,UgxfauWTU3o92vCSli14AaABAg,"So my ASSUMPTION as to why Aquaman was talking to Mera and Vulko in those air domes was because they wanted to talk in private since sound travels faster in water than in the air, it's the equivalent of Get Smarts Cone of Silence. Since this movie WAS SUPPOSED to take place before Aquaman, Orm aka Ocean Master was still king of Atlantis, and they probably didn't want him over hearing them talk about Steppenwolf, as akin to when Umbridge didn't want students of Hogwarts talking about how Voldemort was back.",Painter Lava Lamp,146,2021-04-04T04:41:38Z
42,UgzNUoBaNa-yexQ3UyJ4AaABAg,The dialogue is nearly identical to the 2017 version. The biggest difference is Mera's British accent. Presumably Amber dubbed it over in the other one because she'd decided not to use it in the Aquaman movie after all.,Jordacar,79,2021-04-03T06:51:42Z
43,UgwVl_z6STH1wZrPew54AaABAg,Mera said her parents died in the Snyder cut. In Aquamanovie she had a father. Opps that's plot hole in the DCEU now,s vuy,28,2021-04-01T03:25:12Z
