,id,comment,author,likecount,publishedAt
99,UgzsDouSabXtHfWzswd4AaABAg,"Yeah, but every thing got pushed back because of corona!!!! I’m not sure if she realizes the word is dealing with a lot. So most of the films being made are having scheduling issues because of the pandemic!!",Nadine Smith-Jensen,3,2020-09-07T22:16:54Z
100,Ugy5fPY4cdm3lZtUafx4AaABAg,"Dont they realize they will loose alot of money because of her
 I will not watch it.just hearing her speak repulses me and makes me want to break something.",k kimbo,5,2020-09-07T22:14:12Z
101,UgypeXAuoat0P1ONUYJ4AaABAg,"As I said in another video, I don’t think she has a case.",A L,7,2020-09-07T22:12:32Z
102,Ugwc_xQdyJUESyOiIC94AaABAg,How much you wanna bet Heard's not gonna be on Aquaman 2's press tour?,TheSouloftheDragon,8,2020-09-07T22:10:14Z
103,UgwXeaxgZl_7upxbUTd4AaABAg,She's insane,gblakely322,37,2020-09-07T22:08:42Z
104,UgxzsfJ_CH4j6c30LTZ4AaABAg,"*Amber:*  How irresponsible of Johnny to request a different court date due to filming conflicts!  Its disrespectful to the court!
*Amber:*  BTW I want to have it done before I start shooting Aquaman 2.",JSSTyger,30,2020-09-07T22:08:16Z
105,Ugxr3dJ5p6KozxK5MNB4AaABAg,This saga is like a merry go round. Amber is a melodramatic drama junkie.,Nicholas Mullarkey,39,2020-09-07T22:07:47Z
106,UgwdSXTQhGH3AdzrZPF4AaABAg,Amber saying johnny is trying to manipulate the court....is amber manipulating the court. And its not the court she thinks is subservient....its amber feeling submissive to johnny.  Its why she counter sued to feel like she controls johnny again.,Maaike R,6,2020-09-07T22:07:38Z
107,UgxHabQtVw6xRwzd71R4AaABAg,"I think she is being run through by lawyers at this point, they want her dumb money, she dumb and they will separate her from that money.",Christopher Montgomery,29,2020-09-07T22:07:13Z
108,Ugy9_LhPcPpJ8I8oWTJ4AaABAg,"Hello Miss Tristen !!! I am Listening
Still Subbed, Illuminated Like Button !!!
I Have been Called Many Things but A Russian Bot is most likely one of the nicest things A leftist has called Me !!!
Thanks For Another Daily Dose...........
Amber still can't Get NO SATISFACTION
😄😄😄😄😄😄😄😄😄😄😄😄😄😄",yellow beard james gibson,3,2020-09-07T22:02:28Z
109,UgwJrGl9QOkctcAtqi94AaABAg,That's so crazy! It almost seems like men and women have forgotten how to get along.....,AlexTremo DelNorte,1,2020-09-07T22:01:16Z
110,UgwBZjFqZ8COIlB80LB4AaABAg,"Whatever comes from this, she will have lost all respect from anybody who has followed this story.
 DC must realise the effect she is having.",Shamefulswine,21,2020-09-07T22:00:05Z
111,UgyXMNLE88pk9ckDtMt4AaABAg,"She said ‘Johnny trying to weasel out’?!!  Lol sounds like projection of fear. It’s obvious now she is getting increasingly desperate, and looks like she has gone mad! She looks totally drained in her new Instagram photos, her face swollen and her eyes look empty, and she’s such a bad actress she can’t act like everything is still ok! This is all but the calmness before the storm that is her epic downfall. Can’t wait for the London trial’s result to come out.",Nicholas Chen,36,2020-09-07T21:59:51Z
112,UgxahRSHx6l_okdeSg94AaABAg,"Well at least she is Aquamans girlfriend still, probably why I wont watch the sequel",Matt Brown,31,2020-09-07T21:57:01Z
113,UgwsLSmP7x8o0h99PLF4AaABAg,"Oh yeah, Terry Dowling just hides my comments debunking her. Oof",Tuna Sandwich,11,2020-09-07T21:56:57Z
114,Ugx_Ke43vvNZomJiWtx4AaABAg,"God, I LOATHE Amber Heard!!!",Tania Haeussler,18,2020-09-07T21:56:16Z
