,id,comment,author,likecount,publishedAt
108,UgwU5mbTkCnBKGEFJBp4AaABAg,"I swear Scamer Turd’s team of “lawyers” aren’t really “lawyers” (which is why I always write it that way!! Lol!) bc they do & say SO MANY things that are nonsensical, the opposite of what real lawyers would do, show they have no idea what they’re doing or saying, let alone just how damn unprofessional they act! 🙄 It’s like they thought they could just claim defense of reliance on counsel to get Scamber Turd out of being held responsible for the Op-Ed and get nabbed for the defamation, and that was just that - it would be over, no question, no ands - ifs - or buts about it!! It’s like her own damn “lawyers” didn’t realize if they claimed defense of reliance on counsel, that meant they were waiving attorney - client privileges regarding the Op-Ed and that meant it would OPEN THEM UP FURTHER for even MORE lines of questioning, that they were now putting themselves in a position and claiming something they would have to PROVE - which they already have to prove so much in this case as is, this was just adding even MORE to that ever growing list........all making it harder for her side, more work for her side, more scrutiny, etc!! That claiming this defense would basically be opening a can of worms that they would NOT want to open at all, that a lot of the behind the scenes communications, information and going ons that would have previously been PROTECTED and NOT up for questioning PRIOR to claiming defense of reliance of counsel, would NO LONGER APPLY.....meaning all of those things would be up for discussion, discovery, questioning, depositions, witnesses, testimony, admittance of evidence for trail, brought up in trial, etc etc and that they’d be wide open to it ALL, w basically none of the protections they would have had, had they NOT claimed that defense! That basically, we’d not only get to have the curtain pulled back, revealing the man behind the curtain that we shouldn’t be paying attention to, but that we’d get to interrogate the man behind the curtain, compel evidence, put him on the jury stand during the trial for the jury to see....& so much more!! 

This is what I mean, REAL lawyers would damn well know claiming defense of reliance on counsel would be opening a HUGE can of worms that they do NOT want to open, it would leave their side and Scamber Turd more vulnerable and exposed, it would be opening VERY IMPORTANT lines of questioning that would NOT be open for questioning and examination if that defense would NOT be claimed, that they’d be putting their side and Scamber Turd in a position where they now have even MORE to prove and more work to do as a result.....more bars to meet for a trial, etc etc! REAL lawyers would know that on ANY case, w ANY client - even the strongest, most reliable clients that will play out well and play to the jury and public really well, in a positive way for their side and case........even the STRONGEST cases that are pretty damn clear cut, they would really want to think this through EXTREMELY CAREFULLY if they really want to take this position and defense or not, weigh just how risky it is vs the benefits, decide if the risk is worth it and this will bode well and play out well for their side and case, they would sit to talk this through w their client IN DEPTH, discussing all this would entail, risks vs benefits, the merits of taking said defense, how it can blow up in their faces, etc etc! They would have this LONG convos w their client MULTIPLE times, fully debating the topic and fully informing client BEFORE they decided to make this defense, that way the client is fully informed and they all know what the hell they’re getting themselves into so they can FULLh prepare themselves and come up w the best game plan!!  

However, it seems like Scamber Turd’s “lawyers” did absolutely NONE of this at all!! It’s like they just claimed this defense and thought that was the end of that! It seems like they were completely unaware and unprepared of what claiming defense of reliance on counsel entailed and just what that meant for their side, what it opened them up to, what they’d now have to prove for that defense, how attorney - client privilege would be waived by claiming this defense and just how large and ugly that can of worms are! They have been acting completely surprised at everything that’s happened to them SINCE claiming defense of reliance of counsel, completely shocked and unaware that means they’d be waiving attorney - client privilege, that they’d now have to prove that defense, that it would open them up to some pretty extraordinary and damning lines of questioning, that they’d have to submit evidence, that it would allow brand new witnesses to the list for depos and court sworn testimony in front of the jury and judge......including that of her legal team and past lawyers, as well as the ACLU,  that this would make it in to the court room at trial - in front of the jury’s eyes, and much more! Ever since they claimed defense of reliance on counsel and they found out how they fucked go, picking out and opening the worst can of worms they ever could have.....they’ve been feigning ignorance and idiocy and have been trying to fight all this defense and position they took entails and opens them up to, every single baby step of the way!! Which, is actually making them look even WORSE in the courts eyes, and the public’s eyes, and we can all see the growing frustration from the courts and judge and just how quickly the judges patience is dissolving bc she’s seeing how Scamber Turd and her “lawyers” keep trying to play games, and keep wasting the courts time playing these games! It’s really not going well for them!! 

Not to mention, any REAL LAWYERS.....esp lawyers who are actually GOOD, know their shit, and WIN their cases at an astounding rates, would know that the risks of taking this defense and all it would entail and open up their side to, particularly Scamber Turd, WAY OUTWEIGH THE BENEFITS!! That this is a risk they should NOT and do NOT want to take........that they do NOT want to pick this can of worms, let alone actually open it!! REAL lawyers would know that Scamber Turd doesn’t even really have that strong of a case, she really doesn’t have the evidence and witnesses she should and that she claims she does and acts like she does! That when comparing Johnnys side and what they’ve got to hers, she’s got a really weak case that doesn’t bode well for her, esp since she’s the one that’s been running her mouth this whole time, has based her entire personality and career of this lie and has said so many things (written Op-Ed’s, etc) where she uses such strong language, makes such bold claims and accusations, that she doesn’t actually have the evidence and witnesses to back those things up!! Basically, Scamber Turd’s mouth has been writing checks that her ass can’t cash!! Real lawyers, smart lawyers who know their shit, good lawyers, lawyers who win the majority of their cases would know and see these things immediately and would know they would NOT want to even THINK about fucking w the can of worms they would be if they claimed defense of reliance on counsel!!! Lol",Twinkle Toes,0,2021-07-30T21:33:12Z
109,UgyiOD2gDLHZlQ1j1FJ4AaABAg,"To Amber Turd ""ALPHA MIKE FOXTROT!!!!"" Think about it!!",K.L.P,0,2021-07-30T21:27:23Z
110,UgwelKHZjSSnBGFFuBd4AaABAg,"Watched it twice, so, so nice. Thanks TUG. 💚",Sunshine,4,2021-07-30T21:27:20Z
111,Ugzi-ZwoRPuyWJaVMnZ4AaABAg,"I don´t put too much hope in a win in VA, because the roots go deep and the corruption and collusion is too big to lose. Johnny´s resources are limited. Theirs aren´t by far.",LoveAndLaughter,1,2021-07-30T21:19:32Z
112,UgyiwTh34LU8dIDG-zR4AaABAg,Can’t wait to see her behind bars,Wrathful Coma,0,2021-07-30T21:10:35Z
113,UgyEhNzTI4Ky1cp4SJV4AaABAg,so if i cut someone´s finger off i get to play in a MCU movie?? amber heard!!!! i want 10 movies here i come ^^,Reza Nurmohamed,1,2021-07-30T20:53:36Z
114,UgxD9LjMv0F-f-o568F4AaABAg,"But wouldn't the lawyer be protected by privilege?  Client confidentiality and all that, unless they decide to waive that...",callak _,0,2021-07-30T20:51:13Z
115,UgxOPeDm5tNiOo6cyfF4AaABAg,💙 thanks TUG,Maria A.,1,2021-07-30T20:43:10Z
116,UgylD0g8TBAqQLGNj4J4AaABAg,"Morning TUG...

MSM has come out and said that Warner is IGNORING JD FANS PETITION against Heard.
Seems like they dont think twattersphere opinions of AH and her part in the movie dont count......
(Because of her blatant lies and the fact she swings a mean right hook)

Dont you just hate the arrogance of these do called power brokers...?",I.M. De Marco,3,2021-07-30T20:40:59Z
117,UgybbM3MJw4eJLBYNc54AaABAg,stop asking me hard questions haha hilarious... Thank you TUG,Angie H.,0,2021-07-30T20:38:59Z
118,UgyguQ7rPQTUJtLHrX94AaABAg,When doom has arrived again 🙌😂,Esther Phiri,0,2021-07-30T20:38:16Z
119,UgyXejXKKG2Zg3fQh_d4AaABAg,"Today's Random thought....
""Facts don't care about your feelings""

Fact; she broke the NDA 
Fact: she publicly said, she had donated all of the 7mil to charity. She did not 
Fact: False allegations of abuse 
Fact: staged and tampered with evidence 
Fact: she was not party to the UK Trial
Fact; she conspired with her witnesses 
Fact: she lied under oath
Fact: she admitted to being an abuser 
Fact: she exploits her child for personal gain and attention 🙄",Rachel Olson,64,2021-07-30T20:32:39Z
120,UgwPwsidE-yadu8rEFZ4AaABAg,"I can’t wait til she gets Karma in jail. Turd on JDs bed, turd on your bed in jail or even better PRISON.",Yannah Lam,0,2021-07-30T20:29:19Z
121,UgzNrbX7G5izGKGcOVV4AaABAg,The writers released information 6 hours ago about keeping her for Aquaman 2 saying they are keeping her. So let me guess they dont care about any court cases and more going on? So even after everything they still want her wonded of the movie will be made with her because of all this.,americus fallout 4,0,2021-07-30T20:18:11Z
122,Ugy-R1x4bs2oFVjzzzZ4AaABAg,i likes and comments for the algorythm.... yeahhhh i drink my rum to the honorable capt sparrow 🏴‍☠️🦜,Gus Spur,1,2021-07-30T20:04:02Z
123,Ugy9Dl93xViNHWPC_-Z4AaABAg,👍✌❤ interaction,Uncovering Hypocrisy,1,2021-07-30T20:00:40Z
124,UgxeL2eRfcW0q_wtQmZ4AaABAg,This dude is like the Hagrid of closet where all AH's dirty laundry is kept.,Dominic Campbell,50,2021-07-30T19:56:58Z
125,UgzpjMgNFRKZ31xwUzB4AaABAg,This lawyer needs to be setup like Samuel.L.Jackson in “the Hitmans Bodyguard” because of how vital he is,Hashem,3,2021-07-30T19:56:21Z
126,UgxLN7YgWz78ZshDobR4AaABAg,Keep on putting your foot on Ambert Turd neck!! I'm here for it.,Angie,0,2021-07-30T19:54:30Z
127,UgzgRGzunSRBhJ7TzqB4AaABAg,"Great work TUG! After this case is over, JD should invite y'all for a good ol' southern BBQ! 
Even though you and Laura B have been Doxxed, I have refused to learn what your IRL identities are! Keep on keeping on with the great content and updates! \m/",Bella Legosi,5,2021-07-30T19:53:21Z
128,UgwvjLh9JRZ5cjXt24J4AaABAg,"*{Maniacal Laugh!—Maniacal Laugh—!}*
🤣💖",GloryGlory Hole’allelujah,1,2021-07-30T19:50:22Z
129,UgzVqqBwx0Rwd-vgVz14AaABAg,"Isn't this a fun turn of events...!!! Funny when your first thought is to deceive to win, an your xlawyer teams up with your xhusband to put a stop to your deception...😁 Oh the joy of watching AH biting her finger nails to nubs...!!!! ✌🏻💗😊❣️",Donna Kawana,0,2021-07-30T19:44:28Z
130,Ugx5wy9iqNeEjU-0DsB4AaABAg,The courts can tho,Tory Mann,0,2021-07-30T19:41:32Z
131,Ugy-0Eo_fReduzn9kll4AaABAg,Welp what she said might not b true,Tory Mann,0,2021-07-30T19:40:55Z
132,Ugwizmxvh2WMoSgjyt54AaABAg,"Just a refresher, remember when the UK trial was over and AH  met Rocketman in Mexico and he didnt look very happy, count the months and that must have been when AH told him she was having a baby with the embreyos. He is the daddy. Interesting maybe?",Marquitta Mone,1,2021-07-30T19:40:44Z
133,UgxgFHVkTQ-EDJH0YF54AaABAg,Brb,Tory Mann,0,2021-07-30T19:39:33Z
134,UgxyraL7hRBY0B6mSQh4AaABAg,Is this the same guy who was JD’s divorce attorney and all the videos and stuff were hidden from JD? Can he be trusted if he already screwed his client before? Maybe I’m mistaken. Too many clowns in their circus.can’t keep them straight.,Birdie,1,2021-07-30T19:39:21Z
135,UgxfkEwTW8T0MNi76694AaABAg,"I really hope That jd get justice and wins in Virginia trial, because he deserves it, he is a real víctim, i pray to god That happens, great vídeo umbrella guy, you are awesome",Carla Castillo,0,2021-07-30T19:35:10Z
136,UgxYSfNKBgVerjkBexR4AaABAg,That lawyer is cooperating because he can lose his license to practice by not cooperating. And there is a possibility that he still could over unethical practices.,daddyattitude,2,2021-07-30T19:33:57Z
137,UgzbYACzi_Qqzg4BZB14AaABAg,"No more corruption, and unjustice,",Carla Castillo,0,2021-07-30T19:33:43Z
138,Ugzn0usACYtCxAORYq94AaABAg,GREAT TIMES! AMAZING TIMES! WONDERFUL TIMES!!! lol,Fernanda Godo,0,2021-07-30T19:33:01Z
139,UgzcXOwHOsWIhypotsF4AaABAg,"She has to pay in someway, she deserves it, justice for my handsome and beautiful man jd, go jd go, we are with you, not matter what, this woman cannot get away just like That, i hope That this time she pays for her felonies, and líes That she said about jd, we want real justice for real DV",Carla Castillo,0,2021-07-30T19:32:55Z
140,UgyTZQ6_c_0p3TwVoDR4AaABAg,Buh bye Ambuser... the quicksand you landed yourself in won't be letting go!,melanie ryan,0,2021-07-30T19:31:51Z
141,UgxFKT2duS_T6K7N37B4AaABAg,The phrase is the truth shall set you free...thought in Amber's case it may well lock her up.,corey shorter,0,2021-07-30T19:26:36Z
142,Ugwn_VTO8P609n2NpWh4AaABAg,"Is Turdys defense seriously “but Jonnys a bad person”. It’s like her defense strategy was created by a 12 year old…. Or Turdy created it. You know for someone who reads so much, she sure is a colossal idiot.",Ian Klingensmith,1,2021-07-30T19:26:23Z
143,UgwxtklCGt2pinDVrwZ4AaABAg,"Fun times TUG, fun times indeed 👏👏👏",Kelly Robinson,2,2021-07-30T19:25:16Z
144,UgxBxSYEQJe06Turhnl4AaABAg,I love days that has Twice umbrella Guy.,Andyswoodshope O,1,2021-07-30T19:24:10Z
145,Ugxpf-z01H9ZwsmnInJ4AaABAg,The likes to dislikes ratios has certainly changed over the last few years only 3 dislikes when i wrote this people have begun to see the truth. thanks to you TUG.,Oakley's Tactics,4,2021-07-30T19:23:26Z
146,UgwgPLfH81CJLybTEE14AaABAg,We appreciate the heck out of you too Tug❤️👍,stinabo,3,2021-07-30T19:22:45Z
147,Ugw0wdpSm4jN028aqMN4AaABAg,"Finally, Amber may be getting that final nail in her coffin if her lawyer has to answer some of the questions she fears him answering honestly~",Matthew Riddle,23,2021-07-30T19:18:42Z
148,UgzrwsZFFBE3nem37jB4AaABAg,Gotta love this witness!,Reign Deppe,4,2021-07-30T19:17:14Z
149,UgxawC2PXzgIIuE8cH54AaABAg,With all the lies the nameless one has pulled I always wonder if she is lying about not being able to actually have a child herself. I know that's a bad to think something like this about someone but imo she's a monster so I don't feel to bad wondering about it.,Patrick Moore,15,2021-07-30T19:15:11Z
150,UgwkgeOYU2IUmoaVNFZ4AaABAg,"I wish I could send the book ""The Art of War"" by Sun Tzu to Johnny somehow.",lyrastar999,3,2021-07-30T19:10:53Z
151,UgzKRPZvVcBfwxVgxLt4AaABAg,Fun times indeed just hoping this man tells the truth,Darkstrass,2,2021-07-30T19:03:55Z
152,Ugx3As2sYCg8mcUaMoV4AaABAg,I'm all for jd but what about lawyer client privilege.  Can anyone give answer,Skip D,2,2021-07-30T19:03:30Z
153,Ugw7QFnX3jhAdlT82vV4AaABAg,I am sooo glad that KARMA is hitting AH hard 🤣😂🤣😂 she is so stupid to think that this crap wouldn't come back on her. So happy for Johnny and his team. JUSTICE FOR JOHNNY 💜,Tia A,1,2021-07-30T19:01:52Z
154,UgwfAnbDgF77MpSK7YF4AaABAg,Niiiiiiiiiiiiiiiiiiiiiiicccccccccceeeeeee,William Terry,1,2021-07-30T18:58:20Z
155,Ugx5oZHRjW_dfMgYfpt4AaABAg,"Me: *reeds  title*

Also me: Wait, that is allowed?",SPOUWNER RING,1,2021-07-30T18:58:17Z
156,UgxGfq6uokImyJV3oW54AaABAg,It gets better and better 🤣,Sandra VL,1,2021-07-30T18:57:18Z
157,Ugy82HtKzqpKoqWcY8V4AaABAg,feeding the algorithm,Elondinne,3,2021-07-30T18:47:40Z
158,UgyxZ53GflIDELqEHYZ4AaABAg,I thought lawyers couldn't talk about their clients. Laywer/client previlage.,WaitingForYukiOnna,3,2021-07-30T18:46:43Z
159,UgwqKzGstSVWu0PMBZR4AaABAg,"Help me understand, Eric George is who?  Does he work for the ACLU as an attorney and helped AH write her op-ed? So if that's the case there is no privilege that he is violating by answering these questions.",J D,2,2021-07-30T18:46:31Z
160,UgyNKKOpXFRJtEjJjAJ4AaABAg,Will he answer honestly ? Or will they lie like they did in the U.K.? Or will Elon’s money talk,Willow Wilson,1,2021-07-30T18:45:43Z
161,UgwlQZZx-F0-wTRhsaJ4AaABAg,Woohoo such awesome news. The beginning of more wins. Now let the big wins keep rolling. Thank you TUG for continuing to cover all this. I just can't wait for the VA trials to begin and The Judge to rip that nameless party apart. AH belongs in prison period!!!!,Zoey Jafferally,4,2021-07-30T18:43:34Z
162,UgxY2gHPsBTn-A7iTDp4AaABAg,Send it,Wesley SnipesYah,0,2021-07-30T18:42:52Z
163,UgzlWatspzLoZELdyCh4AaABAg,I hope AH likes crows. She’s going to be eating a lot of that while wiping the egg off her face. Maybe they will bring the silver platter with both to the stand while she testifies. We know she likes stuffing her face in depositions lol! Thanks Tug you are awesome 👍🏻👍🏻,Mary-Lynne,0,2021-07-30T18:42:16Z
164,UgynMvn8UtC_l0QPekp4AaABAg,Just wondering how the British courts feel now that it’s proved that they were played for suckers by her ?,John Lansing,0,2021-07-30T18:41:50Z
165,Ugx7hs3XM26_3jE3aQd4AaABAg,Isn't that a violation of Attorney/Client privilege?,Blah Blah,1,2021-07-30T18:40:46Z
166,UgzAjcUv0BBM9mA099l4AaABAg,Why would she panics ? don(t you understand lawyer/client privilege the lawyer can't say shit,DoNMoSs2,1,2021-07-30T18:40:11Z
167,Ugyrz83dTQACrdqQsFZ4AaABAg,This is weekend wonderful news 📰😘🏆.Tugtastic!!,Andrea oldfield,1,2021-07-30T18:39:35Z
168,Ugx-iX4ednPmK6YgZPN4AaABAg,Justice for Johnny against cold-hearted gold diggers!,Pop Tart,1,2021-07-30T18:39:00Z
169,UgwAD_hDvMoKY5nY3LB4AaABAg,"I hope they all go down together, all of them",Dawn R,0,2021-07-30T18:35:05Z
170,Ugw4ABgMTNRR871NIOR4AaABAg,Amber Turd deserves every bit of hate and losses that she gets!! JUSTICE FOR JOHNNY!!,mau Barlow,79,2021-07-30T18:30:46Z
171,UgzOoiM59lxUgmBXpP94AaABAg,So why isn’t the papers and media covering this,keller blair,1,2021-07-30T18:29:24Z
172,UgyQ29HmRGid-Baacox4AaABAg,"FEED THE ALGORITHM! *STOMP STOMP*

Hopefully Eric George’s second round of talk blows this case wide open!",Ardan Blade,23,2021-07-30T18:29:24Z
173,UgxpZZF9nqx6D1nECAd4AaABAg,"just put that succubus in jail already, there's so much evidence on that turd it's insane",DoT.,1,2021-07-30T18:28:19Z
174,Ugwk2swIPJDx_O7kFXN4AaABAg,No MSM coverage of this-SHOCKING!😉😉,STB 1971,3,2021-07-30T18:27:21Z
175,Ugx-cK-fEGgQkYQkA7x4AaABAg,Thank you for sharing this with us TUG…,Nicky Phoenix,4,2021-07-30T18:18:50Z
176,Ugw_058SnB8LzCiPeSB4AaABAg,Set It Off sang it best; karma's gonna come collect your debt! I deeply hope that Mr. George will be allowed to testify.  This will be quite the progression to see unfold in the case.,LunaMane,3,2021-07-30T18:18:23Z
177,Ugziov9Y-0GF1M2Dlst4AaABAg,Be careful burning bridges. Make sure you aren't still relying on them in some form or another.,MrPingn,1,2021-07-30T18:17:27Z
178,UgwjZC4x_CanZ0Ua1sF4AaABAg,I'M NOT GETTING YOUR NOTIFICATIONS TUG,ann brown,0,2021-07-30T18:17:14Z
179,UgzDZ7X4d-CO23m6Prh4AaABAg,Oh what a tangled web we weave when first we practice to deceive,Margaret Greenwood,1,2021-07-30T18:14:05Z
180,Ugz738cI7dL4gMuVJsV4AaABAg,Algorithms......test....,Parameswaran Nambiar,0,2021-07-30T18:12:41Z
181,Ugz0HUKgXuTpwW6goDN4AaABAg,🌮🌮🌮🌮🌮🌮,Bigfoot Phill,1,2021-07-30T18:11:51Z
182,UgzUga1VQ5f3pwkgk714AaABAg,I can't wait for this trial,FlerfSpective,10,2021-07-30T18:09:26Z
183,UgwBv8yAT2IRYchfw5R4AaABAg,Got your book recently. Thanks TUG!,Hex Harper,2,2021-07-30T18:07:20Z
184,UgxHIDZUnjZZ_lv28mh4AaABAg,Wonder if this is why the A2 producer went to the papers today with weak damage control dismissing people who have spoken out against nameless on social media,Helen,2,2021-07-30T18:05:52Z
185,UgxfIeydY1ikTMOyWhR4AaABAg,J4JD,Rock Candy,3,2021-07-30T18:02:52Z
186,UgxX_ue15Qq94V-AXEt4AaABAg,"It has become WAY too easy to get a guy convicted on a pretty girl's word and nothing else. Maybe the lawyers and judges should sit in the D.O.C. for a little while, just because the guy said so.",john brown,41,2021-07-30T18:02:42Z
187,UgxVHPvYYjcD2Cwl1JV4AaABAg,Thank you TUG for spreading the truth about a certain nameless person. I am not surprised AH wants to silence this guy from telling the truth because the truth makes her look bad,Lauren Rhoads,45,2021-07-30T18:02:23Z
188,UgzT6MFHr3roS8lfbpV4AaABAg,"Honestly Heard's just like that one villian in a movie who unexpectedly always try's to come back and doesn't stop at anything just to get back at someone so selfishly corrupted there's no end to it




Madness",Dante Toshiro64,97,2021-07-30T18:02:13Z
189,UgxO1qD8eOGR5JIKcwR4AaABAg,I hope the court will not let them get away without answering these. So frustrating how nobody seemed to care to enquire if her stories were true. I think all publishers should hold to some effing standards or be held accountable,Nina Piyasheva,77,2021-07-30T18:00:03Z
190,Ugywkx96fo-HL5KQU0B4AaABAg,Thanks Tug,Susan Mcknight,2,2021-07-30T17:58:11Z
191,UgyorH_NUOPdnubosvB4AaABAg,Something for the algorithm to munch on 🍳🎂🍎🌶🍗🍟,--,3,2021-07-30T17:58:06Z
192,Ugz25ybO1Q_umytbisd4AaABAg,Liked and shared big ❤️from a Russian bot in the UK keep up the good fight,Lewis Lewis,6,2021-07-30T17:57:10Z
193,UgwuNGwWrBdPI2xqTZt4AaABAg,All I gotta say is I wonder how the United the kingdom judge feels right now for basically allowing amber heard lie under oath and for letting her win,David James,0,2021-07-30T17:57:02Z
194,UgydtUNsklzH5PAu8yV4AaABAg,God is goed,Alexander Sergeant,2,2021-07-30T17:54:42Z
195,Ugyawiqx9tNwRMQ_xa54AaABAg,"when the hell is something gunna be done about her? she must have something on industry bosses thats keeping her employed, such as possible affairs? if the likes of disney n warner swallow their pride, admit they got it wrong n black listed her, as well as apologise to jd etc, this would impact on all entitled aresholes to change their ways",Tony Hyde,6,2021-07-30T17:54:32Z
196,UgxJaa8q8C5zblHfyih4AaABAg,Thanks Tug .,Janet Howarth,5,2021-07-30T17:53:14Z
197,Ugwlgp0-ooEuLDFoEuR4AaABAg,"I'm really confused. What about lawyer client privilege? If she had him on retainer, paying him during everything that took place that he's talking about, ain't that covered?
What took place where that privilege was no longer active?",Jayme Splendid,3,2021-07-30T17:52:13Z
198,UgyfDcJeTx5IbkQshK14AaABAg,its all too delicious!,gemqueen1,5,2021-07-30T17:51:29Z
199,Ugy_Ij1xZ-huBZQvaWt4AaABAg,It's just getting better and better...,damnitalexis,7,2021-07-30T17:50:48Z
200,UgwR4mwObnmiDoC95el4AaABAg,He admîts they took her words as true without doing any research. How can an organization like ACLU handle such a relevant case with this superficiality? Disgusting,Laura B,129,2021-07-30T17:49:40Z
201,UgxOsOAqNQiqZWlHQ7R4AaABAg,Thank you Mr. Tug....🙂🙂🙂💯,V L,5,2021-07-30T17:49:01Z
202,UgyKSBQvZh28fPxmW_J4AaABAg,Made my Friday!!!!,Maki Roll,3,2021-07-30T17:48:20Z
203,UgwfIx5tzzVMF1AdkKp4AaABAg,So... Where was this guy the few months this been going on again??,Cephalon Stitch,3,2021-07-30T17:48:12Z
204,UgwzVw2rUJH_CL8hPFV4AaABAg,They should ask for the judge that handled the other case ask about the dinner they all had before the verdict,Jonathon Lilbourne,63,2021-07-30T17:47:36Z
205,UgxGVj78V5EQEaafE314AaABAg,"I always thought the ACLU was so necessary and important, especially in the last few years. I feel like a sucker for not considering that they would prize the appearance of ethics over being genuinely ethical. Fighting abuse against women and domestic violence in particular is so important but they essentially canonized a rich beautiful white woman who’s story was shaky from day one. You know how much vetting SNCC did before they went with Rosa Parks to be the symbol of the necessity of civil rights? The movement can be hurt when you make a liar the face of it. Think of all the poor women, the minorities who don’t have her resources who experience this and will not be believed because of a very (now) famous rich liar who will always be associated with calling wolf about domestic violence.",Eleanor Svenson,51,2021-07-30T17:47:31Z
206,UgwKoPu_26VI5hDpB_F4AaABAg,Hey therre!,Anna Nishikinomiya,2,2021-07-30T17:47:24Z
207,Ugx5ZbbIObC5gGhqNAx4AaABAg,"This is such a breath of fresh air after a massive dumpsterfire that is Blizzard, Dc, Disney, and the whole Kevin Smith fuck up and doubling down from all of em XD Thanks Mr Guy~",Ghet Orange,88,2021-07-30T17:45:55Z
208,UgwI_jf3ExvkPUnLFp14AaABAg,just feeding the pesky algorithm here,rosie alejandra,4,2021-07-30T17:45:37Z
