,id,comment,author,likecount,publishedAt
209,UgzQtaQzFUfY1pzWJ1F4AaABAg,"Oh, the look on her face when justice is served...

Unfortunately, she's getting away with a lot right now still. I read an article saying Aquaman producers are keeping her on board because they, ""don't listen to Twitter and do what's best for the movie."" Haven't seen Hollywood actually do what's best for the movie in a while. I can't speak to how legitimate this is, but I don't think this is something a media outlet would lie about.",Nikole Finger,26,2021-07-30T17:45:24Z
210,UgynXMgJ9L_yGTTQ-fR4AaABAg,"So close so very very close, dont sell out don't sell out",5thNovember scrivener,2,2021-07-30T17:45:08Z
211,UgwClkDDbJwaTRwyZL14AaABAg,Cannot wait for JD’s day in court. Mainly to see the nameless person get reamed by the judge and get humiliated!!!! I have stood tall with Johnny since the beginning!!! The more evidence that comes to light about her lies and scandalous ways….just lights me up!!! Now if they don’t pay attention to all the evidence this time….I lose complete faith in the justice system!!!,Angel Barbarito,166,2021-07-30T17:44:57Z
212,UgziH284SrxIvP8Lx7B4AaABAg,Bad for the lawyer who if they helped to do illegal things before the illegal things were done rather than just trying to help some one not face the legal pena.tjds if what they did are guilty  of those illegal acts they helped to plan.  He he,Eastlyn Burkholder,6,2021-07-30T17:44:23Z
213,UgzfZoyQKQHx8RGjQzF4AaABAg,"How can her lawyer testify??? Is he no longer her lawyer??? Ohhhh man if he can and does, LET'S ROCK N ROLL!!!!! Let that Witch Wither!!!!",QuEeN Mama Bear,16,2021-07-30T17:43:52Z
214,UgyOo9misilV2f3iQVh4AaABAg,"Hypocrisy doesn't cover nameless's legal possee. She's definately the face of Domestic Violence alright! An abuser of a man! She's an author on ""How to lie about a man and ruin his life"". Real victims are sick to their stomachs at the sound of her name or seeing her face. What she has done is surely to lead to someone's death for her lies.",Tracy Haverstick,1,2021-07-30T17:43:52Z
215,UgwecUPapfgaI7YTH5V4AaABAg,"Wait I'm confused where was this guy in the U.K. an I thought your Lawyers couldn't do this cuz of the Client Privacy Crap. Don't get me wrong I would love for Him to burn her down, I'm just hoping she can't try to shut him down.",N.S.D. J.P.T.,1,2021-07-30T17:43:27Z
216,Ugzmk2LU4zLcQjGIZad4AaABAg,Get ben chew,danielle kosa,2,2021-07-30T17:41:42Z
217,UgwfK0zc5xTNfLYrCAx4AaABAg,Great vid TUG!,Evey2u,8,2021-07-30T17:41:18Z
218,UgyIcnHYs7BQ0fLfd4p4AaABAg,Thanks for the update x,Lauralou waters,5,2021-07-30T17:39:53Z
219,UgyVJAjInkOlmzsZKCB4AaABAg,Always excited when I get a notification with an update! Thank you,Pika_MR,11,2021-07-30T17:39:28Z
220,Ugy-JFIZM_TGe1-W-XZ4AaABAg,"Thank you for the update, TUG!",Annie Serra,13,2021-07-30T17:39:26Z
221,UgxjgEjCeoAzeIeYw5V4AaABAg,Love a bit of spice with my 🌮🌮thanks TUG,marie brophy,7,2021-07-30T17:38:56Z
222,UgwS1ICKVpFAjlcZMCx4AaABAg,"Uh-oh, deep trouble for ya, sweetie!",Daniele Arturo Nappi,5,2021-07-30T17:38:49Z
223,Ugzj839KuI5aP3QH-jh4AaABAg,"Oh well you know I Amber she's probably losing her ever-loving mind
😂🤣🤣🤣🤣",Margaret Chafe,26,2021-07-30T17:38:31Z
224,UgzRGhEqjDTJFV8wLBJ4AaABAg,"When you ask for a topic to be opened up and looked into, then what you know about that topic might become relevant info in a court proceeding. Ha ha",Eastlyn Burkholder,64,2021-07-30T17:37:59Z
225,UgyLIPAYkS_xXWlpOxt4AaABAg,They both can rot in hell.,Slade Wilson,0,2021-07-30T17:37:13Z
226,UgzeFVgsNc7uLCF6n_J4AaABAg,*lights cigar*: I love it when a plan comes together,Kieran McSorley,166,2021-07-30T17:36:53Z
227,UgyEp961jWCQfwAh1Cd4AaABAg,Congratulations to the non factor know as the nameless idiot,Ocean,1,2021-07-30T17:35:43Z
228,UgxbmCNVIeWsbhTM6h14AaABAg,And why is there not media coverage? Because then the norms would be complaining at Rupert Murdoch,meh,177,2021-07-30T17:35:17Z
229,Ugyy_3BhQRI3V64Dp6p4AaABAg,"Oh boy this is going to be spicy
🍔🧇🫔🥪🍗🧇🥜",Artem Protectron,27,2021-07-30T17:34:39Z
230,UgyBoGjckKXcArFyDux4AaABAg,Love stuff like this hoooo yessss! Thanks tug 😉😍👍,Shadoe Moon,15,2021-07-30T17:34:04Z
231,Ugz3nQUGOB_KvH_69NB4AaABAg,"Thank you, TUG!",Libby Priest,14,2021-07-30T17:33:23Z
232,UgzvWDE6Cek6gxdhbLR4AaABAg,"Shared.   Also love that Emma Stone may now sue Disney because of Cruella.   Karma Baby!
Should be easy to check if she actually changed her phone number.",Jeanne Cihla,31,2021-07-30T17:33:07Z
233,UgzOmMiRiLHM53rSovJ4AaABAg,Caught in her own Web of lies.,Matt B,15,2021-07-30T17:32:15Z
234,UgylKGV6vlx1Mko_xB14AaABAg,2 Views 5 comments 24 likes 😂,Doc Dat,3,2021-07-30T17:32:14Z
235,UgxZPQ8LU6qY3HTZZVF4AaABAg,It will be a holiday if she goes to jail. @TUG what's the latest on Australia?,Vido,46,2021-07-30T17:31:35Z
236,Ugxx8r98RjAPKKDnx-Z4AaABAg,🇩🇰❤️🇩🇰,Maja Lund,7,2021-07-30T17:31:25Z
237,UgwPDpnNUz2JJiFAX7d4AaABAg,Dammit,MrGhostBoxer,7,2021-07-30T17:31:11Z
238,UgxM6U3srcmeJICFubB4AaABAg,Thank you for consistently updating TUG TUG TUG,Rachel Deadman,43,2021-07-30T17:30:53Z
239,UgzkOQUu6kfmO27ZpJl4AaABAg,LETS GO!!!!! SEND IT!,Dr4g0n0v3rl0rd,37,2021-07-30T17:30:50Z
240,UgyWagskZlkmaeCy-gd4AaABAg,First like today!,Tracy Haverstick,5,2021-07-30T17:30:49Z
241,UgxAVwhU77S62gdk30l4AaABAg,First...!,RageRacerRiley,5,2021-07-30T17:30:28Z
242,Ugw-TwqJEh4XLC8uUqN4AaABAg,First!,Blu Daizee,5,2021-07-30T17:30:25Z
243,UgwDg9n6Pq9Udj8E1yd4AaABAg,"⭐Here you go ""pesky"" 🍖🌮🌯🍩🥪🍛🥩",Tanya,10,2021-07-30T17:30:24Z
