,id,comment,author,likecount,publishedAt
0,UgwrILL46OJll0g6Kxx4AaABAg,yli your a sh*t for that! 😱❔ - syn,Manuela Cecena,0,2021-08-30T14:57:23Z
1,Ugxt5O4It3u5HLn_vN94AaABAg,"Some people: Oh, a wholesome scene between Mera and a little girl
Other people: All she did is make the little girl's parents think she's crazy which will get them to get her to a mental institution where they will try and convince her that she's crazy and was just seeing things, but she will continue to insist that she saw it, which will lead to them putting her in a cell with a strap jacket and everything",Anon,1,2021-08-21T05:52:14Z
2,Ugwn8m-48QFnLlSdq_54AaABAg,Welcome to Sicily the place where Michael Corleon were his lovely new car was completely destroyed. He never even put a 1000 miles on it.😭😭😭. Oh yeah and of course his current wife she died in the blast too. But still  He never even got a chance to wear out the tires.,Ryan Yeager,0,2021-08-09T15:06:56Z
3,UgxtmxdtKK4wswIEB8l4AaABAg,356Shriyaa,sunita sathe,0,2021-08-09T07:14:46Z
4,UgxYFtTRFEo0QFMqm794AaABAg,"Like the accent Mera has in this movie better than Justice League. The JL one was too cliche' and tried, I think. Were  as this one fits",Queen Amidala,1,2021-07-23T20:47:41Z
5,UgwGyLIOiP70VzyFaA54AaABAg,This looks like where they filmed the Disney film “Luca”,Johnny Quest,0,2021-07-11T22:04:25Z
6,UgxWCTD3B_M2PUqcNmV4AaABAg,3:58 who is the illustrator of the book?,NANA BANANA,0,2021-06-02T05:27:20Z
7,Ugw_wuDRgvPz3ns6BRN4AaABAg,I legit didn't know there was a Pinocchio book I thought it was just the movie,Alejandro Garcia,1,2021-05-26T21:36:37Z
8,Ugz5io6XuzRdcFNXxK54AaABAg,"Mera is so beautiful, don't you guys think so?",Nether Freak Ultima,2,2021-05-16T21:31:23Z
9,UgwSyRimHH6-2CRDqal4AaABAg,The first time I watched this movie I only saw her,football magic,1,2021-05-07T12:18:18Z
10,Ugyw_KCemLqxtyBBlM14AaABAg,She looks like Ariel 🧜‍♀️,BTS X CELINE,4,2021-05-02T14:22:28Z
11,UgxLowOeksrF1n2qPTx4AaABAg,rose petals are very tasty in spring salads,Blanche's Lesbian Lover,2,2021-04-18T21:16:23Z
12,Ugyycdk8GG4FAYQfgSV4AaABAg,"I'm sicilian and when we saw the map, at the cinema, we were like:""ooohh""",Federica Napolitano,3,2021-04-12T14:52:46Z
13,UgwbQL8x8O8ITIRUda54AaABAg,Lose Ambuser Turd from Aquaman 2.  Look in cleaner waters for a new Mera #JusticeForJohnnyDepp,Rock Candy,0,2021-03-28T22:09:19Z
14,UgzsVNRHUrvWVsfX7DZ4AaABAg,aquaman is basically modern poseidon,Felix,2,2021-03-09T15:09:52Z
15,UgyDhTGH0MM21XHI0PZ4AaABAg,I don't know what I should call it ''Cute'' or ''Weird'' or Funny,blader's edge,2,2021-01-08T21:46:48Z
16,UgzI07480liPs_nnNsF4AaABAg,What is the name of the song?,Marco Tromba,1,2020-12-16T17:18:14Z
17,Ugwtu_OO4tbgQoV2QeJ4AaABAg,"Me: tempts by Mera's fighting 
    When I try to do that fight...
                   Bruh
Broked my leg by myself......😐😐",Jonnada Neeraja,1,2020-11-29T16:47:34Z
18,UgzLdpC8qR8PvJ0LVnl4AaABAg,😳😳😳,Francesco Romani,0,2020-10-25T10:30:58Z
19,UgxmbnYd4F3aai3uvVB4AaABAg,"This American ""idea"" that Italy is a sort of ""Disney place"" with color and flowers is incredibly funny.",Aku,15,2020-09-13T22:55:52Z
20,Ugwt4XxHk11A9CZ8xrt4AaABAg,Best scene😍,NewSpectro,1,2020-09-11T21:22:47Z
21,Ugx5ifL80mQ9j2_4xaJ4AaABAg,Horrible actress,merdelune9,2,2020-08-27T10:56:06Z
22,Ugw8sidFEXQCAfqQbHt4AaABAg,2:41-2:44 cutest most innocent face ever. Im in love ❤,USAlien234,5,2020-07-29T04:56:27Z
23,Ugx-H_jH5e3W9W5uCLB4AaABAg,Yes red head!,Devido Prasetya,0,2020-07-21T19:46:16Z
24,UgwTF2gqPTdFpnQmjRN4AaABAg,"Man, she was soooooo good in this movie, sucks she turned out to be a lying, cheating, bat shit crazy whore 👎",Little Gipper,6,2020-07-14T04:15:44Z
25,UgzapTYDm67uLusvs-14AaABAg,Those roses must taste good maybe I’ll switch from eating the Force to eating flowers next,Darth Nihilus,1,2020-06-07T07:25:20Z
26,UgxE4-2zyt1v9iWHXyJ4AaABAg,Yow the boys at the back 2:38,Juvris John Colinares,1,2020-06-06T12:04:34Z
27,Ugyl8n13H8xFf-SG9MB4AaABAg,Yow the boys at the back 2:38,Juvris John Colinares,1,2020-06-06T12:04:23Z
28,UgxWu8ClYPSLnGEqCx94AaABAg,Nice to see Mera getting a different perspective on the surface dwellers,Joe Whitehead,4,2020-06-05T23:41:30Z
29,UgxZA6ze-LjYP1NRHwt4AaABAg,This is Sicily? Really,DALBO the noob,3,2020-05-19T17:31:56Z
30,UgzVfj4hScLjALTEBOF4AaABAg,I'm never going to see another Amber Heard movie again!,John Raiser,3,2020-05-10T23:19:16Z
31,UgzaGVDgMjmBKiIw0Xh4AaABAg,"Amber should be banished from Hollywood.
We don't need a toxic woman like that.",John Raiser,4,2020-05-10T23:18:51Z
32,Ugw5ZSzsjNSLl0PvnSp4AaABAg,"I can't explain why exactly, but there's something very Shrek-like about this scene.",Artsy Fartsy,2,2020-05-08T14:28:56Z
33,Ugyh9hrvsa6QAuuDw5p4AaABAg,Warner Bros and DC definitely need 2 replace Amber 4 the sequel.   She did an excellent performance here but seeing what happened with this whole Johhny Depp thing I'm gonna have a hard time seeing her in Aquaman 2.,Cytron1515,3,2020-05-01T16:08:09Z
34,Ugzo-w7ZPNnJ4rtctxR4AaABAg,I bet those roses tasted good.,Carlos Andres,2,2020-04-27T21:20:21Z
35,UgzhzzX8TMFlyyqv6cB4AaABAg,Is this cunt really Amber Heard? Geez putting her in with Roy Orbison thats terrible.,EricoChico,1,2020-04-25T07:23:26Z
36,Ugwgs2yXSExPI8kE7zF4AaABAg,Sicily number 1!,miccoligno1,0,2020-04-12T06:10:38Z
37,Ugy1wBJXxlhpy1euKkl4AaABAg,well to be fair Roses are edible,ITS JUST ASH,1,2020-03-23T04:12:46Z
38,UgxOZNUzh-MRek1hcDF4AaABAg,1:40 he grab the bottle upsidedown and suddenly it flips back,BaguSadikin,2,2020-03-17T00:49:02Z
39,UgwrxqrePp1_iAct24J4AaABAg,I guess you could say they *ROSE* to the occasion! 😀😀,Larry Poppins,3,2020-03-10T23:30:10Z
40,UgxpL24lUw1gXYQlKz54AaABAg,She didn’t even pay for the rose!,Julie J,1,2020-03-08T12:26:04Z
41,Ugw4_np-GwqYMhsEhU14AaABAg,Is she Ariel?,P Q,2,2020-03-07T16:41:50Z
42,Ugyoi6thWHJ1VmfqgJF4AaABAg,"Petition in favor of actress Amber Heard, protagonist in the film Aquaman, as Mera. http://chng.it/pfN9c8MC46",Gabriel Atlan,2,2020-03-01T04:09:34Z
43,UgxMKIPsPccGdfazJI94AaABAg,"Lol *KEEP THE BOTTLES AWAY FROM AMBER, YOU WILL LOSE A FINGER AND YOUR SOUL!* 😆",Teddster Pinx,1,2020-02-15T12:08:07Z
44,Ugxm0C-z6CHG3TO6bU94AaABAg,"Who knew she was such an incredibly damaged, lying slunt.",Teddster Pinx,2,2020-02-15T12:06:51Z
45,Ugy0JW8QLZPjomEyT9V4AaABAg,#AmberHeardneedstogotojail,Rose Gail Peirson,0,2020-02-08T21:28:06Z
46,UgwwIgY9GIYQh3dy94R4AaABAg,That next morning Aquaman was late for her bday party so she took a crap on his water bed.,Max Riggah,8,2020-02-08T06:52:35Z
47,Ugx0KXJ4gIu6K9hQ_4d4AaABAg,3:33,Akbar Aliansyah,0,2020-02-03T04:27:22Z
48,Ugw3E32hSuyF8kSElZh4AaABAg,Plot twisted now the girl is called insane by the parents and got thrown in a mental hospital,Arizakawa Miyamoto,7,2020-02-01T08:14:38Z
49,Ugz3ecHBVPeBu6sVPUN4AaABAg,"Avenger : This about fight, fire, high technology
Avatar , Aquaman :  fight, fire, high technologi ??? Of course, but ++ beautiful places n creatures.",Netizen AlwaysRight,0,2020-02-01T07:21:52Z
50,UgyzSZv-DqoETMWa0It4AaABAg,Song?,Little Gipper,1,2020-01-22T04:23:26Z
51,UgwiouIu3ePQXA1RWAZ4AaABAg,"""I wanna be, part of your world""
And then she eats the rose",This is Ajang,1,2020-01-08T10:53:42Z
52,UgxXfzW5jPtbIPfnRC94AaABAg,Aquaman is the best dceu film,Steve Rogers,1,2020-01-08T00:54:10Z
53,Ugyh--gmxylp7VjU47J4AaABAg,Is this the only redhead in the comics that Hollywood didn't change into a black person?,esnips123123,0,2020-01-06T23:53:36Z
54,UgyuyGqipFEsH6-67lR4AaABAg,Someone should make a petition for disney to cast amber heard as ariel,Will,4,2020-01-04T21:10:25Z
55,UgymaUjfPd-KweIzqn94AaABAg,Uzumaki kushina😍😘😍😘😍,Cahaya Bintang,0,2020-01-04T05:01:04Z
56,UgwDm7m7MFzFBfoLzOR4AaABAg,Nice to see a romance with actual chemistry between the characters,IainWFowler,3,2019-12-29T00:23:23Z
57,UgyJRSNqpgbpGSOmOS94AaABAg,Nearly a Disney Lawsuit here.,Caine7ify,0,2019-12-25T04:17:56Z
58,UgzbaJp9W7arwYARtm94AaABAg,"They really should have just cast Amber Heard in The Little Mermaid.

Also, Something something Trident.",Reasonable Gump,2,2019-12-13T15:54:20Z
59,Ugz-FaGSi4R9nIEt8at4AaABAg,Would sicily be on a map back in the time when desert was ocean?,wolfofsummerbreeze,0,2019-12-13T03:43:57Z
60,Ugzwn2LobYO9iHo8_ip4AaABAg,I may be a marvel fan but I gotta say this was a good movie,Rashune Knight,1,2019-12-07T15:42:33Z
61,Ugzn99KGSCrFGE8DOuJ4AaABAg,I know the lady who grew the roses in this scene and that's my 1 claim to fame.,Chelsea McNamara,2,2019-11-24T14:12:48Z
62,UgxXhixznZgdfenI8514AaABAg,I wonder if Mera would enjoy some Italian cuisine? lol 🌹🍝,HEAVYMETALmovie1981,2,2019-11-24T02:09:10Z
63,UgykLUmTC4iDtYxwdCl4AaABAg,What is the name of the 2:11 minute song?,Ednairi Febres,0,2019-11-23T15:55:11Z
64,UgxbwFAFT_3kiLqsCaB4AaABAg,DC doing a good job for Mera's make up eyes... It's so fit to her ❤️❤️❤️,Sight Field,4,2019-11-18T23:25:44Z
65,UgzfFo4QjVKN8DLahPl4AaABAg,The way she gave the flowers ❤️,Sight Field,4,2019-11-18T23:24:03Z
66,UgzuKHeWYgf2513ob3Z4AaABAg,Want the song when Mera a Arthur are holding hands,Fierce Scarlet,0,2019-11-16T22:59:16Z
67,UgwhuK-lp0HG8QkB7Gt4AaABAg,i brought it from the movie te amo (i love you),Jose Flores,1,2019-11-15T06:47:33Z
68,UgzoXXTUPxtyV8YnE5Z4AaABAg,arthur loves mera,Jose Flores,1,2019-11-15T06:46:43Z
69,UgxPSVtiHFPj6WJb2894AaABAg,te amo means i love you to mera,Jose Flores,1,2019-11-15T06:46:09Z
70,UgwBic09Zs7_gQa_6N54AaABAg,2:01 That's alot of white people,Zarahemla Dela Cruz,0,2019-11-13T12:18:21Z
71,UgxFMfqdDITnwbyMdCx4AaABAg,"Love how Arthur eats the roses as well as to say to Mera  ""I am on your wave length""",FeelGood & PlayMore - Frankie,4,2019-11-12T15:28:46Z
72,Ugx9sf7OiMAPk5KhdT54AaABAg,Name of the song?,Maciel King,1,2019-10-27T20:19:24Z
73,Ugw_rsm2RWZohQozhbx4AaABAg,I got Diana Prince wibes when I saw Mera in Sicily,Axel Nilsson,1,2019-10-22T17:44:52Z
74,UgxI06VCWZ-jPIQ145d4AaABAg,I am Sicilian,Igny,0,2019-10-19T09:18:29Z
75,UgwFAf1Mq356LNn9m8p4AaABAg,"The beautiful people, its all relative to the size of your steeple - Marilyn Manson",Zach Attack,0,2019-10-09T07:42:50Z
76,UgyuLANzKkM23QZr1cJ4AaABAg,Amber Heard is fucking georgeous,Jhon wiii,0,2019-10-05T17:18:11Z
77,UgznMdbT2dKs6D4noRx4AaABAg,*Sicily is a isle of Italy* :D Erice,Foxesred2,2,2019-10-04T21:14:55Z
78,UgyNUm8BU_jabadXu0F4AaABAg,She should play Ariel,Johnny G random stuff,0,2019-09-24T20:55:35Z
79,Ugxq_VW9RSlFjQcuukZ4AaABAg,am i the only one who thinks Amber heard would make the perfect Ariel for the live-action little mermaid?,Michael Morris,2,2019-09-23T21:48:18Z
80,Ugzb4ywyYyHkoqJymwp4AaABAg,Mera is giving me both Ariel and Black Widow vibes,Destiny,0,2019-09-22T00:53:49Z
81,UgwCO9WTFkNbFZibLhZ4AaABAg,"3:58 the red head and the P word Pinocchio.
More examples from this message Subliminal.
The red head and the P.
Red head Phineas and Candace and the Agente P. Perry
The red head blossom and the logo PPG.
The red head Kim P.
The red head Peter Pan
The red head Pippi Langstrump
The red head Mary Jane and Peter Parker
The red head Pepper Ann
The red head Sherman and Peabody 
Penny Patterson
Patty Patterson
Paul Patterson
The red head Peg Bundy
The red head from the mask Peggy Brandt
The red head hottest Peg from the troop goofy and is husband Pete, son Pj and daughter Pistol.
The red head ranma Chan and P Chan.
The red head vilma Flintstone and Pebbles
The read head P. Spectra from Danny phantom",SG Mensajes Subliminales,6,2019-09-19T01:35:59Z
82,UgzP0tkH6y4YeqJ1BVp4AaABAg,"See Mera, the surface isn’t so bad",Joe Whitehead,1,2019-09-16T21:32:29Z
83,UgxevYjQtoDYI9MG_IF4AaABAg,Hey how much expensive is sicily,Fawad Ahmed Shaikh,0,2019-09-14T12:40:13Z
84,UgwG607EIdcAnvsF4rR4AaABAg,"BEFORE ANYONE SAYS EATING ROSES ARE WRONG.

APPLES COME FROM THE ROSE FAMILY.

ROSES ARE EDIBLE. THEY ARE USED IN SALADS, DRINKS, AND DESSERTS.",Xolly Xolly,2,2019-08-31T00:32:36Z
85,Ugy8Sb5A1lAyiU8jW-54AaABAg,"I dont mind if she become ariel.
Especially with red hair🌹",I don't say,0,2019-08-29T09:02:11Z
86,Ugx82QXzCqifvxmDXLl4AaABAg,They went to my home in Sicily,Pain,4,2019-08-29T06:32:44Z
87,Ugzu6MuWy7E9VHpqEnJ4AaABAg,Amber looks Beautiful  with red hair,Kalel311 superman,1,2019-08-26T19:16:54Z
88,Ugy0NmaAr654GEK2mn94AaABAg,3:10-3:23 how cute,Jaylen Hioe,3,2019-08-22T06:01:27Z
89,Ugzm-J5u7iVZrjhOK214AaABAg,MCU 2.0,Slade Wilson,1,2019-08-17T16:32:56Z
90,UgxSufCmgtKurtBttDh4AaABAg,They are adorable,Tsukiakari 1203,1,2019-08-13T08:28:00Z
91,UgwAmTj3c5iYBR5vqNN4AaABAg,1:28 ok but can we talk about how THIS SCENE IS ADORABLE?!??!?,Ju-lia,25,2019-08-13T01:32:17Z
92,Ugzk1xCrdKTRDxIfDOx4AaABAg,Amber looks so hot with red hair!,Vue Xiong,5,2019-08-11T17:51:36Z
93,UgwwxBWusp0mvIDcqTp4AaABAg,Roses are actually edible. I've seen them cooked with chicken.,Eduardo Magana,1,2019-08-09T18:52:48Z
94,UgzAp_i2SbwsH9FaBPp4AaABAg,"I'm so happy for the DC fans now that the movies are getting better and better (Shazam, Wonder Woman, Aquaman)",Lycan Power12,2,2019-08-09T02:48:52Z
95,UgwrZh204ApDyrpldfh4AaABAg,"She's eating fucking flowers.


That's adorable.",Daniel Wilson,1,2019-08-07T20:42:25Z
96,UgyM8CeOaPwFeSrYvHJ4AaABAg,"great movie, yes i agree with you guys,  that girl must act ariel without second thought",Life Prime,0,2019-08-04T23:02:51Z
97,UgxgzcY-wnqytNc-TBJ4AaABAg,"The Little MERAmaid







Literally",Full Moon,2,2019-07-29T08:44:18Z
98,UgzH2gXvkSAaih8WA5l4AaABAg,She's so hot.,Yot Pwe,1,2019-07-29T08:01:03Z
99,UgzrtPBd0f1FccIiNP54AaABAg,What is the song,Ashton brogan,1,2019-07-27T15:23:34Z
100,Ugw7D4n7ze5P4ASJTWJ4AaABAg,She is soooo beautiful,ヒソカ好き過ぎて困る,1,2019-07-27T08:15:39Z
101,UgzgiaJHo0xx14R_frZ4AaABAg,"How does everybody keep forgetting that Mera, at least in personality and character, resembles more closely to Katara from Avatar: The Last Airbender?",determinator 94,0,2019-07-19T08:51:30Z
102,UgwEMuwag2JIxUveqFt4AaABAg,Mera is so beautifully and her hair I       hair I can't beat it and Aquaman I like it,Yungkukcolony Sangsangnyu,0,2019-07-17T11:46:22Z
103,UgziukKrqWl2oPtIdZ94AaABAg,"roses has nectar to them i think
well i guess thats why its actually good",Jhon Lindo,5,2019-07-13T10:05:32Z
104,UgyizUzstrJNTW39tZZ4AaABAg,amber is real Ariel,Max,6,2019-07-11T17:53:49Z
105,Ugw-2Nu4KuP3k0_J2h94AaABAg,I think amber heard is the perfect fit for ariel the little mermaid movie,Good Cat,8,2019-07-11T11:45:05Z
106,UgzY6licJfwX6t7CyZB4AaABAg,Fuck. This is the closest I'm going to see Ariel in live adaptation😩😩😩,Erika Warren,2,2019-07-07T21:07:40Z
107,UgwfTVVJdvxJTdcqThR4AaABAg,"어느 나라든 에리얼이 메라배우 엠버허드랑 찰떡이라 생각하는 구나....

In any country, Amberheard is a good fit for the role of Ariel.",0000 00,7,2019-07-07T10:17:56Z
108,Ugy6AppSXIWKsPqq3a14AaABAg,"Mera looks more like Ariel than Halle Bailey, smh",Sugary Heaven,156,2019-07-05T09:25:00Z
109,Ugz5egOrNZ1W6LYQSQ94AaABAg,Hey looks! That is my Ariel. No need for little mermaid live action anymore 🙄,kawaii shoujo,242,2019-07-04T15:37:52Z
110,UgxEOtrozJtdO467kUd4AaABAg,"When Amber Heard looks more Ariel than the Disney casted, I dont mind a badass Ariel",klrbbt,501,2019-07-04T14:40:07Z
111,UgwerF3DNIMnT8jeXJF4AaABAg,"Did anyone notice that Mystery Girl was sped up?  I love the song and was pleased that they used it, but having it altered like that made me flinch a little bit. Is there anyone else familiar with the original song that agrees?",Patrick White,1,2019-07-04T06:16:50Z
112,UgywHnp2UPttigrljk54AaABAg,BUT WHY DOES SHE RANDOMLY GIVE HER A BOOK?!?!?!,CharizardDragon,58,2019-07-01T02:51:59Z
113,Ugz7IT8dbBjPNu7JXB14AaABAg,I don't care what your opinions of DC are - that scene where Mera eats the roses is fucking adorable,Cindy H.,405,2019-06-29T23:29:46Z
114,UgxCHqwZUv_YHuxIPTp4AaABAg,Wolverine and Jean Grey!,CinemaSans,5,2019-06-27T09:09:30Z
115,Ugxm-dn9CSiZIAjZ12x4AaABAg,"Sht, this is cute :(",Sejarah47,3,2019-06-25T23:21:34Z
116,UgyMyC8TqDRTk1Z4jut4AaABAg,She is just like Ariel lmao,clnarmy,32,2019-06-24T12:07:27Z
117,Ugzq_yxvds1DEFtlKbJ4AaABAg,This reminds me of the little mermaid,Johnny G random stuff,8,2019-06-16T21:05:28Z
118,UgxFcetGsvEio1woz-14AaABAg,2:40,Abdel93600,6,2019-06-14T19:33:41Z
119,UgwZJbUtD__AfVjvP7Z4AaABAg,Lights of Taormina,Marte J.R.,2,2019-06-10T03:22:47Z
120,Ugwv8TBQY0dH0ldKnEZ4AaABAg,"A red headed woman who lives in the ocean, comes out onto the land and realizes how beautiful it is, while also falling in love with a man from the land.",Diego Rodriguez,16,2019-05-31T04:37:14Z
121,UgxZdYOrEDByfOu3_2t4AaABAg,He did say something something trident,Warren Chapoton,8,2019-05-27T17:57:58Z
122,Ugxx04VhxJxnieiMa_p4AaABAg,This is actually one of my favorite scenes in the movie. It's rare for films to showcase our heroes just enjoying life and appreciating the world they're always tasked to save.,Syryu,25,2019-05-21T13:25:01Z
123,UgzblhfklDHFkBMxjm94AaABAg,I'm italian. 3:18 child with fake italian accent lol.,Zack Fair,23,2019-05-21T09:24:03Z
124,Ugx4KncXTI4vYL9d7g54AaABAg,I like to see how Jason and amber be a couple but..... Jason already has a wife!!😭😭,Tiffany 123,29,2019-05-20T13:16:01Z
125,UgxpLh4bIJ0VHzeDojp4AaABAg,3:33 I love that shot of Amber Heard! She's so stunning ♥️,Michelle Herrera,15,2019-05-20T05:03:37Z
126,UgwUjO1WvlobW1F01TZ4AaABAg,"Mera: *eats roses*
Me: *cries bc of cuteness overload*
Arthur: *eats roses Mera offers him*
Me: *cries bc of cuteness and romance overload*
I LOVE THIS COUPLE SO MUCH 😍😍",natalia alianovna,215,2019-05-13T08:41:32Z
127,UgxiLTKEPb-lwQ0NKuV4AaABAg,"This movie is stupid,  why would the little girl give a book as a response to what she had done.

It's only there for the most forced call back for a joke ever.

I dont understand how people think this film is good.",R D,3,2019-05-11T18:51:31Z
128,UgyZrk3hc1FeurlEQBN4AaABAg,Mera and Aquaman could eat flowers cuz they are from different adaptation.(from the sea),Simi Jacob,5,2019-05-04T11:38:38Z
129,Ugxd5ANHs7rzntXFvJV4AaABAg,"Literally just finished watching it and I'm now completely obsessed!!!
This has to be one of my favourite scenes of this movie!! 💕 💕 💕",Ace Enby,5,2019-05-03T23:44:08Z
130,UgxtS0cbT9nJpjsOP0F4AaABAg,name of the background song,Brayan Daniel Guzman Rodrigues,4,2019-04-24T19:37:04Z
131,UgwdJZKVJwCyDLOiPAd4AaABAg,"That beautiful unexpecting ""animated-disney-romance"" scene in a DC movie. #rare",Sun Shine,145,2019-04-18T20:23:40Z
132,Ugx_L2m_6yRiAAWdlil4AaABAg,I’m more of a marvel fan myself but this is a good movie,SunNight,260,2019-04-17T03:46:56Z
133,UgxEA3pTysX-L64YSoZ4AaABAg,Dam mera was smokin in this movie,Galaxy art Lord,12,2019-04-14T05:14:43Z
134,UgxKXkHI2vS7WEq-mex4AaABAg,The best couple 💖💖💖💖💖💖💖💖,dario wong,13,2019-04-12T17:47:58Z
135,UgxwmMATw78ii2Px2AF4AaABAg,What's the theme or song at 1:29 - 1:34,Truth,2,2019-04-12T05:46:42Z
136,Ugz8-LW7H_EgbUR1wOl4AaABAg,She Hella cute,Astan.,3,2019-04-07T08:50:45Z
137,Ugz8Dy_ZSXbh_qCYZYF4AaABAg,"James Wan, I hope Aquaman 2 really dives into these two's relationship and overcoming a big hurdle.  Really it's pretty simple, just base it off Atlantis is becoming too hot from global warming and the base of it being on a volcanic overheating plate where these two have to embark on a journey across the world to find a key to stopping this threat.",Kartboarder22G,47,2019-04-03T19:59:51Z
138,UgzSp4ZdnIDRj_dvoS94AaABAg,"Here is the weirdest, but one of the best parts of this film, is usually when they have a secret mission, the mission gets discovered by the antagonist and it becomes usually the big climatic event, will the antagonist foil the plans of the hero.  Well in this film the secret mission, finding the trident never get's spoiled.  Most movies just lean on spoiling the plans of the hero, where this one dismisses it.  It's sorta like the movie is done when he grabs onto the trident.  Ocean Master becomes a little problem at that point.",Kartboarder22G,25,2019-04-03T19:52:26Z
139,Ugy6XbWW4CsGqZeQqjJ4AaABAg,1:19 I can't breathe.😂😂😂😂😂😂😂😂😂,Black Panther,17,2019-04-02T17:05:49Z
140,Ugx6Eie_R60LvOb6AZV4AaABAg,"i don't understand Romulus supposed to  lived after decades of thousands of years after the Sahara had dried of and the Atlan was dead! and why with a Roman king? Myth of Atlantis was a Greek myth written by Plato and in the Myth ancient Athenians won them in battle , i wish they could saw us something like an ancient confederation against Atlantis and a big war",Julius,9,2019-04-02T13:02:20Z
141,Ugy2yoz6kgLiLmG16g54AaABAg,"You just admire the flowers. You don’t eat em, lol",Joe Whitehead,7,2019-04-02T01:08:07Z
142,Ugy6Oe2P4cZlrb_g1F54AaABAg,"Damn, imagine the bacteria and the possible infection that little girl got from kissing that old coin. Absolutely unsanitary.",Patrick Bateman,5,2019-03-28T21:23:52Z
143,UgzUhclLDbqzbB7ZE1R4AaABAg,They eating flower....,Alexz [GD],8,2019-03-28T04:12:31Z
144,UgzjlpqZNYaIO5PT1HJ4AaABAg,"I'm glad it wasn't The Little Mermaid because if Mera sees the ending, she will be devastated.",Aidan Hever,16,2019-03-27T19:01:39Z
145,Ugxrzks8OK6WSZM9KQl4AaABAg,"""I got it from the movie""

Yup, Aquaman is THE most relatable superhero in the DCEU!",Stuart Hays,327,2019-03-26T13:42:22Z
146,UgyjsQPR1cwnaofQjfl4AaABAg,my dads favorite part of the film,Garrett Hochmuth,8,2019-03-25T04:39:59Z
147,UgzDJspNdER5W2y_mV54AaABAg,Couple goalllsssss they are so cute💕💕💕💕,Shree Singh,19,2019-03-24T20:43:40Z
148,UgxgeQ6-JHmeyRR_OvF4AaABAg,This movie is beautiful,leocmen,25,2019-03-23T21:31:25Z
149,UgxjGgcTk5NCqb0Llzp4AaABAg,"Me in math
Something something numbers
Yah I totally got it",deirdre maguire,57,2019-03-23T01:32:45Z
150,Ugy2eQsMIztvV4uX5eV4AaABAg,"My god, they are both very good looking",Rihana Jan,190,2019-03-21T00:58:03Z
151,UgwjeyJglmgGITw8uUh4AaABAg,Sweetest scene of the movie,Claron Dias,81,2019-03-20T06:23:37Z
152,UgyRU-Penvqs7c77lXx4AaABAg,That bit were Mera had water constructs dance for that little girl was adorable.,Actionfan19,258,2019-03-19T21:56:53Z
153,UgzxDvYjINY4tX2y3DJ4AaABAg,This was the most awkward scene in the whole movie.  It turned into an early 2000's rom-com for like 4 minutes out of nowhere.  So misplaced,Zed,14,2019-03-19T01:47:37Z
154,UgzjO_9auNvV9s4qvit4AaABAg,"Roy Orbision song, written by Bono.  The night before a concert in London, Bono couldn't sleep, so he played ""In Dreams"" from the Blue Velvet soundtrack until he drifted off.  When he awoke, he had a song in his head.  He played it for the band backstage, who remarked that it sounded like a Roy Orbison song.  Then, who comes to meet the band backstage at that moment?  Roy Orbison.  They collaborated on Roy's final album.",Jason Garfield Bardy,11,2019-03-18T05:38:07Z
155,UgzOLJYuLXbCESt9YQB4AaABAg,Like se sei italiano 🧐,Ruben,9,2019-03-17T02:08:49Z
156,UgzD4CnpkGSndqJ6GQt4AaABAg,Beautiful 😍❤👌😘,Princess Ayesha,31,2019-03-16T16:44:26Z
157,UgyPeYP_BBPhfPwfkCB4AaABAg,"Unironically my favorite scene in the movie. These’s smaller, subdued scenes in big superhero movies always get to me.",Noah Hesket,153,2019-03-15T19:22:28Z
158,UgzemZc1cHHBGU83Dm14AaABAg,"When I was seeing this with my dad, I remember saying “eating those can’t be good for you” at the flower eating scene. My dad responded with “no, but he rose to the occasion”",Ethan Really,596,2019-03-15T01:52:03Z
159,Ugw3zXrASVBIovg1QtN4AaABAg,"""Something something trident.""",KMS Tirpitz,215,2019-03-14T14:10:34Z
160,Ugz7g_ElHSq5NSXVDBZ4AaABAg,Amber was so hot in this movie,Aaron Lee,207,2019-03-14T01:40:36Z
161,Ugzsl22tkxguLLzGGcx4AaABAg,This was such a cute and beautiful scene.,PresidentWordSalad,256,2019-03-14T00:25:56Z
162,UgymMU-bDAVUYvYgF0N4AaABAg,"They ate flowers
I understand why Mera may eat flowers but why did Arthur as well?",Stephen Samuel,73,2019-03-10T18:40:14Z
