,id,comment,author,likecount,publishedAt
0,UgzLhiCQTZ2itu2f9lZ4AaABAg,"I wont belive that until the police lock her up, like a regular  criminal,  that's is what she is, no one else can lie to a grand jury and get away with that, I  keep wondering  why she is still out of jail, for lieing, to the jury, ,",Gloria Lewis,1,2021-09-06T10:14:35Z
1,UgyJIegUm8p9qq5_lQF4AaABAg,She deserved to be lock up. . .  # Justice for Johnny Depp,Underdog Bjorn,0,2021-07-27T12:39:30Z
2,Ugy2zBbFCJKam1fuASB4AaABAg,"As far as I'm concerned, a.h. should be locked up and they should throw away the key forever...",Jerome Dudek,0,2021-07-27T08:08:31Z
3,UgwLv8ey3GE9PPG5kPt4AaABAg,I can't wait till she in jail she a wicked person and Johnny will be safe way from this person she is I crazy b****,Deborah Thurston,0,2021-07-27T04:58:34Z
4,Ugxf5NVAu0bwBX0m3u14AaABAg,She isn’t going to jail for 14 years,OddlyWitch,0,2021-07-26T22:28:42Z
5,UgziLfyJV2G1sEmN6Zt4AaABAg,"Amber Heards supporters are delusional. They are now going after Johnny Depp's friends like Kevin Smith.

#JusticeForKevinSmith 
#JusticeForJohnnyDepp",August,5,2021-07-26T19:25:16Z
6,UgwPxgR7IMceaSvGmRZ4AaABAg,Decided jail time determineds how young or older her daughter is and if it’s long the daughter will be able to defend herself from her mom !!,Judy Nabors,3,2021-07-26T18:28:42Z
7,Ugx7bIUKOGyiEsgY_Bl4AaABAg,"Its all her own doing , anger turd deserves everything she gets , I hope she does get prison time , she totally thinks she's untouchable , justice for Johnny 😡😡😡😡",Jayne Conlon,13,2021-07-26T16:19:21Z
